{"Graph": "n7line_friends", "Description": "Imagine a group of 7 people. Anne is friends with Bob and Charles. Bob is friends with Anne and Deborah. Charles is friends with Anne and Emily. Deborah is friends with Bob and Mary. Emily is friends with Charles and Kelly. Mary is friends with Deborah. Kelly is friends with Emily.", "No Prime Question": "From Kelly, what is the shortest path to Deborah? Starting from Kelly, please only list the people's names in order, including Kelly, separated by commas. Answer: ", "No Prime Question Answer": ["Kelly", "Emily", "Charles", "Anne", "Bob", "Deborah"], "Both Prime Question": "Imagine a group of 7 people. Anne is friends with Bob and Charles. Bob is friends with Anne and Deborah. Charles is friends with Anne and Emily. Deborah is friends with Bob and Mary. Emily is friends with Charles and Kelly. Mary is friends with Deborah. Kelly is friends with Emily. From Charles, what is the shortest path to Anne? Starting from Charles, please only list the people's names in order, including Charles, separated by commas. Answer: ['Charles', 'Anne'] From Kelly, what is the shortest path to Deborah? Starting from Kelly, please only list the people's names in order, including Kelly, separated by commas. Answer: ", "Both Prime Question Answer": ["Kelly", "Emily", "Charles", "Anne", "Bob", "Deborah"], "Lexical Prime Question": "Imagine a group of 15 people. Anne is friends with Bob, Charles, Deborah and Emily. Bob is friends with Anne, Charles, Deborah and Emily. Charles is friends with Anne, Bob, Deborah and Emily. Deborah is friends with Anne, Bob, Charles and Mary. Emily is friends with Anne, Bob, Charles and Ned. Mary is friends with Deborah, Kelly, Sam and John. Kelly is friends with Mary, Sam, John and George. Sam is friends with Mary, Kelly, John and George. John is friends with Mary, Kelly, Sam and George. George is friends with Kelly, Sam, John and Fred. Fred is friends with George, Harrison, Isabelle and Lauren. Harrison is friends with Fred, Isabelle, Lauren and Ned. Isabelle is friends with Fred, Harrison, Lauren and Ned. Lauren is friends with Fred, Harrison, Isabelle and Ned. Ned is friends with Harrison, Isabelle, Lauren and Emily. From Harrison, what is the shortest path to Ned? Starting from Harrison, please only list the people's names in order, including Harrison, separated by commas. Answer: ['Harrison', 'Ned'] Imagine a group of 7 people. Anne is friends with Bob and Charles. Bob is friends with Anne and Deborah. Charles is friends with Anne and Emily. Deborah is friends with Bob and Mary. Emily is friends with Charles and Kelly. Mary is friends with Deborah. Kelly is friends with Emily. From Kelly, what is the shortest path to Deborah? Starting from Kelly, please only list the people's names in order, including Kelly, separated by commas. Answer: ", "Lexical Prime Question Answer": ["Kelly", "Emily", "Charles", "Anne", "Bob", "Deborah"], "Structural Prime Question": "Imagine a garden with 7 sections of flowers. The rose section is connected to the tulip section and the lavender section. The tulip section is connected to the rose section and the sunflower section. The lavender section is connected to the rose section and the daffodil section. The sunflower section is connected to the tulip section and the peony section. The daffodil section is connected to the lavender section and the geranium section. The peony section is connected to the sunflower section. The geranium section is connected to the daffodil section. From the daffodil section, what is the shortest path to the lavender section? Starting from daffodil, please only list the flower names in order, including daffodil, separated by commas. Answer: ['Daffodil', 'Lavender'] Imagine a group of 7 people. Anne is friends with Bob and Charles. Bob is friends with Anne and Deborah. Charles is friends with Anne and Emily. Deborah is friends with Bob and Mary. Emily is friends with Charles and Kelly. Mary is friends with Deborah. Kelly is friends with Emily. From Kelly, what is the shortest path to Deborah? Starting from Kelly, please only list the people's names in order, including Kelly, separated by commas. Answer: ", "Structural Prime Question Answer": ["Kelly", "Emily", "Charles", "Anne", "Bob", "Deborah"]}
{"Graph": "n7line_friends", "Description": "Imagine a group of 7 people. Anne is friends with Bob and Charles. Bob is friends with Anne and Deborah. Charles is friends with Anne and Emily. Deborah is friends with Bob and Mary. Emily is friends with Charles and Kelly. Mary is friends with Deborah. Kelly is friends with Emily.", "No Prime Question": "From Mary, what is the shortest path to Anne? Starting from Mary, please only list the people's names in order, including Mary, separated by commas. Answer: ", "No Prime Question Answer": ["Mary", "Deborah", "Bob", "Anne"], "Both Prime Question": "Imagine a group of 7 people. Anne is friends with Bob and Charles. Bob is friends with Anne and Deborah. Charles is friends with Anne and Emily. Deborah is friends with Bob and Mary. Emily is friends with Charles and Kelly. Mary is friends with Deborah. Kelly is friends with Emily. From Deborah, what is the shortest path to Kelly? Starting from Deborah, please only list the people's names in order, including Deborah, separated by commas. Answer: ['Deborah', 'Bob', 'Anne', 'Charles', 'Emily', 'Kelly'] From Mary, what is the shortest path to Anne? Starting from Mary, please only list the people's names in order, including Mary, separated by commas. Answer: ", "Both Prime Question Answer": ["Mary", "Deborah", "Bob", "Anne"], "Lexical Prime Question": "Imagine a group of 13 people. Anne is friends with Bob and Charles. Bob is friends with Anne and Deborah. Charles is friends with Anne and Emily. Deborah is friends with Bob and Mary. Emily is friends with Charles and Kelly. Mary is friends with Deborah and Sam. Kelly is friends with Emily and John. Sam is friends with Mary and George. John is friends with Kelly and Fred. George is friends with Sam and Harrison. Fred is friends with John and Isabelle. Harrison is friends with George. Isabelle is friends with Fred. From Anne, what is the shortest path to Deborah? Starting from Anne, please only list the people's names in order, including Anne, separated by commas. Answer: ['Anne', 'Bob', 'Deborah'] Imagine a group of 7 people. Anne is friends with Bob and Charles. Bob is friends with Anne and Deborah. Charles is friends with Anne and Emily. Deborah is friends with Bob and Mary. Emily is friends with Charles and Kelly. Mary is friends with Deborah. Kelly is friends with Emily. From Mary, what is the shortest path to Anne? Starting from Mary, please only list the people's names in order, including Mary, separated by commas. Answer: ", "Lexical Prime Question Answer": ["Mary", "Deborah", "Bob", "Anne"], "Structural Prime Question": "Imagine a garden with 7 sections of flowers. The rose section is connected to the tulip section and the lavender section. The tulip section is connected to the rose section and the sunflower section. The lavender section is connected to the rose section and the daffodil section. The sunflower section is connected to the tulip section and the peony section. The daffodil section is connected to the lavender section and the geranium section. The peony section is connected to the sunflower section. The geranium section is connected to the daffodil section. From the daffodil section, what is the shortest path to the rose section? Starting from daffodil, please only list the flower names in order, including daffodil, separated by commas. Answer: ['Daffodil', 'Lavender', 'Rose'] Imagine a group of 7 people. Anne is friends with Bob and Charles. Bob is friends with Anne and Deborah. Charles is friends with Anne and Emily. Deborah is friends with Bob and Mary. Emily is friends with Charles and Kelly. Mary is friends with Deborah. Kelly is friends with Emily. From Mary, what is the shortest path to Anne? Starting from Mary, please only list the people's names in order, including Mary, separated by commas. Answer: ", "Structural Prime Question Answer": ["Mary", "Deborah", "Bob", "Anne"]}
{"Graph": "n7line_friends", "Description": "Imagine a group of 7 people. Anne is friends with Bob and Charles. Bob is friends with Anne and Deborah. Charles is friends with Anne and Emily. Deborah is friends with Bob and Mary. Emily is friends with Charles and Kelly. Mary is friends with Deborah. Kelly is friends with Emily.", "No Prime Question": "From Bob, what is the shortest path to Deborah? Starting from Bob, please only list the people's names in order, including Bob, separated by commas. Answer: ", "No Prime Question Answer": ["Bob", "Deborah"], "Both Prime Question": "Imagine a group of 7 people. Anne is friends with Bob and Charles. Bob is friends with Anne and Deborah. Charles is friends with Anne and Emily. Deborah is friends with Bob and Mary. Emily is friends with Charles and Kelly. Mary is friends with Deborah. Kelly is friends with Emily. From Mary, what is the shortest path to Emily? Starting from Mary, please only list the people's names in order, including Mary, separated by commas. Answer: ['Mary', 'Deborah', 'Bob', 'Anne', 'Charles', 'Emily'] From Bob, what is the shortest path to Deborah? Starting from Bob, please only list the people's names in order, including Bob, separated by commas. Answer: ", "Both Prime Question Answer": ["Bob", "Deborah"], "Lexical Prime Question": "Imagine a group of 15 people. Anne is friends with Bob, Charles, Deborah and Emily. Bob is friends with Anne, Charles, Deborah and Emily. Charles is friends with Anne, Bob, Deborah and Emily. Deborah is friends with Anne, Bob, Charles and Mary. Emily is friends with Anne, Bob, Charles and Ned. Mary is friends with Deborah, Kelly, Sam and John. Kelly is friends with Mary, Sam, John and George. Sam is friends with Mary, Kelly, John and George. John is friends with Mary, Kelly, Sam and George. George is friends with Kelly, Sam, John and Fred. Fred is friends with George, Harrison, Isabelle and Lauren. Harrison is friends with Fred, Isabelle, Lauren and Ned. Isabelle is friends with Fred, Harrison, Lauren and Ned. Lauren is friends with Fred, Harrison, Isabelle and Ned. Ned is friends with Harrison, Isabelle, Lauren and Emily. From Mary, what is the shortest path to George? Starting from Mary, please only list the people's names in order, including Mary, separated by commas. Answer: ['Mary', 'Kelly', 'George'] Imagine a group of 7 people. Anne is friends with Bob and Charles. Bob is friends with Anne and Deborah. Charles is friends with Anne and Emily. Deborah is friends with Bob and Mary. Emily is friends with Charles and Kelly. Mary is friends with Deborah. Kelly is friends with Emily. From Bob, what is the shortest path to Deborah? Starting from Bob, please only list the people's names in order, including Bob, separated by commas. Answer: ", "Lexical Prime Question Answer": ["Bob", "Deborah"], "Structural Prime Question": "Imagine a home with 7 rooms. Room 1 is connected to Room 2 and Room 3. Room 2 is connected to Room 1 and Room 4. Room 3 is connected to Room 1 and Room 5. Room 4 is connected to Room 2 and Room 6. Room 5 is connected to Room 3 and Room 7. Room 6 is connected to Room 4. Room 7 is connected to Room 5. From room 4, what is the shortest path to room 5? Starting from room 4, please only list the room numbers in order, including room 4, separated by commas. Answer: ['4', '2', '1', '3', '5'] Imagine a group of 7 people. Anne is friends with Bob and Charles. Bob is friends with Anne and Deborah. Charles is friends with Anne and Emily. Deborah is friends with Bob and Mary. Emily is friends with Charles and Kelly. Mary is friends with Deborah. Kelly is friends with Emily. From Bob, what is the shortest path to Deborah? Starting from Bob, please only list the people's names in order, including Bob, separated by commas. Answer: ", "Structural Prime Question Answer": ["Bob", "Deborah"]}
{"Graph": "n7line_friends", "Description": "Imagine a group of 7 people. Anne is friends with Bob and Charles. Bob is friends with Anne and Deborah. Charles is friends with Anne and Emily. Deborah is friends with Bob and Mary. Emily is friends with Charles and Kelly. Mary is friends with Deborah. Kelly is friends with Emily.", "No Prime Question": "From Deborah, what is the shortest path to Anne? Starting from Deborah, please only list the people's names in order, including Deborah, separated by commas. Answer: ", "No Prime Question Answer": ["Deborah", "Bob", "Anne"], "Both Prime Question": "Imagine a group of 7 people. Anne is friends with Bob and Charles. Bob is friends with Anne and Deborah. Charles is friends with Anne and Emily. Deborah is friends with Bob and Mary. Emily is friends with Charles and Kelly. Mary is friends with Deborah. Kelly is friends with Emily. From Bob, what is the shortest path to Kelly? Starting from Bob, please only list the people's names in order, including Bob, separated by commas. Answer: ['Bob', 'Anne', 'Charles', 'Emily', 'Kelly'] From Deborah, what is the shortest path to Anne? Starting from Deborah, please only list the people's names in order, including Deborah, separated by commas. Answer: ", "Both Prime Question Answer": ["Deborah", "Bob", "Anne"], "Lexical Prime Question": "Imagine a group of 15 people. Anne is friends with Bob, Charles, Deborah and Emily. Bob is friends with Anne, Charles, Deborah and Emily. Charles is friends with Anne, Bob, Deborah and Emily. Deborah is friends with Anne, Bob, Charles and Mary. Emily is friends with Anne, Bob, Charles and Ned. Mary is friends with Deborah, Kelly, Sam and John. Kelly is friends with Mary, Sam, John and George. Sam is friends with Mary, Kelly, John and George. John is friends with Mary, Kelly, Sam and George. George is friends with Kelly, Sam, John and Fred. Fred is friends with George, Harrison, Isabelle and Lauren. Harrison is friends with Fred, Isabelle, Lauren and Ned. Isabelle is friends with Fred, Harrison, Lauren and Ned. Lauren is friends with Fred, Harrison, Isabelle and Ned. Ned is friends with Harrison, Isabelle, Lauren and Emily. From Emily, what is the shortest path to Kelly? Starting from Emily, please only list the people's names in order, including Emily, separated by commas. Answer: ['Emily', 'Anne', 'Deborah', 'Mary', 'Kelly'] Imagine a group of 7 people. Anne is friends with Bob and Charles. Bob is friends with Anne and Deborah. Charles is friends with Anne and Emily. Deborah is friends with Bob and Mary. Emily is friends with Charles and Kelly. Mary is friends with Deborah. Kelly is friends with Emily. From Deborah, what is the shortest path to Anne? Starting from Deborah, please only list the people's names in order, including Deborah, separated by commas. Answer: ", "Lexical Prime Question Answer": ["Deborah", "Bob", "Anne"], "Structural Prime Question": "Imagine a garden with 7 sections of flowers. The rose section is connected to the tulip section and the lavender section. The tulip section is connected to the rose section and the sunflower section. The lavender section is connected to the rose section and the daffodil section. The sunflower section is connected to the tulip section and the peony section. The daffodil section is connected to the lavender section and the geranium section. The peony section is connected to the sunflower section. The geranium section is connected to the daffodil section. From the geranium section, what is the shortest path to the lavender section? Starting from geranium, please only list the flower names in order, including geranium, separated by commas. Answer: ['Geranium', 'Daffodil', 'Lavender'] Imagine a group of 7 people. Anne is friends with Bob and Charles. Bob is friends with Anne and Deborah. Charles is friends with Anne and Emily. Deborah is friends with Bob and Mary. Emily is friends with Charles and Kelly. Mary is friends with Deborah. Kelly is friends with Emily. From Deborah, what is the shortest path to Anne? Starting from Deborah, please only list the people's names in order, including Deborah, separated by commas. Answer: ", "Structural Prime Question Answer": ["Deborah", "Bob", "Anne"]}
{"Graph": "n7line_friends", "Description": "Imagine a group of 7 people. Anne is friends with Bob and Charles. Bob is friends with Anne and Deborah. Charles is friends with Anne and Emily. Deborah is friends with Bob and Mary. Emily is friends with Charles and Kelly. Mary is friends with Deborah. Kelly is friends with Emily.", "No Prime Question": "From Bob, what is the shortest path to Kelly? Starting from Bob, please only list the people's names in order, including Bob, separated by commas. Answer: ", "No Prime Question Answer": ["Bob", "Anne", "Charles", "Emily", "Kelly"], "Both Prime Question": "Imagine a group of 7 people. Anne is friends with Bob and Charles. Bob is friends with Anne and Deborah. Charles is friends with Anne and Emily. Deborah is friends with Bob and Mary. Emily is friends with Charles and Kelly. Mary is friends with Deborah. Kelly is friends with Emily. From Deborah, what is the shortest path to Mary? Starting from Deborah, please only list the people's names in order, including Deborah, separated by commas. Answer: ['Deborah', 'Mary'] From Bob, what is the shortest path to Kelly? Starting from Bob, please only list the people's names in order, including Bob, separated by commas. Answer: ", "Both Prime Question Answer": ["Bob", "Anne", "Charles", "Emily", "Kelly"], "Lexical Prime Question": "Imagine a group of 7 people. Anne is friends with Bob and Charles. Bob is friends with Anne, Deborah and Emily. Charles is friends with Anne, Mary and Kelly. Deborah is friends with Bob. Emily is friends with Bob. Mary is friends with Charles. Kelly is friends with Charles. From Anne, what is the shortest path to Kelly? Starting from Anne, please only list the people's names in order, including Anne, separated by commas. Answer: ['Anne', 'Charles', 'Kelly'] Imagine a group of 7 people. Anne is friends with Bob and Charles. Bob is friends with Anne and Deborah. Charles is friends with Anne and Emily. Deborah is friends with Bob and Mary. Emily is friends with Charles and Kelly. Mary is friends with Deborah. Kelly is friends with Emily. From Bob, what is the shortest path to Kelly? Starting from Bob, please only list the people's names in order, including Bob, separated by commas. Answer: ", "Lexical Prime Question Answer": ["Bob", "Anne", "Charles", "Emily", "Kelly"], "Structural Prime Question": "Imagine a garden with 7 sections of flowers. The rose section is connected to the tulip section and the lavender section. The tulip section is connected to the rose section and the sunflower section. The lavender section is connected to the rose section and the daffodil section. The sunflower section is connected to the tulip section and the peony section. The daffodil section is connected to the lavender section and the geranium section. The peony section is connected to the sunflower section. The geranium section is connected to the daffodil section. From the rose section, what is the shortest path to the lavender section? Starting from rose, please only list the flower names in order, including rose, separated by commas. Answer: ['Rose', 'Lavender'] Imagine a group of 7 people. Anne is friends with Bob and Charles. Bob is friends with Anne and Deborah. Charles is friends with Anne and Emily. Deborah is friends with Bob and Mary. Emily is friends with Charles and Kelly. Mary is friends with Deborah. Kelly is friends with Emily. From Bob, what is the shortest path to Kelly? Starting from Bob, please only list the people's names in order, including Bob, separated by commas. Answer: ", "Structural Prime Question Answer": ["Bob", "Anne", "Charles", "Emily", "Kelly"]}
{"Graph": "n7line_friends", "Description": "Imagine a group of 7 people. Anne is friends with Bob and Charles. Bob is friends with Anne and Deborah. Charles is friends with Anne and Emily. Deborah is friends with Bob and Mary. Emily is friends with Charles and Kelly. Mary is friends with Deborah. Kelly is friends with Emily.", "No Prime Question": "From Emily, what is the shortest path to Deborah? Starting from Emily, please only list the people's names in order, including Emily, separated by commas. Answer: ", "No Prime Question Answer": ["Emily", "Charles", "Anne", "Bob", "Deborah"], "Both Prime Question": "Imagine a group of 7 people. Anne is friends with Bob and Charles. Bob is friends with Anne and Deborah. Charles is friends with Anne and Emily. Deborah is friends with Bob and Mary. Emily is friends with Charles and Kelly. Mary is friends with Deborah. Kelly is friends with Emily. From Charles, what is the shortest path to Bob? Starting from Charles, please only list the people's names in order, including Charles, separated by commas. Answer: ['Charles', 'Anne', 'Bob'] From Emily, what is the shortest path to Deborah? Starting from Emily, please only list the people's names in order, including Emily, separated by commas. Answer: ", "Both Prime Question Answer": ["Emily", "Charles", "Anne", "Bob", "Deborah"], "Lexical Prime Question": "Imagine a group of 13 people. Anne is friends with Bob and Charles. Bob is friends with Anne and Deborah. Charles is friends with Anne and Emily. Deborah is friends with Bob and Mary. Emily is friends with Charles and Kelly. Mary is friends with Deborah and Sam. Kelly is friends with Emily and John. Sam is friends with Mary and George. John is friends with Kelly and Fred. George is friends with Sam and Harrison. Fred is friends with John and Isabelle. Harrison is friends with George. Isabelle is friends with Fred. From George, what is the shortest path to Mary? Starting from George, please only list the people's names in order, including George, separated by commas. Answer: ['George', 'Sam', 'Mary'] Imagine a group of 7 people. Anne is friends with Bob and Charles. Bob is friends with Anne and Deborah. Charles is friends with Anne and Emily. Deborah is friends with Bob and Mary. Emily is friends with Charles and Kelly. Mary is friends with Deborah. Kelly is friends with Emily. From Emily, what is the shortest path to Deborah? Starting from Emily, please only list the people's names in order, including Emily, separated by commas. Answer: ", "Lexical Prime Question Answer": ["Emily", "Charles", "Anne", "Bob", "Deborah"], "Structural Prime Question": "Imagine a garden with 7 sections of flowers. The rose section is connected to the tulip section and the lavender section. The tulip section is connected to the rose section and the sunflower section. The lavender section is connected to the rose section and the daffodil section. The sunflower section is connected to the tulip section and the peony section. The daffodil section is connected to the lavender section and the geranium section. The peony section is connected to the sunflower section. The geranium section is connected to the daffodil section. From the lavender section, what is the shortest path to the sunflower section? Starting from lavender, please only list the flower names in order, including lavender, separated by commas. Answer: ['Lavender', 'Rose', 'Tulip', 'Sunflower'] Imagine a group of 7 people. Anne is friends with Bob and Charles. Bob is friends with Anne and Deborah. Charles is friends with Anne and Emily. Deborah is friends with Bob and Mary. Emily is friends with Charles and Kelly. Mary is friends with Deborah. Kelly is friends with Emily. From Emily, what is the shortest path to Deborah? Starting from Emily, please only list the people's names in order, including Emily, separated by commas. Answer: ", "Structural Prime Question Answer": ["Emily", "Charles", "Anne", "Bob", "Deborah"]}
{"Graph": "n7line_friends", "Description": "Imagine a group of 7 people. Anne is friends with Bob and Charles. Bob is friends with Anne and Deborah. Charles is friends with Anne and Emily. Deborah is friends with Bob and Mary. Emily is friends with Charles and Kelly. Mary is friends with Deborah. Kelly is friends with Emily.", "No Prime Question": "From Emily, what is the shortest path to Kelly? Starting from Emily, please only list the people's names in order, including Emily, separated by commas. Answer: ", "No Prime Question Answer": ["Emily", "Kelly"], "Both Prime Question": "Imagine a group of 7 people. Anne is friends with Bob and Charles. Bob is friends with Anne and Deborah. Charles is friends with Anne and Emily. Deborah is friends with Bob and Mary. Emily is friends with Charles and Kelly. Mary is friends with Deborah. Kelly is friends with Emily. From Deborah, what is the shortest path to Anne? Starting from Deborah, please only list the people's names in order, including Deborah, separated by commas. Answer: ['Deborah', 'Bob', 'Anne'] From Emily, what is the shortest path to Kelly? Starting from Emily, please only list the people's names in order, including Emily, separated by commas. Answer: ", "Both Prime Question Answer": ["Emily", "Kelly"], "Lexical Prime Question": "Imagine a group of 7 people. Anne is friends with Bob and Charles. Bob is friends with Anne, Deborah and Emily. Charles is friends with Anne, Mary and Kelly. Deborah is friends with Bob. Emily is friends with Bob. Mary is friends with Charles. Kelly is friends with Charles. From Deborah, what is the shortest path to Bob? Starting from Deborah, please only list the people's names in order, including Deborah, separated by commas. Answer: ['Deborah', 'Bob'] Imagine a group of 7 people. Anne is friends with Bob and Charles. Bob is friends with Anne and Deborah. Charles is friends with Anne and Emily. Deborah is friends with Bob and Mary. Emily is friends with Charles and Kelly. Mary is friends with Deborah. Kelly is friends with Emily. From Emily, what is the shortest path to Kelly? Starting from Emily, please only list the people's names in order, including Emily, separated by commas. Answer: ", "Lexical Prime Question Answer": ["Emily", "Kelly"], "Structural Prime Question": "Imagine a home with 7 rooms. Room 1 is connected to Room 2 and Room 3. Room 2 is connected to Room 1 and Room 4. Room 3 is connected to Room 1 and Room 5. Room 4 is connected to Room 2 and Room 6. Room 5 is connected to Room 3 and Room 7. Room 6 is connected to Room 4. Room 7 is connected to Room 5. From room 2, what is the shortest path to room 1? Starting from room 2, please only list the room numbers in order, including room 2, separated by commas. Answer: ['2', '1'] Imagine a group of 7 people. Anne is friends with Bob and Charles. Bob is friends with Anne and Deborah. Charles is friends with Anne and Emily. Deborah is friends with Bob and Mary. Emily is friends with Charles and Kelly. Mary is friends with Deborah. Kelly is friends with Emily. From Emily, what is the shortest path to Kelly? Starting from Emily, please only list the people's names in order, including Emily, separated by commas. Answer: ", "Structural Prime Question Answer": ["Emily", "Kelly"]}
{"Graph": "n7line_friends", "Description": "Imagine a group of 7 people. Anne is friends with Bob and Charles. Bob is friends with Anne and Deborah. Charles is friends with Anne and Emily. Deborah is friends with Bob and Mary. Emily is friends with Charles and Kelly. Mary is friends with Deborah. Kelly is friends with Emily.", "No Prime Question": "From Emily, what is the shortest path to Deborah? Starting from Emily, please only list the people's names in order, including Emily, separated by commas. Answer: ", "No Prime Question Answer": ["Emily", "Charles", "Anne", "Bob", "Deborah"], "Both Prime Question": "Imagine a group of 7 people. Anne is friends with Bob and Charles. Bob is friends with Anne and Deborah. Charles is friends with Anne and Emily. Deborah is friends with Bob and Mary. Emily is friends with Charles and Kelly. Mary is friends with Deborah. Kelly is friends with Emily. From Anne, what is the shortest path to Mary? Starting from Anne, please only list the people's names in order, including Anne, separated by commas. Answer: ['Anne', 'Bob', 'Deborah', 'Mary'] From Emily, what is the shortest path to Deborah? Starting from Emily, please only list the people's names in order, including Emily, separated by commas. Answer: ", "Both Prime Question Answer": ["Emily", "Charles", "Anne", "Bob", "Deborah"], "Lexical Prime Question": "Imagine a group of 7 people. Anne is friends with Bob and Charles. Bob is friends with Anne, Deborah and Emily. Charles is friends with Anne, Mary and Kelly. Deborah is friends with Bob. Emily is friends with Bob. Mary is friends with Charles. Kelly is friends with Charles. From Emily, what is the shortest path to Kelly? Starting from Emily, please only list the people's names in order, including Emily, separated by commas. Answer: ['Emily', 'Bob', 'Anne', 'Charles', 'Kelly'] Imagine a group of 7 people. Anne is friends with Bob and Charles. Bob is friends with Anne and Deborah. Charles is friends with Anne and Emily. Deborah is friends with Bob and Mary. Emily is friends with Charles and Kelly. Mary is friends with Deborah. Kelly is friends with Emily. From Emily, what is the shortest path to Deborah? Starting from Emily, please only list the people's names in order, including Emily, separated by commas. Answer: ", "Lexical Prime Question Answer": ["Emily", "Charles", "Anne", "Bob", "Deborah"], "Structural Prime Question": "Imagine a home with 7 rooms. Room 1 is connected to Room 2 and Room 3. Room 2 is connected to Room 1 and Room 4. Room 3 is connected to Room 1 and Room 5. Room 4 is connected to Room 2 and Room 6. Room 5 is connected to Room 3 and Room 7. Room 6 is connected to Room 4. Room 7 is connected to Room 5. From room 7, what is the shortest path to room 4? Starting from room 7, please only list the room numbers in order, including room 7, separated by commas. Answer: ['7', '5', '3', '1', '2', '4'] Imagine a group of 7 people. Anne is friends with Bob and Charles. Bob is friends with Anne and Deborah. Charles is friends with Anne and Emily. Deborah is friends with Bob and Mary. Emily is friends with Charles and Kelly. Mary is friends with Deborah. Kelly is friends with Emily. From Emily, what is the shortest path to Deborah? Starting from Emily, please only list the people's names in order, including Emily, separated by commas. Answer: ", "Structural Prime Question Answer": ["Emily", "Charles", "Anne", "Bob", "Deborah"]}
{"Graph": "n7line_friends", "Description": "Imagine a group of 7 people. Anne is friends with Bob and Charles. Bob is friends with Anne and Deborah. Charles is friends with Anne and Emily. Deborah is friends with Bob and Mary. Emily is friends with Charles and Kelly. Mary is friends with Deborah. Kelly is friends with Emily.", "No Prime Question": "From Mary, what is the shortest path to Kelly? Starting from Mary, please only list the people's names in order, including Mary, separated by commas. Answer: ", "No Prime Question Answer": ["Mary", "Deborah", "Bob", "Anne", "Charles", "Emily", "Kelly"], "Both Prime Question": "Imagine a group of 7 people. Anne is friends with Bob and Charles. Bob is friends with Anne and Deborah. Charles is friends with Anne and Emily. Deborah is friends with Bob and Mary. Emily is friends with Charles and Kelly. Mary is friends with Deborah. Kelly is friends with Emily. From Charles, what is the shortest path to Anne? Starting from Charles, please only list the people's names in order, including Charles, separated by commas. Answer: ['Charles', 'Anne'] From Mary, what is the shortest path to Kelly? Starting from Mary, please only list the people's names in order, including Mary, separated by commas. Answer: ", "Both Prime Question Answer": ["Mary", "Deborah", "Bob", "Anne", "Charles", "Emily", "Kelly"], "Lexical Prime Question": "Imagine a group of 13 people. Anne is friends with Bob and Charles. Bob is friends with Anne and Deborah. Charles is friends with Anne and Emily. Deborah is friends with Bob and Mary. Emily is friends with Charles and Kelly. Mary is friends with Deborah and Sam. Kelly is friends with Emily and John. Sam is friends with Mary and George. John is friends with Kelly and Fred. George is friends with Sam and Harrison. Fred is friends with John and Isabelle. Harrison is friends with George. Isabelle is friends with Fred. From Anne, what is the shortest path to Sam? Starting from Anne, please only list the people's names in order, including Anne, separated by commas. Answer: ['Anne', 'Bob', 'Deborah', 'Mary', 'Sam'] Imagine a group of 7 people. Anne is friends with Bob and Charles. Bob is friends with Anne and Deborah. Charles is friends with Anne and Emily. Deborah is friends with Bob and Mary. Emily is friends with Charles and Kelly. Mary is friends with Deborah. Kelly is friends with Emily. From Mary, what is the shortest path to Kelly? Starting from Mary, please only list the people's names in order, including Mary, separated by commas. Answer: ", "Lexical Prime Question Answer": ["Mary", "Deborah", "Bob", "Anne", "Charles", "Emily", "Kelly"], "Structural Prime Question": "Imagine a home with 7 rooms. Room 1 is connected to Room 2 and Room 3. Room 2 is connected to Room 1 and Room 4. Room 3 is connected to Room 1 and Room 5. Room 4 is connected to Room 2 and Room 6. Room 5 is connected to Room 3 and Room 7. Room 6 is connected to Room 4. Room 7 is connected to Room 5. From room 3, what is the shortest path to room 7? Starting from room 3, please only list the room numbers in order, including room 3, separated by commas. Answer: ['3', '5', '7'] Imagine a group of 7 people. Anne is friends with Bob and Charles. Bob is friends with Anne and Deborah. Charles is friends with Anne and Emily. Deborah is friends with Bob and Mary. Emily is friends with Charles and Kelly. Mary is friends with Deborah. Kelly is friends with Emily. From Mary, what is the shortest path to Kelly? Starting from Mary, please only list the people's names in order, including Mary, separated by commas. Answer: ", "Structural Prime Question Answer": ["Mary", "Deborah", "Bob", "Anne", "Charles", "Emily", "Kelly"]}
{"Graph": "n7line_friends", "Description": "Imagine a group of 7 people. Anne is friends with Bob and Charles. Bob is friends with Anne and Deborah. Charles is friends with Anne and Emily. Deborah is friends with Bob and Mary. Emily is friends with Charles and Kelly. Mary is friends with Deborah. Kelly is friends with Emily.", "No Prime Question": "From Kelly, what is the shortest path to Anne? Starting from Kelly, please only list the people's names in order, including Kelly, separated by commas. Answer: ", "No Prime Question Answer": ["Kelly", "Emily", "Charles", "Anne"], "Both Prime Question": "Imagine a group of 7 people. Anne is friends with Bob and Charles. Bob is friends with Anne and Deborah. Charles is friends with Anne and Emily. Deborah is friends with Bob and Mary. Emily is friends with Charles and Kelly. Mary is friends with Deborah. Kelly is friends with Emily. From Deborah, what is the shortest path to Mary? Starting from Deborah, please only list the people's names in order, including Deborah, separated by commas. Answer: ['Deborah', 'Mary'] From Kelly, what is the shortest path to Anne? Starting from Kelly, please only list the people's names in order, including Kelly, separated by commas. Answer: ", "Both Prime Question Answer": ["Kelly", "Emily", "Charles", "Anne"], "Lexical Prime Question": "Imagine a group of 15 people. Anne is friends with Bob, Charles, Deborah and Emily. Bob is friends with Anne, Charles, Deborah and Emily. Charles is friends with Anne, Bob, Deborah and Emily. Deborah is friends with Anne, Bob, Charles and Mary. Emily is friends with Anne, Bob, Charles and Ned. Mary is friends with Deborah, Kelly, Sam and John. Kelly is friends with Mary, Sam, John and George. Sam is friends with Mary, Kelly, John and George. John is friends with Mary, Kelly, Sam and George. George is friends with Kelly, Sam, John and Fred. Fred is friends with George, Harrison, Isabelle and Lauren. Harrison is friends with Fred, Isabelle, Lauren and Ned. Isabelle is friends with Fred, Harrison, Lauren and Ned. Lauren is friends with Fred, Harrison, Isabelle and Ned. Ned is friends with Harrison, Isabelle, Lauren and Emily. From Emily, what is the shortest path to Fred? Starting from Emily, please only list the people's names in order, including Emily, separated by commas. Answer: ['Emily', 'Ned', 'Harrison', 'Fred'] Imagine a group of 7 people. Anne is friends with Bob and Charles. Bob is friends with Anne and Deborah. Charles is friends with Anne and Emily. Deborah is friends with Bob and Mary. Emily is friends with Charles and Kelly. Mary is friends with Deborah. Kelly is friends with Emily. From Kelly, what is the shortest path to Anne? Starting from Kelly, please only list the people's names in order, including Kelly, separated by commas. Answer: ", "Lexical Prime Question Answer": ["Kelly", "Emily", "Charles", "Anne"], "Structural Prime Question": "Imagine a garden with 7 sections of flowers. The rose section is connected to the tulip section and the lavender section. The tulip section is connected to the rose section and the sunflower section. The lavender section is connected to the rose section and the daffodil section. The sunflower section is connected to the tulip section and the peony section. The daffodil section is connected to the lavender section and the geranium section. The peony section is connected to the sunflower section. The geranium section is connected to the daffodil section. From the daffodil section, what is the shortest path to the lavender section? Starting from daffodil, please only list the flower names in order, including daffodil, separated by commas. Answer: ['Daffodil', 'Lavender'] Imagine a group of 7 people. Anne is friends with Bob and Charles. Bob is friends with Anne and Deborah. Charles is friends with Anne and Emily. Deborah is friends with Bob and Mary. Emily is friends with Charles and Kelly. Mary is friends with Deborah. Kelly is friends with Emily. From Kelly, what is the shortest path to Anne? Starting from Kelly, please only list the people's names in order, including Kelly, separated by commas. Answer: ", "Structural Prime Question Answer": ["Kelly", "Emily", "Charles", "Anne"]}
{"Graph": "n7line_friends", "Description": "Imagine a group of 7 people. Anne is friends with Bob and Charles. Bob is friends with Anne and Deborah. Charles is friends with Anne and Emily. Deborah is friends with Bob and Mary. Emily is friends with Charles and Kelly. Mary is friends with Deborah. Kelly is friends with Emily.", "No Prime Question": "From Emily, what is the shortest path to Deborah? Starting from Emily, please only list the people's names in order, including Emily, separated by commas. Answer: ", "No Prime Question Answer": ["Emily", "Charles", "Anne", "Bob", "Deborah"], "Both Prime Question": "Imagine a group of 7 people. Anne is friends with Bob and Charles. Bob is friends with Anne and Deborah. Charles is friends with Anne and Emily. Deborah is friends with Bob and Mary. Emily is friends with Charles and Kelly. Mary is friends with Deborah. Kelly is friends with Emily. From Kelly, what is the shortest path to Mary? Starting from Kelly, please only list the people's names in order, including Kelly, separated by commas. Answer: ['Kelly', 'Emily', 'Charles', 'Anne', 'Bob', 'Deborah', 'Mary'] From Emily, what is the shortest path to Deborah? Starting from Emily, please only list the people's names in order, including Emily, separated by commas. Answer: ", "Both Prime Question Answer": ["Emily", "Charles", "Anne", "Bob", "Deborah"], "Lexical Prime Question": "Imagine a group of 15 people. Anne is friends with Bob, Charles, Deborah and Emily. Bob is friends with Anne, Charles, Deborah and Emily. Charles is friends with Anne, Bob, Deborah and Emily. Deborah is friends with Anne, Bob, Charles and Mary. Emily is friends with Anne, Bob, Charles and Ned. Mary is friends with Deborah, Kelly, Sam and John. Kelly is friends with Mary, Sam, John and George. Sam is friends with Mary, Kelly, John and George. John is friends with Mary, Kelly, Sam and George. George is friends with Kelly, Sam, John and Fred. Fred is friends with George, Harrison, Isabelle and Lauren. Harrison is friends with Fred, Isabelle, Lauren and Ned. Isabelle is friends with Fred, Harrison, Lauren and Ned. Lauren is friends with Fred, Harrison, Isabelle and Ned. Ned is friends with Harrison, Isabelle, Lauren and Emily. From Mary, what is the shortest path to Bob? Starting from Mary, please only list the people's names in order, including Mary, separated by commas. Answer: ['Mary', 'Deborah', 'Bob'] Imagine a group of 7 people. Anne is friends with Bob and Charles. Bob is friends with Anne and Deborah. Charles is friends with Anne and Emily. Deborah is friends with Bob and Mary. Emily is friends with Charles and Kelly. Mary is friends with Deborah. Kelly is friends with Emily. From Emily, what is the shortest path to Deborah? Starting from Emily, please only list the people's names in order, including Emily, separated by commas. Answer: ", "Lexical Prime Question Answer": ["Emily", "Charles", "Anne", "Bob", "Deborah"], "Structural Prime Question": "Imagine a garden with 7 sections of flowers. The rose section is connected to the tulip section and the lavender section. The tulip section is connected to the rose section and the sunflower section. The lavender section is connected to the rose section and the daffodil section. The sunflower section is connected to the tulip section and the peony section. The daffodil section is connected to the lavender section and the geranium section. The peony section is connected to the sunflower section. The geranium section is connected to the daffodil section. From the tulip section, what is the shortest path to the sunflower section? Starting from tulip, please only list the flower names in order, including tulip, separated by commas. Answer: ['Tulip', 'Sunflower'] Imagine a group of 7 people. Anne is friends with Bob and Charles. Bob is friends with Anne and Deborah. Charles is friends with Anne and Emily. Deborah is friends with Bob and Mary. Emily is friends with Charles and Kelly. Mary is friends with Deborah. Kelly is friends with Emily. From Emily, what is the shortest path to Deborah? Starting from Emily, please only list the people's names in order, including Emily, separated by commas. Answer: ", "Structural Prime Question Answer": ["Emily", "Charles", "Anne", "Bob", "Deborah"]}
{"Graph": "n7line_friends", "Description": "Imagine a group of 7 people. Anne is friends with Bob and Charles. Bob is friends with Anne and Deborah. Charles is friends with Anne and Emily. Deborah is friends with Bob and Mary. Emily is friends with Charles and Kelly. Mary is friends with Deborah. Kelly is friends with Emily.", "No Prime Question": "From Charles, what is the shortest path to Deborah? Starting from Charles, please only list the people's names in order, including Charles, separated by commas. Answer: ", "No Prime Question Answer": ["Charles", "Anne", "Bob", "Deborah"], "Both Prime Question": "Imagine a group of 7 people. Anne is friends with Bob and Charles. Bob is friends with Anne and Deborah. Charles is friends with Anne and Emily. Deborah is friends with Bob and Mary. Emily is friends with Charles and Kelly. Mary is friends with Deborah. Kelly is friends with Emily. From Kelly, what is the shortest path to Bob? Starting from Kelly, please only list the people's names in order, including Kelly, separated by commas. Answer: ['Kelly', 'Emily', 'Charles', 'Anne', 'Bob'] From Charles, what is the shortest path to Deborah? Starting from Charles, please only list the people's names in order, including Charles, separated by commas. Answer: ", "Both Prime Question Answer": ["Charles", "Anne", "Bob", "Deborah"], "Lexical Prime Question": "Imagine a group of 7 people. Anne is friends with Bob and Charles. Bob is friends with Anne, Deborah and Emily. Charles is friends with Anne, Mary and Kelly. Deborah is friends with Bob. Emily is friends with Bob. Mary is friends with Charles. Kelly is friends with Charles. From Bob, what is the shortest path to Mary? Starting from Bob, please only list the people's names in order, including Bob, separated by commas. Answer: ['Bob', 'Anne', 'Charles', 'Mary'] Imagine a group of 7 people. Anne is friends with Bob and Charles. Bob is friends with Anne and Deborah. Charles is friends with Anne and Emily. Deborah is friends with Bob and Mary. Emily is friends with Charles and Kelly. Mary is friends with Deborah. Kelly is friends with Emily. From Charles, what is the shortest path to Deborah? Starting from Charles, please only list the people's names in order, including Charles, separated by commas. Answer: ", "Lexical Prime Question Answer": ["Charles", "Anne", "Bob", "Deborah"], "Structural Prime Question": "Imagine a garden with 7 sections of flowers. The rose section is connected to the tulip section and the lavender section. The tulip section is connected to the rose section and the sunflower section. The lavender section is connected to the rose section and the daffodil section. The sunflower section is connected to the tulip section and the peony section. The daffodil section is connected to the lavender section and the geranium section. The peony section is connected to the sunflower section. The geranium section is connected to the daffodil section. From the tulip section, what is the shortest path to the rose section? Starting from tulip, please only list the flower names in order, including tulip, separated by commas. Answer: ['Tulip', 'Rose'] Imagine a group of 7 people. Anne is friends with Bob and Charles. Bob is friends with Anne and Deborah. Charles is friends with Anne and Emily. Deborah is friends with Bob and Mary. Emily is friends with Charles and Kelly. Mary is friends with Deborah. Kelly is friends with Emily. From Charles, what is the shortest path to Deborah? Starting from Charles, please only list the people's names in order, including Charles, separated by commas. Answer: ", "Structural Prime Question Answer": ["Charles", "Anne", "Bob", "Deborah"]}
{"Graph": "n7line_friends", "Description": "Imagine a group of 7 people. Anne is friends with Bob and Charles. Bob is friends with Anne and Deborah. Charles is friends with Anne and Emily. Deborah is friends with Bob and Mary. Emily is friends with Charles and Kelly. Mary is friends with Deborah. Kelly is friends with Emily.", "No Prime Question": "From Anne, what is the shortest path to Charles? Starting from Anne, please only list the people's names in order, including Anne, separated by commas. Answer: ", "No Prime Question Answer": ["Anne", "Charles"], "Both Prime Question": "Imagine a group of 7 people. Anne is friends with Bob and Charles. Bob is friends with Anne and Deborah. Charles is friends with Anne and Emily. Deborah is friends with Bob and Mary. Emily is friends with Charles and Kelly. Mary is friends with Deborah. Kelly is friends with Emily. From Kelly, what is the shortest path to Deborah? Starting from Kelly, please only list the people's names in order, including Kelly, separated by commas. Answer: ['Kelly', 'Emily', 'Charles', 'Anne', 'Bob', 'Deborah'] From Anne, what is the shortest path to Charles? Starting from Anne, please only list the people's names in order, including Anne, separated by commas. Answer: ", "Both Prime Question Answer": ["Anne", "Charles"], "Lexical Prime Question": "Imagine a group of 13 people. Anne is friends with Bob and Charles. Bob is friends with Anne and Deborah. Charles is friends with Anne and Emily. Deborah is friends with Bob and Mary. Emily is friends with Charles and Kelly. Mary is friends with Deborah and Sam. Kelly is friends with Emily and John. Sam is friends with Mary and George. John is friends with Kelly and Fred. George is friends with Sam and Harrison. Fred is friends with John and Isabelle. Harrison is friends with George. Isabelle is friends with Fred. From George, what is the shortest path to Sam? Starting from George, please only list the people's names in order, including George, separated by commas. Answer: ['George', 'Sam'] Imagine a group of 7 people. Anne is friends with Bob and Charles. Bob is friends with Anne and Deborah. Charles is friends with Anne and Emily. Deborah is friends with Bob and Mary. Emily is friends with Charles and Kelly. Mary is friends with Deborah. Kelly is friends with Emily. From Anne, what is the shortest path to Charles? Starting from Anne, please only list the people's names in order, including Anne, separated by commas. Answer: ", "Lexical Prime Question Answer": ["Anne", "Charles"], "Structural Prime Question": "Imagine a garden with 7 sections of flowers. The rose section is connected to the tulip section and the lavender section. The tulip section is connected to the rose section and the sunflower section. The lavender section is connected to the rose section and the daffodil section. The sunflower section is connected to the tulip section and the peony section. The daffodil section is connected to the lavender section and the geranium section. The peony section is connected to the sunflower section. The geranium section is connected to the daffodil section. From the peony section, what is the shortest path to the lavender section? Starting from peony, please only list the flower names in order, including peony, separated by commas. Answer: ['Peony', 'Sunflower', 'Tulip', 'Rose', 'Lavender'] Imagine a group of 7 people. Anne is friends with Bob and Charles. Bob is friends with Anne and Deborah. Charles is friends with Anne and Emily. Deborah is friends with Bob and Mary. Emily is friends with Charles and Kelly. Mary is friends with Deborah. Kelly is friends with Emily. From Anne, what is the shortest path to Charles? Starting from Anne, please only list the people's names in order, including Anne, separated by commas. Answer: ", "Structural Prime Question Answer": ["Anne", "Charles"]}
{"Graph": "n7line_friends", "Description": "Imagine a group of 7 people. Anne is friends with Bob and Charles. Bob is friends with Anne and Deborah. Charles is friends with Anne and Emily. Deborah is friends with Bob and Mary. Emily is friends with Charles and Kelly. Mary is friends with Deborah. Kelly is friends with Emily.", "No Prime Question": "From Anne, what is the shortest path to Deborah? Starting from Anne, please only list the people's names in order, including Anne, separated by commas. Answer: ", "No Prime Question Answer": ["Anne", "Bob", "Deborah"], "Both Prime Question": "Imagine a group of 7 people. Anne is friends with Bob and Charles. Bob is friends with Anne and Deborah. Charles is friends with Anne and Emily. Deborah is friends with Bob and Mary. Emily is friends with Charles and Kelly. Mary is friends with Deborah. Kelly is friends with Emily. From Kelly, what is the shortest path to Bob? Starting from Kelly, please only list the people's names in order, including Kelly, separated by commas. Answer: ['Kelly', 'Emily', 'Charles', 'Anne', 'Bob'] From Anne, what is the shortest path to Deborah? Starting from Anne, please only list the people's names in order, including Anne, separated by commas. Answer: ", "Both Prime Question Answer": ["Anne", "Bob", "Deborah"], "Lexical Prime Question": "Imagine a group of 7 people. Anne is friends with Bob and Charles. Bob is friends with Anne, Deborah and Emily. Charles is friends with Anne, Mary and Kelly. Deborah is friends with Bob. Emily is friends with Bob. Mary is friends with Charles. Kelly is friends with Charles. From Bob, what is the shortest path to Anne? Starting from Bob, please only list the people's names in order, including Bob, separated by commas. Answer: ['Bob', 'Anne'] Imagine a group of 7 people. Anne is friends with Bob and Charles. Bob is friends with Anne and Deborah. Charles is friends with Anne and Emily. Deborah is friends with Bob and Mary. Emily is friends with Charles and Kelly. Mary is friends with Deborah. Kelly is friends with Emily. From Anne, what is the shortest path to Deborah? Starting from Anne, please only list the people's names in order, including Anne, separated by commas. Answer: ", "Lexical Prime Question Answer": ["Anne", "Bob", "Deborah"], "Structural Prime Question": "Imagine a home with 7 rooms. Room 1 is connected to Room 2 and Room 3. Room 2 is connected to Room 1 and Room 4. Room 3 is connected to Room 1 and Room 5. Room 4 is connected to Room 2 and Room 6. Room 5 is connected to Room 3 and Room 7. Room 6 is connected to Room 4. Room 7 is connected to Room 5. From room 1, what is the shortest path to room 4? Starting from room 1, please only list the room numbers in order, including room 1, separated by commas. Answer: ['1', '2', '4'] Imagine a group of 7 people. Anne is friends with Bob and Charles. Bob is friends with Anne and Deborah. Charles is friends with Anne and Emily. Deborah is friends with Bob and Mary. Emily is friends with Charles and Kelly. Mary is friends with Deborah. Kelly is friends with Emily. From Anne, what is the shortest path to Deborah? Starting from Anne, please only list the people's names in order, including Anne, separated by commas. Answer: ", "Structural Prime Question Answer": ["Anne", "Bob", "Deborah"]}
{"Graph": "n7line_friends", "Description": "Imagine a group of 7 people. Anne is friends with Bob and Charles. Bob is friends with Anne and Deborah. Charles is friends with Anne and Emily. Deborah is friends with Bob and Mary. Emily is friends with Charles and Kelly. Mary is friends with Deborah. Kelly is friends with Emily.", "No Prime Question": "From Mary, what is the shortest path to Kelly? Starting from Mary, please only list the people's names in order, including Mary, separated by commas. Answer: ", "No Prime Question Answer": ["Mary", "Deborah", "Bob", "Anne", "Charles", "Emily", "Kelly"], "Both Prime Question": "Imagine a group of 7 people. Anne is friends with Bob and Charles. Bob is friends with Anne and Deborah. Charles is friends with Anne and Emily. Deborah is friends with Bob and Mary. Emily is friends with Charles and Kelly. Mary is friends with Deborah. Kelly is friends with Emily. From Anne, what is the shortest path to Emily? Starting from Anne, please only list the people's names in order, including Anne, separated by commas. Answer: ['Anne', 'Charles', 'Emily'] From Mary, what is the shortest path to Kelly? Starting from Mary, please only list the people's names in order, including Mary, separated by commas. Answer: ", "Both Prime Question Answer": ["Mary", "Deborah", "Bob", "Anne", "Charles", "Emily", "Kelly"], "Lexical Prime Question": "Imagine a group of 15 people. Anne is friends with Bob, Charles, Deborah and Emily. Bob is friends with Anne, Charles, Deborah and Emily. Charles is friends with Anne, Bob, Deborah and Emily. Deborah is friends with Anne, Bob, Charles and Mary. Emily is friends with Anne, Bob, Charles and Ned. Mary is friends with Deborah, Kelly, Sam and John. Kelly is friends with Mary, Sam, John and George. Sam is friends with Mary, Kelly, John and George. John is friends with Mary, Kelly, Sam and George. George is friends with Kelly, Sam, John and Fred. Fred is friends with George, Harrison, Isabelle and Lauren. Harrison is friends with Fred, Isabelle, Lauren and Ned. Isabelle is friends with Fred, Harrison, Lauren and Ned. Lauren is friends with Fred, Harrison, Isabelle and Ned. Ned is friends with Harrison, Isabelle, Lauren and Emily. From Mary, what is the shortest path to Bob? Starting from Mary, please only list the people's names in order, including Mary, separated by commas. Answer: ['Mary', 'Deborah', 'Bob'] Imagine a group of 7 people. Anne is friends with Bob and Charles. Bob is friends with Anne and Deborah. Charles is friends with Anne and Emily. Deborah is friends with Bob and Mary. Emily is friends with Charles and Kelly. Mary is friends with Deborah. Kelly is friends with Emily. From Mary, what is the shortest path to Kelly? Starting from Mary, please only list the people's names in order, including Mary, separated by commas. Answer: ", "Lexical Prime Question Answer": ["Mary", "Deborah", "Bob", "Anne", "Charles", "Emily", "Kelly"], "Structural Prime Question": "Imagine a garden with 7 sections of flowers. The rose section is connected to the tulip section and the lavender section. The tulip section is connected to the rose section and the sunflower section. The lavender section is connected to the rose section and the daffodil section. The sunflower section is connected to the tulip section and the peony section. The daffodil section is connected to the lavender section and the geranium section. The peony section is connected to the sunflower section. The geranium section is connected to the daffodil section. From the rose section, what is the shortest path to the tulip section? Starting from rose, please only list the flower names in order, including rose, separated by commas. Answer: ['Rose', 'Tulip'] Imagine a group of 7 people. Anne is friends with Bob and Charles. Bob is friends with Anne and Deborah. Charles is friends with Anne and Emily. Deborah is friends with Bob and Mary. Emily is friends with Charles and Kelly. Mary is friends with Deborah. Kelly is friends with Emily. From Mary, what is the shortest path to Kelly? Starting from Mary, please only list the people's names in order, including Mary, separated by commas. Answer: ", "Structural Prime Question Answer": ["Mary", "Deborah", "Bob", "Anne", "Charles", "Emily", "Kelly"]}
{"Graph": "n7line_friends", "Description": "Imagine a group of 7 people. Anne is friends with Bob and Charles. Bob is friends with Anne and Deborah. Charles is friends with Anne and Emily. Deborah is friends with Bob and Mary. Emily is friends with Charles and Kelly. Mary is friends with Deborah. Kelly is friends with Emily.", "No Prime Question": "From Kelly, what is the shortest path to Deborah? Starting from Kelly, please only list the people's names in order, including Kelly, separated by commas. Answer: ", "No Prime Question Answer": ["Kelly", "Emily", "Charles", "Anne", "Bob", "Deborah"], "Both Prime Question": "Imagine a group of 7 people. Anne is friends with Bob and Charles. Bob is friends with Anne and Deborah. Charles is friends with Anne and Emily. Deborah is friends with Bob and Mary. Emily is friends with Charles and Kelly. Mary is friends with Deborah. Kelly is friends with Emily. From Bob, what is the shortest path to Emily? Starting from Bob, please only list the people's names in order, including Bob, separated by commas. Answer: ['Bob', 'Anne', 'Charles', 'Emily'] From Kelly, what is the shortest path to Deborah? Starting from Kelly, please only list the people's names in order, including Kelly, separated by commas. Answer: ", "Both Prime Question Answer": ["Kelly", "Emily", "Charles", "Anne", "Bob", "Deborah"], "Lexical Prime Question": "Imagine a group of 13 people. Anne is friends with Bob and Charles. Bob is friends with Anne and Deborah. Charles is friends with Anne and Emily. Deborah is friends with Bob and Mary. Emily is friends with Charles and Kelly. Mary is friends with Deborah and Sam. Kelly is friends with Emily and John. Sam is friends with Mary and George. John is friends with Kelly and Fred. George is friends with Sam and Harrison. Fred is friends with John and Isabelle. Harrison is friends with George. Isabelle is friends with Fred. From Bob, what is the shortest path to Kelly? Starting from Bob, please only list the people's names in order, including Bob, separated by commas. Answer: ['Bob', 'Anne', 'Charles', 'Emily', 'Kelly'] Imagine a group of 7 people. Anne is friends with Bob and Charles. Bob is friends with Anne and Deborah. Charles is friends with Anne and Emily. Deborah is friends with Bob and Mary. Emily is friends with Charles and Kelly. Mary is friends with Deborah. Kelly is friends with Emily. From Kelly, what is the shortest path to Deborah? Starting from Kelly, please only list the people's names in order, including Kelly, separated by commas. Answer: ", "Lexical Prime Question Answer": ["Kelly", "Emily", "Charles", "Anne", "Bob", "Deborah"], "Structural Prime Question": "Imagine a garden with 7 sections of flowers. The rose section is connected to the tulip section and the lavender section. The tulip section is connected to the rose section and the sunflower section. The lavender section is connected to the rose section and the daffodil section. The sunflower section is connected to the tulip section and the peony section. The daffodil section is connected to the lavender section and the geranium section. The peony section is connected to the sunflower section. The geranium section is connected to the daffodil section. From the lavender section, what is the shortest path to the peony section? Starting from lavender, please only list the flower names in order, including lavender, separated by commas. Answer: ['Lavender', 'Rose', 'Tulip', 'Sunflower', 'Peony'] Imagine a group of 7 people. Anne is friends with Bob and Charles. Bob is friends with Anne and Deborah. Charles is friends with Anne and Emily. Deborah is friends with Bob and Mary. Emily is friends with Charles and Kelly. Mary is friends with Deborah. Kelly is friends with Emily. From Kelly, what is the shortest path to Deborah? Starting from Kelly, please only list the people's names in order, including Kelly, separated by commas. Answer: ", "Structural Prime Question Answer": ["Kelly", "Emily", "Charles", "Anne", "Bob", "Deborah"]}
{"Graph": "n7line_friends", "Description": "Imagine a group of 7 people. Anne is friends with Bob and Charles. Bob is friends with Anne and Deborah. Charles is friends with Anne and Emily. Deborah is friends with Bob and Mary. Emily is friends with Charles and Kelly. Mary is friends with Deborah. Kelly is friends with Emily.", "No Prime Question": "From Bob, what is the shortest path to Kelly? Starting from Bob, please only list the people's names in order, including Bob, separated by commas. Answer: ", "No Prime Question Answer": ["Bob", "Anne", "Charles", "Emily", "Kelly"], "Both Prime Question": "Imagine a group of 7 people. Anne is friends with Bob and Charles. Bob is friends with Anne and Deborah. Charles is friends with Anne and Emily. Deborah is friends with Bob and Mary. Emily is friends with Charles and Kelly. Mary is friends with Deborah. Kelly is friends with Emily. From Mary, what is the shortest path to Emily? Starting from Mary, please only list the people's names in order, including Mary, separated by commas. Answer: ['Mary', 'Deborah', 'Bob', 'Anne', 'Charles', 'Emily'] From Bob, what is the shortest path to Kelly? Starting from Bob, please only list the people's names in order, including Bob, separated by commas. Answer: ", "Both Prime Question Answer": ["Bob", "Anne", "Charles", "Emily", "Kelly"], "Lexical Prime Question": "Imagine a group of 7 people. Anne is friends with Bob and Charles. Bob is friends with Anne, Deborah and Emily. Charles is friends with Anne, Mary and Kelly. Deborah is friends with Bob. Emily is friends with Bob. Mary is friends with Charles. Kelly is friends with Charles. From Charles, what is the shortest path to Emily? Starting from Charles, please only list the people's names in order, including Charles, separated by commas. Answer: ['Charles', 'Anne', 'Bob', 'Emily'] Imagine a group of 7 people. Anne is friends with Bob and Charles. Bob is friends with Anne and Deborah. Charles is friends with Anne and Emily. Deborah is friends with Bob and Mary. Emily is friends with Charles and Kelly. Mary is friends with Deborah. Kelly is friends with Emily. From Bob, what is the shortest path to Kelly? Starting from Bob, please only list the people's names in order, including Bob, separated by commas. Answer: ", "Lexical Prime Question Answer": ["Bob", "Anne", "Charles", "Emily", "Kelly"], "Structural Prime Question": "Imagine a garden with 7 sections of flowers. The rose section is connected to the tulip section and the lavender section. The tulip section is connected to the rose section and the sunflower section. The lavender section is connected to the rose section and the daffodil section. The sunflower section is connected to the tulip section and the peony section. The daffodil section is connected to the lavender section and the geranium section. The peony section is connected to the sunflower section. The geranium section is connected to the daffodil section. From the peony section, what is the shortest path to the geranium section? Starting from peony, please only list the flower names in order, including peony, separated by commas. Answer: ['Peony', 'Sunflower', 'Tulip', 'Rose', 'Lavender', 'Daffodil', 'Geranium'] Imagine a group of 7 people. Anne is friends with Bob and Charles. Bob is friends with Anne and Deborah. Charles is friends with Anne and Emily. Deborah is friends with Bob and Mary. Emily is friends with Charles and Kelly. Mary is friends with Deborah. Kelly is friends with Emily. From Bob, what is the shortest path to Kelly? Starting from Bob, please only list the people's names in order, including Bob, separated by commas. Answer: ", "Structural Prime Question Answer": ["Bob", "Anne", "Charles", "Emily", "Kelly"]}
{"Graph": "n7line_friends", "Description": "Imagine a group of 7 people. Anne is friends with Bob and Charles. Bob is friends with Anne and Deborah. Charles is friends with Anne and Emily. Deborah is friends with Bob and Mary. Emily is friends with Charles and Kelly. Mary is friends with Deborah. Kelly is friends with Emily.", "No Prime Question": "From Anne, what is the shortest path to Kelly? Starting from Anne, please only list the people's names in order, including Anne, separated by commas. Answer: ", "No Prime Question Answer": ["Anne", "Charles", "Emily", "Kelly"], "Both Prime Question": "Imagine a group of 7 people. Anne is friends with Bob and Charles. Bob is friends with Anne and Deborah. Charles is friends with Anne and Emily. Deborah is friends with Bob and Mary. Emily is friends with Charles and Kelly. Mary is friends with Deborah. Kelly is friends with Emily. From Emily, what is the shortest path to Bob? Starting from Emily, please only list the people's names in order, including Emily, separated by commas. Answer: ['Emily', 'Charles', 'Anne', 'Bob'] From Anne, what is the shortest path to Kelly? Starting from Anne, please only list the people's names in order, including Anne, separated by commas. Answer: ", "Both Prime Question Answer": ["Anne", "Charles", "Emily", "Kelly"], "Lexical Prime Question": "Imagine a group of 7 people. Anne is friends with Bob and Charles. Bob is friends with Anne, Deborah and Emily. Charles is friends with Anne, Mary and Kelly. Deborah is friends with Bob. Emily is friends with Bob. Mary is friends with Charles. Kelly is friends with Charles. From Kelly, what is the shortest path to Charles? Starting from Kelly, please only list the people's names in order, including Kelly, separated by commas. Answer: ['Kelly', 'Charles'] Imagine a group of 7 people. Anne is friends with Bob and Charles. Bob is friends with Anne and Deborah. Charles is friends with Anne and Emily. Deborah is friends with Bob and Mary. Emily is friends with Charles and Kelly. Mary is friends with Deborah. Kelly is friends with Emily. From Anne, what is the shortest path to Kelly? Starting from Anne, please only list the people's names in order, including Anne, separated by commas. Answer: ", "Lexical Prime Question Answer": ["Anne", "Charles", "Emily", "Kelly"], "Structural Prime Question": "Imagine a home with 7 rooms. Room 1 is connected to Room 2 and Room 3. Room 2 is connected to Room 1 and Room 4. Room 3 is connected to Room 1 and Room 5. Room 4 is connected to Room 2 and Room 6. Room 5 is connected to Room 3 and Room 7. Room 6 is connected to Room 4. Room 7 is connected to Room 5. From room 7, what is the shortest path to room 5? Starting from room 7, please only list the room numbers in order, including room 7, separated by commas. Answer: ['7', '5'] Imagine a group of 7 people. Anne is friends with Bob and Charles. Bob is friends with Anne and Deborah. Charles is friends with Anne and Emily. Deborah is friends with Bob and Mary. Emily is friends with Charles and Kelly. Mary is friends with Deborah. Kelly is friends with Emily. From Anne, what is the shortest path to Kelly? Starting from Anne, please only list the people's names in order, including Anne, separated by commas. Answer: ", "Structural Prime Question Answer": ["Anne", "Charles", "Emily", "Kelly"]}
{"Graph": "n7line_friends", "Description": "Imagine a group of 7 people. Anne is friends with Bob and Charles. Bob is friends with Anne and Deborah. Charles is friends with Anne and Emily. Deborah is friends with Bob and Mary. Emily is friends with Charles and Kelly. Mary is friends with Deborah. Kelly is friends with Emily.", "No Prime Question": "From Charles, what is the shortest path to Mary? Starting from Charles, please only list the people's names in order, including Charles, separated by commas. Answer: ", "No Prime Question Answer": ["Charles", "Anne", "Bob", "Deborah", "Mary"], "Both Prime Question": "Imagine a group of 7 people. Anne is friends with Bob and Charles. Bob is friends with Anne and Deborah. Charles is friends with Anne and Emily. Deborah is friends with Bob and Mary. Emily is friends with Charles and Kelly. Mary is friends with Deborah. Kelly is friends with Emily. From Deborah, what is the shortest path to Kelly? Starting from Deborah, please only list the people's names in order, including Deborah, separated by commas. Answer: ['Deborah', 'Bob', 'Anne', 'Charles', 'Emily', 'Kelly'] From Charles, what is the shortest path to Mary? Starting from Charles, please only list the people's names in order, including Charles, separated by commas. Answer: ", "Both Prime Question Answer": ["Charles", "Anne", "Bob", "Deborah", "Mary"], "Lexical Prime Question": "Imagine a group of 7 people. Anne is friends with Bob and Charles. Bob is friends with Anne, Deborah and Emily. Charles is friends with Anne, Mary and Kelly. Deborah is friends with Bob. Emily is friends with Bob. Mary is friends with Charles. Kelly is friends with Charles. From Bob, what is the shortest path to Deborah? Starting from Bob, please only list the people's names in order, including Bob, separated by commas. Answer: ['Bob', 'Deborah'] Imagine a group of 7 people. Anne is friends with Bob and Charles. Bob is friends with Anne and Deborah. Charles is friends with Anne and Emily. Deborah is friends with Bob and Mary. Emily is friends with Charles and Kelly. Mary is friends with Deborah. Kelly is friends with Emily. From Charles, what is the shortest path to Mary? Starting from Charles, please only list the people's names in order, including Charles, separated by commas. Answer: ", "Lexical Prime Question Answer": ["Charles", "Anne", "Bob", "Deborah", "Mary"], "Structural Prime Question": "Imagine a garden with 7 sections of flowers. The rose section is connected to the tulip section and the lavender section. The tulip section is connected to the rose section and the sunflower section. The lavender section is connected to the rose section and the daffodil section. The sunflower section is connected to the tulip section and the peony section. The daffodil section is connected to the lavender section and the geranium section. The peony section is connected to the sunflower section. The geranium section is connected to the daffodil section. From the rose section, what is the shortest path to the geranium section? Starting from rose, please only list the flower names in order, including rose, separated by commas. Answer: ['Rose', 'Lavender', 'Daffodil', 'Geranium'] Imagine a group of 7 people. Anne is friends with Bob and Charles. Bob is friends with Anne and Deborah. Charles is friends with Anne and Emily. Deborah is friends with Bob and Mary. Emily is friends with Charles and Kelly. Mary is friends with Deborah. Kelly is friends with Emily. From Charles, what is the shortest path to Mary? Starting from Charles, please only list the people's names in order, including Charles, separated by commas. Answer: ", "Structural Prime Question Answer": ["Charles", "Anne", "Bob", "Deborah", "Mary"]}
{"Graph": "n7line_friends", "Description": "Imagine a group of 7 people. Anne is friends with Bob and Charles. Bob is friends with Anne and Deborah. Charles is friends with Anne and Emily. Deborah is friends with Bob and Mary. Emily is friends with Charles and Kelly. Mary is friends with Deborah. Kelly is friends with Emily.", "No Prime Question": "From Kelly, what is the shortest path to Bob? Starting from Kelly, please only list the people's names in order, including Kelly, separated by commas. Answer: ", "No Prime Question Answer": ["Kelly", "Emily", "Charles", "Anne", "Bob"], "Both Prime Question": "Imagine a group of 7 people. Anne is friends with Bob and Charles. Bob is friends with Anne and Deborah. Charles is friends with Anne and Emily. Deborah is friends with Bob and Mary. Emily is friends with Charles and Kelly. Mary is friends with Deborah. Kelly is friends with Emily. From Anne, what is the shortest path to Emily? Starting from Anne, please only list the people's names in order, including Anne, separated by commas. Answer: ['Anne', 'Charles', 'Emily'] From Kelly, what is the shortest path to Bob? Starting from Kelly, please only list the people's names in order, including Kelly, separated by commas. Answer: ", "Both Prime Question Answer": ["Kelly", "Emily", "Charles", "Anne", "Bob"], "Lexical Prime Question": "Imagine a group of 15 people. Anne is friends with Bob, Charles, Deborah and Emily. Bob is friends with Anne, Charles, Deborah and Emily. Charles is friends with Anne, Bob, Deborah and Emily. Deborah is friends with Anne, Bob, Charles and Mary. Emily is friends with Anne, Bob, Charles and Ned. Mary is friends with Deborah, Kelly, Sam and John. Kelly is friends with Mary, Sam, John and George. Sam is friends with Mary, Kelly, John and George. John is friends with Mary, Kelly, Sam and George. George is friends with Kelly, Sam, John and Fred. Fred is friends with George, Harrison, Isabelle and Lauren. Harrison is friends with Fred, Isabelle, Lauren and Ned. Isabelle is friends with Fred, Harrison, Lauren and Ned. Lauren is friends with Fred, Harrison, Isabelle and Ned. Ned is friends with Harrison, Isabelle, Lauren and Emily. From John, what is the shortest path to Kelly? Starting from John, please only list the people's names in order, including John, separated by commas. Answer: ['John', 'Kelly'] Imagine a group of 7 people. Anne is friends with Bob and Charles. Bob is friends with Anne and Deborah. Charles is friends with Anne and Emily. Deborah is friends with Bob and Mary. Emily is friends with Charles and Kelly. Mary is friends with Deborah. Kelly is friends with Emily. From Kelly, what is the shortest path to Bob? Starting from Kelly, please only list the people's names in order, including Kelly, separated by commas. Answer: ", "Lexical Prime Question Answer": ["Kelly", "Emily", "Charles", "Anne", "Bob"], "Structural Prime Question": "Imagine a home with 7 rooms. Room 1 is connected to Room 2 and Room 3. Room 2 is connected to Room 1 and Room 4. Room 3 is connected to Room 1 and Room 5. Room 4 is connected to Room 2 and Room 6. Room 5 is connected to Room 3 and Room 7. Room 6 is connected to Room 4. Room 7 is connected to Room 5. From room 6, what is the shortest path to room 4? Starting from room 6, please only list the room numbers in order, including room 6, separated by commas. Answer: ['6', '4'] Imagine a group of 7 people. Anne is friends with Bob and Charles. Bob is friends with Anne and Deborah. Charles is friends with Anne and Emily. Deborah is friends with Bob and Mary. Emily is friends with Charles and Kelly. Mary is friends with Deborah. Kelly is friends with Emily. From Kelly, what is the shortest path to Bob? Starting from Kelly, please only list the people's names in order, including Kelly, separated by commas. Answer: ", "Structural Prime Question Answer": ["Kelly", "Emily", "Charles", "Anne", "Bob"]}
