{"Graph": "n13line_friends", "Description": "Imagine a group of 13 people. Anne is friends with Bob and Charles. Bob is friends with Anne and Deborah. Charles is friends with Anne and Emily. Deborah is friends with Bob and Mary. Emily is friends with Charles and Kelly. Mary is friends with Deborah and Sam. Kelly is friends with Emily and John. Sam is friends with Mary and George. John is friends with Kelly and Fred. George is friends with Sam and Harrison. Fred is friends with John and Isabelle. Harrison is friends with George. Isabelle is friends with Fred.", "No Prime Question": "From Bob, what is the shortest path to Emily? Starting from Bob, please only list the people's names in order, including Bob, separated by commas. Answer: ", "No Prime Question Answer": ["Bob", "Anne", "Charles", "Emily"], "Both Prime Question": "Imagine a group of 13 people. Anne is friends with Bob and Charles. Bob is friends with Anne and Deborah. Charles is friends with Anne and Emily. Deborah is friends with Bob and Mary. Emily is friends with Charles and Kelly. Mary is friends with Deborah and Sam. Kelly is friends with Emily and John. Sam is friends with Mary and George. John is friends with Kelly and Fred. George is friends with Sam and Harrison. Fred is friends with John and Isabelle. Harrison is friends with George. Isabelle is friends with Fred. From Charles, what is the shortest path to Fred? Starting from Charles, please only list the people's names in order, including Charles, separated by commas. Answer: ['Charles', 'Emily', 'Kelly', 'John', 'Fred'] From Bob, what is the shortest path to Emily? Starting from Bob, please only list the people's names in order, including Bob, separated by commas. Answer: ", "Both Prime Question Answer": ["Bob", "Anne", "Charles", "Emily"], "Lexical Prime Question": "Imagine a group of 7 people. Anne is friends with Bob and Charles. Bob is friends with Anne and Deborah. Charles is friends with Anne and Emily. Deborah is friends with Bob and Mary. Emily is friends with Charles and Kelly. Mary is friends with Deborah. Kelly is friends with Emily. From Deborah, what is the shortest path to Charles? Starting from Deborah, please only list the people's names in order, including Deborah, separated by commas. Answer: ['Deborah', 'Bob', 'Anne', 'Charles'] Imagine a group of 13 people. Anne is friends with Bob and Charles. Bob is friends with Anne and Deborah. Charles is friends with Anne and Emily. Deborah is friends with Bob and Mary. Emily is friends with Charles and Kelly. Mary is friends with Deborah and Sam. Kelly is friends with Emily and John. Sam is friends with Mary and George. John is friends with Kelly and Fred. George is friends with Sam and Harrison. Fred is friends with John and Isabelle. Harrison is friends with George. Isabelle is friends with Fred. From Bob, what is the shortest path to Emily? Starting from Bob, please only list the people's names in order, including Bob, separated by commas. Answer: ", "Lexical Prime Question Answer": ["Bob", "Anne", "Charles", "Emily"], "Structural Prime Question": "Imagine a garden with 13 sections of flowers. The rose section is connected to the tulip section and the lavender section. The tulip section is connected to the rose section and the sunflower section. The lavender section is connected to the rose section and the daffodil section. The sunflower section is connected to the tulip section and the peony section. The daffodil section is connected to the lavender section and the geranium section. The peony section is connected to the sunflower section and the carnation section. The geranium section is connected to the daffodil section and the daisy section. The carnation section is connected to the peony section and the orchid section. The daisy section is connected to the geranium section and the iris section. The orchid section is connected to the carnation section and the poppy section. The iris section is connected to the daisy section and the marigold section. The poppy section is connected to the orchid section. The marigold section is connected to the iris section. From the lavender section, what is the shortest path to the poppy section? Starting from lavender, please only list the flower names in order, including lavender, separated by commas. Answer: ['Lavender', 'Rose', 'Tulip', 'Sunflower', 'Peony', 'Carnation', 'Orchid', 'Poppy'] Imagine a group of 13 people. Anne is friends with Bob and Charles. Bob is friends with Anne and Deborah. Charles is friends with Anne and Emily. Deborah is friends with Bob and Mary. Emily is friends with Charles and Kelly. Mary is friends with Deborah and Sam. Kelly is friends with Emily and John. Sam is friends with Mary and George. John is friends with Kelly and Fred. George is friends with Sam and Harrison. Fred is friends with John and Isabelle. Harrison is friends with George. Isabelle is friends with Fred. From Bob, what is the shortest path to Emily? Starting from Bob, please only list the people's names in order, including Bob, separated by commas. Answer: ", "Structural Prime Question Answer": ["Bob", "Anne", "Charles", "Emily"]}
{"Graph": "n13line_friends", "Description": "Imagine a group of 13 people. Anne is friends with Bob and Charles. Bob is friends with Anne and Deborah. Charles is friends with Anne and Emily. Deborah is friends with Bob and Mary. Emily is friends with Charles and Kelly. Mary is friends with Deborah and Sam. Kelly is friends with Emily and John. Sam is friends with Mary and George. John is friends with Kelly and Fred. George is friends with Sam and Harrison. Fred is friends with John and Isabelle. Harrison is friends with George. Isabelle is friends with Fred.", "No Prime Question": "From Sam, what is the shortest path to John? Starting from Sam, please only list the people's names in order, including Sam, separated by commas. Answer: ", "No Prime Question Answer": ["Sam", "Mary", "Deborah", "Bob", "Anne", "Charles", "Emily", "Kelly", "John"], "Both Prime Question": "Imagine a group of 13 people. Anne is friends with Bob and Charles. Bob is friends with Anne and Deborah. Charles is friends with Anne and Emily. Deborah is friends with Bob and Mary. Emily is friends with Charles and Kelly. Mary is friends with Deborah and Sam. Kelly is friends with Emily and John. Sam is friends with Mary and George. John is friends with Kelly and Fred. George is friends with Sam and Harrison. Fred is friends with John and Isabelle. Harrison is friends with George. Isabelle is friends with Fred. From Emily, what is the shortest path to Isabelle? Starting from Emily, please only list the people's names in order, including Emily, separated by commas. Answer: ['Emily', 'Kelly', 'John', 'Fred', 'Isabelle'] From Sam, what is the shortest path to John? Starting from Sam, please only list the people's names in order, including Sam, separated by commas. Answer: ", "Both Prime Question Answer": ["Sam", "Mary", "Deborah", "Bob", "Anne", "Charles", "Emily", "Kelly", "John"], "Lexical Prime Question": "Imagine a group of 7 people. Anne is friends with Bob and Charles. Bob is friends with Anne and Deborah. Charles is friends with Anne and Emily. Deborah is friends with Bob and Mary. Emily is friends with Charles and Kelly. Mary is friends with Deborah. Kelly is friends with Emily. From Emily, what is the shortest path to Bob? Starting from Emily, please only list the people's names in order, including Emily, separated by commas. Answer: ['Emily', 'Charles', 'Anne', 'Bob'] Imagine a group of 13 people. Anne is friends with Bob and Charles. Bob is friends with Anne and Deborah. Charles is friends with Anne and Emily. Deborah is friends with Bob and Mary. Emily is friends with Charles and Kelly. Mary is friends with Deborah and Sam. Kelly is friends with Emily and John. Sam is friends with Mary and George. John is friends with Kelly and Fred. George is friends with Sam and Harrison. Fred is friends with John and Isabelle. Harrison is friends with George. Isabelle is friends with Fred. From Sam, what is the shortest path to John? Starting from Sam, please only list the people's names in order, including Sam, separated by commas. Answer: ", "Lexical Prime Question Answer": ["Sam", "Mary", "Deborah", "Bob", "Anne", "Charles", "Emily", "Kelly", "John"], "Structural Prime Question": "Imagine a garden with 13 sections of flowers. The rose section is connected to the tulip section and the lavender section. The tulip section is connected to the rose section and the sunflower section. The lavender section is connected to the rose section and the daffodil section. The sunflower section is connected to the tulip section and the peony section. The daffodil section is connected to the lavender section and the geranium section. The peony section is connected to the sunflower section and the carnation section. The geranium section is connected to the daffodil section and the daisy section. The carnation section is connected to the peony section and the orchid section. The daisy section is connected to the geranium section and the iris section. The orchid section is connected to the carnation section and the poppy section. The iris section is connected to the daisy section and the marigold section. The poppy section is connected to the orchid section. The marigold section is connected to the iris section. From the orchid section, what is the shortest path to the marigold section? Starting from orchid, please only list the flower names in order, including orchid, separated by commas. Answer: ['Orchid', 'Carnation', 'Peony', 'Sunflower', 'Tulip', 'Rose', 'Lavender', 'Daffodil', 'Geranium', 'Daisy', 'Iris', 'Marigold'] Imagine a group of 13 people. Anne is friends with Bob and Charles. Bob is friends with Anne and Deborah. Charles is friends with Anne and Emily. Deborah is friends with Bob and Mary. Emily is friends with Charles and Kelly. Mary is friends with Deborah and Sam. Kelly is friends with Emily and John. Sam is friends with Mary and George. John is friends with Kelly and Fred. George is friends with Sam and Harrison. Fred is friends with John and Isabelle. Harrison is friends with George. Isabelle is friends with Fred. From Sam, what is the shortest path to John? Starting from Sam, please only list the people's names in order, including Sam, separated by commas. Answer: ", "Structural Prime Question Answer": ["Sam", "Mary", "Deborah", "Bob", "Anne", "Charles", "Emily", "Kelly", "John"]}
{"Graph": "n13line_friends", "Description": "Imagine a group of 13 people. Anne is friends with Bob and Charles. Bob is friends with Anne and Deborah. Charles is friends with Anne and Emily. Deborah is friends with Bob and Mary. Emily is friends with Charles and Kelly. Mary is friends with Deborah and Sam. Kelly is friends with Emily and John. Sam is friends with Mary and George. John is friends with Kelly and Fred. George is friends with Sam and Harrison. Fred is friends with John and Isabelle. Harrison is friends with George. Isabelle is friends with Fred.", "No Prime Question": "From Harrison, what is the shortest path to George? Starting from Harrison, please only list the people's names in order, including Harrison, separated by commas. Answer: ", "No Prime Question Answer": ["Harrison", "George"], "Both Prime Question": "Imagine a group of 13 people. Anne is friends with Bob and Charles. Bob is friends with Anne and Deborah. Charles is friends with Anne and Emily. Deborah is friends with Bob and Mary. Emily is friends with Charles and Kelly. Mary is friends with Deborah and Sam. Kelly is friends with Emily and John. Sam is friends with Mary and George. John is friends with Kelly and Fred. George is friends with Sam and Harrison. Fred is friends with John and Isabelle. Harrison is friends with George. Isabelle is friends with Fred. From Deborah, what is the shortest path to John? Starting from Deborah, please only list the people's names in order, including Deborah, separated by commas. Answer: ['Deborah', 'Bob', 'Anne', 'Charles', 'Emily', 'Kelly', 'John'] From Harrison, what is the shortest path to George? Starting from Harrison, please only list the people's names in order, including Harrison, separated by commas. Answer: ", "Both Prime Question Answer": ["Harrison", "George"], "Lexical Prime Question": "Imagine a group of 7 people. Anne is friends with Bob and Charles. Bob is friends with Anne and Deborah. Charles is friends with Anne and Emily. Deborah is friends with Bob and Mary. Emily is friends with Charles and Kelly. Mary is friends with Deborah. Kelly is friends with Emily. From Anne, what is the shortest path to Emily? Starting from Anne, please only list the people's names in order, including Anne, separated by commas. Answer: ['Anne', 'Charles', 'Emily'] Imagine a group of 13 people. Anne is friends with Bob and Charles. Bob is friends with Anne and Deborah. Charles is friends with Anne and Emily. Deborah is friends with Bob and Mary. Emily is friends with Charles and Kelly. Mary is friends with Deborah and Sam. Kelly is friends with Emily and John. Sam is friends with Mary and George. John is friends with Kelly and Fred. George is friends with Sam and Harrison. Fred is friends with John and Isabelle. Harrison is friends with George. Isabelle is friends with Fred. From Harrison, what is the shortest path to George? Starting from Harrison, please only list the people's names in order, including Harrison, separated by commas. Answer: ", "Lexical Prime Question Answer": ["Harrison", "George"], "Structural Prime Question": "Imagine a home with 13 rooms. Room 1 is connected to Room 2 and Room 3. Room 2 is connected to Room 1 and Room 4. Room 3 is connected to Room 1 and Room 5. Room 4 is connected to Room 2 and Room 6. Room 5 is connected to Room 3 and Room 7. Room 6 is connected to Room 4 and Room 8. Room 7 is connected to Room 5 and Room 9. Room 8 is connected to Room 6 and Room 10. Room 9 is connected to Room 7 and Room 11. Room 10 is connected to Room 8 and Room 12. Room 11 is connected to Room 9 and Room 13. Room 12 is connected to Room 10. Room 13 is connected to Room 11. From room 13, what is the shortest path to room 11? Starting from room 13, please only list the room numbers in order, including room 13, separated by commas. Answer: ['13', '11'] Imagine a group of 13 people. Anne is friends with Bob and Charles. Bob is friends with Anne and Deborah. Charles is friends with Anne and Emily. Deborah is friends with Bob and Mary. Emily is friends with Charles and Kelly. Mary is friends with Deborah and Sam. Kelly is friends with Emily and John. Sam is friends with Mary and George. John is friends with Kelly and Fred. George is friends with Sam and Harrison. Fred is friends with John and Isabelle. Harrison is friends with George. Isabelle is friends with Fred. From Harrison, what is the shortest path to George? Starting from Harrison, please only list the people's names in order, including Harrison, separated by commas. Answer: ", "Structural Prime Question Answer": ["Harrison", "George"]}
{"Graph": "n13line_friends", "Description": "Imagine a group of 13 people. Anne is friends with Bob and Charles. Bob is friends with Anne and Deborah. Charles is friends with Anne and Emily. Deborah is friends with Bob and Mary. Emily is friends with Charles and Kelly. Mary is friends with Deborah and Sam. Kelly is friends with Emily and John. Sam is friends with Mary and George. John is friends with Kelly and Fred. George is friends with Sam and Harrison. Fred is friends with John and Isabelle. Harrison is friends with George. Isabelle is friends with Fred.", "No Prime Question": "From Deborah, what is the shortest path to Sam? Starting from Deborah, please only list the people's names in order, including Deborah, separated by commas. Answer: ", "No Prime Question Answer": ["Deborah", "Mary", "Sam"], "Both Prime Question": "Imagine a group of 13 people. Anne is friends with Bob and Charles. Bob is friends with Anne and Deborah. Charles is friends with Anne and Emily. Deborah is friends with Bob and Mary. Emily is friends with Charles and Kelly. Mary is friends with Deborah and Sam. Kelly is friends with Emily and John. Sam is friends with Mary and George. John is friends with Kelly and Fred. George is friends with Sam and Harrison. Fred is friends with John and Isabelle. Harrison is friends with George. Isabelle is friends with Fred. From Anne, what is the shortest path to Emily? Starting from Anne, please only list the people's names in order, including Anne, separated by commas. Answer: ['Anne', 'Charles', 'Emily'] From Deborah, what is the shortest path to Sam? Starting from Deborah, please only list the people's names in order, including Deborah, separated by commas. Answer: ", "Both Prime Question Answer": ["Deborah", "Mary", "Sam"], "Lexical Prime Question": "Imagine a group of 7 people. Anne is friends with Bob and Charles. Bob is friends with Anne and Deborah. Charles is friends with Anne and Emily. Deborah is friends with Bob and Mary. Emily is friends with Charles and Kelly. Mary is friends with Deborah. Kelly is friends with Emily. From Anne, what is the shortest path to Charles? Starting from Anne, please only list the people's names in order, including Anne, separated by commas. Answer: ['Anne', 'Charles'] Imagine a group of 13 people. Anne is friends with Bob and Charles. Bob is friends with Anne and Deborah. Charles is friends with Anne and Emily. Deborah is friends with Bob and Mary. Emily is friends with Charles and Kelly. Mary is friends with Deborah and Sam. Kelly is friends with Emily and John. Sam is friends with Mary and George. John is friends with Kelly and Fred. George is friends with Sam and Harrison. Fred is friends with John and Isabelle. Harrison is friends with George. Isabelle is friends with Fred. From Deborah, what is the shortest path to Sam? Starting from Deborah, please only list the people's names in order, including Deborah, separated by commas. Answer: ", "Lexical Prime Question Answer": ["Deborah", "Mary", "Sam"], "Structural Prime Question": "Imagine a garden with 13 sections of flowers. The rose section is connected to the tulip section and the lavender section. The tulip section is connected to the rose section and the sunflower section. The lavender section is connected to the rose section and the daffodil section. The sunflower section is connected to the tulip section and the peony section. The daffodil section is connected to the lavender section and the geranium section. The peony section is connected to the sunflower section and the carnation section. The geranium section is connected to the daffodil section and the daisy section. The carnation section is connected to the peony section and the orchid section. The daisy section is connected to the geranium section and the iris section. The orchid section is connected to the carnation section and the poppy section. The iris section is connected to the daisy section and the marigold section. The poppy section is connected to the orchid section. The marigold section is connected to the iris section. From the daisy section, what is the shortest path to the carnation section? Starting from daisy, please only list the flower names in order, including daisy, separated by commas. Answer: ['Daisy', 'Geranium', 'Daffodil', 'Lavender', 'Rose', 'Tulip', 'Sunflower', 'Peony', 'Carnation'] Imagine a group of 13 people. Anne is friends with Bob and Charles. Bob is friends with Anne and Deborah. Charles is friends with Anne and Emily. Deborah is friends with Bob and Mary. Emily is friends with Charles and Kelly. Mary is friends with Deborah and Sam. Kelly is friends with Emily and John. Sam is friends with Mary and George. John is friends with Kelly and Fred. George is friends with Sam and Harrison. Fred is friends with John and Isabelle. Harrison is friends with George. Isabelle is friends with Fred. From Deborah, what is the shortest path to Sam? Starting from Deborah, please only list the people's names in order, including Deborah, separated by commas. Answer: ", "Structural Prime Question Answer": ["Deborah", "Mary", "Sam"]}
{"Graph": "n13line_friends", "Description": "Imagine a group of 13 people. Anne is friends with Bob and Charles. Bob is friends with Anne and Deborah. Charles is friends with Anne and Emily. Deborah is friends with Bob and Mary. Emily is friends with Charles and Kelly. Mary is friends with Deborah and Sam. Kelly is friends with Emily and John. Sam is friends with Mary and George. John is friends with Kelly and Fred. George is friends with Sam and Harrison. Fred is friends with John and Isabelle. Harrison is friends with George. Isabelle is friends with Fred.", "No Prime Question": "From Harrison, what is the shortest path to Kelly? Starting from Harrison, please only list the people's names in order, including Harrison, separated by commas. Answer: ", "No Prime Question Answer": ["Harrison", "George", "Sam", "Mary", "Deborah", "Bob", "Anne", "Charles", "Emily", "Kelly"], "Both Prime Question": "Imagine a group of 13 people. Anne is friends with Bob and Charles. Bob is friends with Anne and Deborah. Charles is friends with Anne and Emily. Deborah is friends with Bob and Mary. Emily is friends with Charles and Kelly. Mary is friends with Deborah and Sam. Kelly is friends with Emily and John. Sam is friends with Mary and George. John is friends with Kelly and Fred. George is friends with Sam and Harrison. Fred is friends with John and Isabelle. Harrison is friends with George. Isabelle is friends with Fred. From Emily, what is the shortest path to George? Starting from Emily, please only list the people's names in order, including Emily, separated by commas. Answer: ['Emily', 'Charles', 'Anne', 'Bob', 'Deborah', 'Mary', 'Sam', 'George'] From Harrison, what is the shortest path to Kelly? Starting from Harrison, please only list the people's names in order, including Harrison, separated by commas. Answer: ", "Both Prime Question Answer": ["Harrison", "George", "Sam", "Mary", "Deborah", "Bob", "Anne", "Charles", "Emily", "Kelly"], "Lexical Prime Question": "Imagine a group of 7 people. Anne is friends with Bob and Charles. Bob is friends with Anne, Deborah and Emily. Charles is friends with Anne, Mary and Kelly. Deborah is friends with Bob. Emily is friends with Bob. Mary is friends with Charles. Kelly is friends with Charles. From Bob, what is the shortest path to Deborah? Starting from Bob, please only list the people's names in order, including Bob, separated by commas. Answer: ['Bob', 'Deborah'] Imagine a group of 13 people. Anne is friends with Bob and Charles. Bob is friends with Anne and Deborah. Charles is friends with Anne and Emily. Deborah is friends with Bob and Mary. Emily is friends with Charles and Kelly. Mary is friends with Deborah and Sam. Kelly is friends with Emily and John. Sam is friends with Mary and George. John is friends with Kelly and Fred. George is friends with Sam and Harrison. Fred is friends with John and Isabelle. Harrison is friends with George. Isabelle is friends with Fred. From Harrison, what is the shortest path to Kelly? Starting from Harrison, please only list the people's names in order, including Harrison, separated by commas. Answer: ", "Lexical Prime Question Answer": ["Harrison", "George", "Sam", "Mary", "Deborah", "Bob", "Anne", "Charles", "Emily", "Kelly"], "Structural Prime Question": "Imagine a garden with 13 sections of flowers. The rose section is connected to the tulip section and the lavender section. The tulip section is connected to the rose section and the sunflower section. The lavender section is connected to the rose section and the daffodil section. The sunflower section is connected to the tulip section and the peony section. The daffodil section is connected to the lavender section and the geranium section. The peony section is connected to the sunflower section and the carnation section. The geranium section is connected to the daffodil section and the daisy section. The carnation section is connected to the peony section and the orchid section. The daisy section is connected to the geranium section and the iris section. The orchid section is connected to the carnation section and the poppy section. The iris section is connected to the daisy section and the marigold section. The poppy section is connected to the orchid section. The marigold section is connected to the iris section. From the sunflower section, what is the shortest path to the geranium section? Starting from sunflower, please only list the flower names in order, including sunflower, separated by commas. Answer: ['Sunflower', 'Tulip', 'Rose', 'Lavender', 'Daffodil', 'Geranium'] Imagine a group of 13 people. Anne is friends with Bob and Charles. Bob is friends with Anne and Deborah. Charles is friends with Anne and Emily. Deborah is friends with Bob and Mary. Emily is friends with Charles and Kelly. Mary is friends with Deborah and Sam. Kelly is friends with Emily and John. Sam is friends with Mary and George. John is friends with Kelly and Fred. George is friends with Sam and Harrison. Fred is friends with John and Isabelle. Harrison is friends with George. Isabelle is friends with Fred. From Harrison, what is the shortest path to Kelly? Starting from Harrison, please only list the people's names in order, including Harrison, separated by commas. Answer: ", "Structural Prime Question Answer": ["Harrison", "George", "Sam", "Mary", "Deborah", "Bob", "Anne", "Charles", "Emily", "Kelly"]}
{"Graph": "n13line_friends", "Description": "Imagine a group of 13 people. Anne is friends with Bob and Charles. Bob is friends with Anne and Deborah. Charles is friends with Anne and Emily. Deborah is friends with Bob and Mary. Emily is friends with Charles and Kelly. Mary is friends with Deborah and Sam. Kelly is friends with Emily and John. Sam is friends with Mary and George. John is friends with Kelly and Fred. George is friends with Sam and Harrison. Fred is friends with John and Isabelle. Harrison is friends with George. Isabelle is friends with Fred.", "No Prime Question": "From Sam, what is the shortest path to George? Starting from Sam, please only list the people's names in order, including Sam, separated by commas. Answer: ", "No Prime Question Answer": ["Sam", "George"], "Both Prime Question": "Imagine a group of 13 people. Anne is friends with Bob and Charles. Bob is friends with Anne and Deborah. Charles is friends with Anne and Emily. Deborah is friends with Bob and Mary. Emily is friends with Charles and Kelly. Mary is friends with Deborah and Sam. Kelly is friends with Emily and John. Sam is friends with Mary and George. John is friends with Kelly and Fred. George is friends with Sam and Harrison. Fred is friends with John and Isabelle. Harrison is friends with George. Isabelle is friends with Fred. From Fred, what is the shortest path to Kelly? Starting from Fred, please only list the people's names in order, including Fred, separated by commas. Answer: ['Fred', 'John', 'Kelly'] From Sam, what is the shortest path to George? Starting from Sam, please only list the people's names in order, including Sam, separated by commas. Answer: ", "Both Prime Question Answer": ["Sam", "George"], "Lexical Prime Question": "Imagine a group of 7 people. Anne is friends with Bob and Charles. Bob is friends with Anne, Deborah and Emily. Charles is friends with Anne, Mary and Kelly. Deborah is friends with Bob. Emily is friends with Bob. Mary is friends with Charles. Kelly is friends with Charles. From Bob, what is the shortest path to Emily? Starting from Bob, please only list the people's names in order, including Bob, separated by commas. Answer: ['Bob', 'Emily'] Imagine a group of 13 people. Anne is friends with Bob and Charles. Bob is friends with Anne and Deborah. Charles is friends with Anne and Emily. Deborah is friends with Bob and Mary. Emily is friends with Charles and Kelly. Mary is friends with Deborah and Sam. Kelly is friends with Emily and John. Sam is friends with Mary and George. John is friends with Kelly and Fred. George is friends with Sam and Harrison. Fred is friends with John and Isabelle. Harrison is friends with George. Isabelle is friends with Fred. From Sam, what is the shortest path to George? Starting from Sam, please only list the people's names in order, including Sam, separated by commas. Answer: ", "Lexical Prime Question Answer": ["Sam", "George"], "Structural Prime Question": "Imagine a garden with 13 sections of flowers. The rose section is connected to the tulip section and the lavender section. The tulip section is connected to the rose section and the sunflower section. The lavender section is connected to the rose section and the daffodil section. The sunflower section is connected to the tulip section and the peony section. The daffodil section is connected to the lavender section and the geranium section. The peony section is connected to the sunflower section and the carnation section. The geranium section is connected to the daffodil section and the daisy section. The carnation section is connected to the peony section and the orchid section. The daisy section is connected to the geranium section and the iris section. The orchid section is connected to the carnation section and the poppy section. The iris section is connected to the daisy section and the marigold section. The poppy section is connected to the orchid section. The marigold section is connected to the iris section. From the daisy section, what is the shortest path to the lavender section? Starting from daisy, please only list the flower names in order, including daisy, separated by commas. Answer: ['Daisy', 'Geranium', 'Daffodil', 'Lavender'] Imagine a group of 13 people. Anne is friends with Bob and Charles. Bob is friends with Anne and Deborah. Charles is friends with Anne and Emily. Deborah is friends with Bob and Mary. Emily is friends with Charles and Kelly. Mary is friends with Deborah and Sam. Kelly is friends with Emily and John. Sam is friends with Mary and George. John is friends with Kelly and Fred. George is friends with Sam and Harrison. Fred is friends with John and Isabelle. Harrison is friends with George. Isabelle is friends with Fred. From Sam, what is the shortest path to George? Starting from Sam, please only list the people's names in order, including Sam, separated by commas. Answer: ", "Structural Prime Question Answer": ["Sam", "George"]}
{"Graph": "n13line_friends", "Description": "Imagine a group of 13 people. Anne is friends with Bob and Charles. Bob is friends with Anne and Deborah. Charles is friends with Anne and Emily. Deborah is friends with Bob and Mary. Emily is friends with Charles and Kelly. Mary is friends with Deborah and Sam. Kelly is friends with Emily and John. Sam is friends with Mary and George. John is friends with Kelly and Fred. George is friends with Sam and Harrison. Fred is friends with John and Isabelle. Harrison is friends with George. Isabelle is friends with Fred.", "No Prime Question": "From Deborah, what is the shortest path to Isabelle? Starting from Deborah, please only list the people's names in order, including Deborah, separated by commas. Answer: ", "No Prime Question Answer": ["Deborah", "Bob", "Anne", "Charles", "Emily", "Kelly", "John", "Fred", "Isabelle"], "Both Prime Question": "Imagine a group of 13 people. Anne is friends with Bob and Charles. Bob is friends with Anne and Deborah. Charles is friends with Anne and Emily. Deborah is friends with Bob and Mary. Emily is friends with Charles and Kelly. Mary is friends with Deborah and Sam. Kelly is friends with Emily and John. Sam is friends with Mary and George. John is friends with Kelly and Fred. George is friends with Sam and Harrison. Fred is friends with John and Isabelle. Harrison is friends with George. Isabelle is friends with Fred. From Harrison, what is the shortest path to Bob? Starting from Harrison, please only list the people's names in order, including Harrison, separated by commas. Answer: ['Harrison', 'George', 'Sam', 'Mary', 'Deborah', 'Bob'] From Deborah, what is the shortest path to Isabelle? Starting from Deborah, please only list the people's names in order, including Deborah, separated by commas. Answer: ", "Both Prime Question Answer": ["Deborah", "Bob", "Anne", "Charles", "Emily", "Kelly", "John", "Fred", "Isabelle"], "Lexical Prime Question": "Imagine a group of 15 people. Anne is friends with Bob, Charles, Deborah and Emily. Bob is friends with Anne, Charles, Deborah and Emily. Charles is friends with Anne, Bob, Deborah and Emily. Deborah is friends with Anne, Bob, Charles and Mary. Emily is friends with Anne, Bob, Charles and Ned. Mary is friends with Deborah, Kelly, Sam and John. Kelly is friends with Mary, Sam, John and George. Sam is friends with Mary, Kelly, John and George. John is friends with Mary, Kelly, Sam and George. George is friends with Kelly, Sam, John and Fred. Fred is friends with George, Harrison, Isabelle and Lauren. Harrison is friends with Fred, Isabelle, Lauren and Ned. Isabelle is friends with Fred, Harrison, Lauren and Ned. Lauren is friends with Fred, Harrison, Isabelle and Ned. Ned is friends with Harrison, Isabelle, Lauren and Emily. From Mary, what is the shortest path to Fred? Starting from Mary, please only list the people's names in order, including Mary, separated by commas. Answer: ['Mary', 'Kelly', 'George', 'Fred'] Imagine a group of 13 people. Anne is friends with Bob and Charles. Bob is friends with Anne and Deborah. Charles is friends with Anne and Emily. Deborah is friends with Bob and Mary. Emily is friends with Charles and Kelly. Mary is friends with Deborah and Sam. Kelly is friends with Emily and John. Sam is friends with Mary and George. John is friends with Kelly and Fred. George is friends with Sam and Harrison. Fred is friends with John and Isabelle. Harrison is friends with George. Isabelle is friends with Fred. From Deborah, what is the shortest path to Isabelle? Starting from Deborah, please only list the people's names in order, including Deborah, separated by commas. Answer: ", "Lexical Prime Question Answer": ["Deborah", "Bob", "Anne", "Charles", "Emily", "Kelly", "John", "Fred", "Isabelle"], "Structural Prime Question": "Imagine a garden with 13 sections of flowers. The rose section is connected to the tulip section and the lavender section. The tulip section is connected to the rose section and the sunflower section. The lavender section is connected to the rose section and the daffodil section. The sunflower section is connected to the tulip section and the peony section. The daffodil section is connected to the lavender section and the geranium section. The peony section is connected to the sunflower section and the carnation section. The geranium section is connected to the daffodil section and the daisy section. The carnation section is connected to the peony section and the orchid section. The daisy section is connected to the geranium section and the iris section. The orchid section is connected to the carnation section and the poppy section. The iris section is connected to the daisy section and the marigold section. The poppy section is connected to the orchid section. The marigold section is connected to the iris section. From the geranium section, what is the shortest path to the carnation section? Starting from geranium, please only list the flower names in order, including geranium, separated by commas. Answer: ['Geranium', 'Daffodil', 'Lavender', 'Rose', 'Tulip', 'Sunflower', 'Peony', 'Carnation'] Imagine a group of 13 people. Anne is friends with Bob and Charles. Bob is friends with Anne and Deborah. Charles is friends with Anne and Emily. Deborah is friends with Bob and Mary. Emily is friends with Charles and Kelly. Mary is friends with Deborah and Sam. Kelly is friends with Emily and John. Sam is friends with Mary and George. John is friends with Kelly and Fred. George is friends with Sam and Harrison. Fred is friends with John and Isabelle. Harrison is friends with George. Isabelle is friends with Fred. From Deborah, what is the shortest path to Isabelle? Starting from Deborah, please only list the people's names in order, including Deborah, separated by commas. Answer: ", "Structural Prime Question Answer": ["Deborah", "Bob", "Anne", "Charles", "Emily", "Kelly", "John", "Fred", "Isabelle"]}
{"Graph": "n13line_friends", "Description": "Imagine a group of 13 people. Anne is friends with Bob and Charles. Bob is friends with Anne and Deborah. Charles is friends with Anne and Emily. Deborah is friends with Bob and Mary. Emily is friends with Charles and Kelly. Mary is friends with Deborah and Sam. Kelly is friends with Emily and John. Sam is friends with Mary and George. John is friends with Kelly and Fred. George is friends with Sam and Harrison. Fred is friends with John and Isabelle. Harrison is friends with George. Isabelle is friends with Fred.", "No Prime Question": "From George, what is the shortest path to Deborah? Starting from George, please only list the people's names in order, including George, separated by commas. Answer: ", "No Prime Question Answer": ["George", "Sam", "Mary", "Deborah"], "Both Prime Question": "Imagine a group of 13 people. Anne is friends with Bob and Charles. Bob is friends with Anne and Deborah. Charles is friends with Anne and Emily. Deborah is friends with Bob and Mary. Emily is friends with Charles and Kelly. Mary is friends with Deborah and Sam. Kelly is friends with Emily and John. Sam is friends with Mary and George. John is friends with Kelly and Fred. George is friends with Sam and Harrison. Fred is friends with John and Isabelle. Harrison is friends with George. Isabelle is friends with Fred. From Fred, what is the shortest path to Anne? Starting from Fred, please only list the people's names in order, including Fred, separated by commas. Answer: ['Fred', 'John', 'Kelly', 'Emily', 'Charles', 'Anne'] From George, what is the shortest path to Deborah? Starting from George, please only list the people's names in order, including George, separated by commas. Answer: ", "Both Prime Question Answer": ["George", "Sam", "Mary", "Deborah"], "Lexical Prime Question": "Imagine a group of 15 people. Anne is friends with Bob, Charles, Deborah and Emily. Bob is friends with Anne, Charles, Deborah and Emily. Charles is friends with Anne, Bob, Deborah and Emily. Deborah is friends with Anne, Bob, Charles and Mary. Emily is friends with Anne, Bob, Charles and Ned. Mary is friends with Deborah, Kelly, Sam and John. Kelly is friends with Mary, Sam, John and George. Sam is friends with Mary, Kelly, John and George. John is friends with Mary, Kelly, Sam and George. George is friends with Kelly, Sam, John and Fred. Fred is friends with George, Harrison, Isabelle and Lauren. Harrison is friends with Fred, Isabelle, Lauren and Ned. Isabelle is friends with Fred, Harrison, Lauren and Ned. Lauren is friends with Fred, Harrison, Isabelle and Ned. Ned is friends with Harrison, Isabelle, Lauren and Emily. From Mary, what is the shortest path to Kelly? Starting from Mary, please only list the people's names in order, including Mary, separated by commas. Answer: ['Mary', 'Kelly'] Imagine a group of 13 people. Anne is friends with Bob and Charles. Bob is friends with Anne and Deborah. Charles is friends with Anne and Emily. Deborah is friends with Bob and Mary. Emily is friends with Charles and Kelly. Mary is friends with Deborah and Sam. Kelly is friends with Emily and John. Sam is friends with Mary and George. John is friends with Kelly and Fred. George is friends with Sam and Harrison. Fred is friends with John and Isabelle. Harrison is friends with George. Isabelle is friends with Fred. From George, what is the shortest path to Deborah? Starting from George, please only list the people's names in order, including George, separated by commas. Answer: ", "Lexical Prime Question Answer": ["George", "Sam", "Mary", "Deborah"], "Structural Prime Question": "Imagine a home with 13 rooms. Room 1 is connected to Room 2 and Room 3. Room 2 is connected to Room 1 and Room 4. Room 3 is connected to Room 1 and Room 5. Room 4 is connected to Room 2 and Room 6. Room 5 is connected to Room 3 and Room 7. Room 6 is connected to Room 4 and Room 8. Room 7 is connected to Room 5 and Room 9. Room 8 is connected to Room 6 and Room 10. Room 9 is connected to Room 7 and Room 11. Room 10 is connected to Room 8 and Room 12. Room 11 is connected to Room 9 and Room 13. Room 12 is connected to Room 10. Room 13 is connected to Room 11. From room 2, what is the shortest path to room 7? Starting from room 2, please only list the room numbers in order, including room 2, separated by commas. Answer: ['2', '1', '3', '5', '7'] Imagine a group of 13 people. Anne is friends with Bob and Charles. Bob is friends with Anne and Deborah. Charles is friends with Anne and Emily. Deborah is friends with Bob and Mary. Emily is friends with Charles and Kelly. Mary is friends with Deborah and Sam. Kelly is friends with Emily and John. Sam is friends with Mary and George. John is friends with Kelly and Fred. George is friends with Sam and Harrison. Fred is friends with John and Isabelle. Harrison is friends with George. Isabelle is friends with Fred. From George, what is the shortest path to Deborah? Starting from George, please only list the people's names in order, including George, separated by commas. Answer: ", "Structural Prime Question Answer": ["George", "Sam", "Mary", "Deborah"]}
{"Graph": "n13line_friends", "Description": "Imagine a group of 13 people. Anne is friends with Bob and Charles. Bob is friends with Anne and Deborah. Charles is friends with Anne and Emily. Deborah is friends with Bob and Mary. Emily is friends with Charles and Kelly. Mary is friends with Deborah and Sam. Kelly is friends with Emily and John. Sam is friends with Mary and George. John is friends with Kelly and Fred. George is friends with Sam and Harrison. Fred is friends with John and Isabelle. Harrison is friends with George. Isabelle is friends with Fred.", "No Prime Question": "From Bob, what is the shortest path to Deborah? Starting from Bob, please only list the people's names in order, including Bob, separated by commas. Answer: ", "No Prime Question Answer": ["Bob", "Deborah"], "Both Prime Question": "Imagine a group of 13 people. Anne is friends with Bob and Charles. Bob is friends with Anne and Deborah. Charles is friends with Anne and Emily. Deborah is friends with Bob and Mary. Emily is friends with Charles and Kelly. Mary is friends with Deborah and Sam. Kelly is friends with Emily and John. Sam is friends with Mary and George. John is friends with Kelly and Fred. George is friends with Sam and Harrison. Fred is friends with John and Isabelle. Harrison is friends with George. Isabelle is friends with Fred. From Kelly, what is the shortest path to John? Starting from Kelly, please only list the people's names in order, including Kelly, separated by commas. Answer: ['Kelly', 'John'] From Bob, what is the shortest path to Deborah? Starting from Bob, please only list the people's names in order, including Bob, separated by commas. Answer: ", "Both Prime Question Answer": ["Bob", "Deborah"], "Lexical Prime Question": "Imagine a group of 15 people. Anne is friends with Bob, Charles, Deborah and Emily. Bob is friends with Anne, Charles, Deborah and Emily. Charles is friends with Anne, Bob, Deborah and Emily. Deborah is friends with Anne, Bob, Charles and Mary. Emily is friends with Anne, Bob, Charles and Ned. Mary is friends with Deborah, Kelly, Sam and John. Kelly is friends with Mary, Sam, John and George. Sam is friends with Mary, Kelly, John and George. John is friends with Mary, Kelly, Sam and George. George is friends with Kelly, Sam, John and Fred. Fred is friends with George, Harrison, Isabelle and Lauren. Harrison is friends with Fred, Isabelle, Lauren and Ned. Isabelle is friends with Fred, Harrison, Lauren and Ned. Lauren is friends with Fred, Harrison, Isabelle and Ned. Ned is friends with Harrison, Isabelle, Lauren and Emily. From Anne, what is the shortest path to Sam? Starting from Anne, please only list the people's names in order, including Anne, separated by commas. Answer: ['Anne', 'Deborah', 'Mary', 'Sam'] Imagine a group of 13 people. Anne is friends with Bob and Charles. Bob is friends with Anne and Deborah. Charles is friends with Anne and Emily. Deborah is friends with Bob and Mary. Emily is friends with Charles and Kelly. Mary is friends with Deborah and Sam. Kelly is friends with Emily and John. Sam is friends with Mary and George. John is friends with Kelly and Fred. George is friends with Sam and Harrison. Fred is friends with John and Isabelle. Harrison is friends with George. Isabelle is friends with Fred. From Bob, what is the shortest path to Deborah? Starting from Bob, please only list the people's names in order, including Bob, separated by commas. Answer: ", "Lexical Prime Question Answer": ["Bob", "Deborah"], "Structural Prime Question": "Imagine a home with 13 rooms. Room 1 is connected to Room 2 and Room 3. Room 2 is connected to Room 1 and Room 4. Room 3 is connected to Room 1 and Room 5. Room 4 is connected to Room 2 and Room 6. Room 5 is connected to Room 3 and Room 7. Room 6 is connected to Room 4 and Room 8. Room 7 is connected to Room 5 and Room 9. Room 8 is connected to Room 6 and Room 10. Room 9 is connected to Room 7 and Room 11. Room 10 is connected to Room 8 and Room 12. Room 11 is connected to Room 9 and Room 13. Room 12 is connected to Room 10. Room 13 is connected to Room 11. From room 5, what is the shortest path to room 3? Starting from room 5, please only list the room numbers in order, including room 5, separated by commas. Answer: ['5', '3'] Imagine a group of 13 people. Anne is friends with Bob and Charles. Bob is friends with Anne and Deborah. Charles is friends with Anne and Emily. Deborah is friends with Bob and Mary. Emily is friends with Charles and Kelly. Mary is friends with Deborah and Sam. Kelly is friends with Emily and John. Sam is friends with Mary and George. John is friends with Kelly and Fred. George is friends with Sam and Harrison. Fred is friends with John and Isabelle. Harrison is friends with George. Isabelle is friends with Fred. From Bob, what is the shortest path to Deborah? Starting from Bob, please only list the people's names in order, including Bob, separated by commas. Answer: ", "Structural Prime Question Answer": ["Bob", "Deborah"]}
{"Graph": "n13line_friends", "Description": "Imagine a group of 13 people. Anne is friends with Bob and Charles. Bob is friends with Anne and Deborah. Charles is friends with Anne and Emily. Deborah is friends with Bob and Mary. Emily is friends with Charles and Kelly. Mary is friends with Deborah and Sam. Kelly is friends with Emily and John. Sam is friends with Mary and George. John is friends with Kelly and Fred. George is friends with Sam and Harrison. Fred is friends with John and Isabelle. Harrison is friends with George. Isabelle is friends with Fred.", "No Prime Question": "From Sam, what is the shortest path to John? Starting from Sam, please only list the people's names in order, including Sam, separated by commas. Answer: ", "No Prime Question Answer": ["Sam", "Mary", "Deborah", "Bob", "Anne", "Charles", "Emily", "Kelly", "John"], "Both Prime Question": "Imagine a group of 13 people. Anne is friends with Bob and Charles. Bob is friends with Anne and Deborah. Charles is friends with Anne and Emily. Deborah is friends with Bob and Mary. Emily is friends with Charles and Kelly. Mary is friends with Deborah and Sam. Kelly is friends with Emily and John. Sam is friends with Mary and George. John is friends with Kelly and Fred. George is friends with Sam and Harrison. Fred is friends with John and Isabelle. Harrison is friends with George. Isabelle is friends with Fred. From Deborah, what is the shortest path to Anne? Starting from Deborah, please only list the people's names in order, including Deborah, separated by commas. Answer: ['Deborah', 'Bob', 'Anne'] From Sam, what is the shortest path to John? Starting from Sam, please only list the people's names in order, including Sam, separated by commas. Answer: ", "Both Prime Question Answer": ["Sam", "Mary", "Deborah", "Bob", "Anne", "Charles", "Emily", "Kelly", "John"], "Lexical Prime Question": "Imagine a group of 7 people. Anne is friends with Bob and Charles. Bob is friends with Anne and Deborah. Charles is friends with Anne and Emily. Deborah is friends with Bob and Mary. Emily is friends with Charles and Kelly. Mary is friends with Deborah. Kelly is friends with Emily. From Mary, what is the shortest path to Deborah? Starting from Mary, please only list the people's names in order, including Mary, separated by commas. Answer: ['Mary', 'Deborah'] Imagine a group of 13 people. Anne is friends with Bob and Charles. Bob is friends with Anne and Deborah. Charles is friends with Anne and Emily. Deborah is friends with Bob and Mary. Emily is friends with Charles and Kelly. Mary is friends with Deborah and Sam. Kelly is friends with Emily and John. Sam is friends with Mary and George. John is friends with Kelly and Fred. George is friends with Sam and Harrison. Fred is friends with John and Isabelle. Harrison is friends with George. Isabelle is friends with Fred. From Sam, what is the shortest path to John? Starting from Sam, please only list the people's names in order, including Sam, separated by commas. Answer: ", "Lexical Prime Question Answer": ["Sam", "Mary", "Deborah", "Bob", "Anne", "Charles", "Emily", "Kelly", "John"], "Structural Prime Question": "Imagine a garden with 13 sections of flowers. The rose section is connected to the tulip section and the lavender section. The tulip section is connected to the rose section and the sunflower section. The lavender section is connected to the rose section and the daffodil section. The sunflower section is connected to the tulip section and the peony section. The daffodil section is connected to the lavender section and the geranium section. The peony section is connected to the sunflower section and the carnation section. The geranium section is connected to the daffodil section and the daisy section. The carnation section is connected to the peony section and the orchid section. The daisy section is connected to the geranium section and the iris section. The orchid section is connected to the carnation section and the poppy section. The iris section is connected to the daisy section and the marigold section. The poppy section is connected to the orchid section. The marigold section is connected to the iris section. From the poppy section, what is the shortest path to the peony section? Starting from poppy, please only list the flower names in order, including poppy, separated by commas. Answer: ['Poppy', 'Orchid', 'Carnation', 'Peony'] Imagine a group of 13 people. Anne is friends with Bob and Charles. Bob is friends with Anne and Deborah. Charles is friends with Anne and Emily. Deborah is friends with Bob and Mary. Emily is friends with Charles and Kelly. Mary is friends with Deborah and Sam. Kelly is friends with Emily and John. Sam is friends with Mary and George. John is friends with Kelly and Fred. George is friends with Sam and Harrison. Fred is friends with John and Isabelle. Harrison is friends with George. Isabelle is friends with Fred. From Sam, what is the shortest path to John? Starting from Sam, please only list the people's names in order, including Sam, separated by commas. Answer: ", "Structural Prime Question Answer": ["Sam", "Mary", "Deborah", "Bob", "Anne", "Charles", "Emily", "Kelly", "John"]}
{"Graph": "n13line_friends", "Description": "Imagine a group of 13 people. Anne is friends with Bob and Charles. Bob is friends with Anne and Deborah. Charles is friends with Anne and Emily. Deborah is friends with Bob and Mary. Emily is friends with Charles and Kelly. Mary is friends with Deborah and Sam. Kelly is friends with Emily and John. Sam is friends with Mary and George. John is friends with Kelly and Fred. George is friends with Sam and Harrison. Fred is friends with John and Isabelle. Harrison is friends with George. Isabelle is friends with Fred.", "No Prime Question": "From Isabelle, what is the shortest path to Fred? Starting from Isabelle, please only list the people's names in order, including Isabelle, separated by commas. Answer: ", "No Prime Question Answer": ["Isabelle", "Fred"], "Both Prime Question": "Imagine a group of 13 people. Anne is friends with Bob and Charles. Bob is friends with Anne and Deborah. Charles is friends with Anne and Emily. Deborah is friends with Bob and Mary. Emily is friends with Charles and Kelly. Mary is friends with Deborah and Sam. Kelly is friends with Emily and John. Sam is friends with Mary and George. John is friends with Kelly and Fred. George is friends with Sam and Harrison. Fred is friends with John and Isabelle. Harrison is friends with George. Isabelle is friends with Fred. From Mary, what is the shortest path to Bob? Starting from Mary, please only list the people's names in order, including Mary, separated by commas. Answer: ['Mary', 'Deborah', 'Bob'] From Isabelle, what is the shortest path to Fred? Starting from Isabelle, please only list the people's names in order, including Isabelle, separated by commas. Answer: ", "Both Prime Question Answer": ["Isabelle", "Fred"], "Lexical Prime Question": "Imagine a group of 7 people. Anne is friends with Bob and Charles. Bob is friends with Anne and Deborah. Charles is friends with Anne and Emily. Deborah is friends with Bob and Mary. Emily is friends with Charles and Kelly. Mary is friends with Deborah. Kelly is friends with Emily. From Bob, what is the shortest path to Emily? Starting from Bob, please only list the people's names in order, including Bob, separated by commas. Answer: ['Bob', 'Anne', 'Charles', 'Emily'] Imagine a group of 13 people. Anne is friends with Bob and Charles. Bob is friends with Anne and Deborah. Charles is friends with Anne and Emily. Deborah is friends with Bob and Mary. Emily is friends with Charles and Kelly. Mary is friends with Deborah and Sam. Kelly is friends with Emily and John. Sam is friends with Mary and George. John is friends with Kelly and Fred. George is friends with Sam and Harrison. Fred is friends with John and Isabelle. Harrison is friends with George. Isabelle is friends with Fred. From Isabelle, what is the shortest path to Fred? Starting from Isabelle, please only list the people's names in order, including Isabelle, separated by commas. Answer: ", "Lexical Prime Question Answer": ["Isabelle", "Fred"], "Structural Prime Question": "Imagine a garden with 13 sections of flowers. The rose section is connected to the tulip section and the lavender section. The tulip section is connected to the rose section and the sunflower section. The lavender section is connected to the rose section and the daffodil section. The sunflower section is connected to the tulip section and the peony section. The daffodil section is connected to the lavender section and the geranium section. The peony section is connected to the sunflower section and the carnation section. The geranium section is connected to the daffodil section and the daisy section. The carnation section is connected to the peony section and the orchid section. The daisy section is connected to the geranium section and the iris section. The orchid section is connected to the carnation section and the poppy section. The iris section is connected to the daisy section and the marigold section. The poppy section is connected to the orchid section. The marigold section is connected to the iris section. From the rose section, what is the shortest path to the daffodil section? Starting from rose, please only list the flower names in order, including rose, separated by commas. Answer: ['Rose', 'Lavender', 'Daffodil'] Imagine a group of 13 people. Anne is friends with Bob and Charles. Bob is friends with Anne and Deborah. Charles is friends with Anne and Emily. Deborah is friends with Bob and Mary. Emily is friends with Charles and Kelly. Mary is friends with Deborah and Sam. Kelly is friends with Emily and John. Sam is friends with Mary and George. John is friends with Kelly and Fred. George is friends with Sam and Harrison. Fred is friends with John and Isabelle. Harrison is friends with George. Isabelle is friends with Fred. From Isabelle, what is the shortest path to Fred? Starting from Isabelle, please only list the people's names in order, including Isabelle, separated by commas. Answer: ", "Structural Prime Question Answer": ["Isabelle", "Fred"]}
{"Graph": "n13line_friends", "Description": "Imagine a group of 13 people. Anne is friends with Bob and Charles. Bob is friends with Anne and Deborah. Charles is friends with Anne and Emily. Deborah is friends with Bob and Mary. Emily is friends with Charles and Kelly. Mary is friends with Deborah and Sam. Kelly is friends with Emily and John. Sam is friends with Mary and George. John is friends with Kelly and Fred. George is friends with Sam and Harrison. Fred is friends with John and Isabelle. Harrison is friends with George. Isabelle is friends with Fred.", "No Prime Question": "From Charles, what is the shortest path to Isabelle? Starting from Charles, please only list the people's names in order, including Charles, separated by commas. Answer: ", "No Prime Question Answer": ["Charles", "Emily", "Kelly", "John", "Fred", "Isabelle"], "Both Prime Question": "Imagine a group of 13 people. Anne is friends with Bob and Charles. Bob is friends with Anne and Deborah. Charles is friends with Anne and Emily. Deborah is friends with Bob and Mary. Emily is friends with Charles and Kelly. Mary is friends with Deborah and Sam. Kelly is friends with Emily and John. Sam is friends with Mary and George. John is friends with Kelly and Fred. George is friends with Sam and Harrison. Fred is friends with John and Isabelle. Harrison is friends with George. Isabelle is friends with Fred. From Harrison, what is the shortest path to Anne? Starting from Harrison, please only list the people's names in order, including Harrison, separated by commas. Answer: ['Harrison', 'George', 'Sam', 'Mary', 'Deborah', 'Bob', 'Anne'] From Charles, what is the shortest path to Isabelle? Starting from Charles, please only list the people's names in order, including Charles, separated by commas. Answer: ", "Both Prime Question Answer": ["Charles", "Emily", "Kelly", "John", "Fred", "Isabelle"], "Lexical Prime Question": "Imagine a group of 7 people. Anne is friends with Bob and Charles. Bob is friends with Anne and Deborah. Charles is friends with Anne and Emily. Deborah is friends with Bob and Mary. Emily is friends with Charles and Kelly. Mary is friends with Deborah. Kelly is friends with Emily. From Emily, what is the shortest path to Bob? Starting from Emily, please only list the people's names in order, including Emily, separated by commas. Answer: ['Emily', 'Charles', 'Anne', 'Bob'] Imagine a group of 13 people. Anne is friends with Bob and Charles. Bob is friends with Anne and Deborah. Charles is friends with Anne and Emily. Deborah is friends with Bob and Mary. Emily is friends with Charles and Kelly. Mary is friends with Deborah and Sam. Kelly is friends with Emily and John. Sam is friends with Mary and George. John is friends with Kelly and Fred. George is friends with Sam and Harrison. Fred is friends with John and Isabelle. Harrison is friends with George. Isabelle is friends with Fred. From Charles, what is the shortest path to Isabelle? Starting from Charles, please only list the people's names in order, including Charles, separated by commas. Answer: ", "Lexical Prime Question Answer": ["Charles", "Emily", "Kelly", "John", "Fred", "Isabelle"], "Structural Prime Question": "Imagine a home with 13 rooms. Room 1 is connected to Room 2 and Room 3. Room 2 is connected to Room 1 and Room 4. Room 3 is connected to Room 1 and Room 5. Room 4 is connected to Room 2 and Room 6. Room 5 is connected to Room 3 and Room 7. Room 6 is connected to Room 4 and Room 8. Room 7 is connected to Room 5 and Room 9. Room 8 is connected to Room 6 and Room 10. Room 9 is connected to Room 7 and Room 11. Room 10 is connected to Room 8 and Room 12. Room 11 is connected to Room 9 and Room 13. Room 12 is connected to Room 10. Room 13 is connected to Room 11. From room 10, what is the shortest path to room 4? Starting from room 10, please only list the room numbers in order, including room 10, separated by commas. Answer: ['10', '8', '6', '4'] Imagine a group of 13 people. Anne is friends with Bob and Charles. Bob is friends with Anne and Deborah. Charles is friends with Anne and Emily. Deborah is friends with Bob and Mary. Emily is friends with Charles and Kelly. Mary is friends with Deborah and Sam. Kelly is friends with Emily and John. Sam is friends with Mary and George. John is friends with Kelly and Fred. George is friends with Sam and Harrison. Fred is friends with John and Isabelle. Harrison is friends with George. Isabelle is friends with Fred. From Charles, what is the shortest path to Isabelle? Starting from Charles, please only list the people's names in order, including Charles, separated by commas. Answer: ", "Structural Prime Question Answer": ["Charles", "Emily", "Kelly", "John", "Fred", "Isabelle"]}
{"Graph": "n13line_friends", "Description": "Imagine a group of 13 people. Anne is friends with Bob and Charles. Bob is friends with Anne and Deborah. Charles is friends with Anne and Emily. Deborah is friends with Bob and Mary. Emily is friends with Charles and Kelly. Mary is friends with Deborah and Sam. Kelly is friends with Emily and John. Sam is friends with Mary and George. John is friends with Kelly and Fred. George is friends with Sam and Harrison. Fred is friends with John and Isabelle. Harrison is friends with George. Isabelle is friends with Fred.", "No Prime Question": "From Isabelle, what is the shortest path to Anne? Starting from Isabelle, please only list the people's names in order, including Isabelle, separated by commas. Answer: ", "No Prime Question Answer": ["Isabelle", "Fred", "John", "Kelly", "Emily", "Charles", "Anne"], "Both Prime Question": "Imagine a group of 13 people. Anne is friends with Bob and Charles. Bob is friends with Anne and Deborah. Charles is friends with Anne and Emily. Deborah is friends with Bob and Mary. Emily is friends with Charles and Kelly. Mary is friends with Deborah and Sam. Kelly is friends with Emily and John. Sam is friends with Mary and George. John is friends with Kelly and Fred. George is friends with Sam and Harrison. Fred is friends with John and Isabelle. Harrison is friends with George. Isabelle is friends with Fred. From John, what is the shortest path to Sam? Starting from John, please only list the people's names in order, including John, separated by commas. Answer: ['John', 'Kelly', 'Emily', 'Charles', 'Anne', 'Bob', 'Deborah', 'Mary', 'Sam'] From Isabelle, what is the shortest path to Anne? Starting from Isabelle, please only list the people's names in order, including Isabelle, separated by commas. Answer: ", "Both Prime Question Answer": ["Isabelle", "Fred", "John", "Kelly", "Emily", "Charles", "Anne"], "Lexical Prime Question": "Imagine a group of 7 people. Anne is friends with Bob and Charles. Bob is friends with Anne and Deborah. Charles is friends with Anne and Emily. Deborah is friends with Bob and Mary. Emily is friends with Charles and Kelly. Mary is friends with Deborah. Kelly is friends with Emily. From Anne, what is the shortest path to Emily? Starting from Anne, please only list the people's names in order, including Anne, separated by commas. Answer: ['Anne', 'Charles', 'Emily'] Imagine a group of 13 people. Anne is friends with Bob and Charles. Bob is friends with Anne and Deborah. Charles is friends with Anne and Emily. Deborah is friends with Bob and Mary. Emily is friends with Charles and Kelly. Mary is friends with Deborah and Sam. Kelly is friends with Emily and John. Sam is friends with Mary and George. John is friends with Kelly and Fred. George is friends with Sam and Harrison. Fred is friends with John and Isabelle. Harrison is friends with George. Isabelle is friends with Fred. From Isabelle, what is the shortest path to Anne? Starting from Isabelle, please only list the people's names in order, including Isabelle, separated by commas. Answer: ", "Lexical Prime Question Answer": ["Isabelle", "Fred", "John", "Kelly", "Emily", "Charles", "Anne"], "Structural Prime Question": "Imagine a garden with 13 sections of flowers. The rose section is connected to the tulip section and the lavender section. The tulip section is connected to the rose section and the sunflower section. The lavender section is connected to the rose section and the daffodil section. The sunflower section is connected to the tulip section and the peony section. The daffodil section is connected to the lavender section and the geranium section. The peony section is connected to the sunflower section and the carnation section. The geranium section is connected to the daffodil section and the daisy section. The carnation section is connected to the peony section and the orchid section. The daisy section is connected to the geranium section and the iris section. The orchid section is connected to the carnation section and the poppy section. The iris section is connected to the daisy section and the marigold section. The poppy section is connected to the orchid section. The marigold section is connected to the iris section. From the orchid section, what is the shortest path to the peony section? Starting from orchid, please only list the flower names in order, including orchid, separated by commas. Answer: ['Orchid', 'Carnation', 'Peony'] Imagine a group of 13 people. Anne is friends with Bob and Charles. Bob is friends with Anne and Deborah. Charles is friends with Anne and Emily. Deborah is friends with Bob and Mary. Emily is friends with Charles and Kelly. Mary is friends with Deborah and Sam. Kelly is friends with Emily and John. Sam is friends with Mary and George. John is friends with Kelly and Fred. George is friends with Sam and Harrison. Fred is friends with John and Isabelle. Harrison is friends with George. Isabelle is friends with Fred. From Isabelle, what is the shortest path to Anne? Starting from Isabelle, please only list the people's names in order, including Isabelle, separated by commas. Answer: ", "Structural Prime Question Answer": ["Isabelle", "Fred", "John", "Kelly", "Emily", "Charles", "Anne"]}
{"Graph": "n13line_friends", "Description": "Imagine a group of 13 people. Anne is friends with Bob and Charles. Bob is friends with Anne and Deborah. Charles is friends with Anne and Emily. Deborah is friends with Bob and Mary. Emily is friends with Charles and Kelly. Mary is friends with Deborah and Sam. Kelly is friends with Emily and John. Sam is friends with Mary and George. John is friends with Kelly and Fred. George is friends with Sam and Harrison. Fred is friends with John and Isabelle. Harrison is friends with George. Isabelle is friends with Fred.", "No Prime Question": "From Bob, what is the shortest path to Sam? Starting from Bob, please only list the people's names in order, including Bob, separated by commas. Answer: ", "No Prime Question Answer": ["Bob", "Deborah", "Mary", "Sam"], "Both Prime Question": "Imagine a group of 13 people. Anne is friends with Bob and Charles. Bob is friends with Anne and Deborah. Charles is friends with Anne and Emily. Deborah is friends with Bob and Mary. Emily is friends with Charles and Kelly. Mary is friends with Deborah and Sam. Kelly is friends with Emily and John. Sam is friends with Mary and George. John is friends with Kelly and Fred. George is friends with Sam and Harrison. Fred is friends with John and Isabelle. Harrison is friends with George. Isabelle is friends with Fred. From Fred, what is the shortest path to John? Starting from Fred, please only list the people's names in order, including Fred, separated by commas. Answer: ['Fred', 'John'] From Bob, what is the shortest path to Sam? Starting from Bob, please only list the people's names in order, including Bob, separated by commas. Answer: ", "Both Prime Question Answer": ["Bob", "Deborah", "Mary", "Sam"], "Lexical Prime Question": "Imagine a group of 15 people. Anne is friends with Bob, Charles, Deborah and Emily. Bob is friends with Anne, Charles, Deborah and Emily. Charles is friends with Anne, Bob, Deborah and Emily. Deborah is friends with Anne, Bob, Charles and Mary. Emily is friends with Anne, Bob, Charles and Ned. Mary is friends with Deborah, Kelly, Sam and John. Kelly is friends with Mary, Sam, John and George. Sam is friends with Mary, Kelly, John and George. John is friends with Mary, Kelly, Sam and George. George is friends with Kelly, Sam, John and Fred. Fred is friends with George, Harrison, Isabelle and Lauren. Harrison is friends with Fred, Isabelle, Lauren and Ned. Isabelle is friends with Fred, Harrison, Lauren and Ned. Lauren is friends with Fred, Harrison, Isabelle and Ned. Ned is friends with Harrison, Isabelle, Lauren and Emily. From Fred, what is the shortest path to John? Starting from Fred, please only list the people's names in order, including Fred, separated by commas. Answer: ['Fred', 'George', 'John'] Imagine a group of 13 people. Anne is friends with Bob and Charles. Bob is friends with Anne and Deborah. Charles is friends with Anne and Emily. Deborah is friends with Bob and Mary. Emily is friends with Charles and Kelly. Mary is friends with Deborah and Sam. Kelly is friends with Emily and John. Sam is friends with Mary and George. John is friends with Kelly and Fred. George is friends with Sam and Harrison. Fred is friends with John and Isabelle. Harrison is friends with George. Isabelle is friends with Fred. From Bob, what is the shortest path to Sam? Starting from Bob, please only list the people's names in order, including Bob, separated by commas. Answer: ", "Lexical Prime Question Answer": ["Bob", "Deborah", "Mary", "Sam"], "Structural Prime Question": "Imagine a garden with 13 sections of flowers. The rose section is connected to the tulip section and the lavender section. The tulip section is connected to the rose section and the sunflower section. The lavender section is connected to the rose section and the daffodil section. The sunflower section is connected to the tulip section and the peony section. The daffodil section is connected to the lavender section and the geranium section. The peony section is connected to the sunflower section and the carnation section. The geranium section is connected to the daffodil section and the daisy section. The carnation section is connected to the peony section and the orchid section. The daisy section is connected to the geranium section and the iris section. The orchid section is connected to the carnation section and the poppy section. The iris section is connected to the daisy section and the marigold section. The poppy section is connected to the orchid section. The marigold section is connected to the iris section. From the daffodil section, what is the shortest path to the lavender section? Starting from daffodil, please only list the flower names in order, including daffodil, separated by commas. Answer: ['Daffodil', 'Lavender'] Imagine a group of 13 people. Anne is friends with Bob and Charles. Bob is friends with Anne and Deborah. Charles is friends with Anne and Emily. Deborah is friends with Bob and Mary. Emily is friends with Charles and Kelly. Mary is friends with Deborah and Sam. Kelly is friends with Emily and John. Sam is friends with Mary and George. John is friends with Kelly and Fred. George is friends with Sam and Harrison. Fred is friends with John and Isabelle. Harrison is friends with George. Isabelle is friends with Fred. From Bob, what is the shortest path to Sam? Starting from Bob, please only list the people's names in order, including Bob, separated by commas. Answer: ", "Structural Prime Question Answer": ["Bob", "Deborah", "Mary", "Sam"]}
{"Graph": "n13line_friends", "Description": "Imagine a group of 13 people. Anne is friends with Bob and Charles. Bob is friends with Anne and Deborah. Charles is friends with Anne and Emily. Deborah is friends with Bob and Mary. Emily is friends with Charles and Kelly. Mary is friends with Deborah and Sam. Kelly is friends with Emily and John. Sam is friends with Mary and George. John is friends with Kelly and Fred. George is friends with Sam and Harrison. Fred is friends with John and Isabelle. Harrison is friends with George. Isabelle is friends with Fred.", "No Prime Question": "From Harrison, what is the shortest path to Fred? Starting from Harrison, please only list the people's names in order, including Harrison, separated by commas. Answer: ", "No Prime Question Answer": ["Harrison", "George", "Sam", "Mary", "Deborah", "Bob", "Anne", "Charles", "Emily", "Kelly", "John", "Fred"], "Both Prime Question": "Imagine a group of 13 people. Anne is friends with Bob and Charles. Bob is friends with Anne and Deborah. Charles is friends with Anne and Emily. Deborah is friends with Bob and Mary. Emily is friends with Charles and Kelly. Mary is friends with Deborah and Sam. Kelly is friends with Emily and John. Sam is friends with Mary and George. John is friends with Kelly and Fred. George is friends with Sam and Harrison. Fred is friends with John and Isabelle. Harrison is friends with George. Isabelle is friends with Fred. From Anne, what is the shortest path to Sam? Starting from Anne, please only list the people's names in order, including Anne, separated by commas. Answer: ['Anne', 'Bob', 'Deborah', 'Mary', 'Sam'] From Harrison, what is the shortest path to Fred? Starting from Harrison, please only list the people's names in order, including Harrison, separated by commas. Answer: ", "Both Prime Question Answer": ["Harrison", "George", "Sam", "Mary", "Deborah", "Bob", "Anne", "Charles", "Emily", "Kelly", "John", "Fred"], "Lexical Prime Question": "Imagine a group of 7 people. Anne is friends with Bob and Charles. Bob is friends with Anne, Deborah and Emily. Charles is friends with Anne, Mary and Kelly. Deborah is friends with Bob. Emily is friends with Bob. Mary is friends with Charles. Kelly is friends with Charles. From Kelly, what is the shortest path to Emily? Starting from Kelly, please only list the people's names in order, including Kelly, separated by commas. Answer: ['Kelly', 'Charles', 'Anne', 'Bob', 'Emily'] Imagine a group of 13 people. Anne is friends with Bob and Charles. Bob is friends with Anne and Deborah. Charles is friends with Anne and Emily. Deborah is friends with Bob and Mary. Emily is friends with Charles and Kelly. Mary is friends with Deborah and Sam. Kelly is friends with Emily and John. Sam is friends with Mary and George. John is friends with Kelly and Fred. George is friends with Sam and Harrison. Fred is friends with John and Isabelle. Harrison is friends with George. Isabelle is friends with Fred. From Harrison, what is the shortest path to Fred? Starting from Harrison, please only list the people's names in order, including Harrison, separated by commas. Answer: ", "Lexical Prime Question Answer": ["Harrison", "George", "Sam", "Mary", "Deborah", "Bob", "Anne", "Charles", "Emily", "Kelly", "John", "Fred"], "Structural Prime Question": "Imagine a garden with 13 sections of flowers. The rose section is connected to the tulip section and the lavender section. The tulip section is connected to the rose section and the sunflower section. The lavender section is connected to the rose section and the daffodil section. The sunflower section is connected to the tulip section and the peony section. The daffodil section is connected to the lavender section and the geranium section. The peony section is connected to the sunflower section and the carnation section. The geranium section is connected to the daffodil section and the daisy section. The carnation section is connected to the peony section and the orchid section. The daisy section is connected to the geranium section and the iris section. The orchid section is connected to the carnation section and the poppy section. The iris section is connected to the daisy section and the marigold section. The poppy section is connected to the orchid section. The marigold section is connected to the iris section. From the carnation section, what is the shortest path to the daffodil section? Starting from carnation, please only list the flower names in order, including carnation, separated by commas. Answer: ['Carnation', 'Peony', 'Sunflower', 'Tulip', 'Rose', 'Lavender', 'Daffodil'] Imagine a group of 13 people. Anne is friends with Bob and Charles. Bob is friends with Anne and Deborah. Charles is friends with Anne and Emily. Deborah is friends with Bob and Mary. Emily is friends with Charles and Kelly. Mary is friends with Deborah and Sam. Kelly is friends with Emily and John. Sam is friends with Mary and George. John is friends with Kelly and Fred. George is friends with Sam and Harrison. Fred is friends with John and Isabelle. Harrison is friends with George. Isabelle is friends with Fred. From Harrison, what is the shortest path to Fred? Starting from Harrison, please only list the people's names in order, including Harrison, separated by commas. Answer: ", "Structural Prime Question Answer": ["Harrison", "George", "Sam", "Mary", "Deborah", "Bob", "Anne", "Charles", "Emily", "Kelly", "John", "Fred"]}
{"Graph": "n13line_friends", "Description": "Imagine a group of 13 people. Anne is friends with Bob and Charles. Bob is friends with Anne and Deborah. Charles is friends with Anne and Emily. Deborah is friends with Bob and Mary. Emily is friends with Charles and Kelly. Mary is friends with Deborah and Sam. Kelly is friends with Emily and John. Sam is friends with Mary and George. John is friends with Kelly and Fred. George is friends with Sam and Harrison. Fred is friends with John and Isabelle. Harrison is friends with George. Isabelle is friends with Fred.", "No Prime Question": "From Isabelle, what is the shortest path to Sam? Starting from Isabelle, please only list the people's names in order, including Isabelle, separated by commas. Answer: ", "No Prime Question Answer": ["Isabelle", "Fred", "John", "Kelly", "Emily", "Charles", "Anne", "Bob", "Deborah", "Mary", "Sam"], "Both Prime Question": "Imagine a group of 13 people. Anne is friends with Bob and Charles. Bob is friends with Anne and Deborah. Charles is friends with Anne and Emily. Deborah is friends with Bob and Mary. Emily is friends with Charles and Kelly. Mary is friends with Deborah and Sam. Kelly is friends with Emily and John. Sam is friends with Mary and George. John is friends with Kelly and Fred. George is friends with Sam and Harrison. Fred is friends with John and Isabelle. Harrison is friends with George. Isabelle is friends with Fred. From Deborah, what is the shortest path to Bob? Starting from Deborah, please only list the people's names in order, including Deborah, separated by commas. Answer: ['Deborah', 'Bob'] From Isabelle, what is the shortest path to Sam? Starting from Isabelle, please only list the people's names in order, including Isabelle, separated by commas. Answer: ", "Both Prime Question Answer": ["Isabelle", "Fred", "John", "Kelly", "Emily", "Charles", "Anne", "Bob", "Deborah", "Mary", "Sam"], "Lexical Prime Question": "Imagine a group of 7 people. Anne is friends with Bob and Charles. Bob is friends with Anne and Deborah. Charles is friends with Anne and Emily. Deborah is friends with Bob and Mary. Emily is friends with Charles and Kelly. Mary is friends with Deborah. Kelly is friends with Emily. From Bob, what is the shortest path to Kelly? Starting from Bob, please only list the people's names in order, including Bob, separated by commas. Answer: ['Bob', 'Anne', 'Charles', 'Emily', 'Kelly'] Imagine a group of 13 people. Anne is friends with Bob and Charles. Bob is friends with Anne and Deborah. Charles is friends with Anne and Emily. Deborah is friends with Bob and Mary. Emily is friends with Charles and Kelly. Mary is friends with Deborah and Sam. Kelly is friends with Emily and John. Sam is friends with Mary and George. John is friends with Kelly and Fred. George is friends with Sam and Harrison. Fred is friends with John and Isabelle. Harrison is friends with George. Isabelle is friends with Fred. From Isabelle, what is the shortest path to Sam? Starting from Isabelle, please only list the people's names in order, including Isabelle, separated by commas. Answer: ", "Lexical Prime Question Answer": ["Isabelle", "Fred", "John", "Kelly", "Emily", "Charles", "Anne", "Bob", "Deborah", "Mary", "Sam"], "Structural Prime Question": "Imagine a garden with 13 sections of flowers. The rose section is connected to the tulip section and the lavender section. The tulip section is connected to the rose section and the sunflower section. The lavender section is connected to the rose section and the daffodil section. The sunflower section is connected to the tulip section and the peony section. The daffodil section is connected to the lavender section and the geranium section. The peony section is connected to the sunflower section and the carnation section. The geranium section is connected to the daffodil section and the daisy section. The carnation section is connected to the peony section and the orchid section. The daisy section is connected to the geranium section and the iris section. The orchid section is connected to the carnation section and the poppy section. The iris section is connected to the daisy section and the marigold section. The poppy section is connected to the orchid section. The marigold section is connected to the iris section. From the iris section, what is the shortest path to the poppy section? Starting from iris, please only list the flower names in order, including iris, separated by commas. Answer: ['Iris', 'Daisy', 'Geranium', 'Daffodil', 'Lavender', 'Rose', 'Tulip', 'Sunflower', 'Peony', 'Carnation', 'Orchid', 'Poppy'] Imagine a group of 13 people. Anne is friends with Bob and Charles. Bob is friends with Anne and Deborah. Charles is friends with Anne and Emily. Deborah is friends with Bob and Mary. Emily is friends with Charles and Kelly. Mary is friends with Deborah and Sam. Kelly is friends with Emily and John. Sam is friends with Mary and George. John is friends with Kelly and Fred. George is friends with Sam and Harrison. Fred is friends with John and Isabelle. Harrison is friends with George. Isabelle is friends with Fred. From Isabelle, what is the shortest path to Sam? Starting from Isabelle, please only list the people's names in order, including Isabelle, separated by commas. Answer: ", "Structural Prime Question Answer": ["Isabelle", "Fred", "John", "Kelly", "Emily", "Charles", "Anne", "Bob", "Deborah", "Mary", "Sam"]}
{"Graph": "n13line_friends", "Description": "Imagine a group of 13 people. Anne is friends with Bob and Charles. Bob is friends with Anne and Deborah. Charles is friends with Anne and Emily. Deborah is friends with Bob and Mary. Emily is friends with Charles and Kelly. Mary is friends with Deborah and Sam. Kelly is friends with Emily and John. Sam is friends with Mary and George. John is friends with Kelly and Fred. George is friends with Sam and Harrison. Fred is friends with John and Isabelle. Harrison is friends with George. Isabelle is friends with Fred.", "No Prime Question": "From Kelly, what is the shortest path to Harrison? Starting from Kelly, please only list the people's names in order, including Kelly, separated by commas. Answer: ", "No Prime Question Answer": ["Kelly", "Emily", "Charles", "Anne", "Bob", "Deborah", "Mary", "Sam", "George", "Harrison"], "Both Prime Question": "Imagine a group of 13 people. Anne is friends with Bob and Charles. Bob is friends with Anne and Deborah. Charles is friends with Anne and Emily. Deborah is friends with Bob and Mary. Emily is friends with Charles and Kelly. Mary is friends with Deborah and Sam. Kelly is friends with Emily and John. Sam is friends with Mary and George. John is friends with Kelly and Fred. George is friends with Sam and Harrison. Fred is friends with John and Isabelle. Harrison is friends with George. Isabelle is friends with Fred. From Fred, what is the shortest path to John? Starting from Fred, please only list the people's names in order, including Fred, separated by commas. Answer: ['Fred', 'John'] From Kelly, what is the shortest path to Harrison? Starting from Kelly, please only list the people's names in order, including Kelly, separated by commas. Answer: ", "Both Prime Question Answer": ["Kelly", "Emily", "Charles", "Anne", "Bob", "Deborah", "Mary", "Sam", "George", "Harrison"], "Lexical Prime Question": "Imagine a group of 7 people. Anne is friends with Bob and Charles. Bob is friends with Anne and Deborah. Charles is friends with Anne and Emily. Deborah is friends with Bob and Mary. Emily is friends with Charles and Kelly. Mary is friends with Deborah. Kelly is friends with Emily. From Bob, what is the shortest path to Kelly? Starting from Bob, please only list the people's names in order, including Bob, separated by commas. Answer: ['Bob', 'Anne', 'Charles', 'Emily', 'Kelly'] Imagine a group of 13 people. Anne is friends with Bob and Charles. Bob is friends with Anne and Deborah. Charles is friends with Anne and Emily. Deborah is friends with Bob and Mary. Emily is friends with Charles and Kelly. Mary is friends with Deborah and Sam. Kelly is friends with Emily and John. Sam is friends with Mary and George. John is friends with Kelly and Fred. George is friends with Sam and Harrison. Fred is friends with John and Isabelle. Harrison is friends with George. Isabelle is friends with Fred. From Kelly, what is the shortest path to Harrison? Starting from Kelly, please only list the people's names in order, including Kelly, separated by commas. Answer: ", "Lexical Prime Question Answer": ["Kelly", "Emily", "Charles", "Anne", "Bob", "Deborah", "Mary", "Sam", "George", "Harrison"], "Structural Prime Question": "Imagine a home with 13 rooms. Room 1 is connected to Room 2 and Room 3. Room 2 is connected to Room 1 and Room 4. Room 3 is connected to Room 1 and Room 5. Room 4 is connected to Room 2 and Room 6. Room 5 is connected to Room 3 and Room 7. Room 6 is connected to Room 4 and Room 8. Room 7 is connected to Room 5 and Room 9. Room 8 is connected to Room 6 and Room 10. Room 9 is connected to Room 7 and Room 11. Room 10 is connected to Room 8 and Room 12. Room 11 is connected to Room 9 and Room 13. Room 12 is connected to Room 10. Room 13 is connected to Room 11. From room 8, what is the shortest path to room 4? Starting from room 8, please only list the room numbers in order, including room 8, separated by commas. Answer: ['8', '6', '4'] Imagine a group of 13 people. Anne is friends with Bob and Charles. Bob is friends with Anne and Deborah. Charles is friends with Anne and Emily. Deborah is friends with Bob and Mary. Emily is friends with Charles and Kelly. Mary is friends with Deborah and Sam. Kelly is friends with Emily and John. Sam is friends with Mary and George. John is friends with Kelly and Fred. George is friends with Sam and Harrison. Fred is friends with John and Isabelle. Harrison is friends with George. Isabelle is friends with Fred. From Kelly, what is the shortest path to Harrison? Starting from Kelly, please only list the people's names in order, including Kelly, separated by commas. Answer: ", "Structural Prime Question Answer": ["Kelly", "Emily", "Charles", "Anne", "Bob", "Deborah", "Mary", "Sam", "George", "Harrison"]}
{"Graph": "n13line_friends", "Description": "Imagine a group of 13 people. Anne is friends with Bob and Charles. Bob is friends with Anne and Deborah. Charles is friends with Anne and Emily. Deborah is friends with Bob and Mary. Emily is friends with Charles and Kelly. Mary is friends with Deborah and Sam. Kelly is friends with Emily and John. Sam is friends with Mary and George. John is friends with Kelly and Fred. George is friends with Sam and Harrison. Fred is friends with John and Isabelle. Harrison is friends with George. Isabelle is friends with Fred.", "No Prime Question": "From George, what is the shortest path to Charles? Starting from George, please only list the people's names in order, including George, separated by commas. Answer: ", "No Prime Question Answer": ["George", "Sam", "Mary", "Deborah", "Bob", "Anne", "Charles"], "Both Prime Question": "Imagine a group of 13 people. Anne is friends with Bob and Charles. Bob is friends with Anne and Deborah. Charles is friends with Anne and Emily. Deborah is friends with Bob and Mary. Emily is friends with Charles and Kelly. Mary is friends with Deborah and Sam. Kelly is friends with Emily and John. Sam is friends with Mary and George. John is friends with Kelly and Fred. George is friends with Sam and Harrison. Fred is friends with John and Isabelle. Harrison is friends with George. Isabelle is friends with Fred. From Emily, what is the shortest path to Fred? Starting from Emily, please only list the people's names in order, including Emily, separated by commas. Answer: ['Emily', 'Kelly', 'John', 'Fred'] From George, what is the shortest path to Charles? Starting from George, please only list the people's names in order, including George, separated by commas. Answer: ", "Both Prime Question Answer": ["George", "Sam", "Mary", "Deborah", "Bob", "Anne", "Charles"], "Lexical Prime Question": "Imagine a group of 7 people. Anne is friends with Bob and Charles. Bob is friends with Anne and Deborah. Charles is friends with Anne and Emily. Deborah is friends with Bob and Mary. Emily is friends with Charles and Kelly. Mary is friends with Deborah. Kelly is friends with Emily. From Kelly, what is the shortest path to Anne? Starting from Kelly, please only list the people's names in order, including Kelly, separated by commas. Answer: ['Kelly', 'Emily', 'Charles', 'Anne'] Imagine a group of 13 people. Anne is friends with Bob and Charles. Bob is friends with Anne and Deborah. Charles is friends with Anne and Emily. Deborah is friends with Bob and Mary. Emily is friends with Charles and Kelly. Mary is friends with Deborah and Sam. Kelly is friends with Emily and John. Sam is friends with Mary and George. John is friends with Kelly and Fred. George is friends with Sam and Harrison. Fred is friends with John and Isabelle. Harrison is friends with George. Isabelle is friends with Fred. From George, what is the shortest path to Charles? Starting from George, please only list the people's names in order, including George, separated by commas. Answer: ", "Lexical Prime Question Answer": ["George", "Sam", "Mary", "Deborah", "Bob", "Anne", "Charles"], "Structural Prime Question": "Imagine a garden with 13 sections of flowers. The rose section is connected to the tulip section and the lavender section. The tulip section is connected to the rose section and the sunflower section. The lavender section is connected to the rose section and the daffodil section. The sunflower section is connected to the tulip section and the peony section. The daffodil section is connected to the lavender section and the geranium section. The peony section is connected to the sunflower section and the carnation section. The geranium section is connected to the daffodil section and the daisy section. The carnation section is connected to the peony section and the orchid section. The daisy section is connected to the geranium section and the iris section. The orchid section is connected to the carnation section and the poppy section. The iris section is connected to the daisy section and the marigold section. The poppy section is connected to the orchid section. The marigold section is connected to the iris section. From the carnation section, what is the shortest path to the daffodil section? Starting from carnation, please only list the flower names in order, including carnation, separated by commas. Answer: ['Carnation', 'Peony', 'Sunflower', 'Tulip', 'Rose', 'Lavender', 'Daffodil'] Imagine a group of 13 people. Anne is friends with Bob and Charles. Bob is friends with Anne and Deborah. Charles is friends with Anne and Emily. Deborah is friends with Bob and Mary. Emily is friends with Charles and Kelly. Mary is friends with Deborah and Sam. Kelly is friends with Emily and John. Sam is friends with Mary and George. John is friends with Kelly and Fred. George is friends with Sam and Harrison. Fred is friends with John and Isabelle. Harrison is friends with George. Isabelle is friends with Fred. From George, what is the shortest path to Charles? Starting from George, please only list the people's names in order, including George, separated by commas. Answer: ", "Structural Prime Question Answer": ["George", "Sam", "Mary", "Deborah", "Bob", "Anne", "Charles"]}
{"Graph": "n13line_friends", "Description": "Imagine a group of 13 people. Anne is friends with Bob and Charles. Bob is friends with Anne and Deborah. Charles is friends with Anne and Emily. Deborah is friends with Bob and Mary. Emily is friends with Charles and Kelly. Mary is friends with Deborah and Sam. Kelly is friends with Emily and John. Sam is friends with Mary and George. John is friends with Kelly and Fred. George is friends with Sam and Harrison. Fred is friends with John and Isabelle. Harrison is friends with George. Isabelle is friends with Fred.", "No Prime Question": "From Sam, what is the shortest path to Harrison? Starting from Sam, please only list the people's names in order, including Sam, separated by commas. Answer: ", "No Prime Question Answer": ["Sam", "George", "Harrison"], "Both Prime Question": "Imagine a group of 13 people. Anne is friends with Bob and Charles. Bob is friends with Anne and Deborah. Charles is friends with Anne and Emily. Deborah is friends with Bob and Mary. Emily is friends with Charles and Kelly. Mary is friends with Deborah and Sam. Kelly is friends with Emily and John. Sam is friends with Mary and George. John is friends with Kelly and Fred. George is friends with Sam and Harrison. Fred is friends with John and Isabelle. Harrison is friends with George. Isabelle is friends with Fred. From Kelly, what is the shortest path to Isabelle? Starting from Kelly, please only list the people's names in order, including Kelly, separated by commas. Answer: ['Kelly', 'John', 'Fred', 'Isabelle'] From Sam, what is the shortest path to Harrison? Starting from Sam, please only list the people's names in order, including Sam, separated by commas. Answer: ", "Both Prime Question Answer": ["Sam", "George", "Harrison"], "Lexical Prime Question": "Imagine a group of 7 people. Anne is friends with Bob and Charles. Bob is friends with Anne, Deborah and Emily. Charles is friends with Anne, Mary and Kelly. Deborah is friends with Bob. Emily is friends with Bob. Mary is friends with Charles. Kelly is friends with Charles. From Mary, what is the shortest path to Kelly? Starting from Mary, please only list the people's names in order, including Mary, separated by commas. Answer: ['Mary', 'Charles', 'Kelly'] Imagine a group of 13 people. Anne is friends with Bob and Charles. Bob is friends with Anne and Deborah. Charles is friends with Anne and Emily. Deborah is friends with Bob and Mary. Emily is friends with Charles and Kelly. Mary is friends with Deborah and Sam. Kelly is friends with Emily and John. Sam is friends with Mary and George. John is friends with Kelly and Fred. George is friends with Sam and Harrison. Fred is friends with John and Isabelle. Harrison is friends with George. Isabelle is friends with Fred. From Sam, what is the shortest path to Harrison? Starting from Sam, please only list the people's names in order, including Sam, separated by commas. Answer: ", "Lexical Prime Question Answer": ["Sam", "George", "Harrison"], "Structural Prime Question": "Imagine a home with 13 rooms. Room 1 is connected to Room 2 and Room 3. Room 2 is connected to Room 1 and Room 4. Room 3 is connected to Room 1 and Room 5. Room 4 is connected to Room 2 and Room 6. Room 5 is connected to Room 3 and Room 7. Room 6 is connected to Room 4 and Room 8. Room 7 is connected to Room 5 and Room 9. Room 8 is connected to Room 6 and Room 10. Room 9 is connected to Room 7 and Room 11. Room 10 is connected to Room 8 and Room 12. Room 11 is connected to Room 9 and Room 13. Room 12 is connected to Room 10. Room 13 is connected to Room 11. From room 5, what is the shortest path to room 13? Starting from room 5, please only list the room numbers in order, including room 5, separated by commas. Answer: ['5', '7', '9', '11', '13'] Imagine a group of 13 people. Anne is friends with Bob and Charles. Bob is friends with Anne and Deborah. Charles is friends with Anne and Emily. Deborah is friends with Bob and Mary. Emily is friends with Charles and Kelly. Mary is friends with Deborah and Sam. Kelly is friends with Emily and John. Sam is friends with Mary and George. John is friends with Kelly and Fred. George is friends with Sam and Harrison. Fred is friends with John and Isabelle. Harrison is friends with George. Isabelle is friends with Fred. From Sam, what is the shortest path to Harrison? Starting from Sam, please only list the people's names in order, including Sam, separated by commas. Answer: ", "Structural Prime Question Answer": ["Sam", "George", "Harrison"]}
{"Graph": "n13line_friends", "Description": "Imagine a group of 13 people. Anne is friends with Bob and Charles. Bob is friends with Anne and Deborah. Charles is friends with Anne and Emily. Deborah is friends with Bob and Mary. Emily is friends with Charles and Kelly. Mary is friends with Deborah and Sam. Kelly is friends with Emily and John. Sam is friends with Mary and George. John is friends with Kelly and Fred. George is friends with Sam and Harrison. Fred is friends with John and Isabelle. Harrison is friends with George. Isabelle is friends with Fred.", "No Prime Question": "From Anne, what is the shortest path to Sam? Starting from Anne, please only list the people's names in order, including Anne, separated by commas. Answer: ", "No Prime Question Answer": ["Anne", "Bob", "Deborah", "Mary", "Sam"], "Both Prime Question": "Imagine a group of 13 people. Anne is friends with Bob and Charles. Bob is friends with Anne and Deborah. Charles is friends with Anne and Emily. Deborah is friends with Bob and Mary. Emily is friends with Charles and Kelly. Mary is friends with Deborah and Sam. Kelly is friends with Emily and John. Sam is friends with Mary and George. John is friends with Kelly and Fred. George is friends with Sam and Harrison. Fred is friends with John and Isabelle. Harrison is friends with George. Isabelle is friends with Fred. From Charles, what is the shortest path to Harrison? Starting from Charles, please only list the people's names in order, including Charles, separated by commas. Answer: ['Charles', 'Anne', 'Bob', 'Deborah', 'Mary', 'Sam', 'George', 'Harrison'] From Anne, what is the shortest path to Sam? Starting from Anne, please only list the people's names in order, including Anne, separated by commas. Answer: ", "Both Prime Question Answer": ["Anne", "Bob", "Deborah", "Mary", "Sam"], "Lexical Prime Question": "Imagine a group of 7 people. Anne is friends with Bob and Charles. Bob is friends with Anne, Deborah and Emily. Charles is friends with Anne, Mary and Kelly. Deborah is friends with Bob. Emily is friends with Bob. Mary is friends with Charles. Kelly is friends with Charles. From Mary, what is the shortest path to Deborah? Starting from Mary, please only list the people's names in order, including Mary, separated by commas. Answer: ['Mary', 'Charles', 'Anne', 'Bob', 'Deborah'] Imagine a group of 13 people. Anne is friends with Bob and Charles. Bob is friends with Anne and Deborah. Charles is friends with Anne and Emily. Deborah is friends with Bob and Mary. Emily is friends with Charles and Kelly. Mary is friends with Deborah and Sam. Kelly is friends with Emily and John. Sam is friends with Mary and George. John is friends with Kelly and Fred. George is friends with Sam and Harrison. Fred is friends with John and Isabelle. Harrison is friends with George. Isabelle is friends with Fred. From Anne, what is the shortest path to Sam? Starting from Anne, please only list the people's names in order, including Anne, separated by commas. Answer: ", "Lexical Prime Question Answer": ["Anne", "Bob", "Deborah", "Mary", "Sam"], "Structural Prime Question": "Imagine a home with 13 rooms. Room 1 is connected to Room 2 and Room 3. Room 2 is connected to Room 1 and Room 4. Room 3 is connected to Room 1 and Room 5. Room 4 is connected to Room 2 and Room 6. Room 5 is connected to Room 3 and Room 7. Room 6 is connected to Room 4 and Room 8. Room 7 is connected to Room 5 and Room 9. Room 8 is connected to Room 6 and Room 10. Room 9 is connected to Room 7 and Room 11. Room 10 is connected to Room 8 and Room 12. Room 11 is connected to Room 9 and Room 13. Room 12 is connected to Room 10. Room 13 is connected to Room 11. From room 8, what is the shortest path to room 6? Starting from room 8, please only list the room numbers in order, including room 8, separated by commas. Answer: ['8', '6'] Imagine a group of 13 people. Anne is friends with Bob and Charles. Bob is friends with Anne and Deborah. Charles is friends with Anne and Emily. Deborah is friends with Bob and Mary. Emily is friends with Charles and Kelly. Mary is friends with Deborah and Sam. Kelly is friends with Emily and John. Sam is friends with Mary and George. John is friends with Kelly and Fred. George is friends with Sam and Harrison. Fred is friends with John and Isabelle. Harrison is friends with George. Isabelle is friends with Fred. From Anne, what is the shortest path to Sam? Starting from Anne, please only list the people's names in order, including Anne, separated by commas. Answer: ", "Structural Prime Question Answer": ["Anne", "Bob", "Deborah", "Mary", "Sam"]}
