{"Graph": "n13line_flowers", "Description": "Imagine a garden with 13 sections of flowers. The rose section is connected to the tulip section and the lavender section. The tulip section is connected to the rose section and the sunflower section. The lavender section is connected to the rose section and the daffodil section. The sunflower section is connected to the tulip section and the peony section. The daffodil section is connected to the lavender section and the geranium section. The peony section is connected to the sunflower section and the carnation section. The geranium section is connected to the daffodil section and the daisy section. The carnation section is connected to the peony section and the orchid section. The daisy section is connected to the geranium section and the iris section. The orchid section is connected to the carnation section and the poppy section. The iris section is connected to the daisy section and the marigold section. The poppy section is connected to the orchid section. The marigold section is connected to the iris section.", "No Prime Question": "From the peony section, what is the shortest path to the daffodil section? Starting from peony, please only list the flower names in order, including peony, separated by commas. Answer:", "No Prime Question Answer": ["Peony", "Sunflower", "Tulip", "Rose", "Lavender", "Daffodil"], "Both Prime Question": "Imagine a garden with 13 sections of flowers. The rose section is connected to the tulip section and the lavender section. The tulip section is connected to the rose section and the sunflower section. The lavender section is connected to the rose section and the daffodil section. The sunflower section is connected to the tulip section and the peony section. The daffodil section is connected to the lavender section and the geranium section. The peony section is connected to the sunflower section and the carnation section. The geranium section is connected to the daffodil section and the daisy section. The carnation section is connected to the peony section and the orchid section. The daisy section is connected to the geranium section and the iris section. The orchid section is connected to the carnation section and the poppy section. The iris section is connected to the daisy section and the marigold section. The poppy section is connected to the orchid section. The marigold section is connected to the iris section. From the marigold section, what is the shortest path to the daisy section? Starting from marigold, please only list the flower names in order, including marigold, separated by commas. Answer: ['Marigold', 'Iris', 'Daisy'] From the peony section, what is the shortest path to the daffodil section? Starting from peony, please only list the flower names in order, including peony, separated by commas. Answer:", "Both Prime Question Answer": ["Peony", "Sunflower", "Tulip", "Rose", "Lavender", "Daffodil"], "Lexical Prime Question": "Imagine a garden with 15 sections of flowers. The rose section is connected to the tulip section, the lavender section, the sunflower section and the daffodil section. The tulip section is connected to the rose section, the lavender section, the sunflower section and the daffodil section. The lavender section is connected to the rose section, the tulip section, the sunflower section and the daffodil section. The sunflower section is connected to the rose section, the tulip section, the lavender section and the peony section. The daffodil section is connected to the rose section, the tulip section, the lavender section and the hyacinth section. The peony section is connected to the sunflower section, the geranium section, the carnation section and the daisy section. The geranium section is connected to the peony section, the carnation section, the daisy section and the orchid section. The carnation section is connected to the peony section, the geranium section, the daisy section and the orchid section. The daisy section is connected to the peony section, the geranium section, the carnation section and the orchid section. The orchid section is connected to the geranium section, the carnation section, the daisy section and the iris section. The iris section is connected to the orchid section, the poppy section, the marigold section and the lily section. The poppy section is connected to the iris section, the marigold section, the lily section and the hyacinth section. The marigold section is connected to the iris section, the poppy section, the lily section and the hyacinth section. The lily section is connected to the iris section, the poppy section, the marigold section and the hyacinth section. The hyacinth section is connected to the poppy section, the marigold section, the lily section and the daffodil section. From the tulip section, what is the shortest path to the rose section? Starting from tulip, please only list the flower names in order, including tulip, separated by commas. Answer: ['Tulip', 'Rose'] Imagine a garden with 13 sections of flowers. The rose section is connected to the tulip section and the lavender section. The tulip section is connected to the rose section and the sunflower section. The lavender section is connected to the rose section and the daffodil section. The sunflower section is connected to the tulip section and the peony section. The daffodil section is connected to the lavender section and the geranium section. The peony section is connected to the sunflower section and the carnation section. The geranium section is connected to the daffodil section and the daisy section. The carnation section is connected to the peony section and the orchid section. The daisy section is connected to the geranium section and the iris section. The orchid section is connected to the carnation section and the poppy section. The iris section is connected to the daisy section and the marigold section. The poppy section is connected to the orchid section. The marigold section is connected to the iris section. From the peony section, what is the shortest path to the daffodil section? Starting from peony, please only list the flower names in order, including peony, separated by commas. Answer:", "Lexical Prime Question Answer": ["Peony", "Sunflower", "Tulip", "Rose", "Lavender", "Daffodil"], "Structural Prime Question": "Imagine a home with 13 rooms. Room 1 is connected to Room 2 and Room 3. Room 2 is connected to Room 1 and Room 4. Room 3 is connected to Room 1 and Room 5. Room 4 is connected to Room 2 and Room 6. Room 5 is connected to Room 3 and Room 7. Room 6 is connected to Room 4 and Room 8. Room 7 is connected to Room 5 and Room 9. Room 8 is connected to Room 6 and Room 10. Room 9 is connected to Room 7 and Room 11. Room 10 is connected to Room 8 and Room 12. Room 11 is connected to Room 9 and Room 13. Room 12 is connected to Room 10. Room 13 is connected to Room 11. From room 6, what is the shortest path to room 10? Starting from room 6, please only list the room numbers in order, including room 6, separated by commas. Answer: ['6', '8', '10'] Imagine a garden with 13 sections of flowers. The rose section is connected to the tulip section and the lavender section. The tulip section is connected to the rose section and the sunflower section. The lavender section is connected to the rose section and the daffodil section. The sunflower section is connected to the tulip section and the peony section. The daffodil section is connected to the lavender section and the geranium section. The peony section is connected to the sunflower section and the carnation section. The geranium section is connected to the daffodil section and the daisy section. The carnation section is connected to the peony section and the orchid section. The daisy section is connected to the geranium section and the iris section. The orchid section is connected to the carnation section and the poppy section. The iris section is connected to the daisy section and the marigold section. The poppy section is connected to the orchid section. The marigold section is connected to the iris section. From the peony section, what is the shortest path to the daffodil section? Starting from peony, please only list the flower names in order, including peony, separated by commas. Answer:", "Structural Prime Question Answer": ["Peony", "Sunflower", "Tulip", "Rose", "Lavender", "Daffodil"]}
{"Graph": "n13line_flowers", "Description": "Imagine a garden with 13 sections of flowers. The rose section is connected to the tulip section and the lavender section. The tulip section is connected to the rose section and the sunflower section. The lavender section is connected to the rose section and the daffodil section. The sunflower section is connected to the tulip section and the peony section. The daffodil section is connected to the lavender section and the geranium section. The peony section is connected to the sunflower section and the carnation section. The geranium section is connected to the daffodil section and the daisy section. The carnation section is connected to the peony section and the orchid section. The daisy section is connected to the geranium section and the iris section. The orchid section is connected to the carnation section and the poppy section. The iris section is connected to the daisy section and the marigold section. The poppy section is connected to the orchid section. The marigold section is connected to the iris section.", "No Prime Question": "From the daisy section, what is the shortest path to the iris section? Starting from daisy, please only list the flower names in order, including daisy, separated by commas. Answer:", "No Prime Question Answer": ["Daisy", "Iris"], "Both Prime Question": "Imagine a garden with 13 sections of flowers. The rose section is connected to the tulip section and the lavender section. The tulip section is connected to the rose section and the sunflower section. The lavender section is connected to the rose section and the daffodil section. The sunflower section is connected to the tulip section and the peony section. The daffodil section is connected to the lavender section and the geranium section. The peony section is connected to the sunflower section and the carnation section. The geranium section is connected to the daffodil section and the daisy section. The carnation section is connected to the peony section and the orchid section. The daisy section is connected to the geranium section and the iris section. The orchid section is connected to the carnation section and the poppy section. The iris section is connected to the daisy section and the marigold section. The poppy section is connected to the orchid section. The marigold section is connected to the iris section. From the carnation section, what is the shortest path to the rose section? Starting from carnation, please only list the flower names in order, including carnation, separated by commas. Answer: ['Carnation', 'Peony', 'Sunflower', 'Tulip', 'Rose'] From the daisy section, what is the shortest path to the iris section? Starting from daisy, please only list the flower names in order, including daisy, separated by commas. Answer:", "Both Prime Question Answer": ["Daisy", "Iris"], "Lexical Prime Question": "Imagine a garden with 7 sections of flowers. The rose section is connected to the tulip section and the lavender section. The tulip section is connected to the rose section and the sunflower section. The lavender section is connected to the rose section and the daffodil section. The sunflower section is connected to the tulip section and the peony section. The daffodil section is connected to the lavender section and the geranium section. The peony section is connected to the sunflower section. The geranium section is connected to the daffodil section. From the lavender section, what is the shortest path to the sunflower section? Starting from lavender, please only list the flower names in order, including lavender, separated by commas. Answer: ['Lavender', 'Rose', 'Tulip', 'Sunflower'] Imagine a garden with 13 sections of flowers. The rose section is connected to the tulip section and the lavender section. The tulip section is connected to the rose section and the sunflower section. The lavender section is connected to the rose section and the daffodil section. The sunflower section is connected to the tulip section and the peony section. The daffodil section is connected to the lavender section and the geranium section. The peony section is connected to the sunflower section and the carnation section. The geranium section is connected to the daffodil section and the daisy section. The carnation section is connected to the peony section and the orchid section. The daisy section is connected to the geranium section and the iris section. The orchid section is connected to the carnation section and the poppy section. The iris section is connected to the daisy section and the marigold section. The poppy section is connected to the orchid section. The marigold section is connected to the iris section. From the daisy section, what is the shortest path to the iris section? Starting from daisy, please only list the flower names in order, including daisy, separated by commas. Answer:", "Lexical Prime Question Answer": ["Daisy", "Iris"], "Structural Prime Question": "Imagine a home with 13 rooms. Room 1 is connected to Room 2 and Room 3. Room 2 is connected to Room 1 and Room 4. Room 3 is connected to Room 1 and Room 5. Room 4 is connected to Room 2 and Room 6. Room 5 is connected to Room 3 and Room 7. Room 6 is connected to Room 4 and Room 8. Room 7 is connected to Room 5 and Room 9. Room 8 is connected to Room 6 and Room 10. Room 9 is connected to Room 7 and Room 11. Room 10 is connected to Room 8 and Room 12. Room 11 is connected to Room 9 and Room 13. Room 12 is connected to Room 10. Room 13 is connected to Room 11. From room 2, what is the shortest path to room 4? Starting from room 2, please only list the room numbers in order, including room 2, separated by commas. Answer: ['2', '4'] Imagine a garden with 13 sections of flowers. The rose section is connected to the tulip section and the lavender section. The tulip section is connected to the rose section and the sunflower section. The lavender section is connected to the rose section and the daffodil section. The sunflower section is connected to the tulip section and the peony section. The daffodil section is connected to the lavender section and the geranium section. The peony section is connected to the sunflower section and the carnation section. The geranium section is connected to the daffodil section and the daisy section. The carnation section is connected to the peony section and the orchid section. The daisy section is connected to the geranium section and the iris section. The orchid section is connected to the carnation section and the poppy section. The iris section is connected to the daisy section and the marigold section. The poppy section is connected to the orchid section. The marigold section is connected to the iris section. From the daisy section, what is the shortest path to the iris section? Starting from daisy, please only list the flower names in order, including daisy, separated by commas. Answer:", "Structural Prime Question Answer": ["Daisy", "Iris"]}
{"Graph": "n13line_flowers", "Description": "Imagine a garden with 13 sections of flowers. The rose section is connected to the tulip section and the lavender section. The tulip section is connected to the rose section and the sunflower section. The lavender section is connected to the rose section and the daffodil section. The sunflower section is connected to the tulip section and the peony section. The daffodil section is connected to the lavender section and the geranium section. The peony section is connected to the sunflower section and the carnation section. The geranium section is connected to the daffodil section and the daisy section. The carnation section is connected to the peony section and the orchid section. The daisy section is connected to the geranium section and the iris section. The orchid section is connected to the carnation section and the poppy section. The iris section is connected to the daisy section and the marigold section. The poppy section is connected to the orchid section. The marigold section is connected to the iris section.", "No Prime Question": "From the geranium section, what is the shortest path to the iris section? Starting from geranium, please only list the flower names in order, including geranium, separated by commas. Answer:", "No Prime Question Answer": ["Geranium", "Daisy", "Iris"], "Both Prime Question": "Imagine a garden with 13 sections of flowers. The rose section is connected to the tulip section and the lavender section. The tulip section is connected to the rose section and the sunflower section. The lavender section is connected to the rose section and the daffodil section. The sunflower section is connected to the tulip section and the peony section. The daffodil section is connected to the lavender section and the geranium section. The peony section is connected to the sunflower section and the carnation section. The geranium section is connected to the daffodil section and the daisy section. The carnation section is connected to the peony section and the orchid section. The daisy section is connected to the geranium section and the iris section. The orchid section is connected to the carnation section and the poppy section. The iris section is connected to the daisy section and the marigold section. The poppy section is connected to the orchid section. The marigold section is connected to the iris section. From the sunflower section, what is the shortest path to the marigold section? Starting from sunflower, please only list the flower names in order, including sunflower, separated by commas. Answer: ['Sunflower', 'Tulip', 'Rose', 'Lavender', 'Daffodil', 'Geranium', 'Daisy', 'Iris', 'Marigold'] From the geranium section, what is the shortest path to the iris section? Starting from geranium, please only list the flower names in order, including geranium, separated by commas. Answer:", "Both Prime Question Answer": ["Geranium", "Daisy", "Iris"], "Lexical Prime Question": "Imagine a garden with 7 sections of flowers. The rose section is connected to the tulip section and the lavender section. The tulip section is connected to the rose section and the sunflower section. The lavender section is connected to the rose section and the daffodil section. The sunflower section is connected to the tulip section and the peony section. The daffodil section is connected to the lavender section and the geranium section. The peony section is connected to the sunflower section. The geranium section is connected to the daffodil section. From the geranium section, what is the shortest path to the lavender section? Starting from geranium, please only list the flower names in order, including geranium, separated by commas. Answer: ['Geranium', 'Daffodil', 'Lavender'] Imagine a garden with 13 sections of flowers. The rose section is connected to the tulip section and the lavender section. The tulip section is connected to the rose section and the sunflower section. The lavender section is connected to the rose section and the daffodil section. The sunflower section is connected to the tulip section and the peony section. The daffodil section is connected to the lavender section and the geranium section. The peony section is connected to the sunflower section and the carnation section. The geranium section is connected to the daffodil section and the daisy section. The carnation section is connected to the peony section and the orchid section. The daisy section is connected to the geranium section and the iris section. The orchid section is connected to the carnation section and the poppy section. The iris section is connected to the daisy section and the marigold section. The poppy section is connected to the orchid section. The marigold section is connected to the iris section. From the geranium section, what is the shortest path to the iris section? Starting from geranium, please only list the flower names in order, including geranium, separated by commas. Answer:", "Lexical Prime Question Answer": ["Geranium", "Daisy", "Iris"], "Structural Prime Question": "Imagine a group of 13 people. Anne is friends with Bob and Charles. Bob is friends with Anne and Deborah. Charles is friends with Anne and Emily. Deborah is friends with Bob and Mary. Emily is friends with Charles and Kelly. Mary is friends with Deborah and Sam. Kelly is friends with Emily and John. Sam is friends with Mary and George. John is friends with Kelly and Fred. George is friends with Sam and Harrison. Fred is friends with John and Isabelle. Harrison is friends with George. Isabelle is friends with Fred. From Anne, what is the shortest path to John? Starting from Anne, please only list the people's names in order, including Anne, separated by commas. Answer: ['Anne', 'Charles', 'Emily', 'Kelly', 'John'] Imagine a garden with 13 sections of flowers. The rose section is connected to the tulip section and the lavender section. The tulip section is connected to the rose section and the sunflower section. The lavender section is connected to the rose section and the daffodil section. The sunflower section is connected to the tulip section and the peony section. The daffodil section is connected to the lavender section and the geranium section. The peony section is connected to the sunflower section and the carnation section. The geranium section is connected to the daffodil section and the daisy section. The carnation section is connected to the peony section and the orchid section. The daisy section is connected to the geranium section and the iris section. The orchid section is connected to the carnation section and the poppy section. The iris section is connected to the daisy section and the marigold section. The poppy section is connected to the orchid section. The marigold section is connected to the iris section. From the geranium section, what is the shortest path to the iris section? Starting from geranium, please only list the flower names in order, including geranium, separated by commas. Answer:", "Structural Prime Question Answer": ["Geranium", "Daisy", "Iris"]}
{"Graph": "n13line_flowers", "Description": "Imagine a garden with 13 sections of flowers. The rose section is connected to the tulip section and the lavender section. The tulip section is connected to the rose section and the sunflower section. The lavender section is connected to the rose section and the daffodil section. The sunflower section is connected to the tulip section and the peony section. The daffodil section is connected to the lavender section and the geranium section. The peony section is connected to the sunflower section and the carnation section. The geranium section is connected to the daffodil section and the daisy section. The carnation section is connected to the peony section and the orchid section. The daisy section is connected to the geranium section and the iris section. The orchid section is connected to the carnation section and the poppy section. The iris section is connected to the daisy section and the marigold section. The poppy section is connected to the orchid section. The marigold section is connected to the iris section.", "No Prime Question": "From the carnation section, what is the shortest path to the iris section? Starting from carnation, please only list the flower names in order, including carnation, separated by commas. Answer:", "No Prime Question Answer": ["Carnation", "Peony", "Sunflower", "Tulip", "Rose", "Lavender", "Daffodil", "Geranium", "Daisy", "Iris"], "Both Prime Question": "Imagine a garden with 13 sections of flowers. The rose section is connected to the tulip section and the lavender section. The tulip section is connected to the rose section and the sunflower section. The lavender section is connected to the rose section and the daffodil section. The sunflower section is connected to the tulip section and the peony section. The daffodil section is connected to the lavender section and the geranium section. The peony section is connected to the sunflower section and the carnation section. The geranium section is connected to the daffodil section and the daisy section. The carnation section is connected to the peony section and the orchid section. The daisy section is connected to the geranium section and the iris section. The orchid section is connected to the carnation section and the poppy section. The iris section is connected to the daisy section and the marigold section. The poppy section is connected to the orchid section. The marigold section is connected to the iris section. From the peony section, what is the shortest path to the orchid section? Starting from peony, please only list the flower names in order, including peony, separated by commas. Answer: ['Peony', 'Carnation', 'Orchid'] From the carnation section, what is the shortest path to the iris section? Starting from carnation, please only list the flower names in order, including carnation, separated by commas. Answer:", "Both Prime Question Answer": ["Carnation", "Peony", "Sunflower", "Tulip", "Rose", "Lavender", "Daffodil", "Geranium", "Daisy", "Iris"], "Lexical Prime Question": "Imagine a garden with 7 sections of flowers. The rose section is connected to the tulip section and the lavender section. The tulip section is connected to the rose section and the sunflower section. The lavender section is connected to the rose section and the daffodil section. The sunflower section is connected to the tulip section and the peony section. The daffodil section is connected to the lavender section and the geranium section. The peony section is connected to the sunflower section. The geranium section is connected to the daffodil section. From the daffodil section, what is the shortest path to the peony section? Starting from daffodil, please only list the flower names in order, including daffodil, separated by commas. Answer: ['Daffodil', 'Lavender', 'Rose', 'Tulip', 'Sunflower', 'Peony'] Imagine a garden with 13 sections of flowers. The rose section is connected to the tulip section and the lavender section. The tulip section is connected to the rose section and the sunflower section. The lavender section is connected to the rose section and the daffodil section. The sunflower section is connected to the tulip section and the peony section. The daffodil section is connected to the lavender section and the geranium section. The peony section is connected to the sunflower section and the carnation section. The geranium section is connected to the daffodil section and the daisy section. The carnation section is connected to the peony section and the orchid section. The daisy section is connected to the geranium section and the iris section. The orchid section is connected to the carnation section and the poppy section. The iris section is connected to the daisy section and the marigold section. The poppy section is connected to the orchid section. The marigold section is connected to the iris section. From the carnation section, what is the shortest path to the iris section? Starting from carnation, please only list the flower names in order, including carnation, separated by commas. Answer:", "Lexical Prime Question Answer": ["Carnation", "Peony", "Sunflower", "Tulip", "Rose", "Lavender", "Daffodil", "Geranium", "Daisy", "Iris"], "Structural Prime Question": "Imagine a home with 13 rooms. Room 1 is connected to Room 2 and Room 3. Room 2 is connected to Room 1 and Room 4. Room 3 is connected to Room 1 and Room 5. Room 4 is connected to Room 2 and Room 6. Room 5 is connected to Room 3 and Room 7. Room 6 is connected to Room 4 and Room 8. Room 7 is connected to Room 5 and Room 9. Room 8 is connected to Room 6 and Room 10. Room 9 is connected to Room 7 and Room 11. Room 10 is connected to Room 8 and Room 12. Room 11 is connected to Room 9 and Room 13. Room 12 is connected to Room 10. Room 13 is connected to Room 11. From room 3, what is the shortest path to room 2? Starting from room 3, please only list the room numbers in order, including room 3, separated by commas. Answer: ['3', '1', '2'] Imagine a garden with 13 sections of flowers. The rose section is connected to the tulip section and the lavender section. The tulip section is connected to the rose section and the sunflower section. The lavender section is connected to the rose section and the daffodil section. The sunflower section is connected to the tulip section and the peony section. The daffodil section is connected to the lavender section and the geranium section. The peony section is connected to the sunflower section and the carnation section. The geranium section is connected to the daffodil section and the daisy section. The carnation section is connected to the peony section and the orchid section. The daisy section is connected to the geranium section and the iris section. The orchid section is connected to the carnation section and the poppy section. The iris section is connected to the daisy section and the marigold section. The poppy section is connected to the orchid section. The marigold section is connected to the iris section. From the carnation section, what is the shortest path to the iris section? Starting from carnation, please only list the flower names in order, including carnation, separated by commas. Answer:", "Structural Prime Question Answer": ["Carnation", "Peony", "Sunflower", "Tulip", "Rose", "Lavender", "Daffodil", "Geranium", "Daisy", "Iris"]}
{"Graph": "n13line_flowers", "Description": "Imagine a garden with 13 sections of flowers. The rose section is connected to the tulip section and the lavender section. The tulip section is connected to the rose section and the sunflower section. The lavender section is connected to the rose section and the daffodil section. The sunflower section is connected to the tulip section and the peony section. The daffodil section is connected to the lavender section and the geranium section. The peony section is connected to the sunflower section and the carnation section. The geranium section is connected to the daffodil section and the daisy section. The carnation section is connected to the peony section and the orchid section. The daisy section is connected to the geranium section and the iris section. The orchid section is connected to the carnation section and the poppy section. The iris section is connected to the daisy section and the marigold section. The poppy section is connected to the orchid section. The marigold section is connected to the iris section.", "No Prime Question": "From the marigold section, what is the shortest path to the peony section? Starting from marigold, please only list the flower names in order, including marigold, separated by commas. Answer:", "No Prime Question Answer": ["Marigold", "Iris", "Daisy", "Geranium", "Daffodil", "Lavender", "Rose", "Tulip", "Sunflower", "Peony"], "Both Prime Question": "Imagine a garden with 13 sections of flowers. The rose section is connected to the tulip section and the lavender section. The tulip section is connected to the rose section and the sunflower section. The lavender section is connected to the rose section and the daffodil section. The sunflower section is connected to the tulip section and the peony section. The daffodil section is connected to the lavender section and the geranium section. The peony section is connected to the sunflower section and the carnation section. The geranium section is connected to the daffodil section and the daisy section. The carnation section is connected to the peony section and the orchid section. The daisy section is connected to the geranium section and the iris section. The orchid section is connected to the carnation section and the poppy section. The iris section is connected to the daisy section and the marigold section. The poppy section is connected to the orchid section. The marigold section is connected to the iris section. From the daisy section, what is the shortest path to the geranium section? Starting from daisy, please only list the flower names in order, including daisy, separated by commas. Answer: ['Daisy', 'Geranium'] From the marigold section, what is the shortest path to the peony section? Starting from marigold, please only list the flower names in order, including marigold, separated by commas. Answer:", "Both Prime Question Answer": ["Marigold", "Iris", "Daisy", "Geranium", "Daffodil", "Lavender", "Rose", "Tulip", "Sunflower", "Peony"], "Lexical Prime Question": "Imagine a garden with 7 sections of flowers. The rose section is connected to the tulip section and the lavender section. The tulip section is connected to the rose section, the sunflower section and the daffodil section. The lavender section is connected to the rose section, the peony section and the geranium section. The sunflower section is connected to the tulip section. The daffodil section is connected to the tulip section. The peony section is connected to the lavender section. The geranium section is connected to the lavender section. From the daffodil section, what is the shortest path to the lavender section? Starting from daffodil, please only list the flower names in order, including daffodil, separated by commas. Answer: ['Daffodil', 'Tulip', 'Rose', 'Lavender'] Imagine a garden with 13 sections of flowers. The rose section is connected to the tulip section and the lavender section. The tulip section is connected to the rose section and the sunflower section. The lavender section is connected to the rose section and the daffodil section. The sunflower section is connected to the tulip section and the peony section. The daffodil section is connected to the lavender section and the geranium section. The peony section is connected to the sunflower section and the carnation section. The geranium section is connected to the daffodil section and the daisy section. The carnation section is connected to the peony section and the orchid section. The daisy section is connected to the geranium section and the iris section. The orchid section is connected to the carnation section and the poppy section. The iris section is connected to the daisy section and the marigold section. The poppy section is connected to the orchid section. The marigold section is connected to the iris section. From the marigold section, what is the shortest path to the peony section? Starting from marigold, please only list the flower names in order, including marigold, separated by commas. Answer:", "Lexical Prime Question Answer": ["Marigold", "Iris", "Daisy", "Geranium", "Daffodil", "Lavender", "Rose", "Tulip", "Sunflower", "Peony"], "Structural Prime Question": "Imagine a home with 13 rooms. Room 1 is connected to Room 2 and Room 3. Room 2 is connected to Room 1 and Room 4. Room 3 is connected to Room 1 and Room 5. Room 4 is connected to Room 2 and Room 6. Room 5 is connected to Room 3 and Room 7. Room 6 is connected to Room 4 and Room 8. Room 7 is connected to Room 5 and Room 9. Room 8 is connected to Room 6 and Room 10. Room 9 is connected to Room 7 and Room 11. Room 10 is connected to Room 8 and Room 12. Room 11 is connected to Room 9 and Room 13. Room 12 is connected to Room 10. Room 13 is connected to Room 11. From room 11, what is the shortest path to room 12? Starting from room 11, please only list the room numbers in order, including room 11, separated by commas. Answer: ['11', '9', '7', '5', '3', '1', '2', '4', '6', '8', '10', '12'] Imagine a garden with 13 sections of flowers. The rose section is connected to the tulip section and the lavender section. The tulip section is connected to the rose section and the sunflower section. The lavender section is connected to the rose section and the daffodil section. The sunflower section is connected to the tulip section and the peony section. The daffodil section is connected to the lavender section and the geranium section. The peony section is connected to the sunflower section and the carnation section. The geranium section is connected to the daffodil section and the daisy section. The carnation section is connected to the peony section and the orchid section. The daisy section is connected to the geranium section and the iris section. The orchid section is connected to the carnation section and the poppy section. The iris section is connected to the daisy section and the marigold section. The poppy section is connected to the orchid section. The marigold section is connected to the iris section. From the marigold section, what is the shortest path to the peony section? Starting from marigold, please only list the flower names in order, including marigold, separated by commas. Answer:", "Structural Prime Question Answer": ["Marigold", "Iris", "Daisy", "Geranium", "Daffodil", "Lavender", "Rose", "Tulip", "Sunflower", "Peony"]}
{"Graph": "n13line_flowers", "Description": "Imagine a garden with 13 sections of flowers. The rose section is connected to the tulip section and the lavender section. The tulip section is connected to the rose section and the sunflower section. The lavender section is connected to the rose section and the daffodil section. The sunflower section is connected to the tulip section and the peony section. The daffodil section is connected to the lavender section and the geranium section. The peony section is connected to the sunflower section and the carnation section. The geranium section is connected to the daffodil section and the daisy section. The carnation section is connected to the peony section and the orchid section. The daisy section is connected to the geranium section and the iris section. The orchid section is connected to the carnation section and the poppy section. The iris section is connected to the daisy section and the marigold section. The poppy section is connected to the orchid section. The marigold section is connected to the iris section.", "No Prime Question": "From the geranium section, what is the shortest path to the poppy section? Starting from geranium, please only list the flower names in order, including geranium, separated by commas. Answer:", "No Prime Question Answer": ["Geranium", "Daffodil", "Lavender", "Rose", "Tulip", "Sunflower", "Peony", "Carnation", "Orchid", "Poppy"], "Both Prime Question": "Imagine a garden with 13 sections of flowers. The rose section is connected to the tulip section and the lavender section. The tulip section is connected to the rose section and the sunflower section. The lavender section is connected to the rose section and the daffodil section. The sunflower section is connected to the tulip section and the peony section. The daffodil section is connected to the lavender section and the geranium section. The peony section is connected to the sunflower section and the carnation section. The geranium section is connected to the daffodil section and the daisy section. The carnation section is connected to the peony section and the orchid section. The daisy section is connected to the geranium section and the iris section. The orchid section is connected to the carnation section and the poppy section. The iris section is connected to the daisy section and the marigold section. The poppy section is connected to the orchid section. The marigold section is connected to the iris section. From the daffodil section, what is the shortest path to the lavender section? Starting from daffodil, please only list the flower names in order, including daffodil, separated by commas. Answer: ['Daffodil', 'Lavender'] From the geranium section, what is the shortest path to the poppy section? Starting from geranium, please only list the flower names in order, including geranium, separated by commas. Answer:", "Both Prime Question Answer": ["Geranium", "Daffodil", "Lavender", "Rose", "Tulip", "Sunflower", "Peony", "Carnation", "Orchid", "Poppy"], "Lexical Prime Question": "Imagine a garden with 7 sections of flowers. The rose section is connected to the tulip section and the lavender section. The tulip section is connected to the rose section and the sunflower section. The lavender section is connected to the rose section and the daffodil section. The sunflower section is connected to the tulip section and the peony section. The daffodil section is connected to the lavender section and the geranium section. The peony section is connected to the sunflower section. The geranium section is connected to the daffodil section. From the geranium section, what is the shortest path to the peony section? Starting from geranium, please only list the flower names in order, including geranium, separated by commas. Answer: ['Geranium', 'Daffodil', 'Lavender', 'Rose', 'Tulip', 'Sunflower', 'Peony'] Imagine a garden with 13 sections of flowers. The rose section is connected to the tulip section and the lavender section. The tulip section is connected to the rose section and the sunflower section. The lavender section is connected to the rose section and the daffodil section. The sunflower section is connected to the tulip section and the peony section. The daffodil section is connected to the lavender section and the geranium section. The peony section is connected to the sunflower section and the carnation section. The geranium section is connected to the daffodil section and the daisy section. The carnation section is connected to the peony section and the orchid section. The daisy section is connected to the geranium section and the iris section. The orchid section is connected to the carnation section and the poppy section. The iris section is connected to the daisy section and the marigold section. The poppy section is connected to the orchid section. The marigold section is connected to the iris section. From the geranium section, what is the shortest path to the poppy section? Starting from geranium, please only list the flower names in order, including geranium, separated by commas. Answer:", "Lexical Prime Question Answer": ["Geranium", "Daffodil", "Lavender", "Rose", "Tulip", "Sunflower", "Peony", "Carnation", "Orchid", "Poppy"], "Structural Prime Question": "Imagine a group of 13 people. Anne is friends with Bob and Charles. Bob is friends with Anne and Deborah. Charles is friends with Anne and Emily. Deborah is friends with Bob and Mary. Emily is friends with Charles and Kelly. Mary is friends with Deborah and Sam. Kelly is friends with Emily and John. Sam is friends with Mary and George. John is friends with Kelly and Fred. George is friends with Sam and Harrison. Fred is friends with John and Isabelle. Harrison is friends with George. Isabelle is friends with Fred. From Kelly, what is the shortest path to Deborah? Starting from Kelly, please only list the people's names in order, including Kelly, separated by commas. Answer: ['Kelly', 'Emily', 'Charles', 'Anne', 'Bob', 'Deborah'] Imagine a garden with 13 sections of flowers. The rose section is connected to the tulip section and the lavender section. The tulip section is connected to the rose section and the sunflower section. The lavender section is connected to the rose section and the daffodil section. The sunflower section is connected to the tulip section and the peony section. The daffodil section is connected to the lavender section and the geranium section. The peony section is connected to the sunflower section and the carnation section. The geranium section is connected to the daffodil section and the daisy section. The carnation section is connected to the peony section and the orchid section. The daisy section is connected to the geranium section and the iris section. The orchid section is connected to the carnation section and the poppy section. The iris section is connected to the daisy section and the marigold section. The poppy section is connected to the orchid section. The marigold section is connected to the iris section. From the geranium section, what is the shortest path to the poppy section? Starting from geranium, please only list the flower names in order, including geranium, separated by commas. Answer:", "Structural Prime Question Answer": ["Geranium", "Daffodil", "Lavender", "Rose", "Tulip", "Sunflower", "Peony", "Carnation", "Orchid", "Poppy"]}
{"Graph": "n13line_flowers", "Description": "Imagine a garden with 13 sections of flowers. The rose section is connected to the tulip section and the lavender section. The tulip section is connected to the rose section and the sunflower section. The lavender section is connected to the rose section and the daffodil section. The sunflower section is connected to the tulip section and the peony section. The daffodil section is connected to the lavender section and the geranium section. The peony section is connected to the sunflower section and the carnation section. The geranium section is connected to the daffodil section and the daisy section. The carnation section is connected to the peony section and the orchid section. The daisy section is connected to the geranium section and the iris section. The orchid section is connected to the carnation section and the poppy section. The iris section is connected to the daisy section and the marigold section. The poppy section is connected to the orchid section. The marigold section is connected to the iris section.", "No Prime Question": "From the sunflower section, what is the shortest path to the carnation section? Starting from sunflower, please only list the flower names in order, including sunflower, separated by commas. Answer:", "No Prime Question Answer": ["Sunflower", "Peony", "Carnation"], "Both Prime Question": "Imagine a garden with 13 sections of flowers. The rose section is connected to the tulip section and the lavender section. The tulip section is connected to the rose section and the sunflower section. The lavender section is connected to the rose section and the daffodil section. The sunflower section is connected to the tulip section and the peony section. The daffodil section is connected to the lavender section and the geranium section. The peony section is connected to the sunflower section and the carnation section. The geranium section is connected to the daffodil section and the daisy section. The carnation section is connected to the peony section and the orchid section. The daisy section is connected to the geranium section and the iris section. The orchid section is connected to the carnation section and the poppy section. The iris section is connected to the daisy section and the marigold section. The poppy section is connected to the orchid section. The marigold section is connected to the iris section. From the rose section, what is the shortest path to the peony section? Starting from rose, please only list the flower names in order, including rose, separated by commas. Answer: ['Rose', 'Tulip', 'Sunflower', 'Peony'] From the sunflower section, what is the shortest path to the carnation section? Starting from sunflower, please only list the flower names in order, including sunflower, separated by commas. Answer:", "Both Prime Question Answer": ["Sunflower", "Peony", "Carnation"], "Lexical Prime Question": "Imagine a garden with 7 sections of flowers. The rose section is connected to the tulip section and the lavender section. The tulip section is connected to the rose section, the sunflower section and the daffodil section. The lavender section is connected to the rose section, the peony section and the geranium section. The sunflower section is connected to the tulip section. The daffodil section is connected to the tulip section. The peony section is connected to the lavender section. The geranium section is connected to the lavender section. From the lavender section, what is the shortest path to the rose section? Starting from lavender, please only list the flower names in order, including lavender, separated by commas. Answer: ['Lavender', 'Rose'] Imagine a garden with 13 sections of flowers. The rose section is connected to the tulip section and the lavender section. The tulip section is connected to the rose section and the sunflower section. The lavender section is connected to the rose section and the daffodil section. The sunflower section is connected to the tulip section and the peony section. The daffodil section is connected to the lavender section and the geranium section. The peony section is connected to the sunflower section and the carnation section. The geranium section is connected to the daffodil section and the daisy section. The carnation section is connected to the peony section and the orchid section. The daisy section is connected to the geranium section and the iris section. The orchid section is connected to the carnation section and the poppy section. The iris section is connected to the daisy section and the marigold section. The poppy section is connected to the orchid section. The marigold section is connected to the iris section. From the sunflower section, what is the shortest path to the carnation section? Starting from sunflower, please only list the flower names in order, including sunflower, separated by commas. Answer:", "Lexical Prime Question Answer": ["Sunflower", "Peony", "Carnation"], "Structural Prime Question": "Imagine a group of 13 people. Anne is friends with Bob and Charles. Bob is friends with Anne and Deborah. Charles is friends with Anne and Emily. Deborah is friends with Bob and Mary. Emily is friends with Charles and Kelly. Mary is friends with Deborah and Sam. Kelly is friends with Emily and John. Sam is friends with Mary and George. John is friends with Kelly and Fred. George is friends with Sam and Harrison. Fred is friends with John and Isabelle. Harrison is friends with George. Isabelle is friends with Fred. From Sam, what is the shortest path to John? Starting from Sam, please only list the people's names in order, including Sam, separated by commas. Answer: ['Sam', 'Mary', 'Deborah', 'Bob', 'Anne', 'Charles', 'Emily', 'Kelly', 'John'] Imagine a garden with 13 sections of flowers. The rose section is connected to the tulip section and the lavender section. The tulip section is connected to the rose section and the sunflower section. The lavender section is connected to the rose section and the daffodil section. The sunflower section is connected to the tulip section and the peony section. The daffodil section is connected to the lavender section and the geranium section. The peony section is connected to the sunflower section and the carnation section. The geranium section is connected to the daffodil section and the daisy section. The carnation section is connected to the peony section and the orchid section. The daisy section is connected to the geranium section and the iris section. The orchid section is connected to the carnation section and the poppy section. The iris section is connected to the daisy section and the marigold section. The poppy section is connected to the orchid section. The marigold section is connected to the iris section. From the sunflower section, what is the shortest path to the carnation section? Starting from sunflower, please only list the flower names in order, including sunflower, separated by commas. Answer:", "Structural Prime Question Answer": ["Sunflower", "Peony", "Carnation"]}
{"Graph": "n13line_flowers", "Description": "Imagine a garden with 13 sections of flowers. The rose section is connected to the tulip section and the lavender section. The tulip section is connected to the rose section and the sunflower section. The lavender section is connected to the rose section and the daffodil section. The sunflower section is connected to the tulip section and the peony section. The daffodil section is connected to the lavender section and the geranium section. The peony section is connected to the sunflower section and the carnation section. The geranium section is connected to the daffodil section and the daisy section. The carnation section is connected to the peony section and the orchid section. The daisy section is connected to the geranium section and the iris section. The orchid section is connected to the carnation section and the poppy section. The iris section is connected to the daisy section and the marigold section. The poppy section is connected to the orchid section. The marigold section is connected to the iris section.", "No Prime Question": "From the carnation section, what is the shortest path to the daisy section? Starting from carnation, please only list the flower names in order, including carnation, separated by commas. Answer:", "No Prime Question Answer": ["Carnation", "Peony", "Sunflower", "Tulip", "Rose", "Lavender", "Daffodil", "Geranium", "Daisy"], "Both Prime Question": "Imagine a garden with 13 sections of flowers. The rose section is connected to the tulip section and the lavender section. The tulip section is connected to the rose section and the sunflower section. The lavender section is connected to the rose section and the daffodil section. The sunflower section is connected to the tulip section and the peony section. The daffodil section is connected to the lavender section and the geranium section. The peony section is connected to the sunflower section and the carnation section. The geranium section is connected to the daffodil section and the daisy section. The carnation section is connected to the peony section and the orchid section. The daisy section is connected to the geranium section and the iris section. The orchid section is connected to the carnation section and the poppy section. The iris section is connected to the daisy section and the marigold section. The poppy section is connected to the orchid section. The marigold section is connected to the iris section. From the marigold section, what is the shortest path to the daffodil section? Starting from marigold, please only list the flower names in order, including marigold, separated by commas. Answer: ['Marigold', 'Iris', 'Daisy', 'Geranium', 'Daffodil'] From the carnation section, what is the shortest path to the daisy section? Starting from carnation, please only list the flower names in order, including carnation, separated by commas. Answer:", "Both Prime Question Answer": ["Carnation", "Peony", "Sunflower", "Tulip", "Rose", "Lavender", "Daffodil", "Geranium", "Daisy"], "Lexical Prime Question": "Imagine a garden with 15 sections of flowers. The rose section is connected to the tulip section, the lavender section, the sunflower section and the daffodil section. The tulip section is connected to the rose section, the lavender section, the sunflower section and the daffodil section. The lavender section is connected to the rose section, the tulip section, the sunflower section and the daffodil section. The sunflower section is connected to the rose section, the tulip section, the lavender section and the peony section. The daffodil section is connected to the rose section, the tulip section, the lavender section and the hyacinth section. The peony section is connected to the sunflower section, the geranium section, the carnation section and the daisy section. The geranium section is connected to the peony section, the carnation section, the daisy section and the orchid section. The carnation section is connected to the peony section, the geranium section, the daisy section and the orchid section. The daisy section is connected to the peony section, the geranium section, the carnation section and the orchid section. The orchid section is connected to the geranium section, the carnation section, the daisy section and the iris section. The iris section is connected to the orchid section, the poppy section, the marigold section and the lily section. The poppy section is connected to the iris section, the marigold section, the lily section and the hyacinth section. The marigold section is connected to the iris section, the poppy section, the lily section and the hyacinth section. The lily section is connected to the iris section, the poppy section, the marigold section and the hyacinth section. The hyacinth section is connected to the poppy section, the marigold section, the lily section and the daffodil section. From the daisy section, what is the shortest path to the orchid section? Starting from daisy, please only list the flower names in order, including daisy, separated by commas. Answer: ['Daisy', 'Orchid'] Imagine a garden with 13 sections of flowers. The rose section is connected to the tulip section and the lavender section. The tulip section is connected to the rose section and the sunflower section. The lavender section is connected to the rose section and the daffodil section. The sunflower section is connected to the tulip section and the peony section. The daffodil section is connected to the lavender section and the geranium section. The peony section is connected to the sunflower section and the carnation section. The geranium section is connected to the daffodil section and the daisy section. The carnation section is connected to the peony section and the orchid section. The daisy section is connected to the geranium section and the iris section. The orchid section is connected to the carnation section and the poppy section. The iris section is connected to the daisy section and the marigold section. The poppy section is connected to the orchid section. The marigold section is connected to the iris section. From the carnation section, what is the shortest path to the daisy section? Starting from carnation, please only list the flower names in order, including carnation, separated by commas. Answer:", "Lexical Prime Question Answer": ["Carnation", "Peony", "Sunflower", "Tulip", "Rose", "Lavender", "Daffodil", "Geranium", "Daisy"], "Structural Prime Question": "Imagine a home with 13 rooms. Room 1 is connected to Room 2 and Room 3. Room 2 is connected to Room 1 and Room 4. Room 3 is connected to Room 1 and Room 5. Room 4 is connected to Room 2 and Room 6. Room 5 is connected to Room 3 and Room 7. Room 6 is connected to Room 4 and Room 8. Room 7 is connected to Room 5 and Room 9. Room 8 is connected to Room 6 and Room 10. Room 9 is connected to Room 7 and Room 11. Room 10 is connected to Room 8 and Room 12. Room 11 is connected to Room 9 and Room 13. Room 12 is connected to Room 10. Room 13 is connected to Room 11. From room 4, what is the shortest path to room 10? Starting from room 4, please only list the room numbers in order, including room 4, separated by commas. Answer: ['4', '6', '8', '10'] Imagine a garden with 13 sections of flowers. The rose section is connected to the tulip section and the lavender section. The tulip section is connected to the rose section and the sunflower section. The lavender section is connected to the rose section and the daffodil section. The sunflower section is connected to the tulip section and the peony section. The daffodil section is connected to the lavender section and the geranium section. The peony section is connected to the sunflower section and the carnation section. The geranium section is connected to the daffodil section and the daisy section. The carnation section is connected to the peony section and the orchid section. The daisy section is connected to the geranium section and the iris section. The orchid section is connected to the carnation section and the poppy section. The iris section is connected to the daisy section and the marigold section. The poppy section is connected to the orchid section. The marigold section is connected to the iris section. From the carnation section, what is the shortest path to the daisy section? Starting from carnation, please only list the flower names in order, including carnation, separated by commas. Answer:", "Structural Prime Question Answer": ["Carnation", "Peony", "Sunflower", "Tulip", "Rose", "Lavender", "Daffodil", "Geranium", "Daisy"]}
{"Graph": "n13line_flowers", "Description": "Imagine a garden with 13 sections of flowers. The rose section is connected to the tulip section and the lavender section. The tulip section is connected to the rose section and the sunflower section. The lavender section is connected to the rose section and the daffodil section. The sunflower section is connected to the tulip section and the peony section. The daffodil section is connected to the lavender section and the geranium section. The peony section is connected to the sunflower section and the carnation section. The geranium section is connected to the daffodil section and the daisy section. The carnation section is connected to the peony section and the orchid section. The daisy section is connected to the geranium section and the iris section. The orchid section is connected to the carnation section and the poppy section. The iris section is connected to the daisy section and the marigold section. The poppy section is connected to the orchid section. The marigold section is connected to the iris section.", "No Prime Question": "From the orchid section, what is the shortest path to the geranium section? Starting from orchid, please only list the flower names in order, including orchid, separated by commas. Answer:", "No Prime Question Answer": ["Orchid", "Carnation", "Peony", "Sunflower", "Tulip", "Rose", "Lavender", "Daffodil", "Geranium"], "Both Prime Question": "Imagine a garden with 13 sections of flowers. The rose section is connected to the tulip section and the lavender section. The tulip section is connected to the rose section and the sunflower section. The lavender section is connected to the rose section and the daffodil section. The sunflower section is connected to the tulip section and the peony section. The daffodil section is connected to the lavender section and the geranium section. The peony section is connected to the sunflower section and the carnation section. The geranium section is connected to the daffodil section and the daisy section. The carnation section is connected to the peony section and the orchid section. The daisy section is connected to the geranium section and the iris section. The orchid section is connected to the carnation section and the poppy section. The iris section is connected to the daisy section and the marigold section. The poppy section is connected to the orchid section. The marigold section is connected to the iris section. From the lavender section, what is the shortest path to the sunflower section? Starting from lavender, please only list the flower names in order, including lavender, separated by commas. Answer: ['Lavender', 'Rose', 'Tulip', 'Sunflower'] From the orchid section, what is the shortest path to the geranium section? Starting from orchid, please only list the flower names in order, including orchid, separated by commas. Answer:", "Both Prime Question Answer": ["Orchid", "Carnation", "Peony", "Sunflower", "Tulip", "Rose", "Lavender", "Daffodil", "Geranium"], "Lexical Prime Question": "Imagine a garden with 7 sections of flowers. The rose section is connected to the tulip section and the lavender section. The tulip section is connected to the rose section, the sunflower section and the daffodil section. The lavender section is connected to the rose section, the peony section and the geranium section. The sunflower section is connected to the tulip section. The daffodil section is connected to the tulip section. The peony section is connected to the lavender section. The geranium section is connected to the lavender section. From the geranium section, what is the shortest path to the rose section? Starting from geranium, please only list the flower names in order, including geranium, separated by commas. Answer: ['Geranium', 'Lavender', 'Rose'] Imagine a garden with 13 sections of flowers. The rose section is connected to the tulip section and the lavender section. The tulip section is connected to the rose section and the sunflower section. The lavender section is connected to the rose section and the daffodil section. The sunflower section is connected to the tulip section and the peony section. The daffodil section is connected to the lavender section and the geranium section. The peony section is connected to the sunflower section and the carnation section. The geranium section is connected to the daffodil section and the daisy section. The carnation section is connected to the peony section and the orchid section. The daisy section is connected to the geranium section and the iris section. The orchid section is connected to the carnation section and the poppy section. The iris section is connected to the daisy section and the marigold section. The poppy section is connected to the orchid section. The marigold section is connected to the iris section. From the orchid section, what is the shortest path to the geranium section? Starting from orchid, please only list the flower names in order, including orchid, separated by commas. Answer:", "Lexical Prime Question Answer": ["Orchid", "Carnation", "Peony", "Sunflower", "Tulip", "Rose", "Lavender", "Daffodil", "Geranium"], "Structural Prime Question": "Imagine a group of 13 people. Anne is friends with Bob and Charles. Bob is friends with Anne and Deborah. Charles is friends with Anne and Emily. Deborah is friends with Bob and Mary. Emily is friends with Charles and Kelly. Mary is friends with Deborah and Sam. Kelly is friends with Emily and John. Sam is friends with Mary and George. John is friends with Kelly and Fred. George is friends with Sam and Harrison. Fred is friends with John and Isabelle. Harrison is friends with George. Isabelle is friends with Fred. From Charles, what is the shortest path to Kelly? Starting from Charles, please only list the people's names in order, including Charles, separated by commas. Answer: ['Charles', 'Emily', 'Kelly'] Imagine a garden with 13 sections of flowers. The rose section is connected to the tulip section and the lavender section. The tulip section is connected to the rose section and the sunflower section. The lavender section is connected to the rose section and the daffodil section. The sunflower section is connected to the tulip section and the peony section. The daffodil section is connected to the lavender section and the geranium section. The peony section is connected to the sunflower section and the carnation section. The geranium section is connected to the daffodil section and the daisy section. The carnation section is connected to the peony section and the orchid section. The daisy section is connected to the geranium section and the iris section. The orchid section is connected to the carnation section and the poppy section. The iris section is connected to the daisy section and the marigold section. The poppy section is connected to the orchid section. The marigold section is connected to the iris section. From the orchid section, what is the shortest path to the geranium section? Starting from orchid, please only list the flower names in order, including orchid, separated by commas. Answer:", "Structural Prime Question Answer": ["Orchid", "Carnation", "Peony", "Sunflower", "Tulip", "Rose", "Lavender", "Daffodil", "Geranium"]}
{"Graph": "n13line_flowers", "Description": "Imagine a garden with 13 sections of flowers. The rose section is connected to the tulip section and the lavender section. The tulip section is connected to the rose section and the sunflower section. The lavender section is connected to the rose section and the daffodil section. The sunflower section is connected to the tulip section and the peony section. The daffodil section is connected to the lavender section and the geranium section. The peony section is connected to the sunflower section and the carnation section. The geranium section is connected to the daffodil section and the daisy section. The carnation section is connected to the peony section and the orchid section. The daisy section is connected to the geranium section and the iris section. The orchid section is connected to the carnation section and the poppy section. The iris section is connected to the daisy section and the marigold section. The poppy section is connected to the orchid section. The marigold section is connected to the iris section.", "No Prime Question": "From the rose section, what is the shortest path to the daffodil section? Starting from rose, please only list the flower names in order, including rose, separated by commas. Answer:", "No Prime Question Answer": ["Rose", "Lavender", "Daffodil"], "Both Prime Question": "Imagine a garden with 13 sections of flowers. The rose section is connected to the tulip section and the lavender section. The tulip section is connected to the rose section and the sunflower section. The lavender section is connected to the rose section and the daffodil section. The sunflower section is connected to the tulip section and the peony section. The daffodil section is connected to the lavender section and the geranium section. The peony section is connected to the sunflower section and the carnation section. The geranium section is connected to the daffodil section and the daisy section. The carnation section is connected to the peony section and the orchid section. The daisy section is connected to the geranium section and the iris section. The orchid section is connected to the carnation section and the poppy section. The iris section is connected to the daisy section and the marigold section. The poppy section is connected to the orchid section. The marigold section is connected to the iris section. From the geranium section, what is the shortest path to the peony section? Starting from geranium, please only list the flower names in order, including geranium, separated by commas. Answer: ['Geranium', 'Daffodil', 'Lavender', 'Rose', 'Tulip', 'Sunflower', 'Peony'] From the rose section, what is the shortest path to the daffodil section? Starting from rose, please only list the flower names in order, including rose, separated by commas. Answer:", "Both Prime Question Answer": ["Rose", "Lavender", "Daffodil"], "Lexical Prime Question": "Imagine a garden with 7 sections of flowers. The rose section is connected to the tulip section and the lavender section. The tulip section is connected to the rose section and the sunflower section. The lavender section is connected to the rose section and the daffodil section. The sunflower section is connected to the tulip section and the peony section. The daffodil section is connected to the lavender section and the geranium section. The peony section is connected to the sunflower section. The geranium section is connected to the daffodil section. From the geranium section, what is the shortest path to the peony section? Starting from geranium, please only list the flower names in order, including geranium, separated by commas. Answer: ['Geranium', 'Daffodil', 'Lavender', 'Rose', 'Tulip', 'Sunflower', 'Peony'] Imagine a garden with 13 sections of flowers. The rose section is connected to the tulip section and the lavender section. The tulip section is connected to the rose section and the sunflower section. The lavender section is connected to the rose section and the daffodil section. The sunflower section is connected to the tulip section and the peony section. The daffodil section is connected to the lavender section and the geranium section. The peony section is connected to the sunflower section and the carnation section. The geranium section is connected to the daffodil section and the daisy section. The carnation section is connected to the peony section and the orchid section. The daisy section is connected to the geranium section and the iris section. The orchid section is connected to the carnation section and the poppy section. The iris section is connected to the daisy section and the marigold section. The poppy section is connected to the orchid section. The marigold section is connected to the iris section. From the rose section, what is the shortest path to the daffodil section? Starting from rose, please only list the flower names in order, including rose, separated by commas. Answer:", "Lexical Prime Question Answer": ["Rose", "Lavender", "Daffodil"], "Structural Prime Question": "Imagine a home with 13 rooms. Room 1 is connected to Room 2 and Room 3. Room 2 is connected to Room 1 and Room 4. Room 3 is connected to Room 1 and Room 5. Room 4 is connected to Room 2 and Room 6. Room 5 is connected to Room 3 and Room 7. Room 6 is connected to Room 4 and Room 8. Room 7 is connected to Room 5 and Room 9. Room 8 is connected to Room 6 and Room 10. Room 9 is connected to Room 7 and Room 11. Room 10 is connected to Room 8 and Room 12. Room 11 is connected to Room 9 and Room 13. Room 12 is connected to Room 10. Room 13 is connected to Room 11. From room 13, what is the shortest path to room 3? Starting from room 13, please only list the room numbers in order, including room 13, separated by commas. Answer: ['13', '11', '9', '7', '5', '3'] Imagine a garden with 13 sections of flowers. The rose section is connected to the tulip section and the lavender section. The tulip section is connected to the rose section and the sunflower section. The lavender section is connected to the rose section and the daffodil section. The sunflower section is connected to the tulip section and the peony section. The daffodil section is connected to the lavender section and the geranium section. The peony section is connected to the sunflower section and the carnation section. The geranium section is connected to the daffodil section and the daisy section. The carnation section is connected to the peony section and the orchid section. The daisy section is connected to the geranium section and the iris section. The orchid section is connected to the carnation section and the poppy section. The iris section is connected to the daisy section and the marigold section. The poppy section is connected to the orchid section. The marigold section is connected to the iris section. From the rose section, what is the shortest path to the daffodil section? Starting from rose, please only list the flower names in order, including rose, separated by commas. Answer:", "Structural Prime Question Answer": ["Rose", "Lavender", "Daffodil"]}
{"Graph": "n13line_flowers", "Description": "Imagine a garden with 13 sections of flowers. The rose section is connected to the tulip section and the lavender section. The tulip section is connected to the rose section and the sunflower section. The lavender section is connected to the rose section and the daffodil section. The sunflower section is connected to the tulip section and the peony section. The daffodil section is connected to the lavender section and the geranium section. The peony section is connected to the sunflower section and the carnation section. The geranium section is connected to the daffodil section and the daisy section. The carnation section is connected to the peony section and the orchid section. The daisy section is connected to the geranium section and the iris section. The orchid section is connected to the carnation section and the poppy section. The iris section is connected to the daisy section and the marigold section. The poppy section is connected to the orchid section. The marigold section is connected to the iris section.", "No Prime Question": "From the rose section, what is the shortest path to the iris section? Starting from rose, please only list the flower names in order, including rose, separated by commas. Answer:", "No Prime Question Answer": ["Rose", "Lavender", "Daffodil", "Geranium", "Daisy", "Iris"], "Both Prime Question": "Imagine a garden with 13 sections of flowers. The rose section is connected to the tulip section and the lavender section. The tulip section is connected to the rose section and the sunflower section. The lavender section is connected to the rose section and the daffodil section. The sunflower section is connected to the tulip section and the peony section. The daffodil section is connected to the lavender section and the geranium section. The peony section is connected to the sunflower section and the carnation section. The geranium section is connected to the daffodil section and the daisy section. The carnation section is connected to the peony section and the orchid section. The daisy section is connected to the geranium section and the iris section. The orchid section is connected to the carnation section and the poppy section. The iris section is connected to the daisy section and the marigold section. The poppy section is connected to the orchid section. The marigold section is connected to the iris section. From the poppy section, what is the shortest path to the orchid section? Starting from poppy, please only list the flower names in order, including poppy, separated by commas. Answer: ['Poppy', 'Orchid'] From the rose section, what is the shortest path to the iris section? Starting from rose, please only list the flower names in order, including rose, separated by commas. Answer:", "Both Prime Question Answer": ["Rose", "Lavender", "Daffodil", "Geranium", "Daisy", "Iris"], "Lexical Prime Question": "Imagine a garden with 7 sections of flowers. The rose section is connected to the tulip section and the lavender section. The tulip section is connected to the rose section and the sunflower section. The lavender section is connected to the rose section and the daffodil section. The sunflower section is connected to the tulip section and the peony section. The daffodil section is connected to the lavender section and the geranium section. The peony section is connected to the sunflower section. The geranium section is connected to the daffodil section. From the lavender section, what is the shortest path to the rose section? Starting from lavender, please only list the flower names in order, including lavender, separated by commas. Answer: ['Lavender', 'Rose'] Imagine a garden with 13 sections of flowers. The rose section is connected to the tulip section and the lavender section. The tulip section is connected to the rose section and the sunflower section. The lavender section is connected to the rose section and the daffodil section. The sunflower section is connected to the tulip section and the peony section. The daffodil section is connected to the lavender section and the geranium section. The peony section is connected to the sunflower section and the carnation section. The geranium section is connected to the daffodil section and the daisy section. The carnation section is connected to the peony section and the orchid section. The daisy section is connected to the geranium section and the iris section. The orchid section is connected to the carnation section and the poppy section. The iris section is connected to the daisy section and the marigold section. The poppy section is connected to the orchid section. The marigold section is connected to the iris section. From the rose section, what is the shortest path to the iris section? Starting from rose, please only list the flower names in order, including rose, separated by commas. Answer:", "Lexical Prime Question Answer": ["Rose", "Lavender", "Daffodil", "Geranium", "Daisy", "Iris"], "Structural Prime Question": "Imagine a home with 13 rooms. Room 1 is connected to Room 2 and Room 3. Room 2 is connected to Room 1 and Room 4. Room 3 is connected to Room 1 and Room 5. Room 4 is connected to Room 2 and Room 6. Room 5 is connected to Room 3 and Room 7. Room 6 is connected to Room 4 and Room 8. Room 7 is connected to Room 5 and Room 9. Room 8 is connected to Room 6 and Room 10. Room 9 is connected to Room 7 and Room 11. Room 10 is connected to Room 8 and Room 12. Room 11 is connected to Room 9 and Room 13. Room 12 is connected to Room 10. Room 13 is connected to Room 11. From room 8, what is the shortest path to room 5? Starting from room 8, please only list the room numbers in order, including room 8, separated by commas. Answer: ['8', '6', '4', '2', '1', '3', '5'] Imagine a garden with 13 sections of flowers. The rose section is connected to the tulip section and the lavender section. The tulip section is connected to the rose section and the sunflower section. The lavender section is connected to the rose section and the daffodil section. The sunflower section is connected to the tulip section and the peony section. The daffodil section is connected to the lavender section and the geranium section. The peony section is connected to the sunflower section and the carnation section. The geranium section is connected to the daffodil section and the daisy section. The carnation section is connected to the peony section and the orchid section. The daisy section is connected to the geranium section and the iris section. The orchid section is connected to the carnation section and the poppy section. The iris section is connected to the daisy section and the marigold section. The poppy section is connected to the orchid section. The marigold section is connected to the iris section. From the rose section, what is the shortest path to the iris section? Starting from rose, please only list the flower names in order, including rose, separated by commas. Answer:", "Structural Prime Question Answer": ["Rose", "Lavender", "Daffodil", "Geranium", "Daisy", "Iris"]}
{"Graph": "n13line_flowers", "Description": "Imagine a garden with 13 sections of flowers. The rose section is connected to the tulip section and the lavender section. The tulip section is connected to the rose section and the sunflower section. The lavender section is connected to the rose section and the daffodil section. The sunflower section is connected to the tulip section and the peony section. The daffodil section is connected to the lavender section and the geranium section. The peony section is connected to the sunflower section and the carnation section. The geranium section is connected to the daffodil section and the daisy section. The carnation section is connected to the peony section and the orchid section. The daisy section is connected to the geranium section and the iris section. The orchid section is connected to the carnation section and the poppy section. The iris section is connected to the daisy section and the marigold section. The poppy section is connected to the orchid section. The marigold section is connected to the iris section.", "No Prime Question": "From the poppy section, what is the shortest path to the rose section? Starting from poppy, please only list the flower names in order, including poppy, separated by commas. Answer:", "No Prime Question Answer": ["Poppy", "Orchid", "Carnation", "Peony", "Sunflower", "Tulip", "Rose"], "Both Prime Question": "Imagine a garden with 13 sections of flowers. The rose section is connected to the tulip section and the lavender section. The tulip section is connected to the rose section and the sunflower section. The lavender section is connected to the rose section and the daffodil section. The sunflower section is connected to the tulip section and the peony section. The daffodil section is connected to the lavender section and the geranium section. The peony section is connected to the sunflower section and the carnation section. The geranium section is connected to the daffodil section and the daisy section. The carnation section is connected to the peony section and the orchid section. The daisy section is connected to the geranium section and the iris section. The orchid section is connected to the carnation section and the poppy section. The iris section is connected to the daisy section and the marigold section. The poppy section is connected to the orchid section. The marigold section is connected to the iris section. From the orchid section, what is the shortest path to the peony section? Starting from orchid, please only list the flower names in order, including orchid, separated by commas. Answer: ['Orchid', 'Carnation', 'Peony'] From the poppy section, what is the shortest path to the rose section? Starting from poppy, please only list the flower names in order, including poppy, separated by commas. Answer:", "Both Prime Question Answer": ["Poppy", "Orchid", "Carnation", "Peony", "Sunflower", "Tulip", "Rose"], "Lexical Prime Question": "Imagine a garden with 15 sections of flowers. The rose section is connected to the tulip section, the lavender section, the sunflower section and the daffodil section. The tulip section is connected to the rose section, the lavender section, the sunflower section and the daffodil section. The lavender section is connected to the rose section, the tulip section, the sunflower section and the daffodil section. The sunflower section is connected to the rose section, the tulip section, the lavender section and the peony section. The daffodil section is connected to the rose section, the tulip section, the lavender section and the hyacinth section. The peony section is connected to the sunflower section, the geranium section, the carnation section and the daisy section. The geranium section is connected to the peony section, the carnation section, the daisy section and the orchid section. The carnation section is connected to the peony section, the geranium section, the daisy section and the orchid section. The daisy section is connected to the peony section, the geranium section, the carnation section and the orchid section. The orchid section is connected to the geranium section, the carnation section, the daisy section and the iris section. The iris section is connected to the orchid section, the poppy section, the marigold section and the lily section. The poppy section is connected to the iris section, the marigold section, the lily section and the hyacinth section. The marigold section is connected to the iris section, the poppy section, the lily section and the hyacinth section. The lily section is connected to the iris section, the poppy section, the marigold section and the hyacinth section. The hyacinth section is connected to the poppy section, the marigold section, the lily section and the daffodil section. From the peony section, what is the shortest path to the iris section? Starting from peony, please only list the flower names in order, including peony, separated by commas. Answer: ['Peony', 'Geranium', 'Orchid', 'Iris'] Imagine a garden with 13 sections of flowers. The rose section is connected to the tulip section and the lavender section. The tulip section is connected to the rose section and the sunflower section. The lavender section is connected to the rose section and the daffodil section. The sunflower section is connected to the tulip section and the peony section. The daffodil section is connected to the lavender section and the geranium section. The peony section is connected to the sunflower section and the carnation section. The geranium section is connected to the daffodil section and the daisy section. The carnation section is connected to the peony section and the orchid section. The daisy section is connected to the geranium section and the iris section. The orchid section is connected to the carnation section and the poppy section. The iris section is connected to the daisy section and the marigold section. The poppy section is connected to the orchid section. The marigold section is connected to the iris section. From the poppy section, what is the shortest path to the rose section? Starting from poppy, please only list the flower names in order, including poppy, separated by commas. Answer:", "Lexical Prime Question Answer": ["Poppy", "Orchid", "Carnation", "Peony", "Sunflower", "Tulip", "Rose"], "Structural Prime Question": "Imagine a home with 13 rooms. Room 1 is connected to Room 2 and Room 3. Room 2 is connected to Room 1 and Room 4. Room 3 is connected to Room 1 and Room 5. Room 4 is connected to Room 2 and Room 6. Room 5 is connected to Room 3 and Room 7. Room 6 is connected to Room 4 and Room 8. Room 7 is connected to Room 5 and Room 9. Room 8 is connected to Room 6 and Room 10. Room 9 is connected to Room 7 and Room 11. Room 10 is connected to Room 8 and Room 12. Room 11 is connected to Room 9 and Room 13. Room 12 is connected to Room 10. Room 13 is connected to Room 11. From room 4, what is the shortest path to room 2? Starting from room 4, please only list the room numbers in order, including room 4, separated by commas. Answer: ['4', '2'] Imagine a garden with 13 sections of flowers. The rose section is connected to the tulip section and the lavender section. The tulip section is connected to the rose section and the sunflower section. The lavender section is connected to the rose section and the daffodil section. The sunflower section is connected to the tulip section and the peony section. The daffodil section is connected to the lavender section and the geranium section. The peony section is connected to the sunflower section and the carnation section. The geranium section is connected to the daffodil section and the daisy section. The carnation section is connected to the peony section and the orchid section. The daisy section is connected to the geranium section and the iris section. The orchid section is connected to the carnation section and the poppy section. The iris section is connected to the daisy section and the marigold section. The poppy section is connected to the orchid section. The marigold section is connected to the iris section. From the poppy section, what is the shortest path to the rose section? Starting from poppy, please only list the flower names in order, including poppy, separated by commas. Answer:", "Structural Prime Question Answer": ["Poppy", "Orchid", "Carnation", "Peony", "Sunflower", "Tulip", "Rose"]}
{"Graph": "n13line_flowers", "Description": "Imagine a garden with 13 sections of flowers. The rose section is connected to the tulip section and the lavender section. The tulip section is connected to the rose section and the sunflower section. The lavender section is connected to the rose section and the daffodil section. The sunflower section is connected to the tulip section and the peony section. The daffodil section is connected to the lavender section and the geranium section. The peony section is connected to the sunflower section and the carnation section. The geranium section is connected to the daffodil section and the daisy section. The carnation section is connected to the peony section and the orchid section. The daisy section is connected to the geranium section and the iris section. The orchid section is connected to the carnation section and the poppy section. The iris section is connected to the daisy section and the marigold section. The poppy section is connected to the orchid section. The marigold section is connected to the iris section.", "No Prime Question": "From the carnation section, what is the shortest path to the marigold section? Starting from carnation, please only list the flower names in order, including carnation, separated by commas. Answer:", "No Prime Question Answer": ["Carnation", "Peony", "Sunflower", "Tulip", "Rose", "Lavender", "Daffodil", "Geranium", "Daisy", "Iris", "Marigold"], "Both Prime Question": "Imagine a garden with 13 sections of flowers. The rose section is connected to the tulip section and the lavender section. The tulip section is connected to the rose section and the sunflower section. The lavender section is connected to the rose section and the daffodil section. The sunflower section is connected to the tulip section and the peony section. The daffodil section is connected to the lavender section and the geranium section. The peony section is connected to the sunflower section and the carnation section. The geranium section is connected to the daffodil section and the daisy section. The carnation section is connected to the peony section and the orchid section. The daisy section is connected to the geranium section and the iris section. The orchid section is connected to the carnation section and the poppy section. The iris section is connected to the daisy section and the marigold section. The poppy section is connected to the orchid section. The marigold section is connected to the iris section. From the poppy section, what is the shortest path to the sunflower section? Starting from poppy, please only list the flower names in order, including poppy, separated by commas. Answer: ['Poppy', 'Orchid', 'Carnation', 'Peony', 'Sunflower'] From the carnation section, what is the shortest path to the marigold section? Starting from carnation, please only list the flower names in order, including carnation, separated by commas. Answer:", "Both Prime Question Answer": ["Carnation", "Peony", "Sunflower", "Tulip", "Rose", "Lavender", "Daffodil", "Geranium", "Daisy", "Iris", "Marigold"], "Lexical Prime Question": "Imagine a garden with 15 sections of flowers. The rose section is connected to the tulip section, the lavender section, the sunflower section and the daffodil section. The tulip section is connected to the rose section, the lavender section, the sunflower section and the daffodil section. The lavender section is connected to the rose section, the tulip section, the sunflower section and the daffodil section. The sunflower section is connected to the rose section, the tulip section, the lavender section and the peony section. The daffodil section is connected to the rose section, the tulip section, the lavender section and the hyacinth section. The peony section is connected to the sunflower section, the geranium section, the carnation section and the daisy section. The geranium section is connected to the peony section, the carnation section, the daisy section and the orchid section. The carnation section is connected to the peony section, the geranium section, the daisy section and the orchid section. The daisy section is connected to the peony section, the geranium section, the carnation section and the orchid section. The orchid section is connected to the geranium section, the carnation section, the daisy section and the iris section. The iris section is connected to the orchid section, the poppy section, the marigold section and the lily section. The poppy section is connected to the iris section, the marigold section, the lily section and the hyacinth section. The marigold section is connected to the iris section, the poppy section, the lily section and the hyacinth section. The lily section is connected to the iris section, the poppy section, the marigold section and the hyacinth section. The hyacinth section is connected to the poppy section, the marigold section, the lily section and the daffodil section. From the iris section, what is the shortest path to the carnation section? Starting from iris, please only list the flower names in order, including iris, separated by commas. Answer: ['Iris', 'Orchid', 'Carnation'] Imagine a garden with 13 sections of flowers. The rose section is connected to the tulip section and the lavender section. The tulip section is connected to the rose section and the sunflower section. The lavender section is connected to the rose section and the daffodil section. The sunflower section is connected to the tulip section and the peony section. The daffodil section is connected to the lavender section and the geranium section. The peony section is connected to the sunflower section and the carnation section. The geranium section is connected to the daffodil section and the daisy section. The carnation section is connected to the peony section and the orchid section. The daisy section is connected to the geranium section and the iris section. The orchid section is connected to the carnation section and the poppy section. The iris section is connected to the daisy section and the marigold section. The poppy section is connected to the orchid section. The marigold section is connected to the iris section. From the carnation section, what is the shortest path to the marigold section? Starting from carnation, please only list the flower names in order, including carnation, separated by commas. Answer:", "Lexical Prime Question Answer": ["Carnation", "Peony", "Sunflower", "Tulip", "Rose", "Lavender", "Daffodil", "Geranium", "Daisy", "Iris", "Marigold"], "Structural Prime Question": "Imagine a home with 13 rooms. Room 1 is connected to Room 2 and Room 3. Room 2 is connected to Room 1 and Room 4. Room 3 is connected to Room 1 and Room 5. Room 4 is connected to Room 2 and Room 6. Room 5 is connected to Room 3 and Room 7. Room 6 is connected to Room 4 and Room 8. Room 7 is connected to Room 5 and Room 9. Room 8 is connected to Room 6 and Room 10. Room 9 is connected to Room 7 and Room 11. Room 10 is connected to Room 8 and Room 12. Room 11 is connected to Room 9 and Room 13. Room 12 is connected to Room 10. Room 13 is connected to Room 11. From room 13, what is the shortest path to room 6? Starting from room 13, please only list the room numbers in order, including room 13, separated by commas. Answer: ['13', '11', '9', '7', '5', '3', '1', '2', '4', '6'] Imagine a garden with 13 sections of flowers. The rose section is connected to the tulip section and the lavender section. The tulip section is connected to the rose section and the sunflower section. The lavender section is connected to the rose section and the daffodil section. The sunflower section is connected to the tulip section and the peony section. The daffodil section is connected to the lavender section and the geranium section. The peony section is connected to the sunflower section and the carnation section. The geranium section is connected to the daffodil section and the daisy section. The carnation section is connected to the peony section and the orchid section. The daisy section is connected to the geranium section and the iris section. The orchid section is connected to the carnation section and the poppy section. The iris section is connected to the daisy section and the marigold section. The poppy section is connected to the orchid section. The marigold section is connected to the iris section. From the carnation section, what is the shortest path to the marigold section? Starting from carnation, please only list the flower names in order, including carnation, separated by commas. Answer:", "Structural Prime Question Answer": ["Carnation", "Peony", "Sunflower", "Tulip", "Rose", "Lavender", "Daffodil", "Geranium", "Daisy", "Iris", "Marigold"]}
{"Graph": "n13line_flowers", "Description": "Imagine a garden with 13 sections of flowers. The rose section is connected to the tulip section and the lavender section. The tulip section is connected to the rose section and the sunflower section. The lavender section is connected to the rose section and the daffodil section. The sunflower section is connected to the tulip section and the peony section. The daffodil section is connected to the lavender section and the geranium section. The peony section is connected to the sunflower section and the carnation section. The geranium section is connected to the daffodil section and the daisy section. The carnation section is connected to the peony section and the orchid section. The daisy section is connected to the geranium section and the iris section. The orchid section is connected to the carnation section and the poppy section. The iris section is connected to the daisy section and the marigold section. The poppy section is connected to the orchid section. The marigold section is connected to the iris section.", "No Prime Question": "From the carnation section, what is the shortest path to the daffodil section? Starting from carnation, please only list the flower names in order, including carnation, separated by commas. Answer:", "No Prime Question Answer": ["Carnation", "Peony", "Sunflower", "Tulip", "Rose", "Lavender", "Daffodil"], "Both Prime Question": "Imagine a garden with 13 sections of flowers. The rose section is connected to the tulip section and the lavender section. The tulip section is connected to the rose section and the sunflower section. The lavender section is connected to the rose section and the daffodil section. The sunflower section is connected to the tulip section and the peony section. The daffodil section is connected to the lavender section and the geranium section. The peony section is connected to the sunflower section and the carnation section. The geranium section is connected to the daffodil section and the daisy section. The carnation section is connected to the peony section and the orchid section. The daisy section is connected to the geranium section and the iris section. The orchid section is connected to the carnation section and the poppy section. The iris section is connected to the daisy section and the marigold section. The poppy section is connected to the orchid section. The marigold section is connected to the iris section. From the lavender section, what is the shortest path to the rose section? Starting from lavender, please only list the flower names in order, including lavender, separated by commas. Answer: ['Lavender', 'Rose'] From the carnation section, what is the shortest path to the daffodil section? Starting from carnation, please only list the flower names in order, including carnation, separated by commas. Answer:", "Both Prime Question Answer": ["Carnation", "Peony", "Sunflower", "Tulip", "Rose", "Lavender", "Daffodil"], "Lexical Prime Question": "Imagine a garden with 7 sections of flowers. The rose section is connected to the tulip section and the lavender section. The tulip section is connected to the rose section, the sunflower section and the daffodil section. The lavender section is connected to the rose section, the peony section and the geranium section. The sunflower section is connected to the tulip section. The daffodil section is connected to the tulip section. The peony section is connected to the lavender section. The geranium section is connected to the lavender section. From the rose section, what is the shortest path to the tulip section? Starting from rose, please only list the flower names in order, including rose, separated by commas. Answer: ['Rose', 'Tulip'] Imagine a garden with 13 sections of flowers. The rose section is connected to the tulip section and the lavender section. The tulip section is connected to the rose section and the sunflower section. The lavender section is connected to the rose section and the daffodil section. The sunflower section is connected to the tulip section and the peony section. The daffodil section is connected to the lavender section and the geranium section. The peony section is connected to the sunflower section and the carnation section. The geranium section is connected to the daffodil section and the daisy section. The carnation section is connected to the peony section and the orchid section. The daisy section is connected to the geranium section and the iris section. The orchid section is connected to the carnation section and the poppy section. The iris section is connected to the daisy section and the marigold section. The poppy section is connected to the orchid section. The marigold section is connected to the iris section. From the carnation section, what is the shortest path to the daffodil section? Starting from carnation, please only list the flower names in order, including carnation, separated by commas. Answer:", "Lexical Prime Question Answer": ["Carnation", "Peony", "Sunflower", "Tulip", "Rose", "Lavender", "Daffodil"], "Structural Prime Question": "Imagine a group of 13 people. Anne is friends with Bob and Charles. Bob is friends with Anne and Deborah. Charles is friends with Anne and Emily. Deborah is friends with Bob and Mary. Emily is friends with Charles and Kelly. Mary is friends with Deborah and Sam. Kelly is friends with Emily and John. Sam is friends with Mary and George. John is friends with Kelly and Fred. George is friends with Sam and Harrison. Fred is friends with John and Isabelle. Harrison is friends with George. Isabelle is friends with Fred. From Charles, what is the shortest path to Kelly? Starting from Charles, please only list the people's names in order, including Charles, separated by commas. Answer: ['Charles', 'Emily', 'Kelly'] Imagine a garden with 13 sections of flowers. The rose section is connected to the tulip section and the lavender section. The tulip section is connected to the rose section and the sunflower section. The lavender section is connected to the rose section and the daffodil section. The sunflower section is connected to the tulip section and the peony section. The daffodil section is connected to the lavender section and the geranium section. The peony section is connected to the sunflower section and the carnation section. The geranium section is connected to the daffodil section and the daisy section. The carnation section is connected to the peony section and the orchid section. The daisy section is connected to the geranium section and the iris section. The orchid section is connected to the carnation section and the poppy section. The iris section is connected to the daisy section and the marigold section. The poppy section is connected to the orchid section. The marigold section is connected to the iris section. From the carnation section, what is the shortest path to the daffodil section? Starting from carnation, please only list the flower names in order, including carnation, separated by commas. Answer:", "Structural Prime Question Answer": ["Carnation", "Peony", "Sunflower", "Tulip", "Rose", "Lavender", "Daffodil"]}
{"Graph": "n13line_flowers", "Description": "Imagine a garden with 13 sections of flowers. The rose section is connected to the tulip section and the lavender section. The tulip section is connected to the rose section and the sunflower section. The lavender section is connected to the rose section and the daffodil section. The sunflower section is connected to the tulip section and the peony section. The daffodil section is connected to the lavender section and the geranium section. The peony section is connected to the sunflower section and the carnation section. The geranium section is connected to the daffodil section and the daisy section. The carnation section is connected to the peony section and the orchid section. The daisy section is connected to the geranium section and the iris section. The orchid section is connected to the carnation section and the poppy section. The iris section is connected to the daisy section and the marigold section. The poppy section is connected to the orchid section. The marigold section is connected to the iris section.", "No Prime Question": "From the daisy section, what is the shortest path to the tulip section? Starting from daisy, please only list the flower names in order, including daisy, separated by commas. Answer:", "No Prime Question Answer": ["Daisy", "Geranium", "Daffodil", "Lavender", "Rose", "Tulip"], "Both Prime Question": "Imagine a garden with 13 sections of flowers. The rose section is connected to the tulip section and the lavender section. The tulip section is connected to the rose section and the sunflower section. The lavender section is connected to the rose section and the daffodil section. The sunflower section is connected to the tulip section and the peony section. The daffodil section is connected to the lavender section and the geranium section. The peony section is connected to the sunflower section and the carnation section. The geranium section is connected to the daffodil section and the daisy section. The carnation section is connected to the peony section and the orchid section. The daisy section is connected to the geranium section and the iris section. The orchid section is connected to the carnation section and the poppy section. The iris section is connected to the daisy section and the marigold section. The poppy section is connected to the orchid section. The marigold section is connected to the iris section. From the daffodil section, what is the shortest path to the rose section? Starting from daffodil, please only list the flower names in order, including daffodil, separated by commas. Answer: ['Daffodil', 'Lavender', 'Rose'] From the daisy section, what is the shortest path to the tulip section? Starting from daisy, please only list the flower names in order, including daisy, separated by commas. Answer:", "Both Prime Question Answer": ["Daisy", "Geranium", "Daffodil", "Lavender", "Rose", "Tulip"], "Lexical Prime Question": "Imagine a garden with 7 sections of flowers. The rose section is connected to the tulip section and the lavender section. The tulip section is connected to the rose section, the sunflower section and the daffodil section. The lavender section is connected to the rose section, the peony section and the geranium section. The sunflower section is connected to the tulip section. The daffodil section is connected to the tulip section. The peony section is connected to the lavender section. The geranium section is connected to the lavender section. From the daffodil section, what is the shortest path to the lavender section? Starting from daffodil, please only list the flower names in order, including daffodil, separated by commas. Answer: ['Daffodil', 'Tulip', 'Rose', 'Lavender'] Imagine a garden with 13 sections of flowers. The rose section is connected to the tulip section and the lavender section. The tulip section is connected to the rose section and the sunflower section. The lavender section is connected to the rose section and the daffodil section. The sunflower section is connected to the tulip section and the peony section. The daffodil section is connected to the lavender section and the geranium section. The peony section is connected to the sunflower section and the carnation section. The geranium section is connected to the daffodil section and the daisy section. The carnation section is connected to the peony section and the orchid section. The daisy section is connected to the geranium section and the iris section. The orchid section is connected to the carnation section and the poppy section. The iris section is connected to the daisy section and the marigold section. The poppy section is connected to the orchid section. The marigold section is connected to the iris section. From the daisy section, what is the shortest path to the tulip section? Starting from daisy, please only list the flower names in order, including daisy, separated by commas. Answer:", "Lexical Prime Question Answer": ["Daisy", "Geranium", "Daffodil", "Lavender", "Rose", "Tulip"], "Structural Prime Question": "Imagine a group of 13 people. Anne is friends with Bob and Charles. Bob is friends with Anne and Deborah. Charles is friends with Anne and Emily. Deborah is friends with Bob and Mary. Emily is friends with Charles and Kelly. Mary is friends with Deborah and Sam. Kelly is friends with Emily and John. Sam is friends with Mary and George. John is friends with Kelly and Fred. George is friends with Sam and Harrison. Fred is friends with John and Isabelle. Harrison is friends with George. Isabelle is friends with Fred. From Mary, what is the shortest path to Deborah? Starting from Mary, please only list the people's names in order, including Mary, separated by commas. Answer: ['Mary', 'Deborah'] Imagine a garden with 13 sections of flowers. The rose section is connected to the tulip section and the lavender section. The tulip section is connected to the rose section and the sunflower section. The lavender section is connected to the rose section and the daffodil section. The sunflower section is connected to the tulip section and the peony section. The daffodil section is connected to the lavender section and the geranium section. The peony section is connected to the sunflower section and the carnation section. The geranium section is connected to the daffodil section and the daisy section. The carnation section is connected to the peony section and the orchid section. The daisy section is connected to the geranium section and the iris section. The orchid section is connected to the carnation section and the poppy section. The iris section is connected to the daisy section and the marigold section. The poppy section is connected to the orchid section. The marigold section is connected to the iris section. From the daisy section, what is the shortest path to the tulip section? Starting from daisy, please only list the flower names in order, including daisy, separated by commas. Answer:", "Structural Prime Question Answer": ["Daisy", "Geranium", "Daffodil", "Lavender", "Rose", "Tulip"]}
{"Graph": "n13line_flowers", "Description": "Imagine a garden with 13 sections of flowers. The rose section is connected to the tulip section and the lavender section. The tulip section is connected to the rose section and the sunflower section. The lavender section is connected to the rose section and the daffodil section. The sunflower section is connected to the tulip section and the peony section. The daffodil section is connected to the lavender section and the geranium section. The peony section is connected to the sunflower section and the carnation section. The geranium section is connected to the daffodil section and the daisy section. The carnation section is connected to the peony section and the orchid section. The daisy section is connected to the geranium section and the iris section. The orchid section is connected to the carnation section and the poppy section. The iris section is connected to the daisy section and the marigold section. The poppy section is connected to the orchid section. The marigold section is connected to the iris section.", "No Prime Question": "From the rose section, what is the shortest path to the geranium section? Starting from rose, please only list the flower names in order, including rose, separated by commas. Answer:", "No Prime Question Answer": ["Rose", "Lavender", "Daffodil", "Geranium"], "Both Prime Question": "Imagine a garden with 13 sections of flowers. The rose section is connected to the tulip section and the lavender section. The tulip section is connected to the rose section and the sunflower section. The lavender section is connected to the rose section and the daffodil section. The sunflower section is connected to the tulip section and the peony section. The daffodil section is connected to the lavender section and the geranium section. The peony section is connected to the sunflower section and the carnation section. The geranium section is connected to the daffodil section and the daisy section. The carnation section is connected to the peony section and the orchid section. The daisy section is connected to the geranium section and the iris section. The orchid section is connected to the carnation section and the poppy section. The iris section is connected to the daisy section and the marigold section. The poppy section is connected to the orchid section. The marigold section is connected to the iris section. From the tulip section, what is the shortest path to the orchid section? Starting from tulip, please only list the flower names in order, including tulip, separated by commas. Answer: ['Tulip', 'Sunflower', 'Peony', 'Carnation', 'Orchid'] From the rose section, what is the shortest path to the geranium section? Starting from rose, please only list the flower names in order, including rose, separated by commas. Answer:", "Both Prime Question Answer": ["Rose", "Lavender", "Daffodil", "Geranium"], "Lexical Prime Question": "Imagine a garden with 7 sections of flowers. The rose section is connected to the tulip section and the lavender section. The tulip section is connected to the rose section, the sunflower section and the daffodil section. The lavender section is connected to the rose section, the peony section and the geranium section. The sunflower section is connected to the tulip section. The daffodil section is connected to the tulip section. The peony section is connected to the lavender section. The geranium section is connected to the lavender section. From the rose section, what is the shortest path to the daffodil section? Starting from rose, please only list the flower names in order, including rose, separated by commas. Answer: ['Rose', 'Tulip', 'Daffodil'] Imagine a garden with 13 sections of flowers. The rose section is connected to the tulip section and the lavender section. The tulip section is connected to the rose section and the sunflower section. The lavender section is connected to the rose section and the daffodil section. The sunflower section is connected to the tulip section and the peony section. The daffodil section is connected to the lavender section and the geranium section. The peony section is connected to the sunflower section and the carnation section. The geranium section is connected to the daffodil section and the daisy section. The carnation section is connected to the peony section and the orchid section. The daisy section is connected to the geranium section and the iris section. The orchid section is connected to the carnation section and the poppy section. The iris section is connected to the daisy section and the marigold section. The poppy section is connected to the orchid section. The marigold section is connected to the iris section. From the rose section, what is the shortest path to the geranium section? Starting from rose, please only list the flower names in order, including rose, separated by commas. Answer:", "Lexical Prime Question Answer": ["Rose", "Lavender", "Daffodil", "Geranium"], "Structural Prime Question": "Imagine a group of 13 people. Anne is friends with Bob and Charles. Bob is friends with Anne and Deborah. Charles is friends with Anne and Emily. Deborah is friends with Bob and Mary. Emily is friends with Charles and Kelly. Mary is friends with Deborah and Sam. Kelly is friends with Emily and John. Sam is friends with Mary and George. John is friends with Kelly and Fred. George is friends with Sam and Harrison. Fred is friends with John and Isabelle. Harrison is friends with George. Isabelle is friends with Fred. From Isabelle, what is the shortest path to Fred? Starting from Isabelle, please only list the people's names in order, including Isabelle, separated by commas. Answer: ['Isabelle', 'Fred'] Imagine a garden with 13 sections of flowers. The rose section is connected to the tulip section and the lavender section. The tulip section is connected to the rose section and the sunflower section. The lavender section is connected to the rose section and the daffodil section. The sunflower section is connected to the tulip section and the peony section. The daffodil section is connected to the lavender section and the geranium section. The peony section is connected to the sunflower section and the carnation section. The geranium section is connected to the daffodil section and the daisy section. The carnation section is connected to the peony section and the orchid section. The daisy section is connected to the geranium section and the iris section. The orchid section is connected to the carnation section and the poppy section. The iris section is connected to the daisy section and the marigold section. The poppy section is connected to the orchid section. The marigold section is connected to the iris section. From the rose section, what is the shortest path to the geranium section? Starting from rose, please only list the flower names in order, including rose, separated by commas. Answer:", "Structural Prime Question Answer": ["Rose", "Lavender", "Daffodil", "Geranium"]}
{"Graph": "n13line_flowers", "Description": "Imagine a garden with 13 sections of flowers. The rose section is connected to the tulip section and the lavender section. The tulip section is connected to the rose section and the sunflower section. The lavender section is connected to the rose section and the daffodil section. The sunflower section is connected to the tulip section and the peony section. The daffodil section is connected to the lavender section and the geranium section. The peony section is connected to the sunflower section and the carnation section. The geranium section is connected to the daffodil section and the daisy section. The carnation section is connected to the peony section and the orchid section. The daisy section is connected to the geranium section and the iris section. The orchid section is connected to the carnation section and the poppy section. The iris section is connected to the daisy section and the marigold section. The poppy section is connected to the orchid section. The marigold section is connected to the iris section.", "No Prime Question": "From the carnation section, what is the shortest path to the geranium section? Starting from carnation, please only list the flower names in order, including carnation, separated by commas. Answer:", "No Prime Question Answer": ["Carnation", "Peony", "Sunflower", "Tulip", "Rose", "Lavender", "Daffodil", "Geranium"], "Both Prime Question": "Imagine a garden with 13 sections of flowers. The rose section is connected to the tulip section and the lavender section. The tulip section is connected to the rose section and the sunflower section. The lavender section is connected to the rose section and the daffodil section. The sunflower section is connected to the tulip section and the peony section. The daffodil section is connected to the lavender section and the geranium section. The peony section is connected to the sunflower section and the carnation section. The geranium section is connected to the daffodil section and the daisy section. The carnation section is connected to the peony section and the orchid section. The daisy section is connected to the geranium section and the iris section. The orchid section is connected to the carnation section and the poppy section. The iris section is connected to the daisy section and the marigold section. The poppy section is connected to the orchid section. The marigold section is connected to the iris section. From the sunflower section, what is the shortest path to the daisy section? Starting from sunflower, please only list the flower names in order, including sunflower, separated by commas. Answer: ['Sunflower', 'Tulip', 'Rose', 'Lavender', 'Daffodil', 'Geranium', 'Daisy'] From the carnation section, what is the shortest path to the geranium section? Starting from carnation, please only list the flower names in order, including carnation, separated by commas. Answer:", "Both Prime Question Answer": ["Carnation", "Peony", "Sunflower", "Tulip", "Rose", "Lavender", "Daffodil", "Geranium"], "Lexical Prime Question": "Imagine a garden with 15 sections of flowers. The rose section is connected to the tulip section, the lavender section, the sunflower section and the daffodil section. The tulip section is connected to the rose section, the lavender section, the sunflower section and the daffodil section. The lavender section is connected to the rose section, the tulip section, the sunflower section and the daffodil section. The sunflower section is connected to the rose section, the tulip section, the lavender section and the peony section. The daffodil section is connected to the rose section, the tulip section, the lavender section and the hyacinth section. The peony section is connected to the sunflower section, the geranium section, the carnation section and the daisy section. The geranium section is connected to the peony section, the carnation section, the daisy section and the orchid section. The carnation section is connected to the peony section, the geranium section, the daisy section and the orchid section. The daisy section is connected to the peony section, the geranium section, the carnation section and the orchid section. The orchid section is connected to the geranium section, the carnation section, the daisy section and the iris section. The iris section is connected to the orchid section, the poppy section, the marigold section and the lily section. The poppy section is connected to the iris section, the marigold section, the lily section and the hyacinth section. The marigold section is connected to the iris section, the poppy section, the lily section and the hyacinth section. The lily section is connected to the iris section, the poppy section, the marigold section and the hyacinth section. The hyacinth section is connected to the poppy section, the marigold section, the lily section and the daffodil section. From the iris section, what is the shortest path to the tulip section? Starting from iris, please only list the flower names in order, including iris, separated by commas. Answer: ['Iris', 'Poppy', 'Hyacinth', 'Daffodil', 'Tulip'] Imagine a garden with 13 sections of flowers. The rose section is connected to the tulip section and the lavender section. The tulip section is connected to the rose section and the sunflower section. The lavender section is connected to the rose section and the daffodil section. The sunflower section is connected to the tulip section and the peony section. The daffodil section is connected to the lavender section and the geranium section. The peony section is connected to the sunflower section and the carnation section. The geranium section is connected to the daffodil section and the daisy section. The carnation section is connected to the peony section and the orchid section. The daisy section is connected to the geranium section and the iris section. The orchid section is connected to the carnation section and the poppy section. The iris section is connected to the daisy section and the marigold section. The poppy section is connected to the orchid section. The marigold section is connected to the iris section. From the carnation section, what is the shortest path to the geranium section? Starting from carnation, please only list the flower names in order, including carnation, separated by commas. Answer:", "Lexical Prime Question Answer": ["Carnation", "Peony", "Sunflower", "Tulip", "Rose", "Lavender", "Daffodil", "Geranium"], "Structural Prime Question": "Imagine a group of 13 people. Anne is friends with Bob and Charles. Bob is friends with Anne and Deborah. Charles is friends with Anne and Emily. Deborah is friends with Bob and Mary. Emily is friends with Charles and Kelly. Mary is friends with Deborah and Sam. Kelly is friends with Emily and John. Sam is friends with Mary and George. John is friends with Kelly and Fred. George is friends with Sam and Harrison. Fred is friends with John and Isabelle. Harrison is friends with George. Isabelle is friends with Fred. From Kelly, what is the shortest path to Bob? Starting from Kelly, please only list the people's names in order, including Kelly, separated by commas. Answer: ['Kelly', 'Emily', 'Charles', 'Anne', 'Bob'] Imagine a garden with 13 sections of flowers. The rose section is connected to the tulip section and the lavender section. The tulip section is connected to the rose section and the sunflower section. The lavender section is connected to the rose section and the daffodil section. The sunflower section is connected to the tulip section and the peony section. The daffodil section is connected to the lavender section and the geranium section. The peony section is connected to the sunflower section and the carnation section. The geranium section is connected to the daffodil section and the daisy section. The carnation section is connected to the peony section and the orchid section. The daisy section is connected to the geranium section and the iris section. The orchid section is connected to the carnation section and the poppy section. The iris section is connected to the daisy section and the marigold section. The poppy section is connected to the orchid section. The marigold section is connected to the iris section. From the carnation section, what is the shortest path to the geranium section? Starting from carnation, please only list the flower names in order, including carnation, separated by commas. Answer:", "Structural Prime Question Answer": ["Carnation", "Peony", "Sunflower", "Tulip", "Rose", "Lavender", "Daffodil", "Geranium"]}
{"Graph": "n13line_flowers", "Description": "Imagine a garden with 13 sections of flowers. The rose section is connected to the tulip section and the lavender section. The tulip section is connected to the rose section and the sunflower section. The lavender section is connected to the rose section and the daffodil section. The sunflower section is connected to the tulip section and the peony section. The daffodil section is connected to the lavender section and the geranium section. The peony section is connected to the sunflower section and the carnation section. The geranium section is connected to the daffodil section and the daisy section. The carnation section is connected to the peony section and the orchid section. The daisy section is connected to the geranium section and the iris section. The orchid section is connected to the carnation section and the poppy section. The iris section is connected to the daisy section and the marigold section. The poppy section is connected to the orchid section. The marigold section is connected to the iris section.", "No Prime Question": "From the orchid section, what is the shortest path to the sunflower section? Starting from orchid, please only list the flower names in order, including orchid, separated by commas. Answer:", "No Prime Question Answer": ["Orchid", "Carnation", "Peony", "Sunflower"], "Both Prime Question": "Imagine a garden with 13 sections of flowers. The rose section is connected to the tulip section and the lavender section. The tulip section is connected to the rose section and the sunflower section. The lavender section is connected to the rose section and the daffodil section. The sunflower section is connected to the tulip section and the peony section. The daffodil section is connected to the lavender section and the geranium section. The peony section is connected to the sunflower section and the carnation section. The geranium section is connected to the daffodil section and the daisy section. The carnation section is connected to the peony section and the orchid section. The daisy section is connected to the geranium section and the iris section. The orchid section is connected to the carnation section and the poppy section. The iris section is connected to the daisy section and the marigold section. The poppy section is connected to the orchid section. The marigold section is connected to the iris section. From the poppy section, what is the shortest path to the daisy section? Starting from poppy, please only list the flower names in order, including poppy, separated by commas. Answer: ['Poppy', 'Orchid', 'Carnation', 'Peony', 'Sunflower', 'Tulip', 'Rose', 'Lavender', 'Daffodil', 'Geranium', 'Daisy'] From the orchid section, what is the shortest path to the sunflower section? Starting from orchid, please only list the flower names in order, including orchid, separated by commas. Answer:", "Both Prime Question Answer": ["Orchid", "Carnation", "Peony", "Sunflower"], "Lexical Prime Question": "Imagine a garden with 7 sections of flowers. The rose section is connected to the tulip section and the lavender section. The tulip section is connected to the rose section and the sunflower section. The lavender section is connected to the rose section and the daffodil section. The sunflower section is connected to the tulip section and the peony section. The daffodil section is connected to the lavender section and the geranium section. The peony section is connected to the sunflower section. The geranium section is connected to the daffodil section. From the daffodil section, what is the shortest path to the rose section? Starting from daffodil, please only list the flower names in order, including daffodil, separated by commas. Answer: ['Daffodil', 'Lavender', 'Rose'] Imagine a garden with 13 sections of flowers. The rose section is connected to the tulip section and the lavender section. The tulip section is connected to the rose section and the sunflower section. The lavender section is connected to the rose section and the daffodil section. The sunflower section is connected to the tulip section and the peony section. The daffodil section is connected to the lavender section and the geranium section. The peony section is connected to the sunflower section and the carnation section. The geranium section is connected to the daffodil section and the daisy section. The carnation section is connected to the peony section and the orchid section. The daisy section is connected to the geranium section and the iris section. The orchid section is connected to the carnation section and the poppy section. The iris section is connected to the daisy section and the marigold section. The poppy section is connected to the orchid section. The marigold section is connected to the iris section. From the orchid section, what is the shortest path to the sunflower section? Starting from orchid, please only list the flower names in order, including orchid, separated by commas. Answer:", "Lexical Prime Question Answer": ["Orchid", "Carnation", "Peony", "Sunflower"], "Structural Prime Question": "Imagine a group of 13 people. Anne is friends with Bob and Charles. Bob is friends with Anne and Deborah. Charles is friends with Anne and Emily. Deborah is friends with Bob and Mary. Emily is friends with Charles and Kelly. Mary is friends with Deborah and Sam. Kelly is friends with Emily and John. Sam is friends with Mary and George. John is friends with Kelly and Fred. George is friends with Sam and Harrison. Fred is friends with John and Isabelle. Harrison is friends with George. Isabelle is friends with Fred. From Kelly, what is the shortest path to Sam? Starting from Kelly, please only list the people's names in order, including Kelly, separated by commas. Answer: ['Kelly', 'Emily', 'Charles', 'Anne', 'Bob', 'Deborah', 'Mary', 'Sam'] Imagine a garden with 13 sections of flowers. The rose section is connected to the tulip section and the lavender section. The tulip section is connected to the rose section and the sunflower section. The lavender section is connected to the rose section and the daffodil section. The sunflower section is connected to the tulip section and the peony section. The daffodil section is connected to the lavender section and the geranium section. The peony section is connected to the sunflower section and the carnation section. The geranium section is connected to the daffodil section and the daisy section. The carnation section is connected to the peony section and the orchid section. The daisy section is connected to the geranium section and the iris section. The orchid section is connected to the carnation section and the poppy section. The iris section is connected to the daisy section and the marigold section. The poppy section is connected to the orchid section. The marigold section is connected to the iris section. From the orchid section, what is the shortest path to the sunflower section? Starting from orchid, please only list the flower names in order, including orchid, separated by commas. Answer:", "Structural Prime Question Answer": ["Orchid", "Carnation", "Peony", "Sunflower"]}
{"Graph": "n13line_flowers", "Description": "Imagine a garden with 13 sections of flowers. The rose section is connected to the tulip section and the lavender section. The tulip section is connected to the rose section and the sunflower section. The lavender section is connected to the rose section and the daffodil section. The sunflower section is connected to the tulip section and the peony section. The daffodil section is connected to the lavender section and the geranium section. The peony section is connected to the sunflower section and the carnation section. The geranium section is connected to the daffodil section and the daisy section. The carnation section is connected to the peony section and the orchid section. The daisy section is connected to the geranium section and the iris section. The orchid section is connected to the carnation section and the poppy section. The iris section is connected to the daisy section and the marigold section. The poppy section is connected to the orchid section. The marigold section is connected to the iris section.", "No Prime Question": "From the iris section, what is the shortest path to the lavender section? Starting from iris, please only list the flower names in order, including iris, separated by commas. Answer:", "No Prime Question Answer": ["Iris", "Daisy", "Geranium", "Daffodil", "Lavender"], "Both Prime Question": "Imagine a garden with 13 sections of flowers. The rose section is connected to the tulip section and the lavender section. The tulip section is connected to the rose section and the sunflower section. The lavender section is connected to the rose section and the daffodil section. The sunflower section is connected to the tulip section and the peony section. The daffodil section is connected to the lavender section and the geranium section. The peony section is connected to the sunflower section and the carnation section. The geranium section is connected to the daffodil section and the daisy section. The carnation section is connected to the peony section and the orchid section. The daisy section is connected to the geranium section and the iris section. The orchid section is connected to the carnation section and the poppy section. The iris section is connected to the daisy section and the marigold section. The poppy section is connected to the orchid section. The marigold section is connected to the iris section. From the rose section, what is the shortest path to the peony section? Starting from rose, please only list the flower names in order, including rose, separated by commas. Answer: ['Rose', 'Tulip', 'Sunflower', 'Peony'] From the iris section, what is the shortest path to the lavender section? Starting from iris, please only list the flower names in order, including iris, separated by commas. Answer:", "Both Prime Question Answer": ["Iris", "Daisy", "Geranium", "Daffodil", "Lavender"], "Lexical Prime Question": "Imagine a garden with 15 sections of flowers. The rose section is connected to the tulip section, the lavender section, the sunflower section and the daffodil section. The tulip section is connected to the rose section, the lavender section, the sunflower section and the daffodil section. The lavender section is connected to the rose section, the tulip section, the sunflower section and the daffodil section. The sunflower section is connected to the rose section, the tulip section, the lavender section and the peony section. The daffodil section is connected to the rose section, the tulip section, the lavender section and the hyacinth section. The peony section is connected to the sunflower section, the geranium section, the carnation section and the daisy section. The geranium section is connected to the peony section, the carnation section, the daisy section and the orchid section. The carnation section is connected to the peony section, the geranium section, the daisy section and the orchid section. The daisy section is connected to the peony section, the geranium section, the carnation section and the orchid section. The orchid section is connected to the geranium section, the carnation section, the daisy section and the iris section. The iris section is connected to the orchid section, the poppy section, the marigold section and the lily section. The poppy section is connected to the iris section, the marigold section, the lily section and the hyacinth section. The marigold section is connected to the iris section, the poppy section, the lily section and the hyacinth section. The lily section is connected to the iris section, the poppy section, the marigold section and the hyacinth section. The hyacinth section is connected to the poppy section, the marigold section, the lily section and the daffodil section. From the carnation section, what is the shortest path to the peony section? Starting from carnation, please only list the flower names in order, including carnation, separated by commas. Answer: ['Carnation', 'Peony'] Imagine a garden with 13 sections of flowers. The rose section is connected to the tulip section and the lavender section. The tulip section is connected to the rose section and the sunflower section. The lavender section is connected to the rose section and the daffodil section. The sunflower section is connected to the tulip section and the peony section. The daffodil section is connected to the lavender section and the geranium section. The peony section is connected to the sunflower section and the carnation section. The geranium section is connected to the daffodil section and the daisy section. The carnation section is connected to the peony section and the orchid section. The daisy section is connected to the geranium section and the iris section. The orchid section is connected to the carnation section and the poppy section. The iris section is connected to the daisy section and the marigold section. The poppy section is connected to the orchid section. The marigold section is connected to the iris section. From the iris section, what is the shortest path to the lavender section? Starting from iris, please only list the flower names in order, including iris, separated by commas. Answer:", "Lexical Prime Question Answer": ["Iris", "Daisy", "Geranium", "Daffodil", "Lavender"], "Structural Prime Question": "Imagine a home with 13 rooms. Room 1 is connected to Room 2 and Room 3. Room 2 is connected to Room 1 and Room 4. Room 3 is connected to Room 1 and Room 5. Room 4 is connected to Room 2 and Room 6. Room 5 is connected to Room 3 and Room 7. Room 6 is connected to Room 4 and Room 8. Room 7 is connected to Room 5 and Room 9. Room 8 is connected to Room 6 and Room 10. Room 9 is connected to Room 7 and Room 11. Room 10 is connected to Room 8 and Room 12. Room 11 is connected to Room 9 and Room 13. Room 12 is connected to Room 10. Room 13 is connected to Room 11. From room 13, what is the shortest path to room 12? Starting from room 13, please only list the room numbers in order, including room 13, separated by commas. Answer: ['13', '11', '9', '7', '5', '3', '1', '2', '4', '6', '8', '10', '12'] Imagine a garden with 13 sections of flowers. The rose section is connected to the tulip section and the lavender section. The tulip section is connected to the rose section and the sunflower section. The lavender section is connected to the rose section and the daffodil section. The sunflower section is connected to the tulip section and the peony section. The daffodil section is connected to the lavender section and the geranium section. The peony section is connected to the sunflower section and the carnation section. The geranium section is connected to the daffodil section and the daisy section. The carnation section is connected to the peony section and the orchid section. The daisy section is connected to the geranium section and the iris section. The orchid section is connected to the carnation section and the poppy section. The iris section is connected to the daisy section and the marigold section. The poppy section is connected to the orchid section. The marigold section is connected to the iris section. From the iris section, what is the shortest path to the lavender section? Starting from iris, please only list the flower names in order, including iris, separated by commas. Answer:", "Structural Prime Question Answer": ["Iris", "Daisy", "Geranium", "Daffodil", "Lavender"]}
{"Graph": "n13line_flowers", "Description": "Imagine a garden with 13 sections of flowers. The rose section is connected to the tulip section and the lavender section. The tulip section is connected to the rose section and the sunflower section. The lavender section is connected to the rose section and the daffodil section. The sunflower section is connected to the tulip section and the peony section. The daffodil section is connected to the lavender section and the geranium section. The peony section is connected to the sunflower section and the carnation section. The geranium section is connected to the daffodil section and the daisy section. The carnation section is connected to the peony section and the orchid section. The daisy section is connected to the geranium section and the iris section. The orchid section is connected to the carnation section and the poppy section. The iris section is connected to the daisy section and the marigold section. The poppy section is connected to the orchid section. The marigold section is connected to the iris section.", "No Prime Question": "From the orchid section, what is the shortest path to the iris section? Starting from orchid, please only list the flower names in order, including orchid, separated by commas. Answer:", "No Prime Question Answer": ["Orchid", "Carnation", "Peony", "Sunflower", "Tulip", "Rose", "Lavender", "Daffodil", "Geranium", "Daisy", "Iris"], "Both Prime Question": "Imagine a garden with 13 sections of flowers. The rose section is connected to the tulip section and the lavender section. The tulip section is connected to the rose section and the sunflower section. The lavender section is connected to the rose section and the daffodil section. The sunflower section is connected to the tulip section and the peony section. The daffodil section is connected to the lavender section and the geranium section. The peony section is connected to the sunflower section and the carnation section. The geranium section is connected to the daffodil section and the daisy section. The carnation section is connected to the peony section and the orchid section. The daisy section is connected to the geranium section and the iris section. The orchid section is connected to the carnation section and the poppy section. The iris section is connected to the daisy section and the marigold section. The poppy section is connected to the orchid section. The marigold section is connected to the iris section. From the geranium section, what is the shortest path to the lavender section? Starting from geranium, please only list the flower names in order, including geranium, separated by commas. Answer: ['Geranium', 'Daffodil', 'Lavender'] From the orchid section, what is the shortest path to the iris section? Starting from orchid, please only list the flower names in order, including orchid, separated by commas. Answer:", "Both Prime Question Answer": ["Orchid", "Carnation", "Peony", "Sunflower", "Tulip", "Rose", "Lavender", "Daffodil", "Geranium", "Daisy", "Iris"], "Lexical Prime Question": "Imagine a garden with 15 sections of flowers. The rose section is connected to the tulip section, the lavender section, the sunflower section and the daffodil section. The tulip section is connected to the rose section, the lavender section, the sunflower section and the daffodil section. The lavender section is connected to the rose section, the tulip section, the sunflower section and the daffodil section. The sunflower section is connected to the rose section, the tulip section, the lavender section and the peony section. The daffodil section is connected to the rose section, the tulip section, the lavender section and the hyacinth section. The peony section is connected to the sunflower section, the geranium section, the carnation section and the daisy section. The geranium section is connected to the peony section, the carnation section, the daisy section and the orchid section. The carnation section is connected to the peony section, the geranium section, the daisy section and the orchid section. The daisy section is connected to the peony section, the geranium section, the carnation section and the orchid section. The orchid section is connected to the geranium section, the carnation section, the daisy section and the iris section. The iris section is connected to the orchid section, the poppy section, the marigold section and the lily section. The poppy section is connected to the iris section, the marigold section, the lily section and the hyacinth section. The marigold section is connected to the iris section, the poppy section, the lily section and the hyacinth section. The lily section is connected to the iris section, the poppy section, the marigold section and the hyacinth section. The hyacinth section is connected to the poppy section, the marigold section, the lily section and the daffodil section. From the tulip section, what is the shortest path to the geranium section? Starting from tulip, please only list the flower names in order, including tulip, separated by commas. Answer: ['Tulip', 'Sunflower', 'Peony', 'Geranium'] Imagine a garden with 13 sections of flowers. The rose section is connected to the tulip section and the lavender section. The tulip section is connected to the rose section and the sunflower section. The lavender section is connected to the rose section and the daffodil section. The sunflower section is connected to the tulip section and the peony section. The daffodil section is connected to the lavender section and the geranium section. The peony section is connected to the sunflower section and the carnation section. The geranium section is connected to the daffodil section and the daisy section. The carnation section is connected to the peony section and the orchid section. The daisy section is connected to the geranium section and the iris section. The orchid section is connected to the carnation section and the poppy section. The iris section is connected to the daisy section and the marigold section. The poppy section is connected to the orchid section. The marigold section is connected to the iris section. From the orchid section, what is the shortest path to the iris section? Starting from orchid, please only list the flower names in order, including orchid, separated by commas. Answer:", "Lexical Prime Question Answer": ["Orchid", "Carnation", "Peony", "Sunflower", "Tulip", "Rose", "Lavender", "Daffodil", "Geranium", "Daisy", "Iris"], "Structural Prime Question": "Imagine a home with 13 rooms. Room 1 is connected to Room 2 and Room 3. Room 2 is connected to Room 1 and Room 4. Room 3 is connected to Room 1 and Room 5. Room 4 is connected to Room 2 and Room 6. Room 5 is connected to Room 3 and Room 7. Room 6 is connected to Room 4 and Room 8. Room 7 is connected to Room 5 and Room 9. Room 8 is connected to Room 6 and Room 10. Room 9 is connected to Room 7 and Room 11. Room 10 is connected to Room 8 and Room 12. Room 11 is connected to Room 9 and Room 13. Room 12 is connected to Room 10. Room 13 is connected to Room 11. From room 10, what is the shortest path to room 1? Starting from room 10, please only list the room numbers in order, including room 10, separated by commas. Answer: ['10', '8', '6', '4', '2', '1'] Imagine a garden with 13 sections of flowers. The rose section is connected to the tulip section and the lavender section. The tulip section is connected to the rose section and the sunflower section. The lavender section is connected to the rose section and the daffodil section. The sunflower section is connected to the tulip section and the peony section. The daffodil section is connected to the lavender section and the geranium section. The peony section is connected to the sunflower section and the carnation section. The geranium section is connected to the daffodil section and the daisy section. The carnation section is connected to the peony section and the orchid section. The daisy section is connected to the geranium section and the iris section. The orchid section is connected to the carnation section and the poppy section. The iris section is connected to the daisy section and the marigold section. The poppy section is connected to the orchid section. The marigold section is connected to the iris section. From the orchid section, what is the shortest path to the iris section? Starting from orchid, please only list the flower names in order, including orchid, separated by commas. Answer:", "Structural Prime Question Answer": ["Orchid", "Carnation", "Peony", "Sunflower", "Tulip", "Rose", "Lavender", "Daffodil", "Geranium", "Daisy", "Iris"]}
