{"Graph": "n15star_friends", "Description": "Imagine a group of 15 people. Anne is friends with Bob, Charles, Deborah and Emily. Bob is friends with Anne, Charles, Deborah and Emily. Charles is friends with Anne, Bob, Deborah and Emily. Deborah is friends with Anne, Bob, Charles and Mary. Emily is friends with Anne, Bob, Charles and Ned. Mary is friends with Deborah, Kelly, Sam and John. Kelly is friends with Mary, Sam, John and George. Sam is friends with Mary, Kelly, John and George. John is friends with Mary, Kelly, Sam and George. George is friends with Kelly, Sam, John and Fred. Fred is friends with George, Harrison, Isabelle and Lauren. Harrison is friends with Fred, Isabelle, Lauren and Ned. Isabelle is friends with Fred, Harrison, Lauren and Ned. Lauren is friends with Fred, Harrison, Isabelle and Ned. Ned is friends with Harrison, Isabelle, Lauren and Emily.", "No Prime Question": "From Mary, what is the shortest path to Isabelle? Starting from Mary, please only list the people's names in order, including Mary, separated by commas. Answer: ", "No Prime Question Answer": ["Mary", "Kelly", "George", "Fred", "Isabelle"], "Both Prime Question": "Imagine a group of 15 people. Anne is friends with Bob, Charles, Deborah and Emily. Bob is friends with Anne, Charles, Deborah and Emily. Charles is friends with Anne, Bob, Deborah and Emily. Deborah is friends with Anne, Bob, Charles and Mary. Emily is friends with Anne, Bob, Charles and Ned. Mary is friends with Deborah, Kelly, Sam and John. Kelly is friends with Mary, Sam, John and George. Sam is friends with Mary, Kelly, John and George. John is friends with Mary, Kelly, Sam and George. George is friends with Kelly, Sam, John and Fred. Fred is friends with George, Harrison, Isabelle and Lauren. Harrison is friends with Fred, Isabelle, Lauren and Ned. Isabelle is friends with Fred, Harrison, Lauren and Ned. Lauren is friends with Fred, Harrison, Isabelle and Ned. Ned is friends with Harrison, Isabelle, Lauren and Emily. From George, what is the shortest path to Anne? Starting from George, please only list the people's names in order, including George, separated by commas. Answer: ['George', 'Kelly', 'Mary', 'Deborah', 'Anne'] From Mary, what is the shortest path to Isabelle? Starting from Mary, please only list the people's names in order, including Mary, separated by commas. Answer: ", "Both Prime Question Answer": ["Mary", "Kelly", "George", "Fred", "Isabelle"], "Lexical Prime Question": "Imagine a group of 7 people. Anne is friends with Bob and Charles. Bob is friends with Anne and Deborah. Charles is friends with Anne and Emily. Deborah is friends with Bob and Mary. Emily is friends with Charles and Kelly. Mary is friends with Deborah. Kelly is friends with Emily. From Charles, what is the shortest path to Kelly? Starting from Charles, please only list the people's names in order, including Charles, separated by commas. Answer: ['Charles', 'Emily', 'Kelly'] Imagine a group of 15 people. Anne is friends with Bob, Charles, Deborah and Emily. Bob is friends with Anne, Charles, Deborah and Emily. Charles is friends with Anne, Bob, Deborah and Emily. Deborah is friends with Anne, Bob, Charles and Mary. Emily is friends with Anne, Bob, Charles and Ned. Mary is friends with Deborah, Kelly, Sam and John. Kelly is friends with Mary, Sam, John and George. Sam is friends with Mary, Kelly, John and George. John is friends with Mary, Kelly, Sam and George. George is friends with Kelly, Sam, John and Fred. Fred is friends with George, Harrison, Isabelle and Lauren. Harrison is friends with Fred, Isabelle, Lauren and Ned. Isabelle is friends with Fred, Harrison, Lauren and Ned. Lauren is friends with Fred, Harrison, Isabelle and Ned. Ned is friends with Harrison, Isabelle, Lauren and Emily. From Mary, what is the shortest path to Isabelle? Starting from Mary, please only list the people's names in order, including Mary, separated by commas. Answer: ", "Lexical Prime Question Answer": ["Mary", "Kelly", "George", "Fred", "Isabelle"], "Structural Prime Question": "Imagine a home with 15 rooms. Room 1 is connected to Room 2, Room 3, Room 4 and Room 5. Room 2 is connected to Room 1, Room 3, Room 4 and Room 5. Room 3 is connected to Room 1, Room 2, Room 4 and Room 5. Room 4 is connected to Room 1, Room 2, Room 3 and Room 6. Room 5 is connected to Room 1, Room 2, Room 3 and Room 15. Room 6 is connected to Room 4, Room 7, Room 8 and Room 9. Room 7 is connected to Room 6, Room 8, Room 9 and Room 10. Room 8 is connected to Room 6, Room 7, Room 9 and Room 10. Room 9 is connected to Room 6, Room 7, Room 8 and Room 10. Room 10 is connected to Room 7, Room 8, Room 9 and Room 11. Room 11 is connected to Room 10, Room 12, Room 13 and Room 14. Room 12 is connected to Room 11, Room 13, Room 14 and Room 15. Room 13 is connected to Room 11, Room 12, Room 14 and Room 15. Room 14 is connected to Room 11, Room 12, Room 13 and Room 15. Room 15 is connected to Room 12, Room 13, Room 14 and Room 5. From room 3, what is the shortest path to room 6? Starting from room 3, please only list the room numbers in order, including room 3, separated by commas. Answer: ['3', '4', '6'] Imagine a group of 15 people. Anne is friends with Bob, Charles, Deborah and Emily. Bob is friends with Anne, Charles, Deborah and Emily. Charles is friends with Anne, Bob, Deborah and Emily. Deborah is friends with Anne, Bob, Charles and Mary. Emily is friends with Anne, Bob, Charles and Ned. Mary is friends with Deborah, Kelly, Sam and John. Kelly is friends with Mary, Sam, John and George. Sam is friends with Mary, Kelly, John and George. John is friends with Mary, Kelly, Sam and George. George is friends with Kelly, Sam, John and Fred. Fred is friends with George, Harrison, Isabelle and Lauren. Harrison is friends with Fred, Isabelle, Lauren and Ned. Isabelle is friends with Fred, Harrison, Lauren and Ned. Lauren is friends with Fred, Harrison, Isabelle and Ned. Ned is friends with Harrison, Isabelle, Lauren and Emily. From Mary, what is the shortest path to Isabelle? Starting from Mary, please only list the people's names in order, including Mary, separated by commas. Answer: ", "Structural Prime Question Answer": ["Mary", "Kelly", "George", "Fred", "Isabelle"]}
{"Graph": "n15star_friends", "Description": "Imagine a group of 15 people. Anne is friends with Bob, Charles, Deborah and Emily. Bob is friends with Anne, Charles, Deborah and Emily. Charles is friends with Anne, Bob, Deborah and Emily. Deborah is friends with Anne, Bob, Charles and Mary. Emily is friends with Anne, Bob, Charles and Ned. Mary is friends with Deborah, Kelly, Sam and John. Kelly is friends with Mary, Sam, John and George. Sam is friends with Mary, Kelly, John and George. John is friends with Mary, Kelly, Sam and George. George is friends with Kelly, Sam, John and Fred. Fred is friends with George, Harrison, Isabelle and Lauren. Harrison is friends with Fred, Isabelle, Lauren and Ned. Isabelle is friends with Fred, Harrison, Lauren and Ned. Lauren is friends with Fred, Harrison, Isabelle and Ned. Ned is friends with Harrison, Isabelle, Lauren and Emily.", "No Prime Question": "From Bob, what is the shortest path to Fred? Starting from Bob, please only list the people's names in order, including Bob, separated by commas. Answer: ", "No Prime Question Answer": ["Bob", "Emily", "Ned", "Harrison", "Fred"], "Both Prime Question": "Imagine a group of 15 people. Anne is friends with Bob, Charles, Deborah and Emily. Bob is friends with Anne, Charles, Deborah and Emily. Charles is friends with Anne, Bob, Deborah and Emily. Deborah is friends with Anne, Bob, Charles and Mary. Emily is friends with Anne, Bob, Charles and Ned. Mary is friends with Deborah, Kelly, Sam and John. Kelly is friends with Mary, Sam, John and George. Sam is friends with Mary, Kelly, John and George. John is friends with Mary, Kelly, Sam and George. George is friends with Kelly, Sam, John and Fred. Fred is friends with George, Harrison, Isabelle and Lauren. Harrison is friends with Fred, Isabelle, Lauren and Ned. Isabelle is friends with Fred, Harrison, Lauren and Ned. Lauren is friends with Fred, Harrison, Isabelle and Ned. Ned is friends with Harrison, Isabelle, Lauren and Emily. From Kelly, what is the shortest path to John? Starting from Kelly, please only list the people's names in order, including Kelly, separated by commas. Answer: ['Kelly', 'John'] From Bob, what is the shortest path to Fred? Starting from Bob, please only list the people's names in order, including Bob, separated by commas. Answer: ", "Both Prime Question Answer": ["Bob", "Emily", "Ned", "Harrison", "Fred"], "Lexical Prime Question": "Imagine a group of 13 people. Anne is friends with Bob and Charles. Bob is friends with Anne and Deborah. Charles is friends with Anne and Emily. Deborah is friends with Bob and Mary. Emily is friends with Charles and Kelly. Mary is friends with Deborah and Sam. Kelly is friends with Emily and John. Sam is friends with Mary and George. John is friends with Kelly and Fred. George is friends with Sam and Harrison. Fred is friends with John and Isabelle. Harrison is friends with George. Isabelle is friends with Fred. From Bob, what is the shortest path to Deborah? Starting from Bob, please only list the people's names in order, including Bob, separated by commas. Answer: ['Bob', 'Deborah'] Imagine a group of 15 people. Anne is friends with Bob, Charles, Deborah and Emily. Bob is friends with Anne, Charles, Deborah and Emily. Charles is friends with Anne, Bob, Deborah and Emily. Deborah is friends with Anne, Bob, Charles and Mary. Emily is friends with Anne, Bob, Charles and Ned. Mary is friends with Deborah, Kelly, Sam and John. Kelly is friends with Mary, Sam, John and George. Sam is friends with Mary, Kelly, John and George. John is friends with Mary, Kelly, Sam and George. George is friends with Kelly, Sam, John and Fred. Fred is friends with George, Harrison, Isabelle and Lauren. Harrison is friends with Fred, Isabelle, Lauren and Ned. Isabelle is friends with Fred, Harrison, Lauren and Ned. Lauren is friends with Fred, Harrison, Isabelle and Ned. Ned is friends with Harrison, Isabelle, Lauren and Emily. From Bob, what is the shortest path to Fred? Starting from Bob, please only list the people's names in order, including Bob, separated by commas. Answer: ", "Lexical Prime Question Answer": ["Bob", "Emily", "Ned", "Harrison", "Fred"], "Structural Prime Question": "Imagine a garden with 15 sections of flowers. The rose section is connected to the tulip section, the lavender section, the sunflower section and the daffodil section. The tulip section is connected to the rose section, the lavender section, the sunflower section and the daffodil section. The lavender section is connected to the rose section, the tulip section, the sunflower section and the daffodil section. The sunflower section is connected to the rose section, the tulip section, the lavender section and the peony section. The daffodil section is connected to the rose section, the tulip section, the lavender section and the hyacinth section. The peony section is connected to the sunflower section, the geranium section, the carnation section and the daisy section. The geranium section is connected to the peony section, the carnation section, the daisy section and the orchid section. The carnation section is connected to the peony section, the geranium section, the daisy section and the orchid section. The daisy section is connected to the peony section, the geranium section, the carnation section and the orchid section. The orchid section is connected to the geranium section, the carnation section, the daisy section and the iris section. The iris section is connected to the orchid section, the poppy section, the marigold section and the lily section. The poppy section is connected to the iris section, the marigold section, the lily section and the hyacinth section. The marigold section is connected to the iris section, the poppy section, the lily section and the hyacinth section. The lily section is connected to the iris section, the poppy section, the marigold section and the hyacinth section. The hyacinth section is connected to the poppy section, the marigold section, the lily section and the daffodil section. From the daffodil section, what is the shortest path to the hyacinth section? Starting from daffodil, please only list the flower names in order, including daffodil, separated by commas. Answer: ['Daffodil', 'Hyacinth'] Imagine a group of 15 people. Anne is friends with Bob, Charles, Deborah and Emily. Bob is friends with Anne, Charles, Deborah and Emily. Charles is friends with Anne, Bob, Deborah and Emily. Deborah is friends with Anne, Bob, Charles and Mary. Emily is friends with Anne, Bob, Charles and Ned. Mary is friends with Deborah, Kelly, Sam and John. Kelly is friends with Mary, Sam, John and George. Sam is friends with Mary, Kelly, John and George. John is friends with Mary, Kelly, Sam and George. George is friends with Kelly, Sam, John and Fred. Fred is friends with George, Harrison, Isabelle and Lauren. Harrison is friends with Fred, Isabelle, Lauren and Ned. Isabelle is friends with Fred, Harrison, Lauren and Ned. Lauren is friends with Fred, Harrison, Isabelle and Ned. Ned is friends with Harrison, Isabelle, Lauren and Emily. From Bob, what is the shortest path to Fred? Starting from Bob, please only list the people's names in order, including Bob, separated by commas. Answer: ", "Structural Prime Question Answer": ["Bob", "Emily", "Ned", "Harrison", "Fred"]}
{"Graph": "n15star_friends", "Description": "Imagine a group of 15 people. Anne is friends with Bob, Charles, Deborah and Emily. Bob is friends with Anne, Charles, Deborah and Emily. Charles is friends with Anne, Bob, Deborah and Emily. Deborah is friends with Anne, Bob, Charles and Mary. Emily is friends with Anne, Bob, Charles and Ned. Mary is friends with Deborah, Kelly, Sam and John. Kelly is friends with Mary, Sam, John and George. Sam is friends with Mary, Kelly, John and George. John is friends with Mary, Kelly, Sam and George. George is friends with Kelly, Sam, John and Fred. Fred is friends with George, Harrison, Isabelle and Lauren. Harrison is friends with Fred, Isabelle, Lauren and Ned. Isabelle is friends with Fred, Harrison, Lauren and Ned. Lauren is friends with Fred, Harrison, Isabelle and Ned. Ned is friends with Harrison, Isabelle, Lauren and Emily.", "No Prime Question": "From Isabelle, what is the shortest path to Fred? Starting from Isabelle, please only list the people's names in order, including Isabelle, separated by commas. Answer: ", "No Prime Question Answer": ["Isabelle", "Fred"], "Both Prime Question": "Imagine a group of 15 people. Anne is friends with Bob, Charles, Deborah and Emily. Bob is friends with Anne, Charles, Deborah and Emily. Charles is friends with Anne, Bob, Deborah and Emily. Deborah is friends with Anne, Bob, Charles and Mary. Emily is friends with Anne, Bob, Charles and Ned. Mary is friends with Deborah, Kelly, Sam and John. Kelly is friends with Mary, Sam, John and George. Sam is friends with Mary, Kelly, John and George. John is friends with Mary, Kelly, Sam and George. George is friends with Kelly, Sam, John and Fred. Fred is friends with George, Harrison, Isabelle and Lauren. Harrison is friends with Fred, Isabelle, Lauren and Ned. Isabelle is friends with Fred, Harrison, Lauren and Ned. Lauren is friends with Fred, Harrison, Isabelle and Ned. Ned is friends with Harrison, Isabelle, Lauren and Emily. From George, what is the shortest path to Mary? Starting from George, please only list the people's names in order, including George, separated by commas. Answer: ['George', 'Kelly', 'Mary'] From Isabelle, what is the shortest path to Fred? Starting from Isabelle, please only list the people's names in order, including Isabelle, separated by commas. Answer: ", "Both Prime Question Answer": ["Isabelle", "Fred"], "Lexical Prime Question": "Imagine a group of 7 people. Anne is friends with Bob and Charles. Bob is friends with Anne, Deborah and Emily. Charles is friends with Anne, Mary and Kelly. Deborah is friends with Bob. Emily is friends with Bob. Mary is friends with Charles. Kelly is friends with Charles. From Kelly, what is the shortest path to Anne? Starting from Kelly, please only list the people's names in order, including Kelly, separated by commas. Answer: ['Kelly', 'Charles', 'Anne'] Imagine a group of 15 people. Anne is friends with Bob, Charles, Deborah and Emily. Bob is friends with Anne, Charles, Deborah and Emily. Charles is friends with Anne, Bob, Deborah and Emily. Deborah is friends with Anne, Bob, Charles and Mary. Emily is friends with Anne, Bob, Charles and Ned. Mary is friends with Deborah, Kelly, Sam and John. Kelly is friends with Mary, Sam, John and George. Sam is friends with Mary, Kelly, John and George. John is friends with Mary, Kelly, Sam and George. George is friends with Kelly, Sam, John and Fred. Fred is friends with George, Harrison, Isabelle and Lauren. Harrison is friends with Fred, Isabelle, Lauren and Ned. Isabelle is friends with Fred, Harrison, Lauren and Ned. Lauren is friends with Fred, Harrison, Isabelle and Ned. Ned is friends with Harrison, Isabelle, Lauren and Emily. From Isabelle, what is the shortest path to Fred? Starting from Isabelle, please only list the people's names in order, including Isabelle, separated by commas. Answer: ", "Lexical Prime Question Answer": ["Isabelle", "Fred"], "Structural Prime Question": "Imagine a garden with 15 sections of flowers. The rose section is connected to the tulip section, the lavender section, the sunflower section and the daffodil section. The tulip section is connected to the rose section, the lavender section, the sunflower section and the daffodil section. The lavender section is connected to the rose section, the tulip section, the sunflower section and the daffodil section. The sunflower section is connected to the rose section, the tulip section, the lavender section and the peony section. The daffodil section is connected to the rose section, the tulip section, the lavender section and the hyacinth section. The peony section is connected to the sunflower section, the geranium section, the carnation section and the daisy section. The geranium section is connected to the peony section, the carnation section, the daisy section and the orchid section. The carnation section is connected to the peony section, the geranium section, the daisy section and the orchid section. The daisy section is connected to the peony section, the geranium section, the carnation section and the orchid section. The orchid section is connected to the geranium section, the carnation section, the daisy section and the iris section. The iris section is connected to the orchid section, the poppy section, the marigold section and the lily section. The poppy section is connected to the iris section, the marigold section, the lily section and the hyacinth section. The marigold section is connected to the iris section, the poppy section, the lily section and the hyacinth section. The lily section is connected to the iris section, the poppy section, the marigold section and the hyacinth section. The hyacinth section is connected to the poppy section, the marigold section, the lily section and the daffodil section. From the marigold section, what is the shortest path to the orchid section? Starting from marigold, please only list the flower names in order, including marigold, separated by commas. Answer: ['Marigold', 'Iris', 'Orchid'] Imagine a group of 15 people. Anne is friends with Bob, Charles, Deborah and Emily. Bob is friends with Anne, Charles, Deborah and Emily. Charles is friends with Anne, Bob, Deborah and Emily. Deborah is friends with Anne, Bob, Charles and Mary. Emily is friends with Anne, Bob, Charles and Ned. Mary is friends with Deborah, Kelly, Sam and John. Kelly is friends with Mary, Sam, John and George. Sam is friends with Mary, Kelly, John and George. John is friends with Mary, Kelly, Sam and George. George is friends with Kelly, Sam, John and Fred. Fred is friends with George, Harrison, Isabelle and Lauren. Harrison is friends with Fred, Isabelle, Lauren and Ned. Isabelle is friends with Fred, Harrison, Lauren and Ned. Lauren is friends with Fred, Harrison, Isabelle and Ned. Ned is friends with Harrison, Isabelle, Lauren and Emily. From Isabelle, what is the shortest path to Fred? Starting from Isabelle, please only list the people's names in order, including Isabelle, separated by commas. Answer: ", "Structural Prime Question Answer": ["Isabelle", "Fred"]}
{"Graph": "n15star_friends", "Description": "Imagine a group of 15 people. Anne is friends with Bob, Charles, Deborah and Emily. Bob is friends with Anne, Charles, Deborah and Emily. Charles is friends with Anne, Bob, Deborah and Emily. Deborah is friends with Anne, Bob, Charles and Mary. Emily is friends with Anne, Bob, Charles and Ned. Mary is friends with Deborah, Kelly, Sam and John. Kelly is friends with Mary, Sam, John and George. Sam is friends with Mary, Kelly, John and George. John is friends with Mary, Kelly, Sam and George. George is friends with Kelly, Sam, John and Fred. Fred is friends with George, Harrison, Isabelle and Lauren. Harrison is friends with Fred, Isabelle, Lauren and Ned. Isabelle is friends with Fred, Harrison, Lauren and Ned. Lauren is friends with Fred, Harrison, Isabelle and Ned. Ned is friends with Harrison, Isabelle, Lauren and Emily.", "No Prime Question": "From Isabelle, what is the shortest path to Kelly? Starting from Isabelle, please only list the people's names in order, including Isabelle, separated by commas. Answer: ", "No Prime Question Answer": ["Isabelle", "Fred", "George", "Kelly"], "Both Prime Question": "Imagine a group of 15 people. Anne is friends with Bob, Charles, Deborah and Emily. Bob is friends with Anne, Charles, Deborah and Emily. Charles is friends with Anne, Bob, Deborah and Emily. Deborah is friends with Anne, Bob, Charles and Mary. Emily is friends with Anne, Bob, Charles and Ned. Mary is friends with Deborah, Kelly, Sam and John. Kelly is friends with Mary, Sam, John and George. Sam is friends with Mary, Kelly, John and George. John is friends with Mary, Kelly, Sam and George. George is friends with Kelly, Sam, John and Fred. Fred is friends with George, Harrison, Isabelle and Lauren. Harrison is friends with Fred, Isabelle, Lauren and Ned. Isabelle is friends with Fred, Harrison, Lauren and Ned. Lauren is friends with Fred, Harrison, Isabelle and Ned. Ned is friends with Harrison, Isabelle, Lauren and Emily. From Charles, what is the shortest path to Deborah? Starting from Charles, please only list the people's names in order, including Charles, separated by commas. Answer: ['Charles', 'Deborah'] From Isabelle, what is the shortest path to Kelly? Starting from Isabelle, please only list the people's names in order, including Isabelle, separated by commas. Answer: ", "Both Prime Question Answer": ["Isabelle", "Fred", "George", "Kelly"], "Lexical Prime Question": "Imagine a group of 7 people. Anne is friends with Bob and Charles. Bob is friends with Anne and Deborah. Charles is friends with Anne and Emily. Deborah is friends with Bob and Mary. Emily is friends with Charles and Kelly. Mary is friends with Deborah. Kelly is friends with Emily. From Emily, what is the shortest path to Charles? Starting from Emily, please only list the people's names in order, including Emily, separated by commas. Answer: ['Emily', 'Charles'] Imagine a group of 15 people. Anne is friends with Bob, Charles, Deborah and Emily. Bob is friends with Anne, Charles, Deborah and Emily. Charles is friends with Anne, Bob, Deborah and Emily. Deborah is friends with Anne, Bob, Charles and Mary. Emily is friends with Anne, Bob, Charles and Ned. Mary is friends with Deborah, Kelly, Sam and John. Kelly is friends with Mary, Sam, John and George. Sam is friends with Mary, Kelly, John and George. John is friends with Mary, Kelly, Sam and George. George is friends with Kelly, Sam, John and Fred. Fred is friends with George, Harrison, Isabelle and Lauren. Harrison is friends with Fred, Isabelle, Lauren and Ned. Isabelle is friends with Fred, Harrison, Lauren and Ned. Lauren is friends with Fred, Harrison, Isabelle and Ned. Ned is friends with Harrison, Isabelle, Lauren and Emily. From Isabelle, what is the shortest path to Kelly? Starting from Isabelle, please only list the people's names in order, including Isabelle, separated by commas. Answer: ", "Lexical Prime Question Answer": ["Isabelle", "Fred", "George", "Kelly"], "Structural Prime Question": "Imagine a home with 15 rooms. Room 1 is connected to Room 2, Room 3, Room 4 and Room 5. Room 2 is connected to Room 1, Room 3, Room 4 and Room 5. Room 3 is connected to Room 1, Room 2, Room 4 and Room 5. Room 4 is connected to Room 1, Room 2, Room 3 and Room 6. Room 5 is connected to Room 1, Room 2, Room 3 and Room 15. Room 6 is connected to Room 4, Room 7, Room 8 and Room 9. Room 7 is connected to Room 6, Room 8, Room 9 and Room 10. Room 8 is connected to Room 6, Room 7, Room 9 and Room 10. Room 9 is connected to Room 6, Room 7, Room 8 and Room 10. Room 10 is connected to Room 7, Room 8, Room 9 and Room 11. Room 11 is connected to Room 10, Room 12, Room 13 and Room 14. Room 12 is connected to Room 11, Room 13, Room 14 and Room 15. Room 13 is connected to Room 11, Room 12, Room 14 and Room 15. Room 14 is connected to Room 11, Room 12, Room 13 and Room 15. Room 15 is connected to Room 12, Room 13, Room 14 and Room 5. From room 1, what is the shortest path to room 14? Starting from room 1, please only list the room numbers in order, including room 1, separated by commas. Answer: ['1', '5', '15', '14'] Imagine a group of 15 people. Anne is friends with Bob, Charles, Deborah and Emily. Bob is friends with Anne, Charles, Deborah and Emily. Charles is friends with Anne, Bob, Deborah and Emily. Deborah is friends with Anne, Bob, Charles and Mary. Emily is friends with Anne, Bob, Charles and Ned. Mary is friends with Deborah, Kelly, Sam and John. Kelly is friends with Mary, Sam, John and George. Sam is friends with Mary, Kelly, John and George. John is friends with Mary, Kelly, Sam and George. George is friends with Kelly, Sam, John and Fred. Fred is friends with George, Harrison, Isabelle and Lauren. Harrison is friends with Fred, Isabelle, Lauren and Ned. Isabelle is friends with Fred, Harrison, Lauren and Ned. Lauren is friends with Fred, Harrison, Isabelle and Ned. Ned is friends with Harrison, Isabelle, Lauren and Emily. From Isabelle, what is the shortest path to Kelly? Starting from Isabelle, please only list the people's names in order, including Isabelle, separated by commas. Answer: ", "Structural Prime Question Answer": ["Isabelle", "Fred", "George", "Kelly"]}
{"Graph": "n15star_friends", "Description": "Imagine a group of 15 people. Anne is friends with Bob, Charles, Deborah and Emily. Bob is friends with Anne, Charles, Deborah and Emily. Charles is friends with Anne, Bob, Deborah and Emily. Deborah is friends with Anne, Bob, Charles and Mary. Emily is friends with Anne, Bob, Charles and Ned. Mary is friends with Deborah, Kelly, Sam and John. Kelly is friends with Mary, Sam, John and George. Sam is friends with Mary, Kelly, John and George. John is friends with Mary, Kelly, Sam and George. George is friends with Kelly, Sam, John and Fred. Fred is friends with George, Harrison, Isabelle and Lauren. Harrison is friends with Fred, Isabelle, Lauren and Ned. Isabelle is friends with Fred, Harrison, Lauren and Ned. Lauren is friends with Fred, Harrison, Isabelle and Ned. Ned is friends with Harrison, Isabelle, Lauren and Emily.", "No Prime Question": "From Mary, what is the shortest path to Lauren? Starting from Mary, please only list the people's names in order, including Mary, separated by commas. Answer: ", "No Prime Question Answer": ["Mary", "Kelly", "George", "Fred", "Lauren"], "Both Prime Question": "Imagine a group of 15 people. Anne is friends with Bob, Charles, Deborah and Emily. Bob is friends with Anne, Charles, Deborah and Emily. Charles is friends with Anne, Bob, Deborah and Emily. Deborah is friends with Anne, Bob, Charles and Mary. Emily is friends with Anne, Bob, Charles and Ned. Mary is friends with Deborah, Kelly, Sam and John. Kelly is friends with Mary, Sam, John and George. Sam is friends with Mary, Kelly, John and George. John is friends with Mary, Kelly, Sam and George. George is friends with Kelly, Sam, John and Fred. Fred is friends with George, Harrison, Isabelle and Lauren. Harrison is friends with Fred, Isabelle, Lauren and Ned. Isabelle is friends with Fred, Harrison, Lauren and Ned. Lauren is friends with Fred, Harrison, Isabelle and Ned. Ned is friends with Harrison, Isabelle, Lauren and Emily. From Deborah, what is the shortest path to George? Starting from Deborah, please only list the people's names in order, including Deborah, separated by commas. Answer: ['Deborah', 'Mary', 'Kelly', 'George'] From Mary, what is the shortest path to Lauren? Starting from Mary, please only list the people's names in order, including Mary, separated by commas. Answer: ", "Both Prime Question Answer": ["Mary", "Kelly", "George", "Fred", "Lauren"], "Lexical Prime Question": "Imagine a group of 13 people. Anne is friends with Bob and Charles. Bob is friends with Anne and Deborah. Charles is friends with Anne and Emily. Deborah is friends with Bob and Mary. Emily is friends with Charles and Kelly. Mary is friends with Deborah and Sam. Kelly is friends with Emily and John. Sam is friends with Mary and George. John is friends with Kelly and Fred. George is friends with Sam and Harrison. Fred is friends with John and Isabelle. Harrison is friends with George. Isabelle is friends with Fred. From Mary, what is the shortest path to Deborah? Starting from Mary, please only list the people's names in order, including Mary, separated by commas. Answer: ['Mary', 'Deborah'] Imagine a group of 15 people. Anne is friends with Bob, Charles, Deborah and Emily. Bob is friends with Anne, Charles, Deborah and Emily. Charles is friends with Anne, Bob, Deborah and Emily. Deborah is friends with Anne, Bob, Charles and Mary. Emily is friends with Anne, Bob, Charles and Ned. Mary is friends with Deborah, Kelly, Sam and John. Kelly is friends with Mary, Sam, John and George. Sam is friends with Mary, Kelly, John and George. John is friends with Mary, Kelly, Sam and George. George is friends with Kelly, Sam, John and Fred. Fred is friends with George, Harrison, Isabelle and Lauren. Harrison is friends with Fred, Isabelle, Lauren and Ned. Isabelle is friends with Fred, Harrison, Lauren and Ned. Lauren is friends with Fred, Harrison, Isabelle and Ned. Ned is friends with Harrison, Isabelle, Lauren and Emily. From Mary, what is the shortest path to Lauren? Starting from Mary, please only list the people's names in order, including Mary, separated by commas. Answer: ", "Lexical Prime Question Answer": ["Mary", "Kelly", "George", "Fred", "Lauren"], "Structural Prime Question": "Imagine a home with 15 rooms. Room 1 is connected to Room 2, Room 3, Room 4 and Room 5. Room 2 is connected to Room 1, Room 3, Room 4 and Room 5. Room 3 is connected to Room 1, Room 2, Room 4 and Room 5. Room 4 is connected to Room 1, Room 2, Room 3 and Room 6. Room 5 is connected to Room 1, Room 2, Room 3 and Room 15. Room 6 is connected to Room 4, Room 7, Room 8 and Room 9. Room 7 is connected to Room 6, Room 8, Room 9 and Room 10. Room 8 is connected to Room 6, Room 7, Room 9 and Room 10. Room 9 is connected to Room 6, Room 7, Room 8 and Room 10. Room 10 is connected to Room 7, Room 8, Room 9 and Room 11. Room 11 is connected to Room 10, Room 12, Room 13 and Room 14. Room 12 is connected to Room 11, Room 13, Room 14 and Room 15. Room 13 is connected to Room 11, Room 12, Room 14 and Room 15. Room 14 is connected to Room 11, Room 12, Room 13 and Room 15. Room 15 is connected to Room 12, Room 13, Room 14 and Room 5. From room 15, what is the shortest path to room 5? Starting from room 15, please only list the room numbers in order, including room 15, separated by commas. Answer: ['15', '5'] Imagine a group of 15 people. Anne is friends with Bob, Charles, Deborah and Emily. Bob is friends with Anne, Charles, Deborah and Emily. Charles is friends with Anne, Bob, Deborah and Emily. Deborah is friends with Anne, Bob, Charles and Mary. Emily is friends with Anne, Bob, Charles and Ned. Mary is friends with Deborah, Kelly, Sam and John. Kelly is friends with Mary, Sam, John and George. Sam is friends with Mary, Kelly, John and George. John is friends with Mary, Kelly, Sam and George. George is friends with Kelly, Sam, John and Fred. Fred is friends with George, Harrison, Isabelle and Lauren. Harrison is friends with Fred, Isabelle, Lauren and Ned. Isabelle is friends with Fred, Harrison, Lauren and Ned. Lauren is friends with Fred, Harrison, Isabelle and Ned. Ned is friends with Harrison, Isabelle, Lauren and Emily. From Mary, what is the shortest path to Lauren? Starting from Mary, please only list the people's names in order, including Mary, separated by commas. Answer: ", "Structural Prime Question Answer": ["Mary", "Kelly", "George", "Fred", "Lauren"]}
{"Graph": "n15star_friends", "Description": "Imagine a group of 15 people. Anne is friends with Bob, Charles, Deborah and Emily. Bob is friends with Anne, Charles, Deborah and Emily. Charles is friends with Anne, Bob, Deborah and Emily. Deborah is friends with Anne, Bob, Charles and Mary. Emily is friends with Anne, Bob, Charles and Ned. Mary is friends with Deborah, Kelly, Sam and John. Kelly is friends with Mary, Sam, John and George. Sam is friends with Mary, Kelly, John and George. John is friends with Mary, Kelly, Sam and George. George is friends with Kelly, Sam, John and Fred. Fred is friends with George, Harrison, Isabelle and Lauren. Harrison is friends with Fred, Isabelle, Lauren and Ned. Isabelle is friends with Fred, Harrison, Lauren and Ned. Lauren is friends with Fred, Harrison, Isabelle and Ned. Ned is friends with Harrison, Isabelle, Lauren and Emily.", "No Prime Question": "From Harrison, what is the shortest path to Isabelle? Starting from Harrison, please only list the people's names in order, including Harrison, separated by commas. Answer: ", "No Prime Question Answer": ["Harrison", "Isabelle"], "Both Prime Question": "Imagine a group of 15 people. Anne is friends with Bob, Charles, Deborah and Emily. Bob is friends with Anne, Charles, Deborah and Emily. Charles is friends with Anne, Bob, Deborah and Emily. Deborah is friends with Anne, Bob, Charles and Mary. Emily is friends with Anne, Bob, Charles and Ned. Mary is friends with Deborah, Kelly, Sam and John. Kelly is friends with Mary, Sam, John and George. Sam is friends with Mary, Kelly, John and George. John is friends with Mary, Kelly, Sam and George. George is friends with Kelly, Sam, John and Fred. Fred is friends with George, Harrison, Isabelle and Lauren. Harrison is friends with Fred, Isabelle, Lauren and Ned. Isabelle is friends with Fred, Harrison, Lauren and Ned. Lauren is friends with Fred, Harrison, Isabelle and Ned. Ned is friends with Harrison, Isabelle, Lauren and Emily. From Anne, what is the shortest path to Ned? Starting from Anne, please only list the people's names in order, including Anne, separated by commas. Answer: ['Anne', 'Emily', 'Ned'] From Harrison, what is the shortest path to Isabelle? Starting from Harrison, please only list the people's names in order, including Harrison, separated by commas. Answer: ", "Both Prime Question Answer": ["Harrison", "Isabelle"], "Lexical Prime Question": "Imagine a group of 7 people. Anne is friends with Bob and Charles. Bob is friends with Anne, Deborah and Emily. Charles is friends with Anne, Mary and Kelly. Deborah is friends with Bob. Emily is friends with Bob. Mary is friends with Charles. Kelly is friends with Charles. From Emily, what is the shortest path to Anne? Starting from Emily, please only list the people's names in order, including Emily, separated by commas. Answer: ['Emily', 'Bob', 'Anne'] Imagine a group of 15 people. Anne is friends with Bob, Charles, Deborah and Emily. Bob is friends with Anne, Charles, Deborah and Emily. Charles is friends with Anne, Bob, Deborah and Emily. Deborah is friends with Anne, Bob, Charles and Mary. Emily is friends with Anne, Bob, Charles and Ned. Mary is friends with Deborah, Kelly, Sam and John. Kelly is friends with Mary, Sam, John and George. Sam is friends with Mary, Kelly, John and George. John is friends with Mary, Kelly, Sam and George. George is friends with Kelly, Sam, John and Fred. Fred is friends with George, Harrison, Isabelle and Lauren. Harrison is friends with Fred, Isabelle, Lauren and Ned. Isabelle is friends with Fred, Harrison, Lauren and Ned. Lauren is friends with Fred, Harrison, Isabelle and Ned. Ned is friends with Harrison, Isabelle, Lauren and Emily. From Harrison, what is the shortest path to Isabelle? Starting from Harrison, please only list the people's names in order, including Harrison, separated by commas. Answer: ", "Lexical Prime Question Answer": ["Harrison", "Isabelle"], "Structural Prime Question": "Imagine a garden with 15 sections of flowers. The rose section is connected to the tulip section, the lavender section, the sunflower section and the daffodil section. The tulip section is connected to the rose section, the lavender section, the sunflower section and the daffodil section. The lavender section is connected to the rose section, the tulip section, the sunflower section and the daffodil section. The sunflower section is connected to the rose section, the tulip section, the lavender section and the peony section. The daffodil section is connected to the rose section, the tulip section, the lavender section and the hyacinth section. The peony section is connected to the sunflower section, the geranium section, the carnation section and the daisy section. The geranium section is connected to the peony section, the carnation section, the daisy section and the orchid section. The carnation section is connected to the peony section, the geranium section, the daisy section and the orchid section. The daisy section is connected to the peony section, the geranium section, the carnation section and the orchid section. The orchid section is connected to the geranium section, the carnation section, the daisy section and the iris section. The iris section is connected to the orchid section, the poppy section, the marigold section and the lily section. The poppy section is connected to the iris section, the marigold section, the lily section and the hyacinth section. The marigold section is connected to the iris section, the poppy section, the lily section and the hyacinth section. The lily section is connected to the iris section, the poppy section, the marigold section and the hyacinth section. The hyacinth section is connected to the poppy section, the marigold section, the lily section and the daffodil section. From the marigold section, what is the shortest path to the rose section? Starting from marigold, please only list the flower names in order, including marigold, separated by commas. Answer: ['Marigold', 'Hyacinth', 'Daffodil', 'Rose'] Imagine a group of 15 people. Anne is friends with Bob, Charles, Deborah and Emily. Bob is friends with Anne, Charles, Deborah and Emily. Charles is friends with Anne, Bob, Deborah and Emily. Deborah is friends with Anne, Bob, Charles and Mary. Emily is friends with Anne, Bob, Charles and Ned. Mary is friends with Deborah, Kelly, Sam and John. Kelly is friends with Mary, Sam, John and George. Sam is friends with Mary, Kelly, John and George. John is friends with Mary, Kelly, Sam and George. George is friends with Kelly, Sam, John and Fred. Fred is friends with George, Harrison, Isabelle and Lauren. Harrison is friends with Fred, Isabelle, Lauren and Ned. Isabelle is friends with Fred, Harrison, Lauren and Ned. Lauren is friends with Fred, Harrison, Isabelle and Ned. Ned is friends with Harrison, Isabelle, Lauren and Emily. From Harrison, what is the shortest path to Isabelle? Starting from Harrison, please only list the people's names in order, including Harrison, separated by commas. Answer: ", "Structural Prime Question Answer": ["Harrison", "Isabelle"]}
{"Graph": "n15star_friends", "Description": "Imagine a group of 15 people. Anne is friends with Bob, Charles, Deborah and Emily. Bob is friends with Anne, Charles, Deborah and Emily. Charles is friends with Anne, Bob, Deborah and Emily. Deborah is friends with Anne, Bob, Charles and Mary. Emily is friends with Anne, Bob, Charles and Ned. Mary is friends with Deborah, Kelly, Sam and John. Kelly is friends with Mary, Sam, John and George. Sam is friends with Mary, Kelly, John and George. John is friends with Mary, Kelly, Sam and George. George is friends with Kelly, Sam, John and Fred. Fred is friends with George, Harrison, Isabelle and Lauren. Harrison is friends with Fred, Isabelle, Lauren and Ned. Isabelle is friends with Fred, Harrison, Lauren and Ned. Lauren is friends with Fred, Harrison, Isabelle and Ned. Ned is friends with Harrison, Isabelle, Lauren and Emily.", "No Prime Question": "From Bob, what is the shortest path to John? Starting from Bob, please only list the people's names in order, including Bob, separated by commas. Answer: ", "No Prime Question Answer": ["Bob", "Deborah", "Mary", "John"], "Both Prime Question": "Imagine a group of 15 people. Anne is friends with Bob, Charles, Deborah and Emily. Bob is friends with Anne, Charles, Deborah and Emily. Charles is friends with Anne, Bob, Deborah and Emily. Deborah is friends with Anne, Bob, Charles and Mary. Emily is friends with Anne, Bob, Charles and Ned. Mary is friends with Deborah, Kelly, Sam and John. Kelly is friends with Mary, Sam, John and George. Sam is friends with Mary, Kelly, John and George. John is friends with Mary, Kelly, Sam and George. George is friends with Kelly, Sam, John and Fred. Fred is friends with George, Harrison, Isabelle and Lauren. Harrison is friends with Fred, Isabelle, Lauren and Ned. Isabelle is friends with Fred, Harrison, Lauren and Ned. Lauren is friends with Fred, Harrison, Isabelle and Ned. Ned is friends with Harrison, Isabelle, Lauren and Emily. From Deborah, what is the shortest path to Lauren? Starting from Deborah, please only list the people's names in order, including Deborah, separated by commas. Answer: ['Deborah', 'Anne', 'Emily', 'Ned', 'Lauren'] From Bob, what is the shortest path to John? Starting from Bob, please only list the people's names in order, including Bob, separated by commas. Answer: ", "Both Prime Question Answer": ["Bob", "Deborah", "Mary", "John"], "Lexical Prime Question": "Imagine a group of 13 people. Anne is friends with Bob and Charles. Bob is friends with Anne and Deborah. Charles is friends with Anne and Emily. Deborah is friends with Bob and Mary. Emily is friends with Charles and Kelly. Mary is friends with Deborah and Sam. Kelly is friends with Emily and John. Sam is friends with Mary and George. John is friends with Kelly and Fred. George is friends with Sam and Harrison. Fred is friends with John and Isabelle. Harrison is friends with George. Isabelle is friends with Fred. From Emily, what is the shortest path to Charles? Starting from Emily, please only list the people's names in order, including Emily, separated by commas. Answer: ['Emily', 'Charles'] Imagine a group of 15 people. Anne is friends with Bob, Charles, Deborah and Emily. Bob is friends with Anne, Charles, Deborah and Emily. Charles is friends with Anne, Bob, Deborah and Emily. Deborah is friends with Anne, Bob, Charles and Mary. Emily is friends with Anne, Bob, Charles and Ned. Mary is friends with Deborah, Kelly, Sam and John. Kelly is friends with Mary, Sam, John and George. Sam is friends with Mary, Kelly, John and George. John is friends with Mary, Kelly, Sam and George. George is friends with Kelly, Sam, John and Fred. Fred is friends with George, Harrison, Isabelle and Lauren. Harrison is friends with Fred, Isabelle, Lauren and Ned. Isabelle is friends with Fred, Harrison, Lauren and Ned. Lauren is friends with Fred, Harrison, Isabelle and Ned. Ned is friends with Harrison, Isabelle, Lauren and Emily. From Bob, what is the shortest path to John? Starting from Bob, please only list the people's names in order, including Bob, separated by commas. Answer: ", "Lexical Prime Question Answer": ["Bob", "Deborah", "Mary", "John"], "Structural Prime Question": "Imagine a home with 15 rooms. Room 1 is connected to Room 2, Room 3, Room 4 and Room 5. Room 2 is connected to Room 1, Room 3, Room 4 and Room 5. Room 3 is connected to Room 1, Room 2, Room 4 and Room 5. Room 4 is connected to Room 1, Room 2, Room 3 and Room 6. Room 5 is connected to Room 1, Room 2, Room 3 and Room 15. Room 6 is connected to Room 4, Room 7, Room 8 and Room 9. Room 7 is connected to Room 6, Room 8, Room 9 and Room 10. Room 8 is connected to Room 6, Room 7, Room 9 and Room 10. Room 9 is connected to Room 6, Room 7, Room 8 and Room 10. Room 10 is connected to Room 7, Room 8, Room 9 and Room 11. Room 11 is connected to Room 10, Room 12, Room 13 and Room 14. Room 12 is connected to Room 11, Room 13, Room 14 and Room 15. Room 13 is connected to Room 11, Room 12, Room 14 and Room 15. Room 14 is connected to Room 11, Room 12, Room 13 and Room 15. Room 15 is connected to Room 12, Room 13, Room 14 and Room 5. From room 14, what is the shortest path to room 3? Starting from room 14, please only list the room numbers in order, including room 14, separated by commas. Answer: ['14', '15', '5', '3'] Imagine a group of 15 people. Anne is friends with Bob, Charles, Deborah and Emily. Bob is friends with Anne, Charles, Deborah and Emily. Charles is friends with Anne, Bob, Deborah and Emily. Deborah is friends with Anne, Bob, Charles and Mary. Emily is friends with Anne, Bob, Charles and Ned. Mary is friends with Deborah, Kelly, Sam and John. Kelly is friends with Mary, Sam, John and George. Sam is friends with Mary, Kelly, John and George. John is friends with Mary, Kelly, Sam and George. George is friends with Kelly, Sam, John and Fred. Fred is friends with George, Harrison, Isabelle and Lauren. Harrison is friends with Fred, Isabelle, Lauren and Ned. Isabelle is friends with Fred, Harrison, Lauren and Ned. Lauren is friends with Fred, Harrison, Isabelle and Ned. Ned is friends with Harrison, Isabelle, Lauren and Emily. From Bob, what is the shortest path to John? Starting from Bob, please only list the people's names in order, including Bob, separated by commas. Answer: ", "Structural Prime Question Answer": ["Bob", "Deborah", "Mary", "John"]}
{"Graph": "n15star_friends", "Description": "Imagine a group of 15 people. Anne is friends with Bob, Charles, Deborah and Emily. Bob is friends with Anne, Charles, Deborah and Emily. Charles is friends with Anne, Bob, Deborah and Emily. Deborah is friends with Anne, Bob, Charles and Mary. Emily is friends with Anne, Bob, Charles and Ned. Mary is friends with Deborah, Kelly, Sam and John. Kelly is friends with Mary, Sam, John and George. Sam is friends with Mary, Kelly, John and George. John is friends with Mary, Kelly, Sam and George. George is friends with Kelly, Sam, John and Fred. Fred is friends with George, Harrison, Isabelle and Lauren. Harrison is friends with Fred, Isabelle, Lauren and Ned. Isabelle is friends with Fred, Harrison, Lauren and Ned. Lauren is friends with Fred, Harrison, Isabelle and Ned. Ned is friends with Harrison, Isabelle, Lauren and Emily.", "No Prime Question": "From Fred, what is the shortest path to Mary? Starting from Fred, please only list the people's names in order, including Fred, separated by commas. Answer: ", "No Prime Question Answer": ["Fred", "George", "Kelly", "Mary"], "Both Prime Question": "Imagine a group of 15 people. Anne is friends with Bob, Charles, Deborah and Emily. Bob is friends with Anne, Charles, Deborah and Emily. Charles is friends with Anne, Bob, Deborah and Emily. Deborah is friends with Anne, Bob, Charles and Mary. Emily is friends with Anne, Bob, Charles and Ned. Mary is friends with Deborah, Kelly, Sam and John. Kelly is friends with Mary, Sam, John and George. Sam is friends with Mary, Kelly, John and George. John is friends with Mary, Kelly, Sam and George. George is friends with Kelly, Sam, John and Fred. Fred is friends with George, Harrison, Isabelle and Lauren. Harrison is friends with Fred, Isabelle, Lauren and Ned. Isabelle is friends with Fred, Harrison, Lauren and Ned. Lauren is friends with Fred, Harrison, Isabelle and Ned. Ned is friends with Harrison, Isabelle, Lauren and Emily. From Charles, what is the shortest path to Deborah? Starting from Charles, please only list the people's names in order, including Charles, separated by commas. Answer: ['Charles', 'Deborah'] From Fred, what is the shortest path to Mary? Starting from Fred, please only list the people's names in order, including Fred, separated by commas. Answer: ", "Both Prime Question Answer": ["Fred", "George", "Kelly", "Mary"], "Lexical Prime Question": "Imagine a group of 7 people. Anne is friends with Bob and Charles. Bob is friends with Anne and Deborah. Charles is friends with Anne and Emily. Deborah is friends with Bob and Mary. Emily is friends with Charles and Kelly. Mary is friends with Deborah. Kelly is friends with Emily. From Charles, what is the shortest path to Mary? Starting from Charles, please only list the people's names in order, including Charles, separated by commas. Answer: ['Charles', 'Anne', 'Bob', 'Deborah', 'Mary'] Imagine a group of 15 people. Anne is friends with Bob, Charles, Deborah and Emily. Bob is friends with Anne, Charles, Deborah and Emily. Charles is friends with Anne, Bob, Deborah and Emily. Deborah is friends with Anne, Bob, Charles and Mary. Emily is friends with Anne, Bob, Charles and Ned. Mary is friends with Deborah, Kelly, Sam and John. Kelly is friends with Mary, Sam, John and George. Sam is friends with Mary, Kelly, John and George. John is friends with Mary, Kelly, Sam and George. George is friends with Kelly, Sam, John and Fred. Fred is friends with George, Harrison, Isabelle and Lauren. Harrison is friends with Fred, Isabelle, Lauren and Ned. Isabelle is friends with Fred, Harrison, Lauren and Ned. Lauren is friends with Fred, Harrison, Isabelle and Ned. Ned is friends with Harrison, Isabelle, Lauren and Emily. From Fred, what is the shortest path to Mary? Starting from Fred, please only list the people's names in order, including Fred, separated by commas. Answer: ", "Lexical Prime Question Answer": ["Fred", "George", "Kelly", "Mary"], "Structural Prime Question": "Imagine a garden with 15 sections of flowers. The rose section is connected to the tulip section, the lavender section, the sunflower section and the daffodil section. The tulip section is connected to the rose section, the lavender section, the sunflower section and the daffodil section. The lavender section is connected to the rose section, the tulip section, the sunflower section and the daffodil section. The sunflower section is connected to the rose section, the tulip section, the lavender section and the peony section. The daffodil section is connected to the rose section, the tulip section, the lavender section and the hyacinth section. The peony section is connected to the sunflower section, the geranium section, the carnation section and the daisy section. The geranium section is connected to the peony section, the carnation section, the daisy section and the orchid section. The carnation section is connected to the peony section, the geranium section, the daisy section and the orchid section. The daisy section is connected to the peony section, the geranium section, the carnation section and the orchid section. The orchid section is connected to the geranium section, the carnation section, the daisy section and the iris section. The iris section is connected to the orchid section, the poppy section, the marigold section and the lily section. The poppy section is connected to the iris section, the marigold section, the lily section and the hyacinth section. The marigold section is connected to the iris section, the poppy section, the lily section and the hyacinth section. The lily section is connected to the iris section, the poppy section, the marigold section and the hyacinth section. The hyacinth section is connected to the poppy section, the marigold section, the lily section and the daffodil section. From the lavender section, what is the shortest path to the rose section? Starting from lavender, please only list the flower names in order, including lavender, separated by commas. Answer: ['Lavender', 'Rose'] Imagine a group of 15 people. Anne is friends with Bob, Charles, Deborah and Emily. Bob is friends with Anne, Charles, Deborah and Emily. Charles is friends with Anne, Bob, Deborah and Emily. Deborah is friends with Anne, Bob, Charles and Mary. Emily is friends with Anne, Bob, Charles and Ned. Mary is friends with Deborah, Kelly, Sam and John. Kelly is friends with Mary, Sam, John and George. Sam is friends with Mary, Kelly, John and George. John is friends with Mary, Kelly, Sam and George. George is friends with Kelly, Sam, John and Fred. Fred is friends with George, Harrison, Isabelle and Lauren. Harrison is friends with Fred, Isabelle, Lauren and Ned. Isabelle is friends with Fred, Harrison, Lauren and Ned. Lauren is friends with Fred, Harrison, Isabelle and Ned. Ned is friends with Harrison, Isabelle, Lauren and Emily. From Fred, what is the shortest path to Mary? Starting from Fred, please only list the people's names in order, including Fred, separated by commas. Answer: ", "Structural Prime Question Answer": ["Fred", "George", "Kelly", "Mary"]}
{"Graph": "n15star_friends", "Description": "Imagine a group of 15 people. Anne is friends with Bob, Charles, Deborah and Emily. Bob is friends with Anne, Charles, Deborah and Emily. Charles is friends with Anne, Bob, Deborah and Emily. Deborah is friends with Anne, Bob, Charles and Mary. Emily is friends with Anne, Bob, Charles and Ned. Mary is friends with Deborah, Kelly, Sam and John. Kelly is friends with Mary, Sam, John and George. Sam is friends with Mary, Kelly, John and George. John is friends with Mary, Kelly, Sam and George. George is friends with Kelly, Sam, John and Fred. Fred is friends with George, Harrison, Isabelle and Lauren. Harrison is friends with Fred, Isabelle, Lauren and Ned. Isabelle is friends with Fred, Harrison, Lauren and Ned. Lauren is friends with Fred, Harrison, Isabelle and Ned. Ned is friends with Harrison, Isabelle, Lauren and Emily.", "No Prime Question": "From Emily, what is the shortest path to John? Starting from Emily, please only list the people's names in order, including Emily, separated by commas. Answer: ", "No Prime Question Answer": ["Emily", "Anne", "Deborah", "Mary", "John"], "Both Prime Question": "Imagine a group of 15 people. Anne is friends with Bob, Charles, Deborah and Emily. Bob is friends with Anne, Charles, Deborah and Emily. Charles is friends with Anne, Bob, Deborah and Emily. Deborah is friends with Anne, Bob, Charles and Mary. Emily is friends with Anne, Bob, Charles and Ned. Mary is friends with Deborah, Kelly, Sam and John. Kelly is friends with Mary, Sam, John and George. Sam is friends with Mary, Kelly, John and George. John is friends with Mary, Kelly, Sam and George. George is friends with Kelly, Sam, John and Fred. Fred is friends with George, Harrison, Isabelle and Lauren. Harrison is friends with Fred, Isabelle, Lauren and Ned. Isabelle is friends with Fred, Harrison, Lauren and Ned. Lauren is friends with Fred, Harrison, Isabelle and Ned. Ned is friends with Harrison, Isabelle, Lauren and Emily. From Kelly, what is the shortest path to Sam? Starting from Kelly, please only list the people's names in order, including Kelly, separated by commas. Answer: ['Kelly', 'Sam'] From Emily, what is the shortest path to John? Starting from Emily, please only list the people's names in order, including Emily, separated by commas. Answer: ", "Both Prime Question Answer": ["Emily", "Anne", "Deborah", "Mary", "John"], "Lexical Prime Question": "Imagine a group of 13 people. Anne is friends with Bob and Charles. Bob is friends with Anne and Deborah. Charles is friends with Anne and Emily. Deborah is friends with Bob and Mary. Emily is friends with Charles and Kelly. Mary is friends with Deborah and Sam. Kelly is friends with Emily and John. Sam is friends with Mary and George. John is friends with Kelly and Fred. George is friends with Sam and Harrison. Fred is friends with John and Isabelle. Harrison is friends with George. Isabelle is friends with Fred. From Bob, what is the shortest path to George? Starting from Bob, please only list the people's names in order, including Bob, separated by commas. Answer: ['Bob', 'Deborah', 'Mary', 'Sam', 'George'] Imagine a group of 15 people. Anne is friends with Bob, Charles, Deborah and Emily. Bob is friends with Anne, Charles, Deborah and Emily. Charles is friends with Anne, Bob, Deborah and Emily. Deborah is friends with Anne, Bob, Charles and Mary. Emily is friends with Anne, Bob, Charles and Ned. Mary is friends with Deborah, Kelly, Sam and John. Kelly is friends with Mary, Sam, John and George. Sam is friends with Mary, Kelly, John and George. John is friends with Mary, Kelly, Sam and George. George is friends with Kelly, Sam, John and Fred. Fred is friends with George, Harrison, Isabelle and Lauren. Harrison is friends with Fred, Isabelle, Lauren and Ned. Isabelle is friends with Fred, Harrison, Lauren and Ned. Lauren is friends with Fred, Harrison, Isabelle and Ned. Ned is friends with Harrison, Isabelle, Lauren and Emily. From Emily, what is the shortest path to John? Starting from Emily, please only list the people's names in order, including Emily, separated by commas. Answer: ", "Lexical Prime Question Answer": ["Emily", "Anne", "Deborah", "Mary", "John"], "Structural Prime Question": "Imagine a home with 15 rooms. Room 1 is connected to Room 2, Room 3, Room 4 and Room 5. Room 2 is connected to Room 1, Room 3, Room 4 and Room 5. Room 3 is connected to Room 1, Room 2, Room 4 and Room 5. Room 4 is connected to Room 1, Room 2, Room 3 and Room 6. Room 5 is connected to Room 1, Room 2, Room 3 and Room 15. Room 6 is connected to Room 4, Room 7, Room 8 and Room 9. Room 7 is connected to Room 6, Room 8, Room 9 and Room 10. Room 8 is connected to Room 6, Room 7, Room 9 and Room 10. Room 9 is connected to Room 6, Room 7, Room 8 and Room 10. Room 10 is connected to Room 7, Room 8, Room 9 and Room 11. Room 11 is connected to Room 10, Room 12, Room 13 and Room 14. Room 12 is connected to Room 11, Room 13, Room 14 and Room 15. Room 13 is connected to Room 11, Room 12, Room 14 and Room 15. Room 14 is connected to Room 11, Room 12, Room 13 and Room 15. Room 15 is connected to Room 12, Room 13, Room 14 and Room 5. From room 9, what is the shortest path to room 11? Starting from room 9, please only list the room numbers in order, including room 9, separated by commas. Answer: ['9', '10', '11'] Imagine a group of 15 people. Anne is friends with Bob, Charles, Deborah and Emily. Bob is friends with Anne, Charles, Deborah and Emily. Charles is friends with Anne, Bob, Deborah and Emily. Deborah is friends with Anne, Bob, Charles and Mary. Emily is friends with Anne, Bob, Charles and Ned. Mary is friends with Deborah, Kelly, Sam and John. Kelly is friends with Mary, Sam, John and George. Sam is friends with Mary, Kelly, John and George. John is friends with Mary, Kelly, Sam and George. George is friends with Kelly, Sam, John and Fred. Fred is friends with George, Harrison, Isabelle and Lauren. Harrison is friends with Fred, Isabelle, Lauren and Ned. Isabelle is friends with Fred, Harrison, Lauren and Ned. Lauren is friends with Fred, Harrison, Isabelle and Ned. Ned is friends with Harrison, Isabelle, Lauren and Emily. From Emily, what is the shortest path to John? Starting from Emily, please only list the people's names in order, including Emily, separated by commas. Answer: ", "Structural Prime Question Answer": ["Emily", "Anne", "Deborah", "Mary", "John"]}
{"Graph": "n15star_friends", "Description": "Imagine a group of 15 people. Anne is friends with Bob, Charles, Deborah and Emily. Bob is friends with Anne, Charles, Deborah and Emily. Charles is friends with Anne, Bob, Deborah and Emily. Deborah is friends with Anne, Bob, Charles and Mary. Emily is friends with Anne, Bob, Charles and Ned. Mary is friends with Deborah, Kelly, Sam and John. Kelly is friends with Mary, Sam, John and George. Sam is friends with Mary, Kelly, John and George. John is friends with Mary, Kelly, Sam and George. George is friends with Kelly, Sam, John and Fred. Fred is friends with George, Harrison, Isabelle and Lauren. Harrison is friends with Fred, Isabelle, Lauren and Ned. Isabelle is friends with Fred, Harrison, Lauren and Ned. Lauren is friends with Fred, Harrison, Isabelle and Ned. Ned is friends with Harrison, Isabelle, Lauren and Emily.", "No Prime Question": "From Bob, what is the shortest path to Fred? Starting from Bob, please only list the people's names in order, including Bob, separated by commas. Answer: ", "No Prime Question Answer": ["Bob", "Emily", "Ned", "Harrison", "Fred"], "Both Prime Question": "Imagine a group of 15 people. Anne is friends with Bob, Charles, Deborah and Emily. Bob is friends with Anne, Charles, Deborah and Emily. Charles is friends with Anne, Bob, Deborah and Emily. Deborah is friends with Anne, Bob, Charles and Mary. Emily is friends with Anne, Bob, Charles and Ned. Mary is friends with Deborah, Kelly, Sam and John. Kelly is friends with Mary, Sam, John and George. Sam is friends with Mary, Kelly, John and George. John is friends with Mary, Kelly, Sam and George. George is friends with Kelly, Sam, John and Fred. Fred is friends with George, Harrison, Isabelle and Lauren. Harrison is friends with Fred, Isabelle, Lauren and Ned. Isabelle is friends with Fred, Harrison, Lauren and Ned. Lauren is friends with Fred, Harrison, Isabelle and Ned. Ned is friends with Harrison, Isabelle, Lauren and Emily. From Isabelle, what is the shortest path to Lauren? Starting from Isabelle, please only list the people's names in order, including Isabelle, separated by commas. Answer: ['Isabelle', 'Lauren'] From Bob, what is the shortest path to Fred? Starting from Bob, please only list the people's names in order, including Bob, separated by commas. Answer: ", "Both Prime Question Answer": ["Bob", "Emily", "Ned", "Harrison", "Fred"], "Lexical Prime Question": "Imagine a group of 7 people. Anne is friends with Bob and Charles. Bob is friends with Anne and Deborah. Charles is friends with Anne and Emily. Deborah is friends with Bob and Mary. Emily is friends with Charles and Kelly. Mary is friends with Deborah. Kelly is friends with Emily. From Anne, what is the shortest path to Bob? Starting from Anne, please only list the people's names in order, including Anne, separated by commas. Answer: ['Anne', 'Bob'] Imagine a group of 15 people. Anne is friends with Bob, Charles, Deborah and Emily. Bob is friends with Anne, Charles, Deborah and Emily. Charles is friends with Anne, Bob, Deborah and Emily. Deborah is friends with Anne, Bob, Charles and Mary. Emily is friends with Anne, Bob, Charles and Ned. Mary is friends with Deborah, Kelly, Sam and John. Kelly is friends with Mary, Sam, John and George. Sam is friends with Mary, Kelly, John and George. John is friends with Mary, Kelly, Sam and George. George is friends with Kelly, Sam, John and Fred. Fred is friends with George, Harrison, Isabelle and Lauren. Harrison is friends with Fred, Isabelle, Lauren and Ned. Isabelle is friends with Fred, Harrison, Lauren and Ned. Lauren is friends with Fred, Harrison, Isabelle and Ned. Ned is friends with Harrison, Isabelle, Lauren and Emily. From Bob, what is the shortest path to Fred? Starting from Bob, please only list the people's names in order, including Bob, separated by commas. Answer: ", "Lexical Prime Question Answer": ["Bob", "Emily", "Ned", "Harrison", "Fred"], "Structural Prime Question": "Imagine a home with 15 rooms. Room 1 is connected to Room 2, Room 3, Room 4 and Room 5. Room 2 is connected to Room 1, Room 3, Room 4 and Room 5. Room 3 is connected to Room 1, Room 2, Room 4 and Room 5. Room 4 is connected to Room 1, Room 2, Room 3 and Room 6. Room 5 is connected to Room 1, Room 2, Room 3 and Room 15. Room 6 is connected to Room 4, Room 7, Room 8 and Room 9. Room 7 is connected to Room 6, Room 8, Room 9 and Room 10. Room 8 is connected to Room 6, Room 7, Room 9 and Room 10. Room 9 is connected to Room 6, Room 7, Room 8 and Room 10. Room 10 is connected to Room 7, Room 8, Room 9 and Room 11. Room 11 is connected to Room 10, Room 12, Room 13 and Room 14. Room 12 is connected to Room 11, Room 13, Room 14 and Room 15. Room 13 is connected to Room 11, Room 12, Room 14 and Room 15. Room 14 is connected to Room 11, Room 12, Room 13 and Room 15. Room 15 is connected to Room 12, Room 13, Room 14 and Room 5. From room 14, what is the shortest path to room 7? Starting from room 14, please only list the room numbers in order, including room 14, separated by commas. Answer: ['14', '11', '10', '7'] Imagine a group of 15 people. Anne is friends with Bob, Charles, Deborah and Emily. Bob is friends with Anne, Charles, Deborah and Emily. Charles is friends with Anne, Bob, Deborah and Emily. Deborah is friends with Anne, Bob, Charles and Mary. Emily is friends with Anne, Bob, Charles and Ned. Mary is friends with Deborah, Kelly, Sam and John. Kelly is friends with Mary, Sam, John and George. Sam is friends with Mary, Kelly, John and George. John is friends with Mary, Kelly, Sam and George. George is friends with Kelly, Sam, John and Fred. Fred is friends with George, Harrison, Isabelle and Lauren. Harrison is friends with Fred, Isabelle, Lauren and Ned. Isabelle is friends with Fred, Harrison, Lauren and Ned. Lauren is friends with Fred, Harrison, Isabelle and Ned. Ned is friends with Harrison, Isabelle, Lauren and Emily. From Bob, what is the shortest path to Fred? Starting from Bob, please only list the people's names in order, including Bob, separated by commas. Answer: ", "Structural Prime Question Answer": ["Bob", "Emily", "Ned", "Harrison", "Fred"]}
{"Graph": "n15star_friends", "Description": "Imagine a group of 15 people. Anne is friends with Bob, Charles, Deborah and Emily. Bob is friends with Anne, Charles, Deborah and Emily. Charles is friends with Anne, Bob, Deborah and Emily. Deborah is friends with Anne, Bob, Charles and Mary. Emily is friends with Anne, Bob, Charles and Ned. Mary is friends with Deborah, Kelly, Sam and John. Kelly is friends with Mary, Sam, John and George. Sam is friends with Mary, Kelly, John and George. John is friends with Mary, Kelly, Sam and George. George is friends with Kelly, Sam, John and Fred. Fred is friends with George, Harrison, Isabelle and Lauren. Harrison is friends with Fred, Isabelle, Lauren and Ned. Isabelle is friends with Fred, Harrison, Lauren and Ned. Lauren is friends with Fred, Harrison, Isabelle and Ned. Ned is friends with Harrison, Isabelle, Lauren and Emily.", "No Prime Question": "From John, what is the shortest path to Emily? Starting from John, please only list the people's names in order, including John, separated by commas. Answer: ", "No Prime Question Answer": ["John", "Mary", "Deborah", "Anne", "Emily"], "Both Prime Question": "Imagine a group of 15 people. Anne is friends with Bob, Charles, Deborah and Emily. Bob is friends with Anne, Charles, Deborah and Emily. Charles is friends with Anne, Bob, Deborah and Emily. Deborah is friends with Anne, Bob, Charles and Mary. Emily is friends with Anne, Bob, Charles and Ned. Mary is friends with Deborah, Kelly, Sam and John. Kelly is friends with Mary, Sam, John and George. Sam is friends with Mary, Kelly, John and George. John is friends with Mary, Kelly, Sam and George. George is friends with Kelly, Sam, John and Fred. Fred is friends with George, Harrison, Isabelle and Lauren. Harrison is friends with Fred, Isabelle, Lauren and Ned. Isabelle is friends with Fred, Harrison, Lauren and Ned. Lauren is friends with Fred, Harrison, Isabelle and Ned. Ned is friends with Harrison, Isabelle, Lauren and Emily. From Ned, what is the shortest path to Lauren? Starting from Ned, please only list the people's names in order, including Ned, separated by commas. Answer: ['Ned', 'Lauren'] From John, what is the shortest path to Emily? Starting from John, please only list the people's names in order, including John, separated by commas. Answer: ", "Both Prime Question Answer": ["John", "Mary", "Deborah", "Anne", "Emily"], "Lexical Prime Question": "Imagine a group of 7 people. Anne is friends with Bob and Charles. Bob is friends with Anne, Deborah and Emily. Charles is friends with Anne, Mary and Kelly. Deborah is friends with Bob. Emily is friends with Bob. Mary is friends with Charles. Kelly is friends with Charles. From Charles, what is the shortest path to Emily? Starting from Charles, please only list the people's names in order, including Charles, separated by commas. Answer: ['Charles', 'Anne', 'Bob', 'Emily'] Imagine a group of 15 people. Anne is friends with Bob, Charles, Deborah and Emily. Bob is friends with Anne, Charles, Deborah and Emily. Charles is friends with Anne, Bob, Deborah and Emily. Deborah is friends with Anne, Bob, Charles and Mary. Emily is friends with Anne, Bob, Charles and Ned. Mary is friends with Deborah, Kelly, Sam and John. Kelly is friends with Mary, Sam, John and George. Sam is friends with Mary, Kelly, John and George. John is friends with Mary, Kelly, Sam and George. George is friends with Kelly, Sam, John and Fred. Fred is friends with George, Harrison, Isabelle and Lauren. Harrison is friends with Fred, Isabelle, Lauren and Ned. Isabelle is friends with Fred, Harrison, Lauren and Ned. Lauren is friends with Fred, Harrison, Isabelle and Ned. Ned is friends with Harrison, Isabelle, Lauren and Emily. From John, what is the shortest path to Emily? Starting from John, please only list the people's names in order, including John, separated by commas. Answer: ", "Lexical Prime Question Answer": ["John", "Mary", "Deborah", "Anne", "Emily"], "Structural Prime Question": "Imagine a garden with 15 sections of flowers. The rose section is connected to the tulip section, the lavender section, the sunflower section and the daffodil section. The tulip section is connected to the rose section, the lavender section, the sunflower section and the daffodil section. The lavender section is connected to the rose section, the tulip section, the sunflower section and the daffodil section. The sunflower section is connected to the rose section, the tulip section, the lavender section and the peony section. The daffodil section is connected to the rose section, the tulip section, the lavender section and the hyacinth section. The peony section is connected to the sunflower section, the geranium section, the carnation section and the daisy section. The geranium section is connected to the peony section, the carnation section, the daisy section and the orchid section. The carnation section is connected to the peony section, the geranium section, the daisy section and the orchid section. The daisy section is connected to the peony section, the geranium section, the carnation section and the orchid section. The orchid section is connected to the geranium section, the carnation section, the daisy section and the iris section. The iris section is connected to the orchid section, the poppy section, the marigold section and the lily section. The poppy section is connected to the iris section, the marigold section, the lily section and the hyacinth section. The marigold section is connected to the iris section, the poppy section, the lily section and the hyacinth section. The lily section is connected to the iris section, the poppy section, the marigold section and the hyacinth section. The hyacinth section is connected to the poppy section, the marigold section, the lily section and the daffodil section. From the geranium section, what is the shortest path to the poppy section? Starting from geranium, please only list the flower names in order, including geranium, separated by commas. Answer: ['Geranium', 'Orchid', 'Iris', 'Poppy'] Imagine a group of 15 people. Anne is friends with Bob, Charles, Deborah and Emily. Bob is friends with Anne, Charles, Deborah and Emily. Charles is friends with Anne, Bob, Deborah and Emily. Deborah is friends with Anne, Bob, Charles and Mary. Emily is friends with Anne, Bob, Charles and Ned. Mary is friends with Deborah, Kelly, Sam and John. Kelly is friends with Mary, Sam, John and George. Sam is friends with Mary, Kelly, John and George. John is friends with Mary, Kelly, Sam and George. George is friends with Kelly, Sam, John and Fred. Fred is friends with George, Harrison, Isabelle and Lauren. Harrison is friends with Fred, Isabelle, Lauren and Ned. Isabelle is friends with Fred, Harrison, Lauren and Ned. Lauren is friends with Fred, Harrison, Isabelle and Ned. Ned is friends with Harrison, Isabelle, Lauren and Emily. From John, what is the shortest path to Emily? Starting from John, please only list the people's names in order, including John, separated by commas. Answer: ", "Structural Prime Question Answer": ["John", "Mary", "Deborah", "Anne", "Emily"]}
{"Graph": "n15star_friends", "Description": "Imagine a group of 15 people. Anne is friends with Bob, Charles, Deborah and Emily. Bob is friends with Anne, Charles, Deborah and Emily. Charles is friends with Anne, Bob, Deborah and Emily. Deborah is friends with Anne, Bob, Charles and Mary. Emily is friends with Anne, Bob, Charles and Ned. Mary is friends with Deborah, Kelly, Sam and John. Kelly is friends with Mary, Sam, John and George. Sam is friends with Mary, Kelly, John and George. John is friends with Mary, Kelly, Sam and George. George is friends with Kelly, Sam, John and Fred. Fred is friends with George, Harrison, Isabelle and Lauren. Harrison is friends with Fred, Isabelle, Lauren and Ned. Isabelle is friends with Fred, Harrison, Lauren and Ned. Lauren is friends with Fred, Harrison, Isabelle and Ned. Ned is friends with Harrison, Isabelle, Lauren and Emily.", "No Prime Question": "From Sam, what is the shortest path to Anne? Starting from Sam, please only list the people's names in order, including Sam, separated by commas. Answer: ", "No Prime Question Answer": ["Sam", "Mary", "Deborah", "Anne"], "Both Prime Question": "Imagine a group of 15 people. Anne is friends with Bob, Charles, Deborah and Emily. Bob is friends with Anne, Charles, Deborah and Emily. Charles is friends with Anne, Bob, Deborah and Emily. Deborah is friends with Anne, Bob, Charles and Mary. Emily is friends with Anne, Bob, Charles and Ned. Mary is friends with Deborah, Kelly, Sam and John. Kelly is friends with Mary, Sam, John and George. Sam is friends with Mary, Kelly, John and George. John is friends with Mary, Kelly, Sam and George. George is friends with Kelly, Sam, John and Fred. Fred is friends with George, Harrison, Isabelle and Lauren. Harrison is friends with Fred, Isabelle, Lauren and Ned. Isabelle is friends with Fred, Harrison, Lauren and Ned. Lauren is friends with Fred, Harrison, Isabelle and Ned. Ned is friends with Harrison, Isabelle, Lauren and Emily. From Kelly, what is the shortest path to Lauren? Starting from Kelly, please only list the people's names in order, including Kelly, separated by commas. Answer: ['Kelly', 'George', 'Fred', 'Lauren'] From Sam, what is the shortest path to Anne? Starting from Sam, please only list the people's names in order, including Sam, separated by commas. Answer: ", "Both Prime Question Answer": ["Sam", "Mary", "Deborah", "Anne"], "Lexical Prime Question": "Imagine a group of 13 people. Anne is friends with Bob and Charles. Bob is friends with Anne and Deborah. Charles is friends with Anne and Emily. Deborah is friends with Bob and Mary. Emily is friends with Charles and Kelly. Mary is friends with Deborah and Sam. Kelly is friends with Emily and John. Sam is friends with Mary and George. John is friends with Kelly and Fred. George is friends with Sam and Harrison. Fred is friends with John and Isabelle. Harrison is friends with George. Isabelle is friends with Fred. From Deborah, what is the shortest path to George? Starting from Deborah, please only list the people's names in order, including Deborah, separated by commas. Answer: ['Deborah', 'Mary', 'Sam', 'George'] Imagine a group of 15 people. Anne is friends with Bob, Charles, Deborah and Emily. Bob is friends with Anne, Charles, Deborah and Emily. Charles is friends with Anne, Bob, Deborah and Emily. Deborah is friends with Anne, Bob, Charles and Mary. Emily is friends with Anne, Bob, Charles and Ned. Mary is friends with Deborah, Kelly, Sam and John. Kelly is friends with Mary, Sam, John and George. Sam is friends with Mary, Kelly, John and George. John is friends with Mary, Kelly, Sam and George. George is friends with Kelly, Sam, John and Fred. Fred is friends with George, Harrison, Isabelle and Lauren. Harrison is friends with Fred, Isabelle, Lauren and Ned. Isabelle is friends with Fred, Harrison, Lauren and Ned. Lauren is friends with Fred, Harrison, Isabelle and Ned. Ned is friends with Harrison, Isabelle, Lauren and Emily. From Sam, what is the shortest path to Anne? Starting from Sam, please only list the people's names in order, including Sam, separated by commas. Answer: ", "Lexical Prime Question Answer": ["Sam", "Mary", "Deborah", "Anne"], "Structural Prime Question": "Imagine a garden with 15 sections of flowers. The rose section is connected to the tulip section, the lavender section, the sunflower section and the daffodil section. The tulip section is connected to the rose section, the lavender section, the sunflower section and the daffodil section. The lavender section is connected to the rose section, the tulip section, the sunflower section and the daffodil section. The sunflower section is connected to the rose section, the tulip section, the lavender section and the peony section. The daffodil section is connected to the rose section, the tulip section, the lavender section and the hyacinth section. The peony section is connected to the sunflower section, the geranium section, the carnation section and the daisy section. The geranium section is connected to the peony section, the carnation section, the daisy section and the orchid section. The carnation section is connected to the peony section, the geranium section, the daisy section and the orchid section. The daisy section is connected to the peony section, the geranium section, the carnation section and the orchid section. The orchid section is connected to the geranium section, the carnation section, the daisy section and the iris section. The iris section is connected to the orchid section, the poppy section, the marigold section and the lily section. The poppy section is connected to the iris section, the marigold section, the lily section and the hyacinth section. The marigold section is connected to the iris section, the poppy section, the lily section and the hyacinth section. The lily section is connected to the iris section, the poppy section, the marigold section and the hyacinth section. The hyacinth section is connected to the poppy section, the marigold section, the lily section and the daffodil section. From the lavender section, what is the shortest path to the carnation section? Starting from lavender, please only list the flower names in order, including lavender, separated by commas. Answer: ['Lavender', 'Sunflower', 'Peony', 'Carnation'] Imagine a group of 15 people. Anne is friends with Bob, Charles, Deborah and Emily. Bob is friends with Anne, Charles, Deborah and Emily. Charles is friends with Anne, Bob, Deborah and Emily. Deborah is friends with Anne, Bob, Charles and Mary. Emily is friends with Anne, Bob, Charles and Ned. Mary is friends with Deborah, Kelly, Sam and John. Kelly is friends with Mary, Sam, John and George. Sam is friends with Mary, Kelly, John and George. John is friends with Mary, Kelly, Sam and George. George is friends with Kelly, Sam, John and Fred. Fred is friends with George, Harrison, Isabelle and Lauren. Harrison is friends with Fred, Isabelle, Lauren and Ned. Isabelle is friends with Fred, Harrison, Lauren and Ned. Lauren is friends with Fred, Harrison, Isabelle and Ned. Ned is friends with Harrison, Isabelle, Lauren and Emily. From Sam, what is the shortest path to Anne? Starting from Sam, please only list the people's names in order, including Sam, separated by commas. Answer: ", "Structural Prime Question Answer": ["Sam", "Mary", "Deborah", "Anne"]}
{"Graph": "n15star_friends", "Description": "Imagine a group of 15 people. Anne is friends with Bob, Charles, Deborah and Emily. Bob is friends with Anne, Charles, Deborah and Emily. Charles is friends with Anne, Bob, Deborah and Emily. Deborah is friends with Anne, Bob, Charles and Mary. Emily is friends with Anne, Bob, Charles and Ned. Mary is friends with Deborah, Kelly, Sam and John. Kelly is friends with Mary, Sam, John and George. Sam is friends with Mary, Kelly, John and George. John is friends with Mary, Kelly, Sam and George. George is friends with Kelly, Sam, John and Fred. Fred is friends with George, Harrison, Isabelle and Lauren. Harrison is friends with Fred, Isabelle, Lauren and Ned. Isabelle is friends with Fred, Harrison, Lauren and Ned. Lauren is friends with Fred, Harrison, Isabelle and Ned. Ned is friends with Harrison, Isabelle, Lauren and Emily.", "No Prime Question": "From Kelly, what is the shortest path to Charles? Starting from Kelly, please only list the people's names in order, including Kelly, separated by commas. Answer: ", "No Prime Question Answer": ["Kelly", "Mary", "Deborah", "Charles"], "Both Prime Question": "Imagine a group of 15 people. Anne is friends with Bob, Charles, Deborah and Emily. Bob is friends with Anne, Charles, Deborah and Emily. Charles is friends with Anne, Bob, Deborah and Emily. Deborah is friends with Anne, Bob, Charles and Mary. Emily is friends with Anne, Bob, Charles and Ned. Mary is friends with Deborah, Kelly, Sam and John. Kelly is friends with Mary, Sam, John and George. Sam is friends with Mary, Kelly, John and George. John is friends with Mary, Kelly, Sam and George. George is friends with Kelly, Sam, John and Fred. Fred is friends with George, Harrison, Isabelle and Lauren. Harrison is friends with Fred, Isabelle, Lauren and Ned. Isabelle is friends with Fred, Harrison, Lauren and Ned. Lauren is friends with Fred, Harrison, Isabelle and Ned. Ned is friends with Harrison, Isabelle, Lauren and Emily. From Lauren, what is the shortest path to Isabelle? Starting from Lauren, please only list the people's names in order, including Lauren, separated by commas. Answer: ['Lauren', 'Isabelle'] From Kelly, what is the shortest path to Charles? Starting from Kelly, please only list the people's names in order, including Kelly, separated by commas. Answer: ", "Both Prime Question Answer": ["Kelly", "Mary", "Deborah", "Charles"], "Lexical Prime Question": "Imagine a group of 7 people. Anne is friends with Bob and Charles. Bob is friends with Anne, Deborah and Emily. Charles is friends with Anne, Mary and Kelly. Deborah is friends with Bob. Emily is friends with Bob. Mary is friends with Charles. Kelly is friends with Charles. From Emily, what is the shortest path to Deborah? Starting from Emily, please only list the people's names in order, including Emily, separated by commas. Answer: ['Emily', 'Bob', 'Deborah'] Imagine a group of 15 people. Anne is friends with Bob, Charles, Deborah and Emily. Bob is friends with Anne, Charles, Deborah and Emily. Charles is friends with Anne, Bob, Deborah and Emily. Deborah is friends with Anne, Bob, Charles and Mary. Emily is friends with Anne, Bob, Charles and Ned. Mary is friends with Deborah, Kelly, Sam and John. Kelly is friends with Mary, Sam, John and George. Sam is friends with Mary, Kelly, John and George. John is friends with Mary, Kelly, Sam and George. George is friends with Kelly, Sam, John and Fred. Fred is friends with George, Harrison, Isabelle and Lauren. Harrison is friends with Fred, Isabelle, Lauren and Ned. Isabelle is friends with Fred, Harrison, Lauren and Ned. Lauren is friends with Fred, Harrison, Isabelle and Ned. Ned is friends with Harrison, Isabelle, Lauren and Emily. From Kelly, what is the shortest path to Charles? Starting from Kelly, please only list the people's names in order, including Kelly, separated by commas. Answer: ", "Lexical Prime Question Answer": ["Kelly", "Mary", "Deborah", "Charles"], "Structural Prime Question": "Imagine a garden with 15 sections of flowers. The rose section is connected to the tulip section, the lavender section, the sunflower section and the daffodil section. The tulip section is connected to the rose section, the lavender section, the sunflower section and the daffodil section. The lavender section is connected to the rose section, the tulip section, the sunflower section and the daffodil section. The sunflower section is connected to the rose section, the tulip section, the lavender section and the peony section. The daffodil section is connected to the rose section, the tulip section, the lavender section and the hyacinth section. The peony section is connected to the sunflower section, the geranium section, the carnation section and the daisy section. The geranium section is connected to the peony section, the carnation section, the daisy section and the orchid section. The carnation section is connected to the peony section, the geranium section, the daisy section and the orchid section. The daisy section is connected to the peony section, the geranium section, the carnation section and the orchid section. The orchid section is connected to the geranium section, the carnation section, the daisy section and the iris section. The iris section is connected to the orchid section, the poppy section, the marigold section and the lily section. The poppy section is connected to the iris section, the marigold section, the lily section and the hyacinth section. The marigold section is connected to the iris section, the poppy section, the lily section and the hyacinth section. The lily section is connected to the iris section, the poppy section, the marigold section and the hyacinth section. The hyacinth section is connected to the poppy section, the marigold section, the lily section and the daffodil section. From the lavender section, what is the shortest path to the iris section? Starting from lavender, please only list the flower names in order, including lavender, separated by commas. Answer: ['Lavender', 'Daffodil', 'Hyacinth', 'Poppy', 'Iris'] Imagine a group of 15 people. Anne is friends with Bob, Charles, Deborah and Emily. Bob is friends with Anne, Charles, Deborah and Emily. Charles is friends with Anne, Bob, Deborah and Emily. Deborah is friends with Anne, Bob, Charles and Mary. Emily is friends with Anne, Bob, Charles and Ned. Mary is friends with Deborah, Kelly, Sam and John. Kelly is friends with Mary, Sam, John and George. Sam is friends with Mary, Kelly, John and George. John is friends with Mary, Kelly, Sam and George. George is friends with Kelly, Sam, John and Fred. Fred is friends with George, Harrison, Isabelle and Lauren. Harrison is friends with Fred, Isabelle, Lauren and Ned. Isabelle is friends with Fred, Harrison, Lauren and Ned. Lauren is friends with Fred, Harrison, Isabelle and Ned. Ned is friends with Harrison, Isabelle, Lauren and Emily. From Kelly, what is the shortest path to Charles? Starting from Kelly, please only list the people's names in order, including Kelly, separated by commas. Answer: ", "Structural Prime Question Answer": ["Kelly", "Mary", "Deborah", "Charles"]}
{"Graph": "n15star_friends", "Description": "Imagine a group of 15 people. Anne is friends with Bob, Charles, Deborah and Emily. Bob is friends with Anne, Charles, Deborah and Emily. Charles is friends with Anne, Bob, Deborah and Emily. Deborah is friends with Anne, Bob, Charles and Mary. Emily is friends with Anne, Bob, Charles and Ned. Mary is friends with Deborah, Kelly, Sam and John. Kelly is friends with Mary, Sam, John and George. Sam is friends with Mary, Kelly, John and George. John is friends with Mary, Kelly, Sam and George. George is friends with Kelly, Sam, John and Fred. Fred is friends with George, Harrison, Isabelle and Lauren. Harrison is friends with Fred, Isabelle, Lauren and Ned. Isabelle is friends with Fred, Harrison, Lauren and Ned. Lauren is friends with Fred, Harrison, Isabelle and Ned. Ned is friends with Harrison, Isabelle, Lauren and Emily.", "No Prime Question": "From Bob, what is the shortest path to John? Starting from Bob, please only list the people's names in order, including Bob, separated by commas. Answer: ", "No Prime Question Answer": ["Bob", "Deborah", "Mary", "John"], "Both Prime Question": "Imagine a group of 15 people. Anne is friends with Bob, Charles, Deborah and Emily. Bob is friends with Anne, Charles, Deborah and Emily. Charles is friends with Anne, Bob, Deborah and Emily. Deborah is friends with Anne, Bob, Charles and Mary. Emily is friends with Anne, Bob, Charles and Ned. Mary is friends with Deborah, Kelly, Sam and John. Kelly is friends with Mary, Sam, John and George. Sam is friends with Mary, Kelly, John and George. John is friends with Mary, Kelly, Sam and George. George is friends with Kelly, Sam, John and Fred. Fred is friends with George, Harrison, Isabelle and Lauren. Harrison is friends with Fred, Isabelle, Lauren and Ned. Isabelle is friends with Fred, Harrison, Lauren and Ned. Lauren is friends with Fred, Harrison, Isabelle and Ned. Ned is friends with Harrison, Isabelle, Lauren and Emily. From Mary, what is the shortest path to Kelly? Starting from Mary, please only list the people's names in order, including Mary, separated by commas. Answer: ['Mary', 'Kelly'] From Bob, what is the shortest path to John? Starting from Bob, please only list the people's names in order, including Bob, separated by commas. Answer: ", "Both Prime Question Answer": ["Bob", "Deborah", "Mary", "John"], "Lexical Prime Question": "Imagine a group of 13 people. Anne is friends with Bob and Charles. Bob is friends with Anne and Deborah. Charles is friends with Anne and Emily. Deborah is friends with Bob and Mary. Emily is friends with Charles and Kelly. Mary is friends with Deborah and Sam. Kelly is friends with Emily and John. Sam is friends with Mary and George. John is friends with Kelly and Fred. George is friends with Sam and Harrison. Fred is friends with John and Isabelle. Harrison is friends with George. Isabelle is friends with Fred. From Deborah, what is the shortest path to George? Starting from Deborah, please only list the people's names in order, including Deborah, separated by commas. Answer: ['Deborah', 'Mary', 'Sam', 'George'] Imagine a group of 15 people. Anne is friends with Bob, Charles, Deborah and Emily. Bob is friends with Anne, Charles, Deborah and Emily. Charles is friends with Anne, Bob, Deborah and Emily. Deborah is friends with Anne, Bob, Charles and Mary. Emily is friends with Anne, Bob, Charles and Ned. Mary is friends with Deborah, Kelly, Sam and John. Kelly is friends with Mary, Sam, John and George. Sam is friends with Mary, Kelly, John and George. John is friends with Mary, Kelly, Sam and George. George is friends with Kelly, Sam, John and Fred. Fred is friends with George, Harrison, Isabelle and Lauren. Harrison is friends with Fred, Isabelle, Lauren and Ned. Isabelle is friends with Fred, Harrison, Lauren and Ned. Lauren is friends with Fred, Harrison, Isabelle and Ned. Ned is friends with Harrison, Isabelle, Lauren and Emily. From Bob, what is the shortest path to John? Starting from Bob, please only list the people's names in order, including Bob, separated by commas. Answer: ", "Lexical Prime Question Answer": ["Bob", "Deborah", "Mary", "John"], "Structural Prime Question": "Imagine a home with 15 rooms. Room 1 is connected to Room 2, Room 3, Room 4 and Room 5. Room 2 is connected to Room 1, Room 3, Room 4 and Room 5. Room 3 is connected to Room 1, Room 2, Room 4 and Room 5. Room 4 is connected to Room 1, Room 2, Room 3 and Room 6. Room 5 is connected to Room 1, Room 2, Room 3 and Room 15. Room 6 is connected to Room 4, Room 7, Room 8 and Room 9. Room 7 is connected to Room 6, Room 8, Room 9 and Room 10. Room 8 is connected to Room 6, Room 7, Room 9 and Room 10. Room 9 is connected to Room 6, Room 7, Room 8 and Room 10. Room 10 is connected to Room 7, Room 8, Room 9 and Room 11. Room 11 is connected to Room 10, Room 12, Room 13 and Room 14. Room 12 is connected to Room 11, Room 13, Room 14 and Room 15. Room 13 is connected to Room 11, Room 12, Room 14 and Room 15. Room 14 is connected to Room 11, Room 12, Room 13 and Room 15. Room 15 is connected to Room 12, Room 13, Room 14 and Room 5. From room 7, what is the shortest path to room 13? Starting from room 7, please only list the room numbers in order, including room 7, separated by commas. Answer: ['7', '10', '11', '13'] Imagine a group of 15 people. Anne is friends with Bob, Charles, Deborah and Emily. Bob is friends with Anne, Charles, Deborah and Emily. Charles is friends with Anne, Bob, Deborah and Emily. Deborah is friends with Anne, Bob, Charles and Mary. Emily is friends with Anne, Bob, Charles and Ned. Mary is friends with Deborah, Kelly, Sam and John. Kelly is friends with Mary, Sam, John and George. Sam is friends with Mary, Kelly, John and George. John is friends with Mary, Kelly, Sam and George. George is friends with Kelly, Sam, John and Fred. Fred is friends with George, Harrison, Isabelle and Lauren. Harrison is friends with Fred, Isabelle, Lauren and Ned. Isabelle is friends with Fred, Harrison, Lauren and Ned. Lauren is friends with Fred, Harrison, Isabelle and Ned. Ned is friends with Harrison, Isabelle, Lauren and Emily. From Bob, what is the shortest path to John? Starting from Bob, please only list the people's names in order, including Bob, separated by commas. Answer: ", "Structural Prime Question Answer": ["Bob", "Deborah", "Mary", "John"]}
{"Graph": "n15star_friends", "Description": "Imagine a group of 15 people. Anne is friends with Bob, Charles, Deborah and Emily. Bob is friends with Anne, Charles, Deborah and Emily. Charles is friends with Anne, Bob, Deborah and Emily. Deborah is friends with Anne, Bob, Charles and Mary. Emily is friends with Anne, Bob, Charles and Ned. Mary is friends with Deborah, Kelly, Sam and John. Kelly is friends with Mary, Sam, John and George. Sam is friends with Mary, Kelly, John and George. John is friends with Mary, Kelly, Sam and George. George is friends with Kelly, Sam, John and Fred. Fred is friends with George, Harrison, Isabelle and Lauren. Harrison is friends with Fred, Isabelle, Lauren and Ned. Isabelle is friends with Fred, Harrison, Lauren and Ned. Lauren is friends with Fred, Harrison, Isabelle and Ned. Ned is friends with Harrison, Isabelle, Lauren and Emily.", "No Prime Question": "From Harrison, what is the shortest path to Lauren? Starting from Harrison, please only list the people's names in order, including Harrison, separated by commas. Answer: ", "No Prime Question Answer": ["Harrison", "Lauren"], "Both Prime Question": "Imagine a group of 15 people. Anne is friends with Bob, Charles, Deborah and Emily. Bob is friends with Anne, Charles, Deborah and Emily. Charles is friends with Anne, Bob, Deborah and Emily. Deborah is friends with Anne, Bob, Charles and Mary. Emily is friends with Anne, Bob, Charles and Ned. Mary is friends with Deborah, Kelly, Sam and John. Kelly is friends with Mary, Sam, John and George. Sam is friends with Mary, Kelly, John and George. John is friends with Mary, Kelly, Sam and George. George is friends with Kelly, Sam, John and Fred. Fred is friends with George, Harrison, Isabelle and Lauren. Harrison is friends with Fred, Isabelle, Lauren and Ned. Isabelle is friends with Fred, Harrison, Lauren and Ned. Lauren is friends with Fred, Harrison, Isabelle and Ned. Ned is friends with Harrison, Isabelle, Lauren and Emily. From Mary, what is the shortest path to Emily? Starting from Mary, please only list the people's names in order, including Mary, separated by commas. Answer: ['Mary', 'Deborah', 'Anne', 'Emily'] From Harrison, what is the shortest path to Lauren? Starting from Harrison, please only list the people's names in order, including Harrison, separated by commas. Answer: ", "Both Prime Question Answer": ["Harrison", "Lauren"], "Lexical Prime Question": "Imagine a group of 7 people. Anne is friends with Bob and Charles. Bob is friends with Anne, Deborah and Emily. Charles is friends with Anne, Mary and Kelly. Deborah is friends with Bob. Emily is friends with Bob. Mary is friends with Charles. Kelly is friends with Charles. From Anne, what is the shortest path to Mary? Starting from Anne, please only list the people's names in order, including Anne, separated by commas. Answer: ['Anne', 'Charles', 'Mary'] Imagine a group of 15 people. Anne is friends with Bob, Charles, Deborah and Emily. Bob is friends with Anne, Charles, Deborah and Emily. Charles is friends with Anne, Bob, Deborah and Emily. Deborah is friends with Anne, Bob, Charles and Mary. Emily is friends with Anne, Bob, Charles and Ned. Mary is friends with Deborah, Kelly, Sam and John. Kelly is friends with Mary, Sam, John and George. Sam is friends with Mary, Kelly, John and George. John is friends with Mary, Kelly, Sam and George. George is friends with Kelly, Sam, John and Fred. Fred is friends with George, Harrison, Isabelle and Lauren. Harrison is friends with Fred, Isabelle, Lauren and Ned. Isabelle is friends with Fred, Harrison, Lauren and Ned. Lauren is friends with Fred, Harrison, Isabelle and Ned. Ned is friends with Harrison, Isabelle, Lauren and Emily. From Harrison, what is the shortest path to Lauren? Starting from Harrison, please only list the people's names in order, including Harrison, separated by commas. Answer: ", "Lexical Prime Question Answer": ["Harrison", "Lauren"], "Structural Prime Question": "Imagine a home with 15 rooms. Room 1 is connected to Room 2, Room 3, Room 4 and Room 5. Room 2 is connected to Room 1, Room 3, Room 4 and Room 5. Room 3 is connected to Room 1, Room 2, Room 4 and Room 5. Room 4 is connected to Room 1, Room 2, Room 3 and Room 6. Room 5 is connected to Room 1, Room 2, Room 3 and Room 15. Room 6 is connected to Room 4, Room 7, Room 8 and Room 9. Room 7 is connected to Room 6, Room 8, Room 9 and Room 10. Room 8 is connected to Room 6, Room 7, Room 9 and Room 10. Room 9 is connected to Room 6, Room 7, Room 8 and Room 10. Room 10 is connected to Room 7, Room 8, Room 9 and Room 11. Room 11 is connected to Room 10, Room 12, Room 13 and Room 14. Room 12 is connected to Room 11, Room 13, Room 14 and Room 15. Room 13 is connected to Room 11, Room 12, Room 14 and Room 15. Room 14 is connected to Room 11, Room 12, Room 13 and Room 15. Room 15 is connected to Room 12, Room 13, Room 14 and Room 5. From room 3, what is the shortest path to room 8? Starting from room 3, please only list the room numbers in order, including room 3, separated by commas. Answer: ['3', '4', '6', '8'] Imagine a group of 15 people. Anne is friends with Bob, Charles, Deborah and Emily. Bob is friends with Anne, Charles, Deborah and Emily. Charles is friends with Anne, Bob, Deborah and Emily. Deborah is friends with Anne, Bob, Charles and Mary. Emily is friends with Anne, Bob, Charles and Ned. Mary is friends with Deborah, Kelly, Sam and John. Kelly is friends with Mary, Sam, John and George. Sam is friends with Mary, Kelly, John and George. John is friends with Mary, Kelly, Sam and George. George is friends with Kelly, Sam, John and Fred. Fred is friends with George, Harrison, Isabelle and Lauren. Harrison is friends with Fred, Isabelle, Lauren and Ned. Isabelle is friends with Fred, Harrison, Lauren and Ned. Lauren is friends with Fred, Harrison, Isabelle and Ned. Ned is friends with Harrison, Isabelle, Lauren and Emily. From Harrison, what is the shortest path to Lauren? Starting from Harrison, please only list the people's names in order, including Harrison, separated by commas. Answer: ", "Structural Prime Question Answer": ["Harrison", "Lauren"]}
{"Graph": "n15star_friends", "Description": "Imagine a group of 15 people. Anne is friends with Bob, Charles, Deborah and Emily. Bob is friends with Anne, Charles, Deborah and Emily. Charles is friends with Anne, Bob, Deborah and Emily. Deborah is friends with Anne, Bob, Charles and Mary. Emily is friends with Anne, Bob, Charles and Ned. Mary is friends with Deborah, Kelly, Sam and John. Kelly is friends with Mary, Sam, John and George. Sam is friends with Mary, Kelly, John and George. John is friends with Mary, Kelly, Sam and George. George is friends with Kelly, Sam, John and Fred. Fred is friends with George, Harrison, Isabelle and Lauren. Harrison is friends with Fred, Isabelle, Lauren and Ned. Isabelle is friends with Fred, Harrison, Lauren and Ned. Lauren is friends with Fred, Harrison, Isabelle and Ned. Ned is friends with Harrison, Isabelle, Lauren and Emily.", "No Prime Question": "From Ned, what is the shortest path to George? Starting from Ned, please only list the people's names in order, including Ned, separated by commas. Answer: ", "No Prime Question Answer": ["Ned", "Harrison", "Fred", "George"], "Both Prime Question": "Imagine a group of 15 people. Anne is friends with Bob, Charles, Deborah and Emily. Bob is friends with Anne, Charles, Deborah and Emily. Charles is friends with Anne, Bob, Deborah and Emily. Deborah is friends with Anne, Bob, Charles and Mary. Emily is friends with Anne, Bob, Charles and Ned. Mary is friends with Deborah, Kelly, Sam and John. Kelly is friends with Mary, Sam, John and George. Sam is friends with Mary, Kelly, John and George. John is friends with Mary, Kelly, Sam and George. George is friends with Kelly, Sam, John and Fred. Fred is friends with George, Harrison, Isabelle and Lauren. Harrison is friends with Fred, Isabelle, Lauren and Ned. Isabelle is friends with Fred, Harrison, Lauren and Ned. Lauren is friends with Fred, Harrison, Isabelle and Ned. Ned is friends with Harrison, Isabelle, Lauren and Emily. From Fred, what is the shortest path to Anne? Starting from Fred, please only list the people's names in order, including Fred, separated by commas. Answer: ['Fred', 'Harrison', 'Ned', 'Emily', 'Anne'] From Ned, what is the shortest path to George? Starting from Ned, please only list the people's names in order, including Ned, separated by commas. Answer: ", "Both Prime Question Answer": ["Ned", "Harrison", "Fred", "George"], "Lexical Prime Question": "Imagine a group of 13 people. Anne is friends with Bob and Charles. Bob is friends with Anne and Deborah. Charles is friends with Anne and Emily. Deborah is friends with Bob and Mary. Emily is friends with Charles and Kelly. Mary is friends with Deborah and Sam. Kelly is friends with Emily and John. Sam is friends with Mary and George. John is friends with Kelly and Fred. George is friends with Sam and Harrison. Fred is friends with John and Isabelle. Harrison is friends with George. Isabelle is friends with Fred. From Bob, what is the shortest path to George? Starting from Bob, please only list the people's names in order, including Bob, separated by commas. Answer: ['Bob', 'Deborah', 'Mary', 'Sam', 'George'] Imagine a group of 15 people. Anne is friends with Bob, Charles, Deborah and Emily. Bob is friends with Anne, Charles, Deborah and Emily. Charles is friends with Anne, Bob, Deborah and Emily. Deborah is friends with Anne, Bob, Charles and Mary. Emily is friends with Anne, Bob, Charles and Ned. Mary is friends with Deborah, Kelly, Sam and John. Kelly is friends with Mary, Sam, John and George. Sam is friends with Mary, Kelly, John and George. John is friends with Mary, Kelly, Sam and George. George is friends with Kelly, Sam, John and Fred. Fred is friends with George, Harrison, Isabelle and Lauren. Harrison is friends with Fred, Isabelle, Lauren and Ned. Isabelle is friends with Fred, Harrison, Lauren and Ned. Lauren is friends with Fred, Harrison, Isabelle and Ned. Ned is friends with Harrison, Isabelle, Lauren and Emily. From Ned, what is the shortest path to George? Starting from Ned, please only list the people's names in order, including Ned, separated by commas. Answer: ", "Lexical Prime Question Answer": ["Ned", "Harrison", "Fred", "George"], "Structural Prime Question": "Imagine a garden with 15 sections of flowers. The rose section is connected to the tulip section, the lavender section, the sunflower section and the daffodil section. The tulip section is connected to the rose section, the lavender section, the sunflower section and the daffodil section. The lavender section is connected to the rose section, the tulip section, the sunflower section and the daffodil section. The sunflower section is connected to the rose section, the tulip section, the lavender section and the peony section. The daffodil section is connected to the rose section, the tulip section, the lavender section and the hyacinth section. The peony section is connected to the sunflower section, the geranium section, the carnation section and the daisy section. The geranium section is connected to the peony section, the carnation section, the daisy section and the orchid section. The carnation section is connected to the peony section, the geranium section, the daisy section and the orchid section. The daisy section is connected to the peony section, the geranium section, the carnation section and the orchid section. The orchid section is connected to the geranium section, the carnation section, the daisy section and the iris section. The iris section is connected to the orchid section, the poppy section, the marigold section and the lily section. The poppy section is connected to the iris section, the marigold section, the lily section and the hyacinth section. The marigold section is connected to the iris section, the poppy section, the lily section and the hyacinth section. The lily section is connected to the iris section, the poppy section, the marigold section and the hyacinth section. The hyacinth section is connected to the poppy section, the marigold section, the lily section and the daffodil section. From the peony section, what is the shortest path to the tulip section? Starting from peony, please only list the flower names in order, including peony, separated by commas. Answer: ['Peony', 'Sunflower', 'Tulip'] Imagine a group of 15 people. Anne is friends with Bob, Charles, Deborah and Emily. Bob is friends with Anne, Charles, Deborah and Emily. Charles is friends with Anne, Bob, Deborah and Emily. Deborah is friends with Anne, Bob, Charles and Mary. Emily is friends with Anne, Bob, Charles and Ned. Mary is friends with Deborah, Kelly, Sam and John. Kelly is friends with Mary, Sam, John and George. Sam is friends with Mary, Kelly, John and George. John is friends with Mary, Kelly, Sam and George. George is friends with Kelly, Sam, John and Fred. Fred is friends with George, Harrison, Isabelle and Lauren. Harrison is friends with Fred, Isabelle, Lauren and Ned. Isabelle is friends with Fred, Harrison, Lauren and Ned. Lauren is friends with Fred, Harrison, Isabelle and Ned. Ned is friends with Harrison, Isabelle, Lauren and Emily. From Ned, what is the shortest path to George? Starting from Ned, please only list the people's names in order, including Ned, separated by commas. Answer: ", "Structural Prime Question Answer": ["Ned", "Harrison", "Fred", "George"]}
{"Graph": "n15star_friends", "Description": "Imagine a group of 15 people. Anne is friends with Bob, Charles, Deborah and Emily. Bob is friends with Anne, Charles, Deborah and Emily. Charles is friends with Anne, Bob, Deborah and Emily. Deborah is friends with Anne, Bob, Charles and Mary. Emily is friends with Anne, Bob, Charles and Ned. Mary is friends with Deborah, Kelly, Sam and John. Kelly is friends with Mary, Sam, John and George. Sam is friends with Mary, Kelly, John and George. John is friends with Mary, Kelly, Sam and George. George is friends with Kelly, Sam, John and Fred. Fred is friends with George, Harrison, Isabelle and Lauren. Harrison is friends with Fred, Isabelle, Lauren and Ned. Isabelle is friends with Fred, Harrison, Lauren and Ned. Lauren is friends with Fred, Harrison, Isabelle and Ned. Ned is friends with Harrison, Isabelle, Lauren and Emily.", "No Prime Question": "From John, what is the shortest path to Sam? Starting from John, please only list the people's names in order, including John, separated by commas. Answer: ", "No Prime Question Answer": ["John", "Sam"], "Both Prime Question": "Imagine a group of 15 people. Anne is friends with Bob, Charles, Deborah and Emily. Bob is friends with Anne, Charles, Deborah and Emily. Charles is friends with Anne, Bob, Deborah and Emily. Deborah is friends with Anne, Bob, Charles and Mary. Emily is friends with Anne, Bob, Charles and Ned. Mary is friends with Deborah, Kelly, Sam and John. Kelly is friends with Mary, Sam, John and George. Sam is friends with Mary, Kelly, John and George. John is friends with Mary, Kelly, Sam and George. George is friends with Kelly, Sam, John and Fred. Fred is friends with George, Harrison, Isabelle and Lauren. Harrison is friends with Fred, Isabelle, Lauren and Ned. Isabelle is friends with Fred, Harrison, Lauren and Ned. Lauren is friends with Fred, Harrison, Isabelle and Ned. Ned is friends with Harrison, Isabelle, Lauren and Emily. From Fred, what is the shortest path to George? Starting from Fred, please only list the people's names in order, including Fred, separated by commas. Answer: ['Fred', 'George'] From John, what is the shortest path to Sam? Starting from John, please only list the people's names in order, including John, separated by commas. Answer: ", "Both Prime Question Answer": ["John", "Sam"], "Lexical Prime Question": "Imagine a group of 13 people. Anne is friends with Bob and Charles. Bob is friends with Anne and Deborah. Charles is friends with Anne and Emily. Deborah is friends with Bob and Mary. Emily is friends with Charles and Kelly. Mary is friends with Deborah and Sam. Kelly is friends with Emily and John. Sam is friends with Mary and George. John is friends with Kelly and Fred. George is friends with Sam and Harrison. Fred is friends with John and Isabelle. Harrison is friends with George. Isabelle is friends with Fred. From Mary, what is the shortest path to Bob? Starting from Mary, please only list the people's names in order, including Mary, separated by commas. Answer: ['Mary', 'Deborah', 'Bob'] Imagine a group of 15 people. Anne is friends with Bob, Charles, Deborah and Emily. Bob is friends with Anne, Charles, Deborah and Emily. Charles is friends with Anne, Bob, Deborah and Emily. Deborah is friends with Anne, Bob, Charles and Mary. Emily is friends with Anne, Bob, Charles and Ned. Mary is friends with Deborah, Kelly, Sam and John. Kelly is friends with Mary, Sam, John and George. Sam is friends with Mary, Kelly, John and George. John is friends with Mary, Kelly, Sam and George. George is friends with Kelly, Sam, John and Fred. Fred is friends with George, Harrison, Isabelle and Lauren. Harrison is friends with Fred, Isabelle, Lauren and Ned. Isabelle is friends with Fred, Harrison, Lauren and Ned. Lauren is friends with Fred, Harrison, Isabelle and Ned. Ned is friends with Harrison, Isabelle, Lauren and Emily. From John, what is the shortest path to Sam? Starting from John, please only list the people's names in order, including John, separated by commas. Answer: ", "Lexical Prime Question Answer": ["John", "Sam"], "Structural Prime Question": "Imagine a home with 15 rooms. Room 1 is connected to Room 2, Room 3, Room 4 and Room 5. Room 2 is connected to Room 1, Room 3, Room 4 and Room 5. Room 3 is connected to Room 1, Room 2, Room 4 and Room 5. Room 4 is connected to Room 1, Room 2, Room 3 and Room 6. Room 5 is connected to Room 1, Room 2, Room 3 and Room 15. Room 6 is connected to Room 4, Room 7, Room 8 and Room 9. Room 7 is connected to Room 6, Room 8, Room 9 and Room 10. Room 8 is connected to Room 6, Room 7, Room 9 and Room 10. Room 9 is connected to Room 6, Room 7, Room 8 and Room 10. Room 10 is connected to Room 7, Room 8, Room 9 and Room 11. Room 11 is connected to Room 10, Room 12, Room 13 and Room 14. Room 12 is connected to Room 11, Room 13, Room 14 and Room 15. Room 13 is connected to Room 11, Room 12, Room 14 and Room 15. Room 14 is connected to Room 11, Room 12, Room 13 and Room 15. Room 15 is connected to Room 12, Room 13, Room 14 and Room 5. From room 12, what is the shortest path to room 3? Starting from room 12, please only list the room numbers in order, including room 12, separated by commas. Answer: ['12', '15', '5', '3'] Imagine a group of 15 people. Anne is friends with Bob, Charles, Deborah and Emily. Bob is friends with Anne, Charles, Deborah and Emily. Charles is friends with Anne, Bob, Deborah and Emily. Deborah is friends with Anne, Bob, Charles and Mary. Emily is friends with Anne, Bob, Charles and Ned. Mary is friends with Deborah, Kelly, Sam and John. Kelly is friends with Mary, Sam, John and George. Sam is friends with Mary, Kelly, John and George. John is friends with Mary, Kelly, Sam and George. George is friends with Kelly, Sam, John and Fred. Fred is friends with George, Harrison, Isabelle and Lauren. Harrison is friends with Fred, Isabelle, Lauren and Ned. Isabelle is friends with Fred, Harrison, Lauren and Ned. Lauren is friends with Fred, Harrison, Isabelle and Ned. Ned is friends with Harrison, Isabelle, Lauren and Emily. From John, what is the shortest path to Sam? Starting from John, please only list the people's names in order, including John, separated by commas. Answer: ", "Structural Prime Question Answer": ["John", "Sam"]}
{"Graph": "n15star_friends", "Description": "Imagine a group of 15 people. Anne is friends with Bob, Charles, Deborah and Emily. Bob is friends with Anne, Charles, Deborah and Emily. Charles is friends with Anne, Bob, Deborah and Emily. Deborah is friends with Anne, Bob, Charles and Mary. Emily is friends with Anne, Bob, Charles and Ned. Mary is friends with Deborah, Kelly, Sam and John. Kelly is friends with Mary, Sam, John and George. Sam is friends with Mary, Kelly, John and George. John is friends with Mary, Kelly, Sam and George. George is friends with Kelly, Sam, John and Fred. Fred is friends with George, Harrison, Isabelle and Lauren. Harrison is friends with Fred, Isabelle, Lauren and Ned. Isabelle is friends with Fred, Harrison, Lauren and Ned. Lauren is friends with Fred, Harrison, Isabelle and Ned. Ned is friends with Harrison, Isabelle, Lauren and Emily.", "No Prime Question": "From Bob, what is the shortest path to Deborah? Starting from Bob, please only list the people's names in order, including Bob, separated by commas. Answer: ", "No Prime Question Answer": ["Bob", "Deborah"], "Both Prime Question": "Imagine a group of 15 people. Anne is friends with Bob, Charles, Deborah and Emily. Bob is friends with Anne, Charles, Deborah and Emily. Charles is friends with Anne, Bob, Deborah and Emily. Deborah is friends with Anne, Bob, Charles and Mary. Emily is friends with Anne, Bob, Charles and Ned. Mary is friends with Deborah, Kelly, Sam and John. Kelly is friends with Mary, Sam, John and George. Sam is friends with Mary, Kelly, John and George. John is friends with Mary, Kelly, Sam and George. George is friends with Kelly, Sam, John and Fred. Fred is friends with George, Harrison, Isabelle and Lauren. Harrison is friends with Fred, Isabelle, Lauren and Ned. Isabelle is friends with Fred, Harrison, Lauren and Ned. Lauren is friends with Fred, Harrison, Isabelle and Ned. Ned is friends with Harrison, Isabelle, Lauren and Emily. From Isabelle, what is the shortest path to Mary? Starting from Isabelle, please only list the people's names in order, including Isabelle, separated by commas. Answer: ['Isabelle', 'Fred', 'George', 'Kelly', 'Mary'] From Bob, what is the shortest path to Deborah? Starting from Bob, please only list the people's names in order, including Bob, separated by commas. Answer: ", "Both Prime Question Answer": ["Bob", "Deborah"], "Lexical Prime Question": "Imagine a group of 13 people. Anne is friends with Bob and Charles. Bob is friends with Anne and Deborah. Charles is friends with Anne and Emily. Deborah is friends with Bob and Mary. Emily is friends with Charles and Kelly. Mary is friends with Deborah and Sam. Kelly is friends with Emily and John. Sam is friends with Mary and George. John is friends with Kelly and Fred. George is friends with Sam and Harrison. Fred is friends with John and Isabelle. Harrison is friends with George. Isabelle is friends with Fred. From Isabelle, what is the shortest path to Anne? Starting from Isabelle, please only list the people's names in order, including Isabelle, separated by commas. Answer: ['Isabelle', 'Fred', 'John', 'Kelly', 'Emily', 'Charles', 'Anne'] Imagine a group of 15 people. Anne is friends with Bob, Charles, Deborah and Emily. Bob is friends with Anne, Charles, Deborah and Emily. Charles is friends with Anne, Bob, Deborah and Emily. Deborah is friends with Anne, Bob, Charles and Mary. Emily is friends with Anne, Bob, Charles and Ned. Mary is friends with Deborah, Kelly, Sam and John. Kelly is friends with Mary, Sam, John and George. Sam is friends with Mary, Kelly, John and George. John is friends with Mary, Kelly, Sam and George. George is friends with Kelly, Sam, John and Fred. Fred is friends with George, Harrison, Isabelle and Lauren. Harrison is friends with Fred, Isabelle, Lauren and Ned. Isabelle is friends with Fred, Harrison, Lauren and Ned. Lauren is friends with Fred, Harrison, Isabelle and Ned. Ned is friends with Harrison, Isabelle, Lauren and Emily. From Bob, what is the shortest path to Deborah? Starting from Bob, please only list the people's names in order, including Bob, separated by commas. Answer: ", "Lexical Prime Question Answer": ["Bob", "Deborah"], "Structural Prime Question": "Imagine a garden with 15 sections of flowers. The rose section is connected to the tulip section, the lavender section, the sunflower section and the daffodil section. The tulip section is connected to the rose section, the lavender section, the sunflower section and the daffodil section. The lavender section is connected to the rose section, the tulip section, the sunflower section and the daffodil section. The sunflower section is connected to the rose section, the tulip section, the lavender section and the peony section. The daffodil section is connected to the rose section, the tulip section, the lavender section and the hyacinth section. The peony section is connected to the sunflower section, the geranium section, the carnation section and the daisy section. The geranium section is connected to the peony section, the carnation section, the daisy section and the orchid section. The carnation section is connected to the peony section, the geranium section, the daisy section and the orchid section. The daisy section is connected to the peony section, the geranium section, the carnation section and the orchid section. The orchid section is connected to the geranium section, the carnation section, the daisy section and the iris section. The iris section is connected to the orchid section, the poppy section, the marigold section and the lily section. The poppy section is connected to the iris section, the marigold section, the lily section and the hyacinth section. The marigold section is connected to the iris section, the poppy section, the lily section and the hyacinth section. The lily section is connected to the iris section, the poppy section, the marigold section and the hyacinth section. The hyacinth section is connected to the poppy section, the marigold section, the lily section and the daffodil section. From the rose section, what is the shortest path to the lavender section? Starting from rose, please only list the flower names in order, including rose, separated by commas. Answer: ['Rose', 'Lavender'] Imagine a group of 15 people. Anne is friends with Bob, Charles, Deborah and Emily. Bob is friends with Anne, Charles, Deborah and Emily. Charles is friends with Anne, Bob, Deborah and Emily. Deborah is friends with Anne, Bob, Charles and Mary. Emily is friends with Anne, Bob, Charles and Ned. Mary is friends with Deborah, Kelly, Sam and John. Kelly is friends with Mary, Sam, John and George. Sam is friends with Mary, Kelly, John and George. John is friends with Mary, Kelly, Sam and George. George is friends with Kelly, Sam, John and Fred. Fred is friends with George, Harrison, Isabelle and Lauren. Harrison is friends with Fred, Isabelle, Lauren and Ned. Isabelle is friends with Fred, Harrison, Lauren and Ned. Lauren is friends with Fred, Harrison, Isabelle and Ned. Ned is friends with Harrison, Isabelle, Lauren and Emily. From Bob, what is the shortest path to Deborah? Starting from Bob, please only list the people's names in order, including Bob, separated by commas. Answer: ", "Structural Prime Question Answer": ["Bob", "Deborah"]}
{"Graph": "n15star_friends", "Description": "Imagine a group of 15 people. Anne is friends with Bob, Charles, Deborah and Emily. Bob is friends with Anne, Charles, Deborah and Emily. Charles is friends with Anne, Bob, Deborah and Emily. Deborah is friends with Anne, Bob, Charles and Mary. Emily is friends with Anne, Bob, Charles and Ned. Mary is friends with Deborah, Kelly, Sam and John. Kelly is friends with Mary, Sam, John and George. Sam is friends with Mary, Kelly, John and George. John is friends with Mary, Kelly, Sam and George. George is friends with Kelly, Sam, John and Fred. Fred is friends with George, Harrison, Isabelle and Lauren. Harrison is friends with Fred, Isabelle, Lauren and Ned. Isabelle is friends with Fred, Harrison, Lauren and Ned. Lauren is friends with Fred, Harrison, Isabelle and Ned. Ned is friends with Harrison, Isabelle, Lauren and Emily.", "No Prime Question": "From Lauren, what is the shortest path to Fred? Starting from Lauren, please only list the people's names in order, including Lauren, separated by commas. Answer: ", "No Prime Question Answer": ["Lauren", "Fred"], "Both Prime Question": "Imagine a group of 15 people. Anne is friends with Bob, Charles, Deborah and Emily. Bob is friends with Anne, Charles, Deborah and Emily. Charles is friends with Anne, Bob, Deborah and Emily. Deborah is friends with Anne, Bob, Charles and Mary. Emily is friends with Anne, Bob, Charles and Ned. Mary is friends with Deborah, Kelly, Sam and John. Kelly is friends with Mary, Sam, John and George. Sam is friends with Mary, Kelly, John and George. John is friends with Mary, Kelly, Sam and George. George is friends with Kelly, Sam, John and Fred. Fred is friends with George, Harrison, Isabelle and Lauren. Harrison is friends with Fred, Isabelle, Lauren and Ned. Isabelle is friends with Fred, Harrison, Lauren and Ned. Lauren is friends with Fred, Harrison, Isabelle and Ned. Ned is friends with Harrison, Isabelle, Lauren and Emily. From Mary, what is the shortest path to Sam? Starting from Mary, please only list the people's names in order, including Mary, separated by commas. Answer: ['Mary', 'Sam'] From Lauren, what is the shortest path to Fred? Starting from Lauren, please only list the people's names in order, including Lauren, separated by commas. Answer: ", "Both Prime Question Answer": ["Lauren", "Fred"], "Lexical Prime Question": "Imagine a group of 13 people. Anne is friends with Bob and Charles. Bob is friends with Anne and Deborah. Charles is friends with Anne and Emily. Deborah is friends with Bob and Mary. Emily is friends with Charles and Kelly. Mary is friends with Deborah and Sam. Kelly is friends with Emily and John. Sam is friends with Mary and George. John is friends with Kelly and Fred. George is friends with Sam and Harrison. Fred is friends with John and Isabelle. Harrison is friends with George. Isabelle is friends with Fred. From Fred, what is the shortest path to George? Starting from Fred, please only list the people's names in order, including Fred, separated by commas. Answer: ['Fred', 'John', 'Kelly', 'Emily', 'Charles', 'Anne', 'Bob', 'Deborah', 'Mary', 'Sam', 'George'] Imagine a group of 15 people. Anne is friends with Bob, Charles, Deborah and Emily. Bob is friends with Anne, Charles, Deborah and Emily. Charles is friends with Anne, Bob, Deborah and Emily. Deborah is friends with Anne, Bob, Charles and Mary. Emily is friends with Anne, Bob, Charles and Ned. Mary is friends with Deborah, Kelly, Sam and John. Kelly is friends with Mary, Sam, John and George. Sam is friends with Mary, Kelly, John and George. John is friends with Mary, Kelly, Sam and George. George is friends with Kelly, Sam, John and Fred. Fred is friends with George, Harrison, Isabelle and Lauren. Harrison is friends with Fred, Isabelle, Lauren and Ned. Isabelle is friends with Fred, Harrison, Lauren and Ned. Lauren is friends with Fred, Harrison, Isabelle and Ned. Ned is friends with Harrison, Isabelle, Lauren and Emily. From Lauren, what is the shortest path to Fred? Starting from Lauren, please only list the people's names in order, including Lauren, separated by commas. Answer: ", "Lexical Prime Question Answer": ["Lauren", "Fred"], "Structural Prime Question": "Imagine a home with 15 rooms. Room 1 is connected to Room 2, Room 3, Room 4 and Room 5. Room 2 is connected to Room 1, Room 3, Room 4 and Room 5. Room 3 is connected to Room 1, Room 2, Room 4 and Room 5. Room 4 is connected to Room 1, Room 2, Room 3 and Room 6. Room 5 is connected to Room 1, Room 2, Room 3 and Room 15. Room 6 is connected to Room 4, Room 7, Room 8 and Room 9. Room 7 is connected to Room 6, Room 8, Room 9 and Room 10. Room 8 is connected to Room 6, Room 7, Room 9 and Room 10. Room 9 is connected to Room 6, Room 7, Room 8 and Room 10. Room 10 is connected to Room 7, Room 8, Room 9 and Room 11. Room 11 is connected to Room 10, Room 12, Room 13 and Room 14. Room 12 is connected to Room 11, Room 13, Room 14 and Room 15. Room 13 is connected to Room 11, Room 12, Room 14 and Room 15. Room 14 is connected to Room 11, Room 12, Room 13 and Room 15. Room 15 is connected to Room 12, Room 13, Room 14 and Room 5. From room 15, what is the shortest path to room 14? Starting from room 15, please only list the room numbers in order, including room 15, separated by commas. Answer: ['15', '14'] Imagine a group of 15 people. Anne is friends with Bob, Charles, Deborah and Emily. Bob is friends with Anne, Charles, Deborah and Emily. Charles is friends with Anne, Bob, Deborah and Emily. Deborah is friends with Anne, Bob, Charles and Mary. Emily is friends with Anne, Bob, Charles and Ned. Mary is friends with Deborah, Kelly, Sam and John. Kelly is friends with Mary, Sam, John and George. Sam is friends with Mary, Kelly, John and George. John is friends with Mary, Kelly, Sam and George. George is friends with Kelly, Sam, John and Fred. Fred is friends with George, Harrison, Isabelle and Lauren. Harrison is friends with Fred, Isabelle, Lauren and Ned. Isabelle is friends with Fred, Harrison, Lauren and Ned. Lauren is friends with Fred, Harrison, Isabelle and Ned. Ned is friends with Harrison, Isabelle, Lauren and Emily. From Lauren, what is the shortest path to Fred? Starting from Lauren, please only list the people's names in order, including Lauren, separated by commas. Answer: ", "Structural Prime Question Answer": ["Lauren", "Fred"]}
{"Graph": "n15star_friends", "Description": "Imagine a group of 15 people. Anne is friends with Bob, Charles, Deborah and Emily. Bob is friends with Anne, Charles, Deborah and Emily. Charles is friends with Anne, Bob, Deborah and Emily. Deborah is friends with Anne, Bob, Charles and Mary. Emily is friends with Anne, Bob, Charles and Ned. Mary is friends with Deborah, Kelly, Sam and John. Kelly is friends with Mary, Sam, John and George. Sam is friends with Mary, Kelly, John and George. John is friends with Mary, Kelly, Sam and George. George is friends with Kelly, Sam, John and Fred. Fred is friends with George, Harrison, Isabelle and Lauren. Harrison is friends with Fred, Isabelle, Lauren and Ned. Isabelle is friends with Fred, Harrison, Lauren and Ned. Lauren is friends with Fred, Harrison, Isabelle and Ned. Ned is friends with Harrison, Isabelle, Lauren and Emily.", "No Prime Question": "From Anne, what is the shortest path to Ned? Starting from Anne, please only list the people's names in order, including Anne, separated by commas. Answer: ", "No Prime Question Answer": ["Anne", "Emily", "Ned"], "Both Prime Question": "Imagine a group of 15 people. Anne is friends with Bob, Charles, Deborah and Emily. Bob is friends with Anne, Charles, Deborah and Emily. Charles is friends with Anne, Bob, Deborah and Emily. Deborah is friends with Anne, Bob, Charles and Mary. Emily is friends with Anne, Bob, Charles and Ned. Mary is friends with Deborah, Kelly, Sam and John. Kelly is friends with Mary, Sam, John and George. Sam is friends with Mary, Kelly, John and George. John is friends with Mary, Kelly, Sam and George. George is friends with Kelly, Sam, John and Fred. Fred is friends with George, Harrison, Isabelle and Lauren. Harrison is friends with Fred, Isabelle, Lauren and Ned. Isabelle is friends with Fred, Harrison, Lauren and Ned. Lauren is friends with Fred, Harrison, Isabelle and Ned. Ned is friends with Harrison, Isabelle, Lauren and Emily. From Isabelle, what is the shortest path to Sam? Starting from Isabelle, please only list the people's names in order, including Isabelle, separated by commas. Answer: ['Isabelle', 'Fred', 'George', 'Sam'] From Anne, what is the shortest path to Ned? Starting from Anne, please only list the people's names in order, including Anne, separated by commas. Answer: ", "Both Prime Question Answer": ["Anne", "Emily", "Ned"], "Lexical Prime Question": "Imagine a group of 7 people. Anne is friends with Bob and Charles. Bob is friends with Anne, Deborah and Emily. Charles is friends with Anne, Mary and Kelly. Deborah is friends with Bob. Emily is friends with Bob. Mary is friends with Charles. Kelly is friends with Charles. From Anne, what is the shortest path to Charles? Starting from Anne, please only list the people's names in order, including Anne, separated by commas. Answer: ['Anne', 'Charles'] Imagine a group of 15 people. Anne is friends with Bob, Charles, Deborah and Emily. Bob is friends with Anne, Charles, Deborah and Emily. Charles is friends with Anne, Bob, Deborah and Emily. Deborah is friends with Anne, Bob, Charles and Mary. Emily is friends with Anne, Bob, Charles and Ned. Mary is friends with Deborah, Kelly, Sam and John. Kelly is friends with Mary, Sam, John and George. Sam is friends with Mary, Kelly, John and George. John is friends with Mary, Kelly, Sam and George. George is friends with Kelly, Sam, John and Fred. Fred is friends with George, Harrison, Isabelle and Lauren. Harrison is friends with Fred, Isabelle, Lauren and Ned. Isabelle is friends with Fred, Harrison, Lauren and Ned. Lauren is friends with Fred, Harrison, Isabelle and Ned. Ned is friends with Harrison, Isabelle, Lauren and Emily. From Anne, what is the shortest path to Ned? Starting from Anne, please only list the people's names in order, including Anne, separated by commas. Answer: ", "Lexical Prime Question Answer": ["Anne", "Emily", "Ned"], "Structural Prime Question": "Imagine a home with 15 rooms. Room 1 is connected to Room 2, Room 3, Room 4 and Room 5. Room 2 is connected to Room 1, Room 3, Room 4 and Room 5. Room 3 is connected to Room 1, Room 2, Room 4 and Room 5. Room 4 is connected to Room 1, Room 2, Room 3 and Room 6. Room 5 is connected to Room 1, Room 2, Room 3 and Room 15. Room 6 is connected to Room 4, Room 7, Room 8 and Room 9. Room 7 is connected to Room 6, Room 8, Room 9 and Room 10. Room 8 is connected to Room 6, Room 7, Room 9 and Room 10. Room 9 is connected to Room 6, Room 7, Room 8 and Room 10. Room 10 is connected to Room 7, Room 8, Room 9 and Room 11. Room 11 is connected to Room 10, Room 12, Room 13 and Room 14. Room 12 is connected to Room 11, Room 13, Room 14 and Room 15. Room 13 is connected to Room 11, Room 12, Room 14 and Room 15. Room 14 is connected to Room 11, Room 12, Room 13 and Room 15. Room 15 is connected to Room 12, Room 13, Room 14 and Room 5. From room 10, what is the shortest path to room 7? Starting from room 10, please only list the room numbers in order, including room 10, separated by commas. Answer: ['10', '7'] Imagine a group of 15 people. Anne is friends with Bob, Charles, Deborah and Emily. Bob is friends with Anne, Charles, Deborah and Emily. Charles is friends with Anne, Bob, Deborah and Emily. Deborah is friends with Anne, Bob, Charles and Mary. Emily is friends with Anne, Bob, Charles and Ned. Mary is friends with Deborah, Kelly, Sam and John. Kelly is friends with Mary, Sam, John and George. Sam is friends with Mary, Kelly, John and George. John is friends with Mary, Kelly, Sam and George. George is friends with Kelly, Sam, John and Fred. Fred is friends with George, Harrison, Isabelle and Lauren. Harrison is friends with Fred, Isabelle, Lauren and Ned. Isabelle is friends with Fred, Harrison, Lauren and Ned. Lauren is friends with Fred, Harrison, Isabelle and Ned. Ned is friends with Harrison, Isabelle, Lauren and Emily. From Anne, what is the shortest path to Ned? Starting from Anne, please only list the people's names in order, including Anne, separated by commas. Answer: ", "Structural Prime Question Answer": ["Anne", "Emily", "Ned"]}
